booktitle,year,pages,author,title,ee,abstract
STOC,1985,1-10,Michael Luby,A Simple Parallel Algorithm for the Maximal Independent Set Problem,https://doi.org/10.1145/22145.22146,Simple parallel algorithms for the maximal independent set (MIS) problem are presented. The first algorithm is a Monte Carlo algorithm with a very local property. The local property of this algorithm may make it a useful protocol design tool in distributed computing environments and artificial intelligence. One of the main contributions of this paper is the development of powerful and general techniques for converting Monte Carlo algorithms into deterministic algorithms. These techniques are used to convert the Monte Carlo algorithm for the MIS problem into a simple deterministic algorithm with the same parallel running time.
STOC,1985,11-21,"Umesh V. Vazirani, Vijay V. Vazirani",The Two-Processor Scheduling Problem is in R-NC,https://doi.org/10.1145/22145.22147,"The two-processor scheduling problem is perhaps the most basic problem in scheduling theory, and several efficient algorithms have been discovered for it. However, these algorithms are inherently sequential in nature. We give a fast parallel (R-NC) algorithm for this problem. Interestingly enough, our algorithm for this purely combinatoric-looking problem draws on some powerful algebraic methods."
STOC,1985,22-32,"Richard M. Karp, Eli Upfal, Avi Wigderson",Constructing a Perfect Matching is in Random NC,https://doi.org/10.1145/22145.22148,"CONSTRUCTING A PE<RFECT MATCHING IS IN RANDOM NC (ii) Page 1 CONSTRUCTING A PE<RFECT MATCHING IS IN RANDOM NC Richard h4. Karpt Computer Scicncc Division Univwity of California at Rcrkeley Computer Scicncc Department Stanford University Avi Wigdersont 5 IBM San Jose Rcscarch Laboratory"
STOC,1985,33-37,Richard Anderson,A Parallel Algorithm for the Maximal Path Problem,https://doi.org/10.1145/22145.22149,"One of the* important arcas of rcsttiucli in pard-lcl WJllJlliLtiOl ia to idctltify problcnls that can bc sped up significnntly using paA. lclism. The goals of thin work arc t, o find filrt p; &lcl algorithms for spccific problc! rrls and to dcvclop trclinic~ ucs for par&A dgorit, hrun. Thcbrc liiw hc~ n qaitc: it bit of progress rnatlc~ rc: c. cqrrbly, with piLdIC~ I irl~ orit~ hn~ s bc* ifig tic*-vrlo~ wd fix stdl~ xohhllx as M; urimA hlchpXdCJlt"
STOC,1985,38-47,"Faith E. Fich, Martin Tompa",The Parallel Complexity of Exponentiating Polynomials over Finite Fields,https://doi.org/10.1145/22145.22150,"Modular integer exponentiation (given a, e, and m, compute ae mod m) is a fundamental problem in algebraic complexity for which no efficient parallel algorithm is known. Two closely related problems are modular polynomial exponentiation (given a(x), e, and m(x), compute (a(x))e mod m(x)) and polynomial exponentiation (given a(x), e. and t, compute the coefficient of xt in (a(x))e). It is shown that these latter two problems are in NC2 when a(x) and m(x) are polynomials over a finite field whose characteristic is polynomial in the input size."
STOC,1985,48-58,"Faith E. Fich, Friedhelm Meyer auf der Heide, Prabhakar Ragde, Avi Wigderson","One, Two, Three \dots Infinity: Lower Bounds for Parallel Computation",https://doi.org/10.1145/22145.22151,"In this paper we compare the power of the two most commonly used concurrent-write models of parallel computation, the COMMON PRAM and the PRIORITY PRAM. These models differ in the way they resolve write conflicts. If several processors want to write into the same shared memory cell at the same time, in the COMMON model they have to write the same value. In the PRIORITY model, they may attempt to write different values; the processor with smallest index succeeds. We consider PRAM's with n processors, each having arbitrary computational power. We provide the first separation results between these two models in two extreme cases: when the size m of the shared memory is small (m ≤ nε, ε < 1), and when it is infinite. In the case of small memory, the PRIORITY model can be faster than the COMMON model by a factor of Θ(log n), and this lower bound holds even if the COMMON model is probabilistic. In the case of infinite memory, the gap between the models can be a factor of Ω(log log log n). We develop new proof techniques to obtain these results. The technique used for the second lower bound is strong enough to establish the first tight time bounds for the PRIORITY model, which is the strongest parallel computation model. We show that finding the maximum of n numbers requires Θ(log log n) steps, generalizing a result of Valiant for parallel computation trees."
STOC,1985,59-68,Alok Aggarwal,Tradeoffs for VLSI Models with Subpolynomial Delay,https://doi.org/10.1145/22145.22152,"The effect of delay along long wires in VLSI on the area-time complexity of computing certain functions has been investigated recently [CMSl (a), CMSl (b), Ag83]. However, in these papers, tradeoffs have been established only for the cases where the delay is a polynomial in the length of the wire. On the other hand, most researchers [Th80, Ra82, BPP82, NMB83] believe that a more pragmatic model is one that has e (log I) delay along a wire of length 1. Although, Thompson indicated some area-time bounds in his influential thesis [Th80], no serious effort has gone into establishing optimal tradeoffs or lower bounds in this model. In this paper, we attempt to eliminate this deficiency by investigating bounds on area and time for computing certain transitive functions and addition in the subpolynomial delay models. In particular, we demonstrate some truly surprising results which contradict both intuition as well as some widely held conjectures.(See (PRS81] and remark (21 for details.)"
STOC,1985,69-78,"Charles E. Leiserson, F. Miller Maley",Algorithms for Routing and Testing Routability of Planar VLSI Layouts,https://doi.org/10.1145/22145.22153,"This paper studies the problem of routing wires in a grid among features on one layer of a VLSI chip, when a sketch of the layer is given. A sketch specifies the positions of features and the topology of the interconnecting wires. We give polynomial-time algorithms that (1) determine the routability of a sketch, and (2) produce a routing of a sketch that optimizes both individual and total wire length. These algorithms subsume most of the polynomial-time algorithms in the literature for planar routing and routability testing in the rectilinear grid model. We also provide an explicit construction of a database, called the rubber-band equivalent, to support computation involving the layout topology."
STOC,1985,79-87,"Prabhakar Raghavan, Clark D. Thompson",Provably Good Routing in Graphs: Regular Arrays,https://doi.org/10.1145/22145.22154,"We examine the problem of routing wires on a VLSI chip where the nodes to be connected are arranged in a two-dimensional array. We develop provably good algorithms that find a solution close to the optimal one with high probability. Our approximation algorithms solve the relevant 0-1 integer optimization problems by solving their relaxed versions and then rounding by an interesting probabilistic technique. One of our algorithms, using multicommodity flow, has applications to routing in circuit switching networks."
STOC,1985,88-97,"Shuji Jimbo, Akira Maruoka",Expanders Obtained from Affine Transformations (Preliminary Version),https://doi.org/10.1145/22145.22155,"A bipartite graph Gn = (U, V, E) is said an (n, k, δ) expander if |U| = |V| = n, |E| ≤ kn, and for any X ⫅ U, |ΓGn(X)| ≥ (1+δ(1-|X|/n)) |X|, where ΓGn(X) is the set of nodes in V connected to nodes in X with edges in E. In this paper we show that the problem of estimating the coefficient δ of a bipartite graph is reduced to that of estimating the eigenvalue of a matrix related to the graph. As a result we give an explicit construction of (n, 5, 1 - 5/8 √2) expanders. By applying Gabber and Galil's construction to these expanders we obtain n-superconcentrators with 248n edges. "
STOC,1985,98-102,Noga Alon,"Expanders, Sorting in Rounds and Superconcentrators of Limited Depth",https://doi.org/10.1145/22145.22156,"Expanding graphs and superconcentrators are relevant to theoretical computer science in several ways. Here we use finite geometries to construct explicitly highly expanding graphs with essentially the smallest possible number of edges. Our graphs enable us to improve significantly previous results on a parallel sorting problem, by describing an explicit algorithm to sort n elements in k time units using Ο(nαk) processors, where, e.g., α2 = 7/4. Using our graphs we can also construct efficient n-superconcentrators of limited depth. For example, we construct an n superconcentrator of depth 3 with Ο(n4/3) edges; better than the previous known results."
STOC,1985,103-112,Robert E. Wilber,White Pebbles Help,https://doi.org/10.1145/22145.22157,"A family of directed acyclic graphs of vertex indegree 2 is constructed for which there are strategies of the black-white pebble game that use asymptotically fewer pebbles than the best strategies of the black pebble game. This shows that there are straight-line programs that can be evaluated nondeterministically with asymptotically less space than is required by any deterministic evaluation."
STOC,1985,114-120,"Brenda S. Baker, Steven Fortune, Eric Grosse",Stable Prehension with Three Fingers,https://doi.org/10.1145/22145.22158,"We study grasps by a robot hand in the absence of friction. In two dimensions, a hand with three spring-loaded fingers and five degrees of freedom can achieve an equilibrium grasp on any object described by a polygon. Furthermore, the grasp is stable, that is, at a local minimum of the potential energy function defined by the springs of the fingers. In three dimensions, the hand can grasp any cylinder. In contrast, if the degrees of freedom of the hand are restricted to correspond to a hand built by Hanafusa and Asada, stable grips on a polygon cannot in general be achieved."
STOC,1985,121-130,Ming-Deh A. Huang,Riemann Hypothesis and Finding Roots over Finite Fields,https://doi.org/10.1145/22145.22159,"It is shown that assuming Generalized Riemann Hypothesis, the roots of ƒ(x) = O mod p, where p is a prime and f(x) is an integral Abilene polynomial can be found in deterministic polynomial time. The method developed for solving this problem is also applied to prime decomposition in Abelian number fields, and the following result is obtained: assuming Generalized Riemann Hypotheses, for Abelian number fields K of finite extension degree over the rational number field Q, the decomposition pattern of a prime p in K, i.e. the ramification index and the residue class degree, can be computed in deterministic polynomial time, providing p does not divide the extension degree of K over Q. It is also shown, as a theorem fundamental to our algorithm, that for q, p prime and m the order of p mod q, there is a q-th nonresidue in the finite field Fpm that can be written as ao + a1w + … + am-1wm-1, where |a1| ≤ cq2 log2(pq), c is an absolute effectively computable constant, and 1, w, …, wm-1 form a basis of Fpm over Fp. More explicitly, w is a root of the q-th cyclotomic polynomial over Fp. This result partially generalizes, to finite field extensions over Fp, a classical result in number theory stating that assuming Generalized Riemann Hypothesis, the least q-th nonresidue mod p for p,q prime and q dividing p - t is bounded by c log2p, where c is an absolute, effectively computable constant."
STOC,1985,131-142,Erich L. Kaltofen,Computing with Polynomials Given by Straight-Line Programs I: Greatest Common Divisors,https://doi.org/10.1145/22145.22160,"We develop algorithms on multivariate polynomials represented by straight-line programs for the greatest common divisor problem and conversion to sparse representation. Our algorithms are in random polynomial-time for the usual coefficient fields and output with controllably high probability the correct result which for the GCD problem is a straight-line program determining the GCD of the inputs and for the conversion algorithm is the sparse representation of the input. The algorithms only require an a priori bound for the total degrees of the inputs. Over rational numbers the conversion algorithm also needs a bound on the size of the polynomial coefficients. As specializations we get, e.g., random polynomial-time algorithms for computing the sparse GCD of polynomial determinants or for computing the sparse solution of a linear system whose coefficients are given by formulas."
STOC,1985,143-152,"Victor Y. Pan, John H. Reif",Efficient Parallel Solution of Linear Systems,https://doi.org/10.1145/22145.22161,"The most efficient known parallel algorithms for inversion of a nonsingular n × n matrix A or solving a linear system Ax = b over the rationals require Ο(log n)2 time and M(n)n0.5 processors (where M(n) is the number of processors required in order to multiply two n × n rational matrices in time Ο(log n).) Furthermore, all known polylog time algorithms for those problems are unstable: they require the calculation to be done with perfect precision; otherwise they give no results at all. This paper describes parallel algorithms that have good numerical stability and remain efficient as n grows large. In particular, we describe a quadratically convergent iterative method that gives the inverse (within the relative precision 2-nO(1)) of an n × n rational matrix A with condition ≤ n0(1) in Ο(log n)2 time using M(n) processors. This is the optimum processor bound and the factor n0.5 improvement of known processor bounds for polylog time matrix inversion. It is the first known polylog time algorithm that is numerically stable. The algorithm relies on our method of computing an approximate inverse of A that involves Ο(log n) parallel steps and n2 processors. Also, we give a parallel algorithm for solution of a linear system Ax = b with a sparse n × n symmetric positive definite matrix A. If the graph G(A) (which has n vertices and has an edge for each nonzero entry of A) is s(n)-separable, then our algorithm requires only Ο((log n)(log s(n))2) time and |E| + M(s(n)) processors. The algorithm computes a recursive factorization of A so that the solution of any other linear system Ax = b′ with the same matrix A requires only Ο(log n log s(n)) time and |E| + s(n)2 processors."
STOC,1985,153-162,"Katalin Friedl, Lajos Rónyai",Polynomial Time Solutions of Some Problems in Computational Algebra,https://doi.org/10.1145/22145.22162,"The first structure theory in abstract algebra was that of finite dimensional Lie algebras (Cartan-Killing), followed by the structure theory of associative algebras (Wedderburn-Artin). These theories determine, in a non-constructive way, the basic building blocks of the respective algebras (the radical and the simple components of the factor by the radical). In view of the extensive computations done in such algebras, it seems important to design efficient algorithms to find these building blocks. We find polynomial time solutions to a substantial part of these problems. We restrict our attention to algebras over finite fields and over algebraic number fields. We succeed in determining the radical (the “bad part” of the algebra) in polynomial time, using (in the case of prime characteristic) some new algebraic results developed in this paper. For associative algebras we are able to determine the simple components as well. This latter result generalizes factorization of polynomials over the given field. Correspondingly, our algorithm over finite fields is Las Vegas. Some of the results generalize to fields given by oracles. Some fundamental problems remain open. An example: decide whether or not a given rational algebra is a noncommutative field."
STOC,1985,163-168,"Andrew Chi-Chih Yao, F. Frances Yao",A General Approach to d-Dimensional Geometric Queries (Extended Abstract),https://doi.org/10.1145/22145.22163,"It is shown that any bounded region in Ed can be divided into 2d subregions of equal volume in such a way that no hyperplane in Ed can intersect all 2d of the subregions. This theorem provides the basis of a data structure scheme for organizing n points in d dimensions. Under this scheme, a broad class of geometric queries in d dimensions, including many common problems in range search and optimization, can be solved in linear storage space and sublinear time."
STOC,1985,169-174,Pravin M. Vaidya,Space-Time Tradeoffs for Orthogonal Range Queries (Extended Abstract),https://doi.org/10.1145/22145.22164,We investigate the question of (storage) space - (retrieval) time tradeoff for orthogonal range queries on a static database. Lower bounds on the product of retrieval time and storage space are obtained in the arithmetic and tree models.
STOC,1985,175-184,Kenneth L. Clarkson,A Probabilistic Algorithm for the Post Office Problem,https://doi.org/10.1145/22145.22165,"The post office problem is the following: points in d-dimensional space, so that given an arbitrary point p, the closest points in S to p can be found quickly. We consider the case of this problem where the Euclidean norm is the measure of distance. The previous best algorithm for this problem for d>2 requires Ο(n2d+1) preprocessing time to build a data structure allowing an Ο(log n query time. We will show that a data structure can be built in expected Ο(n(d-1)(1+k)) time, for any fixed k;>Ο, so that closest-point queries can be answered in Ο(log n) worstcase time. (The constant factors depend on d and k.) The algorithm employs random sampling, so the expected time holds for any set of points. A variant of this algorithm (for the variant problem where only one closest point of S to the query point is desired) requires Ο(n⌈d/2⌉) ο(n⌈d/2⌉) preprocessing time for ο(nt) worst-case query time, for any fixed ε>0. These results approach the Ω(n⌈d/2⌉) preprocessing time required for any algorithm constructing the Voronoi diagram of the input points. Implementation of these algorithms requires not too much more than a random sampling procedure and a procedure for constructing the Voronoi diagram of that random sample."
STOC,1985,185-194,Dov Harel,A Linear Time Algorithm for Finding Dominators in Flow Graphs and Related Problems,https://doi.org/10.1145/22145.22166,"In the first part of the paper we show how to extend recent methods for solving a special case of the union-find problem in linear time, to a special case of the eval-link-update problem for computing the minimum function defined on paths of trees. In the cases where our approach is applicable, we give a way to perform m eval, link, and update operations on n elements in O(m + n) time and O(n) space, improved from O(m α(m + n, n) + n) time and O(n) space in the more general case, where α is a functional inverse of Ackermans function. The technique gives similar improvements in the efficiency of algorithms for solving several network optimization problems in the case where all the keys involved are integers in some suitable range. In the second part of the paper we show how to use the new technique for speeding up the fastest known algorithm for finding dominators in flow graphs so that it runs in linear time. We introduce the notions of pseudo and external dominators which are both computable in linear time and make the technique introduced in the first part applicable for finding immediate dominators. We first give an algorithm for a limited class of graphs which include cycle free graphs, and thus can be used to find dominators in reducible flow graphs. We then show how to extend our technique for computing dominators on any flow graph. All the algorithms we describe run on a Random Access Machine."
STOC,1985,195-204,"Hitoshi Suzuki, Takao Nishizeki, Nobuji Saito",Multicommodity Flows in Planar Undirected Graphs and Shortest Paths,https://doi.org/10.1145/22145.22167,This paper deals with the multicommodity flow problems for two classes of planar undirected graphs. The first class C12 consists of graphs in which each source-sink pair is located on one of two specified face boundaries. The second class C01 consists of graphs in which some of the source-sink pairs are located on a specified face boundary and all the other pairs share a common sink located on the boundary. We show that the multicommodity flow problem for a graph in C12 (resp. C01) can be reduced to the shortest path problem for an undirected (resp. a directed) graph obtained from the dual of the original undirected graph.
STOC,1985,205-212,Joseph C. Culberson,The Effect of Updates in Binary Search Trees,https://doi.org/10.1145/22145.22168,"If a binary search tree is created by inserting N keys in random order using the usual insertion algorithm, then it is well known that the average search path is about 1.4lgN. However, if deletions, using the frequently recommended Hibbard's algorithm, are interspersed with the insertions, then virtually nothing has been proven except for Knuth and Jonassen's very difficult, but complete, analysis of the case N = 3. In this paper it is shown that after a sufficient number of updates the average search path is θ(N1/2). An improved algorithm given by Knuth is shown to have the same asymptotic behavior."
STOC,1985,213-216,"Samuel W. Bent, John W. John",Finding the Median Requires 2n Comparisons,https://doi.org/10.1145/22145.22169,"A long-standing problem in the analysis of algorithms is to determine the number of comparisons needed to find the t-th largest element in a totally ordered universe of size n. This number has been christened Vt (r) in the literature. By symmetry, we may always assume that 1<[n/21. Of particuiar interest is the asymptotic behavior of V*(n) when n goes to infinity either with f bed or with 1= an for a fixed constant a in the range 0< a 5 l/2. The case 1=[n/21, of course, gives the complexity of finding the median of n elements. The problem has an illustrious history. Knuth [lo] describes an investigation of Vz ((n) made by Dodgson (Lewis Carroll) in 1883 that event. ually inspired its exact determination,"
STOC,1985,217-223,"Fan R. K. Chung, D. J. Hajela, Paul D. Seymour",Self-Organizing Sequential Search and Hilbert's Inequalities,https://doi.org/10.1145/22145.22170,In this paper we describe a general technique which can be used to solve an old problem in analyzing self-organizing sequential search. We prove that the average time required for the move-to-front heuristic is no more than π/2 times that of the optimal order and this bound is best possible. Hilbert's inequalities will be used to derive large classes of inequalities some of which can be applied to obtain tight worst-case bounds for several self-organizing heuristics.
STOC,1985,224-231,"Béla Bollobás, István Simon",On the Expected Behaviour of Disjoint Set Union Algorithms,https://doi.org/10.1145/22145.22171,"We show that the expected time of the Weighted Quickfind (QFW) disjoint set union and find algorithm to perform (n - 1) randomly chosen unions is cn + o(n/log n), where c = 2.0847 …. This implies, through an observation of Tarjan and Van Leeuwen, linear expected time bounds to perform O(n) unions and finds for a class of other union -find algorithms. We also prove that the expected time of the unweighted Quickfind (QF) algorithm is n2/8 + o(n(log n)2), and set the several related open questions of Knuth and Schönhage."
STOC,1985,232-239,David Peleg,Concurrent Dynamic Logic (Extended Abstract),https://doi.org/10.1145/22145.22172,"In this paper concurrent dynamic logic (CDL) is introduced as an extension of dynamic logic tailored toward handling concurrent programs. Properties of CDL are discussed, both on the propositional and first-order level, and the extension is shown to possess most of the desirable properties of DL. Its relationships with the μ-calculus, game logic, DL with recursive procedures, and PTIME are further explored, revealing natural connections between concurrency, recursion, and alternation."
STOC,1985,240-251,"Moshe Y. Vardi, Larry J. Stockmeyer",Improved Upper and Lower Bounds for Modal Logics of Programs: Preliminary Report,https://doi.org/10.1145/22145.22173,"We describe novel techniques for establishing improved upper and lower bounds for modal logics of programs: 1) We introduce hybrid tree automata. These automata seems to be doubly exponential more powerful than Rabin tree automata but their emptiness problem is only exponentially harder (nondeterministic exponential time vs. nondeterministic polynomial time). The satisfiability problem for several logics is reducible to the emptiness problem for hybrid tree automata. Using this reduction we show that the satisfiability problems for Streett's delta-PDL. Kozen's μ-calculus and Parikh's game logic are solvable in nondeterministic exponential time, and the satisfiability problem for Emerson and Halpern's CTL and Vardi and Wolper's process logic (YAPL) are solvable in nondeterministic doubly exponential time. 2) We encode Turing machine computations by Kripke structures where every state in the structure represents a single tape cell. This yields a deterministic doubly exponential time lower bound for CTL and YAPL. 3) For variants of CTL and YAPL that deal only with finite computations we prove completeness for deterministic doubly exponential time."
