booktitle,year,pages,author,title,ee,abstract
STOC,2019,1-12,"Nima Anari, Kuikui Liu, Shayan Oveis Gharan, Cynthia Vinzant",Log-concave polynomials II: high-dimensional walks and an FPRAS for counting bases of a matroid.,https://doi.org/10.1145/3313276.3316385,"We design an FPRAS to count the number of bases of any matroid given by an independent set oracle, and to estimate the partition function of the random cluster model of any matroid in the regime where 0<q<1. Consequently, we can sample random spanning forests in a graph and estimate the reliability polynomial of any matroid. We also prove the thirty year old conjecture of Mihail and Vazirani that the bases exchange graph of any matroid has edge expansion at least 1.  Our algorithm and proof build on the recent results of Dinur, Kaufman, Mass and Oppenheim who show that a high dimensional walk on a weighted simplicial complex mixes rapidly if for every link of the complex, the corresponding localized random walk on the 1-skeleton is a strong spectral expander. One of our key observations is that a weighted simplicial complex X is a 0-local spectral expander if and only if a naturally associated generating polynomial pX is strongly log-concave. More generally, to every pure simplicial complex with positive weights on its maximal faces, we can associate to X a multiaffine homogeneous polynomial pX such that the eigenvalues of the localized random walks on X correspond to the eigenvalues of the Hessian of derivatives of pX."
STOC,2019,13-23,"Ran Raz, Avishay Tal",Oracle separation of BQP and PH.,https://doi.org/10.1145/3313276.3316315,"We present a distribution 𝓓 over inputs in {± 1}2N, such that:  (1)There exists a quantum algorithm that makes one (quantum) query to the input, and runs in time O(log N), that distinguishes between 𝓓 and the uniform distribution with advantage Ω (1/log N). (2)No Boolean circuit of quasi-polynomial size and constant depth distinguishes between 𝓓 and the uniform distribution with advantage better than polylog(N)/√N.  By well-known reductions, this gives a separation of the classes Promise-BQP and Promise-PH in the black-box model and implies an oracle relative to which BQP is not contained in PH."
STOC,2019,24-33,"Wojciech Czerwinski, Slawomir Lasota 0001, Ranko Lazic 0001, Jérôme Leroux, Filip Mazowiecki",The reachability problem for Petri nets is not elementary.,https://doi.org/10.1145/3313276.3316369,"Petri nets, also known as vector addition systems, are a long established model of concurrency with extensive applications in modeling and analysis of hardware, software, and database systems, as well as chemical, biological, and business processes. The central algorithmic problem for Petri nets is reachability: whether from the given initial configuration there exists a sequence of valid execution steps that reaches the given final configuration. The complexity of the problem has remained unsettled since the 1960s, and it is one of the most prominent open questions in the theory of verification. Decidability was proved by Mayr in his seminal STOC 1981 work, and, currently, the best published upper bound is non-primitive recursive Ackermannian of Leroux and Schmitz from Symposium on Logic in Computer Science 2019. We establish a non-elementary lower bound, i.e., that the reachability problem needs a tower of exponentials of time and space. Until this work, the best lower bound has been exponential space, due to Lipton in 1976. The new lower bound is a major breakthrough for several reasons. Firstly, it shows that the reachability problem is much harder than the coverability (i.e., state reachability) problem, which is also ubiquitous but has been known to be complete for exponential space since the late 1970s. Secondly, it implies that a plethora of problems from formal languages, logic, concurrent systems, process calculi, and other areas, which are known to admit reductions from the Petri nets reachability problem, are also not elementary. Thirdly, it makes obsolete the current best lower bounds for the reachability problems for two key extensions of Petri nets: with branching and with a pushdown stack. We develop a construction that uses arbitrarily large pairs of values with ratio R to provide zero testable counters that are bounded by R. At the heart of our proof is then a novel gadget, the so-called factorial amplifier that, assuming availability of counters that are zero testable and bounded by k, guarantees to produce arbitrarily large pairs of values whose ratio is exactly the factorial of k. Repeatedly composing the factorial amplifier with itself by means of the former construction enables us to compute, in linear time, Petri nets that simulate Minsky machines whose counters are bounded by a tower of exponentials, which yields the non-elementary lower bound. By refining this scheme further, we, in fact, already establish hardness for h-exponential space for Petri nets with h + 13 counters."
STOC,2019,34-41,"Lijie Chen 0001, Roei Tell","Bootstrapping results for threshold circuits ""just beyond"" known lower bounds.",https://doi.org/10.1145/3313276.3316333,"The best known lower bounds for the circuit class TC0 are only slightly super-linear. Similarly, the best known algorithm for derandomization of this class is an algorithm for quantified derandomization (i.e., a weak type of derandomization) of circuits of slightly super-linear size. In this paper we show that even very mild quantitative improvements of either of the two foregoing results would already imply super-polynomial lower bounds for TC0. Specifically:  (1) If for every c>1 and sufficiently large d∈ℕ it holds that n-bit TC0 circuits of depth d require n1+c−d wires to compute certain NC1-complete functions, then TC0≠NC1. In fact, even lower bounds for TC0 circuits of size n1+c−d against these functions when c>1 is fixed and sufficiently small would yield lower bounds for polynomial-sized circuits. Lower bounds of the form n1+c−d against these functions are already known, but for a fixed c≈2.41 that is too large to yield new lower bounds via our results.  (2) If there exists a deterministic algorithm that gets as input an n-bit TC0 circuit of depth d and n1+(1.61)−d wires, runs in time 2no(1), and distinguishes circuits that accept at most B(n)=2n1−(1.61)−d inputs from circuits that reject at most B(n) inputs, then NEXP⊈TC0. An algorithm for this “quantified derandomization” task is already known, but it works only when the number of wires is n1+c−d, for c>30, and with a smaller B(n)≈2n1−(30/c)d.  Intuitively, the “takeaway” message from our work is that the gap between currently-known results and results that would suffice to get super-polynomial lower bounds for TC0 boils down to the precise constant c>1 in the bound n1+c−d on the number of wires. Our results improve previous results of Allender and Koucký (2010) and of the second author (2018), respectively, whose hypotheses referred to circuits with n1+c/d wires (rather than n1+c−d wires). We also prove results similar to two results above for other circuit classes (i.e., ACC0 and CC0)."
STOC,2019,42-53,"Arkadev Chattopadhyay, Nikhil S. Mande, Suhail Sherif",The log-approximate-rank conjecture is false.,https://doi.org/10.1145/3313276.3316353,"We construct a simple and total Boolean function F = f ○ XOR on 2n variables that has only O(√n) spectral norm, O(n2) approximate rank, and O(n2.5) approximate nonnegative rank. We show it has polynomially large randomized bounded-error communication complexity of Ω(√n). This yields the first exponential gap between the logarithm of the approximate rank and randomized communication complexity for total functions. Thus, F witnesses a refutation of the log-approximate-rank conjecture that was posed by Lee and Shraibman as a very natural analogue for randomized communication of the still unresolved log-rank conjecture for deterministic communication. The best known previous gap for any total function between the two measures is a recent 4th-power separation by Göös et al. Additionally, our function F refutes Grolmusz’s conjecture and a variant of the log-approximate-nonnegative-rank conjecture suggested recently by Kol et al., both of which are implied by the log-approximate-rank conjecture. The complement of F has exponentially large approximate nonnegative rank. This answers a question of Lee [32], showing that approximate nonnegative rank can be exponentially larger than approximate rank. The inner function F also falsifies a conjecture about parity measures of Boolean functions made by Tsang et al. The latter conjecture implied the log-rank conjecture for XOR functions. We are pleased to note that shortly after we published our results, two independent groups of researchers, Anshu et al. and Sinha and de Wolf, used our function F to prove that the quantum-log-rank conjecture is also false by showing that F has Ω(n1/6) quantum communication complexity."
STOC,2019,54-65,"Jugal Garg, László A. Végh",A strongly polynomial algorithm for linear exchange markets.,https://doi.org/10.1145/3313276.3316340,"We present a strongly polynomial algorithm for computing an equilibrium in Arrow-Debreu exchange markets with linear utilities. Our algorithm is based on a variant of the weakly-polynomial Duan-Mehlhorn (DM) algorithm. We use the DM algorithm as a subroutine to identify revealed edges, i.e., pairs of agents and goods that must correspond to best bang-per-buck transactions in every equilibrium solution. Every time a new revealed edge is found, we use another subroutine that decides if there is an optimal solution using the current set of revealed edges, or if none exists, finds the solution that approximately minimizes the violation of the demand and supply constraints. This task can be reduced to solving a linear program (LP). Even though we are unable to solve this LP in strongly polynomial time, we show that it can be approximated by a simpler LP with two variables per inequality that is solvable in strongly polynomial time."
STOC,2019,66-77,"Eric Balkanski, Aviad Rubinstein, Yaron Singer",An optimal approximation for submodular maximization under a matroid constraint in the adaptive complexity model.,https://doi.org/10.1145/3313276.3316304,"In this paper we study submodular maximization under a matroid constraint in the adaptive complexity model. This model was recently introduced in the context of submodular optimization to quantify the information theoretic complexity of black-box optimization in a parallel computation model. Informally, the adaptivity of an algorithm is the number of sequential rounds it makes when each round can execute polynomially-many function evaluations in parallel. Since submodular optimization is regularly applied on large datasets we seek algorithms with low adaptivity to enable speedups via parallelization. Consequently, a recent line of work has been devoted to designing constant factor approximation algorithms for maximizing submodular functions under various constraints in the adaptive complexity model.  Despite the burst in work on submodular maximization in the adaptive complexity model, the fundamental problem of maximizing a monotone submodular function under a matroid constraint has remained elusive. In particular, all known techniques fail for this problem and there are no known constant factor approximation algorithms whose adaptivity is sublinear in the rank of the matroid k or in the worst case sublinear in the size of the ground set n.  In this paper we present an approximation algorithm for the problem of maximizing a monotone submodular function under a matroid constraint in the adaptive complexity model. The approximation guarantee of the algorithm is arbitrarily close to the optimal 1−1/e and it has near optimal adaptivity of Ø(log(n)log(k)). This result is obtained using a novel technique of adaptive sequencing which departs from previous techniques for submodular maximization in the adaptive complexity model. In addition to our main result we show how to use this technique to design other approximation algorithms with strong approximation guarantees and polylogarithmic adaptivity."
STOC,2019,78-89,"Chandra Chekuri, Kent Quanrud",Parallelizing greedy for submodular set function maximization in matroids and beyond.,https://doi.org/10.1145/3313276.3316406,"We consider parallel, or low adaptivity, algorithms for submodular function maximization. This line of work was recently initiated by Balkanski and Singer and has already led to several interesting results on the cardinality constraint and explicit packing constraints. An important open problem is the classical setting of matroid constraint, which has been instrumental for developments in submodular function maximization. In this paper we develop a general strategy to parallelize the well-studied greedy algorithm and use it to obtain a randomized (1 / 2 − є)-approximation in O( log2(n) / 2 ) rounds of adaptivity. We rely on this algorithm, and an elegant amplification approach due to Badanidiyuru and Vondrák to obtain a fractional solution that yields a near-optimal randomized ( 1 − 1/e − є )-approximation in O( log2(n) / є3 ) rounds of adaptivity. For non-negative functions we obtain a ( 3−2√2 − є )-approximation and a fractional solution that yields a ( 1 / e − є)-approximation. Our approach for parallelizing greedy yields approximations for intersections of matroids and matchoids, and the approximation ratios are comparable to those known for sequential greedy."
STOC,2019,90-101,"Alina Ene, Huy L. Nguyen, Adrian Vladu",Submodular maximization with matroid and packing constraints in parallel.,https://doi.org/10.1145/3313276.3316389,"We consider the problem of maximizing the multilinear extension of a submodular function subject a single matroid constraint or multiple packing constraints with a small number of adaptive rounds of evaluation queries.  We obtain the first algorithms with low adaptivity for submodular maximization with a matroid constraint. Our algorithms achieve a 1−1/e−є approximation for monotone functions and a 1/e−є approximation for non-monotone functions, which nearly matches the best guarantees known in the fully adaptive setting. The number of rounds of adaptivity is O(log2 n/є3), which is an exponential speedup over the existing algorithms.  We obtain the first parallel algorithm for non-monotone submodular maximization subject to packing constraints. Our algorithm achieves a 1/e−є approximation using O(log(n/є) log(1/є) log(n+m)/ є2) parallel rounds, which is again an exponential speedup in parallel time over the existing algorithms. For monotone functions, we obtain a 1−1/e−є approximation in O(log(n/є)logm/є2) parallel rounds. The number of parallel rounds of our algorithm matches that of the state of the art algorithm for solving packing LPs with a linear objective (Mahoney et al., 2016).  Our results apply more generally to the problem of maximizing a diminishing returns submodular (DR-submodular) function."
STOC,2019,102-113,"Lin Chen 0003, Moran Feldman, Amin Karbasi",Unconstrained submodular maximization with constant adaptive complexity.,https://doi.org/10.1145/3313276.3316327,"In this paper, we consider the unconstrained submodular maximization problem. We propose the first algorithm for this problem that achieves a tight (1/2−ε)-approximation guarantee using Õ(ε−1) adaptive rounds and a linear number of function evaluations. No previously known algorithm for this problem achieves an approximation ratio better than 1/3 using less than Ω(n) rounds of adaptivity, where n is the size of the ground set. Moreover, our algorithm easily extends to the maximization of a non-negative continuous DR-submodular function subject to a box constraint, and achieves a tight (1/2−ε)-approximation guarantee for this problem while keeping the same adaptive and query complexities."
STOC,2019,114-125,"Amir Abboud, Raghavendra Addanki, Fabrizio Grandoni 0001, Debmalya Panigrahi, Barna Saha",Dynamic set cover: improved algorithms and lower bounds.,https://doi.org/10.1145/3313276.3316376,"We give new upper and lower bounds for the dynamic set cover problem. First, we give a (1+?) f-approximation for fully dynamic set cover in O(f2logn/?5) (amortized) update time, for any ? > 0, where f is the maximum number of sets that an element belongs to. In the decremental setting, the update time can be improved to O(f2/?5), while still obtaining an (1+?) f-approximation. These are the first algorithms that obtain an approximation factor linear in f for dynamic set cover, thereby almost matching the best bounds known in the offline setting and improving upon the previous best approximation of O(f2) in the dynamic setting.  To complement our upper bounds, we also show that a linear dependence of the update time on f is necessary unless we can tolerate much worse approximation factors. Using the recent distributed PCP-framework, we show that any dynamic set cover algorithm that has an amortized update time of O(f1??) must have an approximation factor that is Ω(nδ) for some constant δ>0 under the Strong Exponential Time Hypothesis."
STOC,2019,126-137,"Deeparnab Chakrabarty, Chaitanya Swamy",Approximation algorithms for minimum norm and ordered optimization problems.,https://doi.org/10.1145/3313276.3316322,"In many optimization problems, a feasible solution induces a multi-dimensional cost vector. For example, in load-balancing a schedule induces a load vector across the machines. In k-clustering, opening k facilities induces an assignment cost vector across the clients. Typically, one seeks a solution which either minimizes the sum- or the max- of this vector, and these problems (makespan minimization, k-median, and k-center) are classic NP-hard problems which have been extensively studied.  In this paper we consider the minimum-norm optimization problem. Given an arbitrary monotone, symmetric norm, the problem asks to find a solution which minimizes the norm of the induced cost-vector. Such norms are versatile and include ℓp norms, Top-ℓ norm (sum of the ℓ largest coordinates in absolute value), and ordered norms (non-negative linear combination of Top-ℓ norms), and consequently, the minimum-norm problem models a wide variety of problems under one umbrella, We give a general framework to tackle the minimum-norm problem, and illustrate its efficacy in the unrelated machine load balancing and k-clustering setting. Our concrete results are the following.  (a) We give constant factor approximation algorithms for the minimum norm load balancing problem in unrelated machines, and the minimum norm k-clustering problem. To our knowledge, our results constitute the first constant-factor approximations for such a general suite of objectives.  (b) For load balancing on unrelated machines, we give a (2+ε)-approximation for ordered load balancing (i.e., min-norm load-balancing under an ordered norm).  (c) For k-clustering, we give a (5+ε)-approximation for the ordered k-median problem, which significantly improves upon the previous-best constant-factor approximation (Chakrabarty and Swamy (ICALP 2018); Byrka, Sornat, and Spoerhase (STOC 2018)).  (d) Our techniques also imply O(1) approximations to the instance-wise best simultaneous approximation factor for unrelated-machine load-balancing and k-clustering. To our knowledge, these are the first positive simultaneous approximation results in these settings.  At a technical level, one of our chief insights is that minimum-norm optimization can be reduced to a special case that we call min-max ordered optimization. Both the reduction, and the task of devising algorithms for the latter problem, require a sparsification idea that we develop, which is of interest for ordered optimization problems. The main ingredient in solving min-max ordered optimization is a deterministic, oblivious rounding procedure (that we devise) for suitable LP relaxations of the load-balancing and k-clustering problem; this may be of independent interest."
STOC,2019,138-151,"Panagiotis Charalampopoulos, Pawel Gawrychowski, Shay Mozes, Oren Weimann",Almost optimal distance oracles for planar graphs.,https://doi.org/10.1145/3313276.3316316,"We present new tradeoffs between space and query-time for exact distance oracles in directed weighted planar graphs. These tradeoffs are almost optimal in the sense that they are within polylogarithmic, subpolynomial or arbitrarily small polynomial factors from the naïve linear space, constant query-time lower bound. These tradeoffs include: (i) an oracle with space O(n1+є) and query-time Õ(1) for any constant є>0, (ii) an oracle with space Õ(n) and query-time O(nє) for any constant є>0, and (iii) an oracle with space n1+o(1) and query-time no(1)."
STOC,2019,152-163,"Jason Li 0006, Merav Parter",Planar diameter via metric compression.,https://doi.org/10.1145/3313276.3316358,"We develop a new approach for distributed distance computation in planar graphs that is based on a variant of the metric compression problem recently introduced by Abboud et al. [SODA’18]. In our variant of the Planar Graph Metric Compression Problem, one is given an n-vertex planar graph G=(V,E), a set of S ⊆ V source terminals lying on a single face, and a subset of target terminals T ⊆ V. The goal is to compactly encode the S× T distances.  One of our key technical contributions is in providing a compression scheme that encodes all S × T distances using O(|S|·(D)+|T|) bits, for unweighted graphs with diameter D. This significantly improves the state of the art of O(|S|· 2D+|T| · D) bits. We also consider an approximate version of the problem for weighted graphs, where the goal is to encode (1+є) approximation of the S × T distances, for a given input parameter є ∈ (0,1]. Here, our compression scheme uses O((|S|/є)+|T|) bits. In addition, we describe how these compression schemes can be computed in near-linear time. At the heart of this compact compression scheme lies a VC-dimension type argument on planar graphs, using the well-known Sauer’’s lemma.  This efficient compression scheme leads to several improvements and simplifications in the setting of diameter computation, most notably in the distributed setting: There is an O(D5)-round randomized distributed algorithm for computing the diameter in planar graphs, w.h.p. There is an O(D3)+D2(logn/є)-round randomized distributed algorithm for computing a (1+є) approximation for the diameter in weighted planar graphs, with unweighted diameter D, w.h.p.   No sublinear round algorithms were known for these problems before. These distributed constructions are based on a new recursive graph decomposition that preserves the (unweighted) diameter of each of the subgraphs up to a logarithmic term. Using this decomposition, we also get an exact SSSP tree computation within O(D2) rounds."
STOC,2019,164-175,"Ken-ichi Kawarabayashi, Anastasios Sidiropoulos",Polylogarithmic approximation for Euler genus on bounded degree graphs.,https://doi.org/10.1145/3313276.3316409,"Computing the Euler genus of a graph is a fundamental problem in algorithmic graph theory. It has been shown to be NP-hard by [Thomassen ’89, Thomassen ’97], even for cubic graphs, and a linear-time fixed-parameter algorithm has been obtained by [Mohar ’99]. Despite extensive study, the approximability of the Euler genus remains wide open. While the existence of an O(1)-approximation is not ruled out, the currently best-known upper bound is a O(n1−α)-approximation, for some universal constant α>0 [Kawarabayashi and Sidiropoulos 2017].  We present an O(log2.5 n)-approximation polynomial time algorithm for this problem on graphs of bounded degree. Prior to our work, the best known result on graphs of bounded degree was a nΩ(1)-approximation [Chekuri and Sidiropoulos 2013].  As an immediate corollary, we also obtain improved approximation algorithms for the crossing number problem and for the minimum vertex planarization problem, on graphs of bounded degree. Specifically, we obtain a polynomial-time O(2 log3.5 n)-approximation algorithm for the minimum vertex planarization problem, on graphs of maximum degree . Moreover we obtain an algorithm which given a graph of crossing number k, computes a drawing with at most k2 logO(1) n crossings in polynomial time. This also implies a n1/2 logO(1) n-approximation polynomial time algorithm. The previously best-known result is a polynomial time algorithm that computes a drawing with k10 logO(1) crossings, which implies a n9/10logO(1) n-approximation algorithm [Chuzhoy 2011]."
