booktitle,year,pages,author,title,ee,abstract
STOC,2019,686-696,"Hedyeh Beyhaghi, S. Matthew Weinberg",Optimal (and benchmark-optimal) competition complexity for additive buyers over independent items.,https://doi.org/10.1145/3313276.3316405,"The Competition Complexity of an auction setting refers to the number of additional bidders necessary in order for the (deterministic, prior-independent, dominant strategy truthful) Vickrey-Clarke-Groves mechanism to achieve greater revenue than the (randomized, prior-dependent, Bayesian-truthful) optimal mechanism without the additional bidders.  We prove that the competition complexity of n bidders with additive valuations over m independent items is at most n(ln(1+m/n)+2), and also at most 9√nm. When n ≤ m, the first bound is optimal up to constant factors, even when the items are i.i.d. and regular. When n ≥ m, the second bound is optimal for the benchmark introduced by Eden et al. up to constant factors, even when the items are i.i.d. and regular. We further show that, while the Eden et al. benchmark is not necessarily tight in the n ≥ m regime, the competition complexity of n bidders with additive valuations over even 2 i.i.d. regular items is indeed ω(1).  Our main technical contribution is a reduction from analyzing the Eden et al. benchmark to proving stochastic dominance of certain random variables."
STOC,2019,697-708,"Bernhard Haeupler, Aviad Rubinstein, Amirbehshad Shahrasbi",Near-linear time insertion-deletion codes and (1+ε)-approximating edit distance via indexing.,https://doi.org/10.1145/3313276.3316371,"We introduce fast-decodable indexing schemes for edit distance which can be used to speed up edit distance computations to near-linear time if one of the strings is indexed by an indexing string I. In particular, for every length n and every ε >0, one can in near linear time construct a string I ∈ Σ′n with |Σ′| = Oε(1), such that, indexing any string S ∈ Σn, symbol-by-symbol, with I results in a string S′ ∈ Σ″n where Σ″ = Σ × Σ′ for which edit distance computations are easy, i.e., one can compute a (1+ε)-approximation of the edit distance between S′ and any other string in O(n (logn)) time.  Our indexing schemes can be used to improve the decoding complexity of state-of-the-art error correcting codes for insertions and deletions. In particular, they lead to near-linear time decoding algorithms for the insertion-deletion codes of [Haeupler, Shahrasbi; STOC ‘17] and faster decoding algorithms for list-decodable insertion-deletion codes of [Haeupler, Shahrasbi, Sudan; ICALP ‘18]. Interestingly, the latter codes are a crucial ingredient in the construction of fast-decodable indexing schemes."
STOC,2019,709-720,"Mahdi Boroujeni, Mohammad Ghodsi, MohammadTaghi Hajiaghayi, Saeed Seddighin",1+ε approximation of tree edit distance in quadratic time.,https://doi.org/10.1145/3313276.3316388,"Edit distance is one of the most fundamental problems in computer science. Tree edit distance is a natural generalization of edit distance to ordered rooted trees. Such a generalization extends the applications of edit distance to areas such as computational biology, structured data analysis (e.g., XML), image analysis, and compiler optimization. Perhaps the most notable application of tree edit distance is in the analysis of RNA molecules in computational biology where the secondary structure of RNA is typically represented as a rooted tree.  The best-known solution for tree edit distance runs in cubic time. Recently, Bringmann et al. show that an O(n2.99) algorithm for weighted tree edit distance is unlikely by proving a conditional lower bound on the computational complexity of tree edit distance. This shows a substantial gap between the computational complexity of tree edit distance and that of edit distance for which a simple dynamic program solves the problem in quadratic time.  In this work, we give the first non-trivial approximation algorithms for tree edit distance. Our main result is a quadratic time approximation scheme for tree edit distance that approximates the solution within a factor of 1+є for any constant є > 0."
STOC,2019,721-732,"Arun Ganesh, Qiuyi (Richard) Zhang",Optimal sequence length requirements for phylogenetic tree reconstruction with indels.,https://doi.org/10.1145/3313276.3316345,"We consider the phylogenetic tree reconstruction problem with insertions and deletions (indels). Phylogenetic algorithms proceed under a model where sequences evolve down the model tree, and given sequences at the leaves, the problem is to reconstruct the model tree with high probability. Traditionally, sequences mutate by substitution-only processes, although some recent work considers evolutionary processes with insertions and deletions. In this paper, we improve on previous work by giving a reconstruction algorithm that simultaneously has O(poly logn) sequence length and tolerates constant indel probabilities on each edge. Our recursively-reconstructed distance-based technique provably outputs the model tree when the model tree has O(poly logn) diameter and discretized branch lengths, allowing for the probability of insertion and deletion to be non-uniform and asymmetric on each edge. Our polylogarithmic sequence length bounds improve significantly over previous polynomial sequence length bounds and match sequence length bounds in the substitution-only models of phylogenetic evolution, thereby challenging the idea that many global misalignments caused by insertions and deletions when pindel is large are a fundamental obstruction to reconstruction with short sequences.  We build upon a signature scheme for sequences, introduced by Daskalakis and Roch, that is robust to insertions and deletions. Our main contribution is to show that an averaging procedure gives an accurate reconstruction of signatures for ancestors, even while the explicit ancestral sequences cannot be reconstructed due to misalignments. Because these signatures are not as sensitive to indels, we can bound the noise that arise from indel-induced shifts and provide a novel analysis that provably reconstructs the model tree with O(poly logn) sequence length as long as the rate of mutation is less than the well known Kesten-Stigum threshold. The upper bound on the rate of mutation is optimal as beyond this threshold, an information-theoretic lower bound of Ω(poly(n)) sequence length requirement exists."
STOC,2019,733-743,"Bartlomiej Dudek 0001, Pawel Gawrychowski",Computing quartet distance is equivalent to counting 4-cycles.,https://doi.org/10.1145/3313276.3316390,"The quartet distance is a measure of similarity used to compare two unrooted phylogenetic trees on the same set of n leaves, defined as the number of subsets of four leaves related by a different topology in both trees. After a series of previous results, Brodal et al. [SODA 2013] presented an algorithm that computes this number in O(ndlogn) time, where d is the maximum degree of a node. For the related triplet distance between rooted phylogenetic trees, the same authors were able to design an O(nlogn) time algorithm, that is, with running time independent of d. This raises the question of achieving such complexity for computing the quartet distance, or at least improving the dependency on d.  Our main contribution is a two-way reduction establishing that the complexity of computing the quartet distance between two trees on n leaves is the same, up to polylogarithmic factors, as the complexity of counting 4-cycles in an undirected simple graph with m edges. The latter problem has been extensively studied, and the fastest known algorithm by Vassilevska Williams [SODA 2015] works in O(m1.48) time. In fact, even for the seemingly simpler problem of detecting a 4-cycle, the best known algorithm works in O(m4/3) time, and a conjecture of Yuster and Zwick implies that this might be optimal. In particular, an almost-linear time for computing the quartet distance would imply a surprisingly efficient algorithm for counting 4-cycles. In the other direction, by plugging in the state-of-the-art algorithms for counting 4-cycles, our reduction allows us to significantly decrease the complexity of computing the quartet distance. For trees with unbounded degrees we obtain an O(n1.48) time algorithm, which is a substantial improvement on the previous bound of O(n2logn). For trees with degrees bounded by d, by analysing the reduction more carefully, we are able to obtain an Õ(nd0.77) time algorithm, which is again a nontrivial improvement on the previous bound of O(ndlogn)."
STOC,2019,744-755,"Sandip Sinha, Omri Weinstein",Local decodability of the Burrows-Wheeler transform.,https://doi.org/10.1145/3313276.3316317,"The Burrows-Wheeler Transform (BWT) is among the most influential discoveries in text compression and DNA storage. It is a reversible preprocessing step that rearranges an n-letter string into runs of identical characters (by exploiting context regularities), resulting in highly compressible strings, and is the basis of the bzip compression program. Alas, the decoding process of BWT is inherently sequential and requires Ω(n) time even to retrieve a single character.  We study the succinct data structure problem of locally decoding short substrings of a given text under its compressed BWT, i.e., with small additive redundancy r over the Move-To-Front (bzip) compression. The celebrated BWT-based FM-index (FOCS ’00), as well as other related literature, yield a trade-off of r=Õ(n/√t) bits, when a single character is to be decoded in O(t) time. We give a near-quadratic improvement r=Õ(nlg(t)/t). As a by-product, we obtain an exponential (in t) improvement on the redundancy of the FM-index for counting pattern-matches on compressed text. In the interesting regime where the text compresses to o(n) (say, n/polylg(n)) bits, these results provide an exp(t) overall space reduction. For the local decoding problem of BWT, we also prove an Ω(n/t2) cell-probe lower bound for “symmetric” data structures.  We achieve our main result by designing a compressed partial-sums (Rank) data structure over BWT. The key component is a locally-decodable Move-to-Front (MTF) code: with only O(1) extra bits per block of length nΩ(1), the decoding time of a single character can be decreased from Ω(n) to O(lgn). This result is of independent interest in algorithmic information theory."
STOC,2019,756-767,"Dominik Kempa, Tomasz Kociumaka",String synchronizing sets: sublinear-time BWT construction and optimal LCE data structure.,https://doi.org/10.1145/3313276.3316368,"Burrows–Wheeler transform (BWT) is an invertible text transformation that, given a text T of length n, permutes its symbols according to the lexicographic order of suffixes of T. BWT is one of the most heavily studied algorithms in data compression with numerous applications in indexing, sequence analysis, and bioinformatics. Its construction is a bottleneck in many scenarios, and settling the complexity of this task is one of the most important unsolved problems in sequence analysis that has remained open for 25 years. Given a binary string of length n, occupying O(n/logn) machine words, the BWT construction algorithm due to Hon et al. (SIAM J. Comput., 2009) runs in O(n) time and O(n/logn) space. Recent advancements (Belazzougui, STOC 2014, and Munro et al., SODA 2017) focus on removing the alphabet-size dependency in the time complexity, but they still require Ω(n) time. Despite the clearly suboptimal running time, the existing techniques appear to have reached their limits.  In this paper, we propose the first algorithm that breaks the O(n)-time barrier for BWT construction. Given a binary string of length n, our procedure builds the Burrows–Wheeler transform in O(n/√logn) time and O(n/logn) space. We complement this result with a conditional lower bound proving that any further progress in the time complexity of BWT construction would yield faster algorithms for the very well studied problem of counting inversions: it would improve the state-of-the-art O(m√logm)-time solution by Chan and Pătraşcu (SODA 2010). Our algorithm is based on a novel concept of string synchronizing sets, which is of independent interest. As one of the applications, we show that this technique lets us design a data structure of the optimal size O(n/logn) that answers Longest Common Extension queries (LCE queries) in O(1) time and, furthermore, can be deterministically constructed in the optimal O(n/logn) time."
STOC,2019,768-779,"André Linhares, Chaitanya Swamy",Approximation algorithms for distributionally-robust stochastic optimization with black-box distributions.,https://doi.org/10.1145/3313276.3316391,"Two-stage stochastic optimization is a widely used framework for modeling uncertainty, where we have a probability distribution over possible realizations of the data, called scenarios, and decisions are taken in two stages: we make first-stage decisions knowing only the underlying distribution and before a scenario is realized, and may take additional second-stage recourse actions after a scenario is realized. The goal is typically to minimize the total expected cost. A common criticism levied at this model is that the underlying probability distribution is itself often imprecise! To address this, an approach that is quite versatile and has gained popularity in the stochastic-optimization literature is the distributionally robust 2-stage model: given a collection D of probability distributions, our goal now is to minimize the maximum expected total cost with respect to a distribution in D.  We provide a framework for designing approximation algorithms in such settings when the collection D is a ball around a central distribution and the central distribution is accessed only via a sampling black box. We first show that one can utilize the sample average approximation (SAA) method—solve the distributionally robust problem with an empirical estimate of the central distribution—to reduce the problem to the case where the central distribution has polynomial-size support. Complementing this, we show how to approximately solve a fractional relaxation of the SAA (i.e., polynomial-scenario central-distribution) problem. Unlike in 2-stage stochastic- or robust- optimization, this turns out to be quite challenging. We utilize the ellipsoid method in conjunction with several new ideas to show that this problem can be approximately solved provided that we have an (approximation) algorithm for a certain max-min problem that is akin to, and generalizes, the k-max-min problem—find the worst-case scenario consisting of at most k elements—encountered in 2-stage robust optimization. We obtain such a procedure for various discrete-optimization problems; by complementing this via LP-rounding algorithms that provide local (i.e., per-scenario) approximation guarantees, we obtain the first approximation algorithms for the distributionally robust versions of a variety of discrete-optimization problems including set cover, vertex cover, edge cover, facility location, and Steiner tree, with guarantees that are, except for set cover, within O(1)-factors of the guarantees known for the deterministic version of the problem."
STOC,2019,780-791,"Moses Charikar, Kirankumar Shiragur, Aaron Sidford",Efficient profile maximum likelihood for universal symmetric property estimation.,https://doi.org/10.1145/3313276.3316398,"Estimating symmetric properties of a distribution, e.g. support size, coverage, entropy, distance to uniformity, are among the most fundamental problems in algorithmic statistics. While these properties have been studied extensively and separate optimal estimators have been produced, in striking recent work Acharya et al. provided a single estimator that is competitive for each. They showed that the value of the property on the distribution that approximately maximizes profile likelihood (PML), i.e. the probability of observed frequency of frequencies, is sample competitive with respect to a broad class of estimators. Unfortunately, prior to this work, there was no known polynomial time algorithm to compute such an approximation or use PML to obtain a universal plug-in estimator.  In this paper we provide an algorithm that, given n samples from a distribution, computes an approximate PML distribution up to a multiplicative error of exp(n2/3 poly log(n)) in nearly linear time. Generalizing work of Acharya et al. we show that our algorithm yields a universal plug-in estimator that is competitive with a broad range of estimators up to accuracy є = Ω(n−0.166). Further, we provide efficient polynomial-time algorithms for computing a d-dimensional generalization of PML (for constant d) that allows for universal plug-in estimation of symmetric relationships between distributions."
STOC,2019,792-803,"Uri Hadar, Jingbo Liu, Yury Polyanskiy, Ofer Shayevitz",Communication complexity of estimating correlations.,https://doi.org/10.1145/3313276.3316332,"We characterize the communication complexity of the following distributed estimation problem. Alice and Bob observe infinitely many iid copies of ρ-correlated unit-variance (Gaussian or ±1 binary) random variables, with unknown ρ∈[−1,1]. By interactively exchanging k bits, Bob wants to produce an estimate ρ of ρ. We show that the best possible performance (optimized over interaction protocol Π and estimator ρ) satisfies infΠ ρsupρE [|ρ−ρ|2] = k−1 (1/2 ln2 + o(1)). Curiously, the number of samples in our achievability scheme is exponential in k; by contrast, a naive scheme exchanging k samples achieves the same Ω(1/k) rate but with a suboptimal prefactor. Our protocol achieving optimal performance is one-way (non-interactive). We also prove the Ω(1/k) bound even when ρ is restricted to any small open sub-interval of [−1,1] (i.e. a local minimax lower bound). Our proof techniques rely on symmetric strong data-processing inequalities and various tensorization techniques from information-theoretic interactive common-randomness extraction. Our results also imply an Ω(n) lower bound on the information complexity of the Gap-Hamming problem, for which we show a direct information-theoretic proof."
STOC,2019,804-815,"Ilias Diakonikolas, Daniel M. Kane",Degree-푑 chow parameters robustly determine degree-푑 PTFs (and algorithmic applications).,https://doi.org/10.1145/3313276.3316301,"The degree-d Chow parameters of a Boolean function are its degree at most d Fourier coefficients. It is well-known that degree-d Chow parameters uniquely characterize degree-d polynomial threshold functions (PTFs) within the space of all bounded functions. In this paper, we prove a robust version of this theorem: For f any Boolean degree-d PTF and g any bounded function, if the degree-d Chow parameters of f are close to the degree-d Chow parameters of g in ℓ2-norm, then f is close to g in ℓ1-distance. Notably, our bound relating the two distances is independent of the dimension. That is, we show that Boolean degree-d PTFs are robustly identifiable from their degree-d Chow parameters. No non-trivial bound was previously known for d >1.  Our robust identifiability result gives the following algorithmic applications: First, we show that Boolean degree-d PTFs can be efficiently approximately reconstructed from approximations to their degree-d Chow parameters. This immediately implies that degree-d PTFs are efficiently learnable in the uniform distribution d-RFA model. As a byproduct of our approach, we also obtain the first low integer-weight approximations of degree-d PTFs, for d>1. As our second application, our robust identifiability result gives the first efficient algorithm, with dimension-independent error guarantees, for malicious learning of Boolean degree-d PTFs under the uniform distribution.  The proof of our robust identifiability result involves several new technical ingredients, including the following structural result for degree-d multivariate polynomials with very poor anti-concentration: If p is a degree-d polynomial where p(x) is very close to 0 on a large number of points in { ± 1 }n, then there exists a degree-d hypersurface that exactly passes though almost all of these points. We leverage this structural result to show that if the degree-d Chow distance between f and g is small, then we can find many degree-d polynomials that vanish on their disagreement region, and in particular enough that forces the ℓ1-distance between f and g to also be small. To implement this proof strategy, we require additional technical ideas. In particular, in the d=2 case we show that for any large vector space of degree-2 polynomials with a large number of common zeroes, there exists a linear function that vanishes on almost all of these zeroes. The degree-d degree generalization of this statement is significantly more complex, and can be viewed as an effective version of Hilbert’s Basis Theorem for our setting."
STOC,2019,816-827,"Jian Ding, Nike Sun",Capacity lower bound for the Ising perceptron.,https://doi.org/10.1145/3313276.3316383,"We consider the Ising perceptron with gaussian disorder, which is equivalent to the discrete cube {−1,+1}N intersected by M random half-spaces. The perceptron’s capacity is the largest integer MN for which the intersection is nonempty. It is conjectured by Krauth and Mézard (1989) that the (random) ratio MN/N converges in probability to an explicit constant α⋆≐ 0.83. Kim and Roche (1998) proved the existence of a positive constant γ such that γ ≤ MN/N ≤ 1−γ with high probability; see also Talagrand (1999). In this paper we show that the Krauth–Mézard conjecture α⋆ is a lower bound with positive probability, under the condition that an explicit univariate function S(λ) is maximized at λ=0. Our proof is an application of the second moment method to a certain slice of perceptron configurations, as selected by the so-called TAP (Thouless, Anderson, and Palmer, 1977) or AMP (approximate message passing) iteration, whose scaling limit has been characterized by Bayati and Montanari (2011) and Bolthausen (2012). For verifying the condition on S(λ) we outline one approach, which is implemented in the current version using (nonrigorous) numerical integration packages. In a future version of this paper we intend to complete the verification by implementing a rigorous numerical method."
STOC,2019,828-839,"Guy Bresler, Frederic Koehler, Ankur Moitra",Learning restricted Boltzmann machines via influence maximization.,https://doi.org/10.1145/3313276.3316372,"Graphical models are a rich language for describing high-dimensional distributions in terms of their dependence structure. While there are algorithms with provable guarantees for learning undirected graphical models in a variety of settings, there has been much less progress in the important scenario when there are latent variables. Here we study Restricted Boltzmann Machines (or RBMs), which are a popular model with wide-ranging applications in dimensionality reduction, collaborative filtering, topic modeling, feature extraction and deep learning.   The main message of our paper is a strong dichotomy in the feasibility of learning RBMs, depending on the nature of the interactions between variables: ferromagnetic models can be learned efficiently, while general models cannot. In particular, we give a simple greedy algorithm based on influence maximization to learn ferromagnetic RBMs with bounded degree. In fact, we learn a description of the distribution on the observed variables as a Markov Random Field. Our analysis is based on tools from mathematical physics that were developed to show the concavity of magnetization. Our algorithm extends straighforwardly to general ferromagnetic Ising models with latent variables.   Conversely, we show that even for a contant number of latent variables with constant degree, without ferromagneticity the problem is as hard as sparse parity with noise. This hardness result is based on a sharp and surprising characterization of the representational power of bounded degree RBMs: the distribution on their observed variables can simulate any bounded order MRF. This result is of independent interest since RBMs are the building blocks of deep belief networks."
