booktitle,year,pages,author,title,ee,abstract
STOC,2005,582-591,"Joseph Naor, Roy Schwartz 0002",Balanced metric labeling.,https://doi.org/10.1145/1060590.1060676,"We define the balanced metric labeling problem, a generalization of the metric labeling problem, in which each label has a capacity, i.e., at most l vertices can be assigned to it. The balanced metric labeling problem is a generalization of fundamental problems in the area of approximation algorithms, e.g., arrangements and balanced partitions of graphs. It is also motivated by resource limitations in certain practical scenarios. We focus on the case where the given metric is uniform and note that this case alone encompasses various well-known graph partitioning problems. We present the first (pseudo) approximation algorithm for this problem, achieving for any ε, 0 < ε < 1, an approximation factor of O((ln n)/ε), while assigning at most min {O(ln k)/1 - ε, l + 1| ( 1 + ε) l vertices to each label (k is the number of labels). Our approximation algorithm is based on a novel randomized rounding of a linear programming formulation that combines an embedding of the graph in a simplex together with spreading metrics and additional constraints that strengthen the formulation. Our randomized rounding technique uses both a randomized metric decomposition technique and a randomized label assignment technique. At the heart of our approach is the fact that only limited dependency is created between the labels assigned to different vertices, allowing us to bound the expected cost of the solution and the number of vertices assigned to each label, simultaneously. We note that the number of vertices assigned to each label is bounded via a new inequality of Janson[15] for tail bounds of (partly) dependent random variables."
STOC,2005,592-601,"Zeev Dvir, Amir Shpilka",Locally decodable codes with 2 queries and polynomial identity testing for depth 3 circuits.,https://doi.org/10.1145/1060590.1060678,"In this work we study two, seemingly unrelated, notions. Locally Decodable Codes (LDCs) are codes that allow the recovery of each message bit from a constant number of entries of the codeword. Polynomial Identity Testing (PIT) is one of the fundamental problems of algebraic complexity: we are given a circuit computing a multivariate polynomial and we have to determine whether the polynomial is identically zero. We improve known results on locally decodable codes and on polynomial identity testing and show a relation between the two notions. In particular we obtain the following results:We show that if E: Fn → Fm is a linear LDC with 2 queries then m = exp(Ω(n)). Previously this was only known for fields of size << 2n [18].We show that from every depth 3 arithmetic circuit (ΣΠΣ circuit), C, with a bounded (constant) top fan-in that computes the zero polynomial, one can construct a locally decodeable code. More formally: Assume that C is minimal (no subset of the multiplication gates sums to zero) and simple (no linear function appears in all the multiplication gates). Denote by d the degree of the polynomial computed by C and by r the rank of the linear functions appearing in C. Then we can construct a linear LDC with 2 queries, that encodes messages of length r/polylog(d) by codewords of length O(d).We prove a structural theorem for ΣΠΣ circuits, with a bounded top fan-in, that compute the zero polynomial. In particular we show that if such a circuit is simple and minimal and of polynomial size then its rank, r, is only polylogarithmic in the number of variables (a priory it could have been linear).We give new PIT algorithms for ΣΠΣ circuits with a bounded top fan-in:A deterministic algorithm that runs in quasi polynomial time.A randomized algorithm that runs in polynomial time and uses only polylogarithmic number of random bits..Moreover, when the circuit is multilinear our deterministic algorithm runs in polynomial time. Previously, deterministic subexponential time algorithms for PIT in bounded depth circuits were known only for depth 2 circuits (in the black box model)[22, 9, 28]. In particular, for the special case of depth 3 circuits with 3 multiplication gates our result resolves an open question asked by Klivans and Spielman [28]."
STOC,2005,602-609,"Venkatesan Guruswami, Atri Rudra",Limits to list decoding Reed-Solomon codes.,https://doi.org/10.1145/1060590.1060679,"In this paper, we prove the following two results that expose some combinatorial limitations to list decoding Reed-Solomon codes.Given n distinct elements α1,...,αn from a field F, and n subsets S1,...,Sn of F each of size at most l, the list decoding algorithm of Guruswami and Sudan [7] can in polynomial time output all polynomials p of degree at most k which satisfy p(αi) ∈ Si for every i, as long as l < ⌈ n/k ⌉. We show that the performance of this algorithm is the best possible in a strong sense; specifically, we show that when l = ⌈ n/k ⌉, the list of output polynomials can be super-polynomially large in n. One way to interpret our result is the following. The algorithm in [7] can, when given as input  distinct pairs (βi,∈i) ∈ F2 (the βi's need not be distinct), find and output all degree k polynomials p such that p(βi) = γi for at least  values of i, provided t > √k n'. By our result, an improvement to the Reed-Solomon list decoder of [7] that works with slightly smaller agreement, say t > √kn' - k/2, can only be obtained by exploiting some property of the βi's (for example, their (near) distinctness).For Reed-Solomon codes of block length  and dimension k where k = nδ for small enough δ, we exhibit an explicit received word r with a super-polynomial number of Reed-Solomon codewords that agree with it on $(2 - ε) k locations, for any desired ε > 0 (we note agreement of k is trivial to achieve). Such a bound was known earlier only for a non-explicit center. We remark that finding explicit bad list decoding configurations is of significant interest --- for example the best known rate vs. distance trade-off is based on a bad list decoding configuration for algebraic-geometric codes [14] which is unfortunately not explicitly known."
STOC,2005,610-618,"Shahar Dobzinski, Noam Nisan, Michael Schapira",Approximation algorithms for combinatorial auctions with complement-free bidders.,https://doi.org/10.1145/1060590.1060681,"We exhibit three approximation algorithms for the allocation problem in combinatorial auctions with complement free bidders. The running time of these algorithms is polynomial in the number of items M"
STOC,2005,619-625,"Gagan Aggarwal, Amos Fiat, Andrew V. Goldberg, Jason D. Hartline, Nicole Immorlica, Madhu Sudan 0001",Derandomization of auctions.,https://doi.org/10.1145/1060590.1060682,"We study the problem of designing seller-optimal auctions, i.e. auctions where the objective is to maximize revenue. Prior to this work, the only auctions known to be approximately optimal in the worst case employed randomization. Our main result is the existence of deterministic auctions that approximately match the performance guarantees of these randomized auctions. We give a fairly general derandomization technique for turning any randomized mechanism into an asymmetric deterministic one with approximately the same revenue. In doing so, we bypass the impossibility result for symmetric deterministic auctions and show that asymmetry is nearly as powerful as randomization for solving optimal mechanism design problems. Our general construction involves solving an exponential-sized flow problem and thus is not polynomial-time computable. To complete the picture, we give an explicit polynomial-time construction for derandomizing a specific auction with good worst-case revenue. Our results are based on toy problems that have a flavor similar to the hat problem from [3]."
STOC,2005,626-633,Vladimir Trifonov,An O(log n log log n) space algorithm for undirected st-connectivity.,https://doi.org/10.1145/1060590.1060684,"We present a deterministic O(log n log log n) space algorithm for undirected st-connectivity. It is based on the deterministic EREW algorithm of Chong and Lam [6] and uses the universal exploration sequences for trees constructed by Koucký [13]. Our result improves the O(log4/3 n) bound of Armoni et al.\ [2] and is a big step towards the optimal O(log n). Independently of our result and using a different set of techniques, the optimal bound was achieved by Reingold [18]."
STOC,2005,634-643,Scott Aaronson,The complexity of agreement.,https://doi.org/10.1145/1060590.1060686,"A celebrated 1976 theorem of Aumann asserts that Bayesian agents with common priors can never ""agree to disagree"": if their opinions about any topic are common knowledge, then those opinions must be equal. But two key questions went unaddressed: first, can the agents reach agreement after a conversation of reasonable length? Second, can the computations needed for that conversation be performed efficiently? This paper answers both questions in the affirmative, thereby strengthening Aumann's original conclusion.We show that for two agents with a common prior to agree within ε about the expectation of a [0,1] variable with high probability over their prior, it suffices for them to exchange O(1/ε2) bits. This bound is completely independent of the number of bits n of relevant knowledge that the agents have. We also extend the bound to three or more agents; and we give an example where the ""standard protocol"" (which consists of repeatedly announcing one's current expectation) nearly saturates the bound, while a new ""attenuated protocol"" does better. Finally, we give a protocol that would cause two Bayesians to agree within ε after exchanging O(1/ε2) messages, and that can be simulated by agents with limited computational resources. By this we mean that, after examining the agents' knowledge and a transcript of their conversation, no one would be able to distinguish the agents from perfect Bayesians. The time used by the simulation procedure is exponential in 1/ε6 but not in n."
STOC,2005,644-653,"Yael Tauman Kalai, Yehuda Lindell, Manoj Prabhakaran",Concurrent general composition of secure protocols in the timing model.,https://doi.org/10.1145/1060590.1060687,"In the setting of secure multiparty computation, a set of mutually distrustful parties wish to jointly compute some function of their input (i.e., they wish to securely carry out some distributed task). %The joint computation should be such that even In the stand-alone case, it has been shown that every efficient function can be securely computed. However, in the setting of concurrent composition, broad impossibility results have been proven for the case where there is no honest majority (or trusted setup).In this paper, we investigate the feasibility of obtaining secure multiparty protocols in a network where certain time bounds are assumed. Specifically, the security of our protocols rely on the very reasonable assumption that local clocks do not ""drift"" too much (i.e., it is assumed that they proceed at approximately the same rate). We show that under this mild timing assumption, it is possible to securely compute any functionality under concurrent general composition (as long as messages from the arbitrary other protocols are delayed for a specified amount of time)."
STOC,2005,654-663,"Yevgeniy Dodis, Adam D. Smith",Correcting errors without leaking partial information.,https://doi.org/10.1145/1060590.1060688,"This paper explores what kinds of information two parties must communicate in order to correct errors which occur in a shared secret string W. Any bits they communicate must leak a significant amount of information about W --- that is, from the adversary's point of view, the entropy of W will drop significantly. Nevertheless, we construct schemes with which Alice and Bob can prevent an adversary from learning any useful information about W. Specifically, if the entropy of W is sufficiently high, then there is no function f(W) which the adversary can learn from the error-correction information with significant probability.This leads to several new results: (a) the design of noise-tolerant ""perfectly one-way"" hash functions in the sense of Canetti et al. [7], which in turn leads to obfuscation of proximity queries for high entropy secrets W; (b) private fuzzy extractors [11], which allow one to extract uniformly random bits from noisy and nonuniform data W, while also insuring that no sensitive information about W is leaked; and (c) noise tolerance and stateless key re-use in the Bounded Storage Model, resolving the main open problem of Ding [10].The heart of our constructions is the design of strong randomness extractors with the property that the source W can be recovered from the extracted randomness and any string W' which is close to W."
STOC,2005,664-673,Thomas Holenstein,Key agreement from weak bit agreement.,https://doi.org/10.1145/1060590.1060689,"Assume that Alice and Bob, given an authentic channel, have a protocol where they end up with a bit SA and SB, respectively, such that with probability 1+ε/2 these bits are equal. Further assume that conditioned on the event SA =n SB no polynomial time bounded algorithm can predict the bit better than with probability 1-δ/2. Is it possible to obtain key agreement from such a primitive? We show that for constant δ and ε the answer is yes if and only if δ > 1-ε/1+ε, both for uniform and non-uniform adversaries.The main computational technique used in this paper is a strengthening of Impagliazzo's hard-core lemma to the uniform case and to a set size parameter which is tight (i.e., twice the original size). This may be of independent interest."
STOC,2005,674-683,"Ferdinando Cicalese, Eduardo Sany Laber",A new strategy for querying priced information.,https://doi.org/10.1145/1060590.1060691,"This paper focuses on competitive function evaluation in the context of computing with priced information. A function f is given together with a cost cx for each variable x of f. The cost cx has to be paid to read the value of x. The problem is to design algorithms that query the values of the variables sequentially in order to compute the function while trying to minimize the total cost incurred. Competitive analysis is employed to evaluate the performance of the algorithms. We describe a novel approach for devising efficient algorithms in this setting. We apply our approach to several classes of functions which have been studied in the literature of computing with priced information. In all cases considered, our approach provides algorithms that achieve better bounds than the best known algorithm for the same class of functions.More precisely, for the class of monotone boolean functions, we give a polynomial time algorithm with extremal competitiveness (k+l - √ min(k,l)) where k (l) denotes the minimum number of variables that one must read, in the worst case, in order to prove that the function under consideration evaluates to 1 (0). This dramatically improves upon the best known result which is an exponential time 2 max(k, l)-competitive algorithm. For the subclass of monotone boolean functions known as Threshold Trees we further improve our bounds and give a polynomial time algorithm with extremal competitive ratio 1.618 max(k, l).We then apply our methodology to classes of non-boolean functions. We consider the case of the so called Game Trees. We improve upon previously published results for this class of functions providing a polynomial time algorithm with extremal competitive ratio 1.5 γ(f), where γ(f) is a lower bound on the extremal competitive ratio of any deterministic algorithm.Finally, we consider the case when f is the function min (minimum). In this case, we are able to determine the optimal competitiveness for the problem. In fact we provide an algorithm with an (n-2)-competitive ratio, which matches the known lower bound."
STOC,2005,684-693,"Nir Ailon, Moses Charikar, Alantha Newman",Aggregating inconsistent information: ranking and clustering.,https://doi.org/10.1145/1060590.1060692,"We address optimization problems in which we are given contradictory pieces of input information and the goal is to find a globally consistent solution that minimizes the extent of disagreement with the respective inputs. Specifically, the problems we address are rank aggregation, the feedback arc set problem on tournaments, and correlation and consensus clustering. We show that for all these problems (and various weighted versions of them), we can obtain improved approximation factors using essentially the same remarkably simple algorithm. Additionally, we almost settle a long-standing conjecture of Bang-Jensen and Thomassen and show that unless NP⊆BPP, there is no polynomial time algorithm for the problem of minimum feedback arc set in tournaments."
STOC,2005,694-703,"Dimitris Achlioptas, Aaron Clauset, David Kempe 0001, Cristopher Moore","On the bias of traceroute sampling: or, power-law degree distributions in regular graphs.",https://doi.org/10.1145/1060590.1060693,"Understanding the graph structure of the Internet is a crucial step for building accurate network models and designing efficient algorithms for Internet applications. Yet, obtaining this graph structure can be a surprisingly difficult task, as edges cannot be explicitly queried. For instance, empirical studies of the network of Internet Protocol (IP) addresses typically rely on indirect methods like traceroute to build what are approximately single-source, all-destinations, shortest-path trees. These trees only sample a fraction of the network's edges, and a paper by Lakhina et al. [2003] found empirically that the resulting sample is intrinsically biased. Further, in simulations, they observed that the degree distribution under traceroute sampling exhibits a power law even when the underlying degree distribution is Poisson. In this article, we study the bias of traceroute sampling mathematically and, for a very general class of underlying degree distributions, explicitly calculate the distribution that will be observed. As example applications of our machinery, we prove that traceroute sampling finds power-law degree distributions in both δ-regular and Poisson-distributed random graphs. Thus, our work puts the observations of Lakhina et al. on a rigorous footing, and extends them to nearly arbitrary degree distributions."
STOC,2005,704-713,Christian Scheideler,How to spread adversarial nodes?: rotate!,https://doi.org/10.1145/1060590.1060694,"In this paper we study the problem of how to keep a dynamic system of nodes well-mixed even under adversarial behavior. This problem is very important in the context of distributed systems.More specifically, we consider the following game: There are n white pebbles and ε n black pebbles for some fixed constant ε < 1. Initially, all of the white pebbles are laid down in a ring, and the adversary has all of the black pebbles in its bag. In each round, the adversary can look at the entire ring and can select to add a black pebble to the ring (if its bag is not empty) or to take any black pebble from the ring and put it back into its bag (i.e. we consider adaptive adversaries). However, the adversary cannot place a black pebble into any position it likes. This is handled by a join strategy to be specified by the system. The goal is to find an oblivious join strategy, i.e. a strategy that cannot distinguish between the white and black pebbles in the ring, that integrates the black pebbles into this ring and may do some further rearrangements so that for a polynomial number of rounds the adversary will not manage to include its black pebbles into the ring so that there is a sequence of s=Θ(log n) consecutive pebbles in which at least half of the pebbles are black. If this is achieved by the join strategy, it wins. Otherwise, the adversary wins.Of course, the brute-force strategy of rearranging all of the pebbles in the ring at random after each insertion of a black pebble will achieve the stated goal, with high probability, but this would be a very expensive strategy. The challenge is to find a join strategy that needs as little randomness and as few rearrangements as possible in order to win with high probability. In this paper, we present and analyze a very simple strategy called k-rotation that chooses k-1 existing positions uniformly at random in the ring, creates a new position uniformly at random in the ring, and then rotates the new pebble and the k-1 old pebbles along these positions. Interestingly, even if the adversary has just  pebbles, it can still win for k=2. But the k-rotation rule wins with high probability for k=3 as long as ε<2/3, demonstrating that there is a sharp threshold for keeping pebbles in a sufficiently perturbed state."
STOC,2005,714-722,"Eli Gafni, Rachid Guerraoui, Bastian Pochon",From a static impossibility to an adaptive lower bound: the complexity of early deciding set agreement.,https://doi.org/10.1145/1060590.1060696,"Set agreement, where processors decisions constitute a set of outputs, is notoriously harder to analyze than consensus where the decisions are restricted to a single output. This is because the topological questions that underly set agreement are not about simple connectivity as in consensus. Analyzing set agreement inspired the discovery of the relation between topology and distributed algorithms, and consequently the impossibility of asynchronous set agreement.Yet, the application of topological reasoning has been to the static case, that of asynchronous and synchronous tasks. It is not known yet for example, how to characterize starvation-free solvability of non-terminating tasks. Non-terminating tasks are dynamic entities with no defined end. In a similar vain, early deciding synchronous set agreement, in which the number of rounds it takes a processor to decide adapts to the actual number of failures, falls in this category of dynamic entities.This paper develops a simulation technique that brings to bear topological results to deal with the dynamic situation that arises with early decisions. The novelty of the new simulation is the ability of simulators to look back at the transcript of past rounds of the simulation to influence their current behavior.Using our new technique, we not only re-derive past results, but we propose and prove a lower bound to synchronous early stopping set agreement. We then provide an algorithm to match the lower bound. Our technique uses the BG simulation, in the most creative way it was used to-date, to obtain a rather simple reduction from a static asynchronous impossibility. This reduction is a simple alternative to yet unknown topological argument, and in fact may suggest the way of finding such an argument."
STOC,2005,723-732,Prasad Jayanti,An optimal multi-writer snapshot algorithm.,https://doi.org/10.1145/1060590.1060697,"An m-component, n-process snapshot object is an abstraction of shared memory that consists of m words and allows up to n processes to concurrently execute the following two types of operations: write(i,v), which writes v into the ith word, and scan(), which returns the current values of all m locations [1, 3]. The snapshot problem is to design algorithms for the write and scan operations that meet two challenging requirements: (1) operations appear to be atomic, and (2) operations are wait-freeFor any (m-component, n-process) snapshot algorithm, which runs on hardware that supports only word-sized objects, Ω(1) and Ω(m) are trivial lower bounds on the time complexity of write(i,v) and scan(), respectively. But, are these bounds tight?For a restricted version of the snapshot problem, known in the literature as the single-writer snapshot problem, Riany, Shavit and Touitou [18] showed that the answer is yes: they designed an algorithm with O(1) and O(m) running times for the write(i,v) and scan() operations, respectively. (The single-writer snapshot problem assumes that (i) the number m of words of the snapshot object is equal to the number n of processes, and (ii) only the ith process may write into the ith snapshot word.This paper shows that the same (optimal) running times of O(1) for write(i,v) and O(m) for scan() are achievable for the general problem, known in the literature as the multiwriter snapshot problem. Our algorithm requires hardware support for the CAS (compare&swap) operation (in comparison, Riany, Shavit and Touitou's algorithm requires hardware support for CAS, fetch&inc, and fetch&dec operations)."
