booktitle,year,pages,author,title,ee,abstract
STOC,2011,177-186,"Noga Zewi, Eli Ben-Sasson",From affine to two-source extractors via approximate duality.,https://doi.org/10.1145/1993636.1993661,"Two-source and affine extractors and dispersers are fundamental objects studied in the context of derandomization. This paper shows how to construct two-source extractors and dispersers for arbitrarily small min-entropy rate in a black-box manner given affine extractors with sufficiently good parameters. Our analysis relies on the study of approximate duality, a concept related to the polynomial Freiman-Ruzsa conjecture (PFR) from additive combinatorics. Two black-box constructions of two-source extractors from affine ones are presented. Both constructions work for min-entropy rate ρ< 1/2. One of them can potentially reach arbitrarily small min-entropy rate provided the the affine extractor used to construct it outputs, on affine sources of min-entropy rate 1/2, a relatively large number of output bits, and has sufficiently small error. Our results are obtained by first showing that each of our constructions yields a two-source disperser for a certain min-entropy rate ρ< 1/2 and then using a general extractor-to-disperser reduction that applies to a large family of constructions. This reduction says that any two-source disperser for min-entropy rate ρ coming from this family is also a two-source extractor with constant error for min-entropy rate ρ+ε for arbitrarily small ε>0. We show that assuming the PFR conjecture, the error of this two-source extractor is exponentially small. The extractor-to-disperser reduction arises from studying  approximate duality, a notion related to additive combinatorics. The duality measure of two sets A,B ⊆ F_2n aims to quantify how ""close"" these sets are to being dual and is defined as [u(A,B)=|Ea ∈ A, b ∈ B[(-1)∑i=1n ai bi]|] Notice that u(A,B)=1 implies that A is contained in an affine shift of B⊥ --- the space dual to the F2span of B. We study what can be said of A,B when their duality measure is large but strictly smaller than 1 and show that A,B contain subsets A',B' of nontrivial size for which u(A',B')=1 and consequently A' is contained in an affine shift of (B')⊥. This implies that our constructions are two-source extractors with constant error. Surprisingly, the PFR implies that such A',B' exist exist when A,B are large, even if the duality measure is exponentially small in , and this implication leads to two-source extractors with exponentially small error."
STOC,2011,187-194,"Hamed Hatami, Shachar Lovett",Correlation testing for affine invariant properties on Fpn in the high error regime.,https://doi.org/10.1145/1993636.1993662,"Recently there has been much interest in Gowers uniformity norms from the perspective of theoretical computer science. This is mainly due to the fact that these norms provide a method for testing whether the maximum correlation of a function f:Fpn -> Fp with polynomials of degree at most d ≤ p is non-negligible, while making only a constant number of queries to the function. This is an instance of correlation testing. In this framework, a fixed test is applied to a function, and the acceptance probability of the test is dependent on the correlation of the function from the property. This is an analog of proximity oblivious testing, a notion coined by Goldreich and Ron, in the high error regime. We study in this work general properties which are affine invariant and which are correlation testable using a constant number of queries. We show that any such property (as long as the field size is not too small) can in fact be tested by the Gowers uniformity test, and hence having correlation with the property is equivalent to having correlation with degree d polynomials for some fixed d. We stress that our result holds also for non-linear properties which are affine invariant. This completely classifies affine invariant properties which are correlation testable. The proof is based on higher-order Fourier analysis, where we establish a new approximate orthogonality for structures defined by linear forms. In particular, this resolves an open problem posed by Gowers and Wolf. Another ingredient is a nontrivial extension of a graph theoretical theorem of Erdos, Lovasz and Spencer to the context of additive number theory."
STOC,2011,195-204,"Bharat Adsul, Jugal Garg, Ruta Mehta, Milind A. Sohoni",Rank-1 bimatrix games: a homeomorphism and a polynomial time algorithm.,https://doi.org/10.1145/1993636.1993664,"Given a rank-1 bimatrix game (A,B), i.e., where rank(A+B)=1, we construct a suitable linear subspace of the rank-1 game space and show that this subspace is homeomorphic to its Nash equilibrium correspondence. Using this homeomorphism, we give the first polynomial time algorithm for computing an exact Nash equilibrium of a rank-1 bimatrix game. This settles an open question posed by Kannan and Theobald (SODA'07). In addition, we give a novel algorithm to enumerate all the Nash equilibria of a rank-1 game and show that a similar technique may also be applied for finding a Nash equilibrium of any bimatrix game. Our approach also provides new proofs of important classical results such as the existence and oddness of Nash equilibria, and the index theorem for bimatrix games. Further, we extend the rank-1 homeomorphism result to a fixed rank game space, and give a fixed point formulation on [0,1]k for solving a rank-k game. The homeomorphism and the fixed point formulation are piece-wise linear and considerably simpler than the classical constructions."
STOC,2011,205-214,"Kristoffer Arnsfelt Hansen, Michal Koucký 0001, Niels Lauritzen, Peter Bro Miltersen, Elias P. Tsigaridas",Exact algorithms for solving stochastic games: extended abstract.,https://doi.org/10.1145/1993636.1993665,"Shapley's discounted stochastic games, Everett's recursive games and Gillette's undiscounted stochastic games are classical models of game theory describing two-player zero-sum games of potentially infinite duration. We describe algorithms for exactly solving these games. When the number of positions of the game isbconstant, our algorithms run in polynomial time."
STOC,2011,215-224,"Nicole Immorlica, Adam Tauman Kalai, Brendan Lucier, Ankur Moitra, Andrew Postlewaite, Moshe Tennenholtz",Dueling algorithms.,https://doi.org/10.1145/1993636.1993666,"We revisit classic algorithmic search and optimization problems from the perspective of competition. Rather than a single optimizer minimizing expected cost, we consider a zero-sum game in which a search problem is presented to two players, whose only goal is to  outperform the opponent. Such games are typically exponentially large zero-sum games, but they often have a rich structure. We provide general techniques by which such structure can be leveraged to find minmax-optimal and approximate minmax-optimal strategies. We give examples of ranking, hiring, compression, and binary search duels, among others. We give bounds on how often one can beat the classic optimization algorithms in such duels."
STOC,2011,225-234,"Ankur Moitra, Ryan O'Donnell",Pareto optimal solutions for smoothed analysts.,https://doi.org/10.1145/1993636.1993667,"Consider an optimization problem with n binary variables and d+1 linear objective functions. Each valid solution x ∈{0,1}n gives rise to an objective vector in Rd+1, and one often wants to enumerate the Pareto optima among them. In the worst case there may be exponentially many Pareto optima; however, it was recently shown that in (a generalization of) the smoothed analysis framework, the expected number is polynomial in~n. Unfortunately, the bound obtained had a rather bad dependence on d; roughly ndd. In this paper we show a significantly improved bound of n2d. Our proof is based on analyzing two algorithms. The first algorithm, on input a Pareto optimal x, outputs a ""testimony"" containing clues about x's objective vector, x's coordinates, and the region of space B in which x's objective vector lies. The second algorithm can be regarded as a speculative execution of the first --- it can uniquely reconstruct x from the testimony's clues and just some of the probability space's outcomes. The remainder of the probability space's outcomes are just enough to bound the probability that x's objective vector falls into the region B."
STOC,2011,235-244,"Kashyap Babu Rao Kolipaka, Mario Szegedy",Moser and tardos meet Lovász.,https://doi.org/10.1145/1993636.1993669,"Beck's early work [3] gave an efficient version of the Lovász Local Lemma(LLL) with significant compromise in the parameters. Following several improvements [1,7,4,13], Moser [8], and Moser and Tardos [9] obtained asymptotically optimal results in terms of the maximal degree. For a fixed dependency graph G the exact criterion under which LLL applies is given by Shearer in [12]. For a dependency structure G, let LO(G) be the set of those probability assignments to the nodes of G for which the Lovász Local Lemma holds. We show that: Both the sequential and parallel ersions of the Moser-Tardos algorithm are efficient up to the Shearer's bound, by giving a tighter analysis. We also prove that, whenever p ∈ LO(G)/(1+ε), the expected running times of the sequential and parallel versions are at most n/ε and O(1/ε log n/ε), the later when ε < 1. Here n is the number of nodes in G. By adding a few lines to our analysis we can reprove Shearer's result (for the general LLL). Our alternative proof for the Shearer's bound not only highlights the connection between the variable and general versions of LLL, but also illustrates that variants of the Moser-Tardos algorithm can be useful in existence proofs. We obtain new formulas for phase transitions in the hardcore lattice gas model, non-trivially equivalent to the ones studied by Scott and Sokal [10]. We prove that if p ∈ LO(G)/(1+ε), the running time of the Moser-Tardos algorithm is polynomial not only in the number of events, but also in the number of variables. This extends one of the results from the more recent work of Haeupler, Saha, and Srinivasan [6]. Our new formulas immediately give a majorizing lemma that connects LLL bounds on different graphs. We show that the LLL bound for the (special case of the) variable version is sometimes larger than for the general version. This is the first known separation between the variable and the general versions of LLL."
STOC,2011,245-252,"Robin A. Moser, Dominik Scheder",A full derandomization of schöning's k-SAT algorithm.,https://doi.org/10.1145/1993636.1993670,Schoening in 1999 presented a simple randomized algorithm for k-SAT with running time an * poly(n) for a = 2(k-1)/k. We give a deterministic version of this algorithm running in time an+o(n).
STOC,2011,253-262,"Parikshit Gopalan, Raghu Meka, Omer Reingold, David Zuckerman",Pseudorandom generators for combinatorial shapes.,https://doi.org/10.1145/1993636.1993671,"We construct pseudorandom generators for combinatorial shapes, which substantially generalize combinatorial rectangles, ε-biased spaces, 0/1 halfspaces, and 0/1 modular sums. A function f:[m]n -> {0,1} is an (m,n)-combinatorial shape if there exist sets A1,...,An ⊆ [m] and a symmetric function h:{0,1}n -> {0,1} such that f(x1,...,xn) = h(1A1(x1),...,1An(xn)). Our generator uses seed length O(log m + log n + log2(1/ε)) to get error ε. When m = 2, this gives the first generator of seed length O(log n) which fools all weight-based tests, meaning that the distribution of the weight of any subset is ε-close to the appropriate binomial distribution in statistical distance. For our proof we give a simple lemma which allows us to convert closeness in Kolmogorov (cdf) distance to closeness in statistical distance. As a corollary of our technique, we give an alternative proof of a powerful variant of the classical central limit theorem showing convergence in statistical distance, instead of the usual Kolmogorov distance."
STOC,2011,263-272,"Michal Koucký 0001, Prajakta Nimbhorkar, Pavel Pudlák",Pseudorandom generators for group products: extended abstract.,https://doi.org/10.1145/1993636.1993672,"We prove that the pseudorandom generator introduced by Impagliazzo et al. (1994) with proper choice of parameters fools group products of a given finite group G. The seed length is O((|G|O(1) + log 1/δ)log n), where n is the length of the word and δ is the allowed error. The result implies that the pseudorandom generator with seed length O((2O(w log w) + log 1/δ)log n) fools read-once permutation branching programs of width w. As an application of the pseudorandom generator one obtains small-bias spaces for products over all finite groups Meka and Zuckerman (2009)."
STOC,2011,273-282,"Paul F. Christiano, Jonathan A. Kelner, Aleksander Madry, Daniel A. Spielman, Shang-Hua Teng","Electrical flows, laplacian systems, and faster approximation of maximum flow in undirected graphs.",https://doi.org/10.1145/1993636.1993674,"We introduce a new approach to computing an approximately maximum s-t flow in a capacitated, undirected graph. This flow is computed by solving a sequence of electrical flow problems. Each electrical flow is given by the solution of a system of linear equations in a Laplacian matrix, and thus may be approximately computed in nearly-linear time. Using this approach, we develop the fastest known algorithm for computing approximately maximum s-t flows. For a graph having n vertices and m edges, our algorithm computes a (1-ε)-approximately maximum s-t flow in time ~O(mn1/3ε-11/3). A dual version of our approach gives the fastest known algorithm for computing a (1+ε)-approximately minimum s-t cut. It takes ~O(m+n4/3ε-16/3) time. Previously, the best dependence on m and n was achieved by the algorithm of Goldberg and Rao (J. ACM 1998), which can be used to compute approximately maximum s-t flows in time ~O({m√nε-1), and approximately minimum s-t cuts in time ~O(m+n3/2ε-3)."
STOC,2011,283-292,"Oliver Friedmann, Thomas Dueholm Hansen, Uri Zwick",Subexponential lower bounds for randomized pivoting rules for the simplex algorithm.,https://doi.org/10.1145/1993636.1993675,"The simplex algorithm is among the most widely used algorithms for solving linear programs in practice. With essentially all deterministic pivoting rules it is known, however, to require an exponential number of steps to solve some linear programs. No non-polynomial lower bounds were known, prior to this work, for randomized pivoting rules. We provide the first subexponential (i.e., of the form 2Ω(nα), for some α>0) lower bounds for the two most natural, and most studied, randomized pivoting rules suggested to date. The first randomized pivoting rule considered is Random-Edge, which among all improving pivoting steps (or edges) from the current basic feasible solution (or vertex) chooses one uniformly at random. The second randomized pivoting rule considered is Random-Facet, a more complicated randomized pivoting rule suggested by Kalai and by Matousek, Sharir and Welzl. Our lower bound for the Random-Facet pivoting rule essentially matches the subexponential upper bounds given by Kalai and by Matousek et al Lower bounds for Random-Edge and Random-Facet were known before only in abstract settings, and not for concrete linear programs. Our lower bounds are obtained by utilizing connections between pivoting steps performed by simplex-based algorithms and improving switches performed by policy iteration algorithms for solving Markov Decision Processes (MDPs)."
STOC,2011,293-302,Bernhard Haeupler,Analyzing network coding gossip made easy.,https://doi.org/10.1145/1993636.1993676,"We introduce projection analysis - a new technique to analyze the stopping time of gossip protocols that are based on random linear network coding (RLNC). Projection analysis drastically simplifies, extends and strengthens previous results. We analyze RLNC gossip in a general framework for network and communication models that encompasses and unifies the models used previously in this context."
STOC,2011,303-312,Julia Chuzhoy,An algorithm for the graph crossing number problem.,https://doi.org/10.1145/1993636.1993678,"We study the Minimum Crossing Number problem: given an n-vertex graph G, the goal is to find a drawing of G in the plane with minimum number of edge crossings. This is one of the central problems in topological graph theory, that has been studied extensively over the past three decades. The first non-trivial efficient algorithm for the problem, due to Leighton and Rao, achieved an O(n log4n)-approximation for bounded degree graphs. This algorithm has since been improved by poly-logarithmic factors, with the best current approximation ratio standing on O (n poly(d) log3/2n ) for graphs with maximum degree d. In contrast, only APX-hardness is known on the negative side. In this paper we present an efficient randomized algorithm to find a drawing of any n-vertex graph G in the plane with O(OPT10poly(d log n)) crossings, where OPT is the number of crossings in the optimal solution, and d is the maximum vertex degree in G. This result implies an ~O(n9/10poly(d))-approximation for Minimum Crossing Number, thus breaking the long-standing ~O(n)-approximation barrier for bounded-degree graphs."
STOC,2011,313-322,"Giuseppe F. Italiano, Yahav Nussbaum, Piotr Sankowski, Christian Wulff-Nilsen",Improved algorithms for min cut and max flow in undirected planar graphs.,https://doi.org/10.1145/1993636.1993679,"We study the min st-cut and max st-flow problems in planar graphs, both in static and in dynamic settings. First, we present an algorithm that given an undirected planar graph and two vertices s and t computes a min st-cut in O(n log log n) time. Second, we show how to achieve the same bound for the problem of computing a max st-flow in an undirected planar graph. These are the first algorithms breaking the O(n log n) barrier for those two problems, which has been standing for more than 25 years. Third, we present a fully dynamic algorithm maintaining the value of the min st-cuts and the max st-flows in an undirected plane graph (i.e., a planar graph with a fixed embedding): our algorithm is able to insert and delete edges and answer queries for min st-cut/max st-flow values between any pair of vertices s and t in O(n(2/3) log(8/3) n) time per operation. This result is based on a new dynamic shortest path algorithm for planar graphs which may be of independent interest. We remark that this is the first known non-trivial dynamic algorithm for min st-cut and max st-flow."
STOC,2011,323-332,"Michael Dinitz, Robert Krauthgamer",Directed spanners via flow-based linear programs.,https://doi.org/10.1145/1993636.1993680,"We examine directed spanners through flow-based linear programming relaxations. We design an ~O(n2/3)-approximation algorithm for the directed k-spanner problem that works for all k ≥ 1, which is the first sublinear approximation for arbitrary edge-lengths. Even in the more restricted setting of unit edge-lengths, our algorithm improves over the previous ~O(n1-1/k) approximation [BGJRW09] when k ≥ 4. For the special case of k=3 we design a different algorithm achieving an ~O(√n)-approximation, improving the previous ~O(n2/3) [EP05,BGJRW09] (independently of our work, an ~O(n1-1/⌈ k/2⌉) was recently devised [BRR10]). Both of our algorithms easily extend to the fault-tolerant setting, which has recently attracted attention but not from an approximation viewpoint. We also prove a nearly matching integrality gap of ~Ω(n1/3 - ε) for every constant ε > 0. A virtue of all our algorithms is that they are relatively simple. Technically, we introduce a new yet natural flow-based relaxation, and show how to approximately solve it even when its size is not polynomial. The main challenge is to design a rounding scheme that ""coordinates"" the choices of flow-paths between the many demand pairs while using few edges overall. We achieve this, roughly speaking, by randomization at the level of vertices."
STOC,2011,333-342,"Scott Aaronson, Alex Arkhipov",The computational complexity of linear optics.,https://doi.org/10.1145/1993636.1993682,"We give new evidence that quantum computers -- moreover, rudimentary quantum computers built entirely out of linear-optical elements -- cannot be efficiently simulated by classical computers. In particular, we define a model of computation in which identical photons are generated, sent through a linear-optical network, then nonadaptively measured to count the number of photons in each mode. This model is not known or believed to be universal for quantum computation, and indeed, we discuss the prospects for realizing the model using current technology. On the other hand, we prove that the model is able to solve sampling problems and search problems that are classically intractable under plausible assumptions. Our first result says that, if there exists a polynomial-time classical algorithm that samples from the same probability distribution as a linear-optical network, then P#P=BPPNP, and hence the polynomial hierarchy collapses to the third level. Unfortunately, this result assumes an extremely accurate simulation. Our main result suggests that even an approximate or noisy classical simulation would already imply a collapse of the polynomial hierarchy. For this, we need two unproven conjectures: the Permanent-of-Gaussians Conjecture, which says that it is #P-hard to approximate the permanent of a matrix A of independent N(0,1) Gaussian entries, with high probability over A; and the Permanent Anti-Concentration Conjecture, which says that |Per(A)|>=√(n!)poly(n) with high probability over A. We present evidence for these conjectures, both of which seem interesting even apart from our application. This paper does not assume knowledge of quantum optics. Indeed, part of its goal is to develop the beautiful theory of noninteracting bosons underlying our model, and its connection to the permanent function, in a self-contained way accessible to theoretical computer scientists."
STOC,2011,343-352,"Fernando G. S. L. Brandão, Matthias Christandl, Jon Yard",A quasipolynomial-time algorithm for the quantum separability problem.,https://doi.org/10.1145/1993636.1993683,"We present a quasipolynomial-time algorithm for solving the weak membership problem for the convex set of separable, i.e. non-entangled, bipartite density matrices. The algorithm decides whether a density matrix is separable or whether it is ε-away from the set of the separable states in time exp(O(ε-2 log|A| log|B|)), where |A| and |B| are the local dimensions, and the distance is measured with either the Euclidean norm, or with the so-called LOCC norm. The latter is an operationally motivated norm giving the optimal probability of distinguishing two bipartite quantum states, each shared by two parties, using any protocol formed by quantum local operations and classical communication (LOCC) between the parties. We also obtain improved algorithms for optimizing over the set of separable states and for computing the ground-state energy of mean-field Hamiltonians. The techniques we develop are also applied to quantum Merlin-Arthur games, where we show that multiple provers are not more powerful than a single prover when the verifier is restricted to LOCC protocols, or when the verification procedure is formed by a measurement of small Euclidean norm. This answers a question posed by Aaronson et al. (Theory of Computing 5, 1, 2009) and provides two new characterizations of the complexity class QMA, a quantum analog of NP. Our algorithm uses semidefinite programming to search for a symmetric extension, as first proposed by Doherty, Parrilo and Spedialieri (Phys. Rev. A, 69, 022308, 2004). The bound on the runtime follows from an improved de Finetti-type bound quantifying the monogamy of quantum entanglement. This result, in turn, follows from a new lower bound on the quantum conditional mutual information and the entanglement measure squashed entanglement."
STOC,2011,353-362,"Julia Kempe, Thomas Vidick",Parallel repetition of entangled games.,https://doi.org/10.1145/1993636.1993684,"We consider one-round games between a classical referee and two players. One of the main questions in this area is the parallel repetition question: Is there a way to decrease the maximum winning probability of a game without increasing the number of rounds or the number of players? Classically, efforts to resolve this question, open for many years, have culminated in Raz's celebrated parallel repetition theorem on one hand, and in efficient product testers for PCPs on the other. In the case where players share entanglement, the only previously known results are for special cases of games, and are based on techniques that seem inherently limited. Here we show for the first time that the maximum success probability of entangled games can be reduced through parallel repetition, provided it was not initially 1. Our proof is inspired by a seminal result of Feige and Kilian in the context of classical two-prover one-round interactive proofs. One of the main components in our proof is an orthogonalization lemma for operators, which might be of independent interest."
