booktitle,year,pages,author,title,ee,abstract
STOC,2003,206-212,"Elchanan Mossel, Ryan O'Donnell, Rocco A. Servedio",Learning juntas.,https://doi.org/10.1145/780542.780574,"We consider a fundamental problem in computational learning theory: learning an arbitrary Boolean function which depends on an unknown set of k out of n Boolean variables. We give an algorithm for learning such functions from uniform random examples which runs in time roughly (nk)ω/(ω + 1), where ω < 2.376 is the matrix multiplication exponent. We thus obtain the first polynomial factor improvement on the naive nk time bound which can be achieved via exhaustive search. Our algorithm and analysis exploit new structural properties of Boolean functions."
STOC,2003,213-222,"Jeong Han Kim, Van H. Vu",Generating random regular graphs.,https://doi.org/10.1145/780542.780576,"Random regular graphs play a central role in combinatorics and theoretical computer science. In this paper, we analyze a simple algorithm introduced by Steger and Wormald [9] and prove that it produces an asymptotically uniform random regular graph in a polynomial time. Precisely, for fixed d and n with d=O(n1/3-ε), it is shown that the algorithm generates an asymptotically uniform random d-regular graph on n vertices in time O(nd2). This confirms a conjecture of Wormald. The key ingredient in the proof is a recently developed concentration inequality by the second author.Besides being perhaps the only algorithm which works for relatively large d in practical time, our result also has a significant theoretical value, as it can be used to derive many properties of uniform random regular graphs."
STOC,2003,223-231,"Dimitris Achlioptas, Yuval Peres",The threshold for random k-SAT is 2k (ln 2 - O(k)).,https://doi.org/10.1145/780542.780577,"Let Fk(n,m) be a random k-SAT formula on n variables formed by selecting uniformly and independently m out of all possible k-clauses. It is well-known that for r ≥ 2k ln 2, Fk(n,rn) is unsatisfiable with probability 1-o(1). We prove that there exists a sequence tk = O(k) such that for r ≥ 2k ln 2 - tk, Fk(n,rn) is satisfiable with probability 1-o(1).Our technique yields an explicit lower bound for every k which for k > 3 improves upon all previously known bounds. For example, when k=10 our lower bound is 704.94 while the upper bound is 708.94."
STOC,2003,232-241,"René Beier, Berthold Vöcking",Random knapsack in expected polynomial time.,https://doi.org/10.1145/780542.780578,"In this paper, we present the first average-case analysis proving an expected polynomial running time for an exact algorithm for the 0/1 knapsack problem. In particular, we prove, for various input distributions, that the number of dominating solutions (i.e., Pareto-optimal knapsack fillings) to this problem is polynomially bounded in the number of available items. An algorithm by Nemhauser and Ullmann can enumerate these solutions very efficiently so that a polynomial upper bound on the number of dominating solutions implies an algorithm with expected polynomial running time.The random input model underlying our analysis is very general and not restricted to a particular input distribution. We assume adversarial weights and randomly drawn profits (or vice versa). Our analysis covers general probability distributions with finite mean, and, in its most general form, can even handle different probability distributions for the profits of different items. This feature enables us to study the effects of correlations between profits and weights. Our analysis confirms and explains practical studies showing that so-called  strongly correlated instances are harder to solve than weakly correlated ones."
STOC,2003,242-250,"Nikhil Bansal 0001, Kirk Pruhs",Server scheduling in the Lp norm: a rising tide lifts all boat.,https://doi.org/10.1145/780542.780580,"Often server systems do not implement the best known algorithms for optimizing average Quality of Service (QoS) out of concern of that these algorithms may be insufficiently fair to individual jobs. The standard method for balancing average QoS and fairness is optimize the Lp metric, 1 < p < ∞. Thus we consider server scheduling strategies to optimize the Lp norms of the standard QoS measures, flow and stretch. We first show that there is no no(1)-competitive online algorithm for the Lp norms of either flow or stretch. We then show that the standard clairvoyant algorithms for optimizing average QoS, SJF and SRPT, are O(1+ε)-speed O(1/ε)-competitive for the Lp norms of flow and stretch. And that the standard nonclairvoyant algorithm for optimizing average QoS, SETF, is O(1+ε)-speed O(1/ε(2+2/p))-competitive for the Lp norms of flow. These results argue that these standard algorithms will not starve jobs until the system is near peak capacity. In contrast, we show that the Round Robin, or Processor Sharing algorithm, which is sometimes adopted because of its seeming fairness properties, is not O(1+ε)-speed no(1)-competitive for sufficiently small ε."
STOC,2003,251-258,"Chryssis Georgiou, Alexander Russell, Alexander A. Shvartsman",Work-competitive scheduling for cooperative computing with dynamic groups.,https://doi.org/10.1145/780542.780581,"The problem of cooperatively performing a set of t tasks in a decentralized setting where the computing medium is subject to failures is one of the fundamental problems in distributed computing. The setting with partitionable networks is especially challenging, as algorithmic solutions must accommodate the possibility that groups of processors become disconnected (and, perhaps, reconnected) during the computation. The efficiency of task-performing algorithms is often assessed in terms of their work: the total number of tasks, counting multiplicities, performed by all of the processors during the computation. In general, an adversary that is able to partition the network into g components can cause any task-performing algorithm to have work Ω(t•g) even if each group of processors performs no more than the optimal number of Θ(t) tasks.Given such pessimistic lower bounds, and in order to understand better the practical implications of performing work in partitionable settings, we study distributed work-scheduling andpursue a competitiveanalysis. Specifically, we study asimple randomized scheduling algorithm for p asynchronous processors, connected by a dynamically changing communication medium, to complete t known tasks. We compare the performance of the algorithm against that of an ""off-line"" algorithm with full knowledge of the future changes in the communication medium. We describe a notion of computation width, which associates a natural number with a history of changes in the communication medium, and show both upper and lower bounds on competitiveness in terms of this quantity. Specifically, we show that a simple randomized algorithm obtains the competitive ratio (1+cw/e), where cw is computation width; we then show that this ratio is tight."
STOC,2003,259-268,"Panagiota Fatourou, Faith E. Fich, Eric Ruppert",A tight time lower bound for space-optimal implementations of multi-writer snapshots.,https://doi.org/10.1145/780542.780582,"A snapshot object consists of a collection of m > 1 components, each capable of storing a value, shared by n processes in an asynchronous shared-memory distributed system. It supports two operations: a process can UPDATE any individual component or atomically SCAN the entire collection to obtain the values of all the components. It is possible to implement a snapshot object using m registers so that each operation takes O(mn) time.In a previous paper, we proved that m registers are necessary to implement a snapshot object with m < n-1 components. Here we prove that, for any such space-optimal implementation, Ω(mn) steps are required to perform a SCAN operation in the worst case, matching the upper bound. We also extend our space and time lower bounds to implementations that use single-writer registers in addition to the multi-writer registers. Specifically, we prove that at least m multi-writer registers are still needed, provided the SCANS do not read a large fraction of the single-writer registers. We also prove that any implementation that uses single-writer registers in addition to  multi-writer registers uses Ω(√mn) steps in the worst case. Our proof yields insight into the structure of any implementation that uses only m multi-writer registers, showing that processes must access the multi-writer registers in a very constrained way."
STOC,2003,269-278,Thomas P. Hayes,Randomly coloring graphs of girth at least five.,https://doi.org/10.1145/780542.780584,"We improve rapid mixing results for the simple Glauber dynamics designed to generate a random k-coloring of a bounded-degree graph.Let G be a graph with maximum degree Δ = Ω(log n), and girth ≥ 5. We prove that if k > Α Δ, where Α ≈ 1.763 then Glauber dynamics has mixing time O(n log n). If girth(G) ≥ 6 and k > Β Δ, where Β ≈ 1.489 then Glauber dynamics has mixing time O(n log n). This improves a recent result of Molloy, who proved the same conclusion under the stronger assumptions that Δ=Ω(log n) and girth Ω(log Δ). Our work suggests that rapid mixing results for high girth and degree graphs may extend to general graphs.Analogous results hold for random graphs of average degree up to n¼, compared with polylog(n), which was the best previously known.Some of our proofs rely on a new Chernoff-Hoeffding type bound, which only requires the random variables to be well-behaved with high probability. This tail inequality may be of independent interest."
STOC,2003,279-286,"Ben Morris, Yuval Peres",Evolving sets and mixin.,https://doi.org/10.1145/780542.780585,"We show that a new probabilistic technique, recently introduced by the first author, yields the sharpest bounds obtained to date on mixing times in terms of isoperimetric properties of the state space (also known as conductance bounds or Cheeger inequalities). We prove that the bounds for mixing time in total variation obtained by Lovasz and Kannan, can be refined to apply to the maximum relative deviation |pn(x,y)/π(y)-1| of the distribution at time n from the stationary distribution π. Our approach also yields a direct link between isoperimetric inequalities and heat kernel bounds; previously, this link rested on analytic estimates known as Nash inequalities."
STOC,2003,287-296,"Sergey G. Bobkov, Prasad Tetali","Modified log-sobolev inequalities, mixing and hypercontractivity.",https://doi.org/10.1145/780542.780586,"Motivated by (the rate of information loss or) the rate at which the entropy of an ergodic Markov chain relative to its stationary distribution decays to zero, we study modified versions of the standard logarithmic Sobolev inequality in the discrete setting of finite Markov chains and graphs. These inequalities turn out to be weaker than the standard log-Sobolev inequality, but stronger than the Poincare' (spectral gap) inequality. We also derive a hypercontractivity formulation equivalent to our main modified log-Sobolev inequality which might be of independent interest. Finally we show that, in contrast with the spectral gap, for bounded degree expander graphs various log-Sobolev-type constants go to zero with the size of the graph."
STOC,2003,297-306,"Anna C. Gilbert, Howard J. Karloff",On the fractal behavior of TCP.,https://doi.org/10.1145/780542.780588,"We propose a natural, mathematically tractable model of TCP which captures both its additive-increase, multiplicative-decrease behavior and its feedback mechanism. Neither a fluid nor a mean-field model, our model does not explicitly model the loss process; the losses are entirely determined by the rates of the sources at the time of buffer overflow. The system involves two sources competing to send packets into one recipient buffer of size B, from which bytes are drained at the rate of d per step. We prove that for many choices of the pairs (B,d), the long term behavior of the system is fractal. We conjecture that this fact continues to hold for all B > d and d > 2."
STOC,2003,307-315,"Gerth Stølting Brodal, Rolf Fagerberg",On the limits of cache-obliviousness.,https://doi.org/10.1145/780542.780589,"In this paper, we present lower bounds for permuting and sorting in the cache-oblivious model. We prove that (1) I/O optimal cache-oblivious comparison based sorting is not possible without a tall cache assumption, and (2) there does not exist an I/O optimal cache-oblivious algorithm for permuting, not even in the presence of a tall cache assumption.Our results for sorting show the existence of an inherent trade-off in the cache-oblivious model between the strength of the tall cache assumption and the overhead for the case M » B, and show that Funnelsort and recursive binary mergesort are optimal algorithms in the sense that they attain this trade-off."
STOC,2003,316-324,"Tugkan Batu, Funda Ergün, Joe Kilian, Avner Magen, Sofya Raskhodnikova, Ronitt Rubinfeld, Rahul Sami",A sublinear algorithm for weakly approximating edit distance.,https://doi.org/10.1145/780542.780590,"We show how to determine whether the edit distance between two given strings is small in sublinear time. Specifically, we present a test which, given two n-character strings A and B, runs in time o(n) and with high probability returns ""CLOSE"" if their edit distance is O(nΑ), and ""FAR"" if their edit distance is Ω(n), where Α is a fixed parameter less than 1. Our algorithm for testing the edit distance works by recursively subdividing the strings A and B into smaller substrings and looking for pairs of substrings in A, B with small edit distance. To do this, we query both strings at random places using a special technique for economizing on the samples which does not pick the samples independently and provides better query and overall complexity. As a result, our test runs in time Õ(nmax(Α/2, 2Α - 1\)) for any fixed Α < 1. Our algorithm thus provides a trade-off between accuracy and efficiency that is particularly useful when the input data is very large.We also show a lower bound of Ω(nΑ/2) on the query complexity of every algorithm that distinguishes pairs of strings with edit distance at most nΑ from those with edit distance at least n/6."
STOC,2003,325-334,"Ryan O'Donnell, Rocco A. Servedio",New degree bounds for polynomial threshold functions.,https://doi.org/10.1145/780542.780592,"We give new upper and lower bounds on the degree of real multivariate polynomials which sign-represent Boolean functions. Our upper bounds for Boolean formulas yield the first known subexponential time learning algorithms for formulas of superconstant depth. Our lower bounds for constant-depth circuits and intersections of halfspaces are the first new degree lower bounds since 1968, improving results of Minsky and Papert. The lower bounds are proved constructively; we give explicit dual solutions to the necessary linear programs."
STOC,2003,335-344,Ziv Bar-Yossef,Sampling lower bounds via information theory.,https://doi.org/10.1145/780542.780593,"We present a novel technique, based on the Jensen-Shannon divergence from information theory, to prove lower bounds on the query complexity of sampling algorithms that approximate functions over arbitrary domain and range. Unlike previous methods, our technique does not use a reduction from a decision promise problem. As a result, it gives stronger bounds for functions that possess a large set of inputs, each two of which exhibit a gap in the function value.We demonstrate the technique with new query complexity lower bounds for three fundamental problems: (1) the ""election problem"", for which we obtain a quadratic improvement over previous bounds, (2) low rank matrix approximation, for which we prove the first lower bounds, showing that the algorithms given for this problem are almost optimal, and (3) matrix reconstruction.In addition, we introduce a new method for proving lower bounds on the expected query complexity of functions, using the Kullback-Leibler divergence. We demonstrate its use by a simple query complexity lower bound for the mean."
STOC,2003,345-354,"Eli Ben-Sasson, Prahladh Harsha, Sofya Raskhodnikova",Some 3CNF properties are hard to test.,https://doi.org/10.1145/780542.780594,"For a boolean formula φ on n variables, the associated property Pφ is the collection of n-bit strings that satisfy φ. We prove that there are 3CNF properties that require a linear number of queries, even for adaptive tests. This contrasts with 2CNF properties that are testable with O(√n) queries[7]. Notice that for every bad instance (i.e. an assignment that does not satisfy φ) there is a 3-bit query that witnesses this fact. Nevertheless, finding such a short witness requires a linear number of queries, even for assignments that are very far from satisfying.We provide sufficient conditions for linear properties to be hard to test, and in the course of the proof include a couple of observations which are of independent interest."
STOC,2003,355-364,"Valentine Kabanets, Russell Impagliazzo",Derandomizing polynomial identity tests means proving circuit lower bounds.,https://doi.org/10.1145/780542.780595,"We show that derandomizing Polynomial Identity Testing is, essentially, equivalent to proving circuit lower bounds for NEXP. More precisely, we prove that if one can test in polynomial time (or, even, nondeterministic subexponential time, infinitely often) whether a given arithmetic circuit over integers computes an identically zero polynomial, then either (i) NEXP ⊄ P/poly or (ii) Permanent is not computable by polynomial-size arithmetic circuits. We also prove a (partial) converse: If Permanent requires superpolynomial-size arithmetic circuits, then one can test in subexponential time whether a given arithmetic formula computes an identically zero polynomial.Since Polynomial Identity Testing is a coRP problem, we obtain the following corollary: If RP=P (or, even, coRP⊆ ∩ε > 0NTIME(2(nε)), infinitely often), then NEXP is not computable by polynomial-size arithmetic circuits. Thus, establishing that RP=coRP or BPP=P would require proving superpolynomial lower bounds for Boolean or arithmetic circuits. We also show that any derandomization of RNC would yield new circuit lower bounds for a language in NEXP."
STOC,2003,365-372,"Anupam Gupta 0001, Amit Kumar 0001, Tim Roughgarden",Simpler and better approximation algorithms for network design.,https://doi.org/10.1145/780542.780597,"We give simple and easy-to-analyze randomized approximation algorithms for several well-studied NP-hard network design problems. Our algorithms improve over the previously best known approximation ratios. Our main results are the following.We give a randomized 3.55-approximation algorithm for the  connected facility location problem. The algorithm requires three lines to state, one page to analyze, and improves the best-known performance guarantee for the problem.We give a 5.55-approximation algorithm for virtual private network design. Previously, constant-factor approximation algorithms were known only for special cases of this problem.We give a simple constant-factor approximation algorithm for the single-sink buy-at-bulk network design problem. Our performance guarantee improves over what was previously known, and is an order of magnitude improvement over previous combinatorial approximation algorithms for the problem."
STOC,2003,373-382,"Jiangzhuo Chen, Rajmohan Rajaraman, Ravi Sundaram",Meet and merge: approximation algorithms for confluent flows.,https://doi.org/10.1145/780542.780598,"In this paper we investigate the problem ofdetermining confluent flows with minimum congestion. A flow of a given commodity is said to be confluent if at any node all the flow of the commodity departs along a single edge. Confluent flows appear in a variety of application areas ranging from wireless communications to evacuations; in fact, most flows in the Internet are confluent since Internet routing is destination based.We consider the single commodity confluent flow problem, in which we are given an n-node directed network G, a sink t and supplies at each node, and the goal is to find a confluent flow that routes all the supplies to the sink while minimizing the maximum edge congestion. Our main result is an approximation algorithm, based on randomized rounding, for the special case when all the supplies are uniform; the algorithm finds a confluent flow with edge congestion O(C2 log3 n) where C is the node congestion of an optimal splittable flow. This implies an Õ(√n) approximation algorithm for the problem. Our result relies on the analysis of a natural probabilistic process defined on directed acyclic graphs, that may be of independent interest.For tree networks, we present an optimal polynomial-time algorithm for a multi-sink generalization of the above confluent flow problem. We show that it is NP-hard to approximate the congestion of the optimal confluent flow for general networks to within a factor of 4/3. We also establish a lower bound on the gap between confluent and splittable flows, and consider multicommodity and fractional versions of confluent flow problems."
STOC,2003,383-388,"Yossi Azar, Edith Cohen, Amos Fiat, Haim Kaplan, Harald Räcke",Optimal oblivious routing in polynomial time.,https://doi.org/10.1145/780542.780599,"A recent seminal result of Racke is that for any network there is an oblivious routing algorithm with a polylog competitive ratio with respect to congestion. Unfortunately, Racke's construction is not polynomial time. We give a polynomial time construction that guarantee's Racke's bounds, and more generally gives the true optimal ratio for any network."
STOC,2003,389-395,"Jochen Könemann, R. Ravi 0001",Primal-dual meets local search: approximating MST's with nonuniform degree bounds.,https://doi.org/10.1145/780542.780600,"We present a new bicriteria approximation algorithm for the degree-bounded minimum-cost spanning tree problem: Given an undirected graph with nonnegative edge weights and degree bounds Bv > 1 for all vertices v, find a spanning tree T of minimum total edge-cost such that the maximum degree of each node v in T is at most Bv. Our algorithm finds a tree in which the degree of each node v is O(Bv + log n) and the total edge-cost is at most a constant times the cost of any tree that obeys all degree constraints.Our previous algorithm[9] with similar guarantees worked only in the case of uniform degree bounds (i.e. Bv=B for all vertices v). While the new algorithm is based on ideas from Lagrangean relaxation as is our previous work, it does not rely on computing a solution to a linear program. Instead it uses a repeated application of Kruskal's MST algorithm interleaved with a combinatorial update of approximate Lagrangean node-multipliers maintained by the algorithm. These updates cause subsequent repetitions of the spanning tree algorithm to run for longer and longer times, leading to overall progress and a proof of the performance guarantee."
STOC,2003,396-406,Miklós Ajtai,The worst-case behavior of schnorr's algorithm approximating the shortest nonzero vector in a lattice.,https://doi.org/10.1145/780542.780602,"Schnorr's algorithm for finding an approximation for the shortest nonzero vector in an n dimensional lattice depends on a parameter k. He proved that for a fixed k ≤ n his algorithm (block 2k-reduction) provides a lattice vector whose length is greater than the length of a shortest nonzero vector in the lattice by at most a factor of (4k2) n/k. (The time required by the algorithm depends on k.) We show that if k=o(n), this bound on the performance of Schnorr's algorithm cannot be improved (apart from a constant factor in the exponent), namely there is a lattice and a basis so that if they are given as an input to the algorithm then the resulting approximating factor of the output is at least k ε n/k. (For larger integers k if Schnorr's algorithm runs in polynomial time then we have already a polynomial time algorithm for finding the shortest nonzero vector.) We also solve an open problem formulated by Schnorr about the the Korkine-Zolotareff lattice constants αk. We show that his upper bound αk ≤ k1 + ln k is the best possible apart from a constant factor in the exponent. We prove a similar result about his upper bound βk≤ 4k2, where βk is another lattice constant with an important role in Schnorr's analysis of his algorithm."
STOC,2003,407-416,Oded Regev 0001,New lattice based cryptographic constructions.,https://doi.org/10.1145/780542.780603,"We introduce the use of Fourier analysis on lattices as an integral part of a lattice-based construction. The tools we develop provide an elegant description of certain Gaussian distributions around lattice points. Our results include two cryptographic constructions that are based on the worst-case hardness of the unique shortest vector problem. The main result is a new public key cryptosystem whose security guarantee is considerably stronger than previous results (O(n1.5) instead of O(n7)). This provides the first alternative to Ajtai and Dwork's original 1996 cryptosystem. Our second result is a family of collision resistant hash functions with an improved security guarantee in terms of the unique shortest vector problem. Surprisingly, both results are derived from one theorem that presents two indistinguishable distributions on the segment [0, 1). It seems that this theorem can have further applications; as an example, we use it to solve an open problem in quantum computation related to the dihedral hidden subgroup problem."
