booktitle,year,pages,author,title,ee,abstract
STOC,2018,890-901,"Cody Murray, R. Ryan Williams",Circuit lower bounds for nondeterministic quasi-polytime: an easy witness lemma for NP and NQP.,https://doi.org/10.1145/3188745.3188910,"We prove that if every problem in NP has nk-size circuits for a fixed constant k, then for every NP-verifier and every yes-instance x of length n for that verifier, the verifier’s search space has an nO(k3)-size witness circuit: a witness for x that can be encoded with a circuit of only nO(k3) size. An analogous statement is proved for nondeterministic quasi-polynomial time, i.e., NQP = NTIME[nlogO(1) n]. This significantly extends the Easy Witness Lemma of Impagliazzo, Kabanets, and Wigderson [JCSS’02] which only held for larger nondeterministic classes such as NEXP.  As a consequence, the connections between circuit-analysis algorithms and circuit lower bounds can be considerably sharpened: algorithms for approximately counting satisfying assignments to given circuits which improve over exhaustive search can imply circuit lower bounds for functions in NQP or even NP. To illustrate, applying known algorithms for satisfiability of ACC ° THR circuits [R. Williams, STOC 2014] we conclude that for every fixed k, NQP does not have nlogk n-size ACC ° THR circuits."
STOC,2018,902-911,"Ankit Garg, Mika G??s, Pritish Kamath, Dmitry Sokolov 0001",Monotone circuit lower bounds from resolution.,https://doi.org/10.1145/3188745.3188838,"For any unsatisfiable CNF formula F that is hard to refute in the Resolution proof system, we show that a gadget-composed version of F is hard to refute in any proof system whose lines are computed by efficient communication protocols—or, equivalently, that a monotone function associated with F has large monotone circuit complexity. Our result extends to monotone real circuits, which yields new lower bounds for the Cutting Planes proof system."
STOC,2018,912-919,"Torsten Mütze, Jerri Nummenpalo, Bartosz Walczak",Sparse Kneser graphs are Hamiltonian.,https://doi.org/10.1145/3188745.3188834,"For integers k≥1 and n≥2k+1, the Kneser graph K(n,k) is the graph whose vertices are the k-element subsets of {1,…,n} and whose edges connect pairs of subsets that are disjoint. The Kneser graphs of the form K(2k+1,k) are also known as the odd graphs. We settle an old problem due to Meredith, Lloyd, and Biggs from the 1970s, proving that for every k≥3, the odd graph K(2k+1,k) has a Hamilton cycle. This and a known conditional result due to Johnson imply that all Kneser graphs of the form K(2k+2a,k) with k≥3 and a≥0 have a Hamilton cycle. We also prove that K(2k+1,k) has at least 22k?6 distinct Hamilton cycles for k≥6. Our proofs are based on a reduction of the Hamiltonicity problem in the odd graph to the problem of finding a spanning tree in a suitably defined hypergraph on Dyck words."
STOC,2018,920-925,"Anna R. Karlin, Shayan Oveis Gharan, Robbie Weber",A simply exponential upper bound on the maximum number of stable matchings.,https://doi.org/10.1145/3188745.3188848,"Stable matching is a classical combinatorial problem that has been the subject of intense theoretical and empirical study since its introduction in 1962 in a seminal paper by Gale and Shapley. In this paper, we provide a new upper bound on f(n), the maximum number of stable matchings that a stable matching instance with n men and n women can have. It has been a long-standing open problem to understand the asymptotic behavior of f(n) as n→∞, first posed by Donald Knuth in the 1970s. Until now the best lower bound was approximately 2.28n, and the best upper bound was 2nlogn? O(n). In this paper, we show that for all n, f(n) ≤ cn for some universal constant c. This matches the lower bound up to the base of the exponent. Our proof is based on a reduction to counting the number of downsets of a family of posets that we call “mixing”. The latter might be of independent interest."
STOC,2018,926-939,"Heng Guo 0001, Chao Liao, Pinyan Lu, Chihao Zhang 0001",Counting hypergraph colourings in the local lemma regime.,https://doi.org/10.1145/3188745.3188934,"We give a fully polynomial-time approximation scheme (FPTAS) to count the number of q-colorings for k-uniform hypergraphs with maximum degree Δ if k≥ 28 and q > 315Δ14/k?14. We also obtain a polynomial-time almost uniform sampler if q>798Δ16/k?16/3. These are the first approximate counting and sampling algorithms in the regime q?Δ (for large Δ and k) without any additional assumptions. Our method is based on the recent work of Moitra (STOC, 2017). One important contribution of ours is to remove the dependency of k and Δ in Moitra’s approach."
STOC,2018,940-951,"Irit Dinur, Subhash Khot, Guy Kindler, Dor Minzer, Muli Safra",On non-optimally expanding sets in Grassmann graphs.,https://doi.org/10.1145/3188745.3188806,"We study the structure of non-expanding sets in the Grassmann graph. We put forth a hypothesis stating that every small set whose expansion is smaller than 1?δ must be correlated with one of a specified list of sets which are isomorphic to smaller Grassmann graphs. We develop a framework of Fourier analysis for analyzing functions over the Grassmann graph, and prove that our hypothesis holds for all sets whose expansion is below 7/8.  In the companion submitted paper [Dinur, Khot, Kindler, Minzer and Safra, STOC 2018], the authors show that a linearity agreement hypothesis implies an NP-hardness gap of 1/2? vs for unique games and other inapproximability results. In [Barak, Kothari and Steurer, ECCC TR18-077], the authors show that the hypothesis in this work implies the linearity agreement hypothesis of [Dinur, Khot, Kindler, Minzer and Safra, STOC 2018]. Combined with our main theorem here this proves a version of the linearity agreement hypothesis with certain specific parameters. Short of proving the entire hypothesis, this nevertheless suffices for getting new unconditional NP hardness gaps for label cover with 2-to-1 and unique constraints.  Our Expansion Hypothesis has been subsequently proved in its full form [Khot, Minzer and Safra, ECCC TR18-006] thereby proving the agreement hypothesis of [Dinur, Khot, Kindler, Minzer and Safra, STOC 2018] and completing the proof of the 2-to-1 Games Conjecture (albeit with imperfect completeness)."
STOC,2018,952-963,"Ittai Abraham, Arnold Filtser, Anupam Gupta 0001, Ofer Neiman",Metric embedding via shortest path decompositions.,https://doi.org/10.1145/3188745.3188808,"We study the problem of embedding weighted graphs of pathwidth k into ?p spaces. Our main result is an O(kmin{1p,12})-distortion embedding. For p=1, this is a super-exponential improvement over the best previous bound of Lee and Sidiropoulos. Our distortion bound is asymptotically tight for any fixed p >1.  Our result is obtained via a novel embedding technique that is based on low depth decompositions of a graph via shortest paths. The core new idea is that given a geodesic shortest path P, we can probabilistically embed all points into 2 dimensions with respect to P. For p>2 our embedding also implies improved distortion on bounded treewidth graphs (O((klogn)1p)). For asymptotically large p, our results also implies improved distortion on graphs excluding a minor."
STOC,2018,964-977,"Mark Braverman, Gillat Kol",Interactive compression to external information.,https://doi.org/10.1145/3188745.3188956,"We describe a new way of compressing two-party communication protocols to get protocols with potentially smaller communication. We show that every communication protocol that communicates C bits and reveals I bits of information about the participants’ private inputs to an observer that watches the communication, can be simulated by a new protocol that communicates at most poly(I) · loglog(C) bits. Our result is tight up to polynomial factors, as it matches the recent work separating communication complexity from external information cost."
STOC,2018,978-989,"Kasper Green Larsen, Omri Weinstein, Huacheng Yu",Crossing the logarithmic barrier for dynamic Boolean data structure lower bounds.,https://doi.org/10.1145/3188745.3188790,"This paper proves the first super-logarithmic lower bounds on the cell probe complexity of dynamic boolean (a.k.a. decision) data structure problems, a long-standing milestone in data structure lower bounds.  We introduce a new approach and use it to prove a Ω(log1.5 n) lower bound on the operational time of a wide range of boolean data structure problems, most notably, on the query time of dynamic range counting over F2. Proving an ω(lgn) lower bound for this problem was explicitly posed as one of five important open problems in the late Mihai Pǎtra?cu’s obituary . This result also implies the first ω(lgn) lower bound for the classical 2D range counting problem, one of the most fundamental data structure problems in computational geometry and spatial databases. We derive similar lower bounds for boolean versions of dynamic polynomial evaluation and 2D rectangle stabbing, and for the (non-boolean) problems of range selection and range median.  Our technical centerpiece is a new way of “weakly” simulating dynamic data structures using efficient one-way communication protocols with small advantage over random guessing. This simulation involves a surprising excursion to low-degree (Chebyshev) polynomials which may be of independent interest, and offers an entirely new algorithmic angle on the “cell sampling” method of Panigrahy et al. ."
STOC,2018,990-1002,"Sumegha Garg, Ran Raz, Avishay Tal",Extractor-based time-space lower bounds for learning.,https://doi.org/10.1145/3188745.3188962,"A matrix M: A × X → {?1,1} corresponds to the following learning problem: An unknown element x ∈ X is chosen uniformly at random. A learner tries to learn x from a stream of samples, (a1, b1), (a2, b2) …, where for every i, ai ∈ A is chosen uniformly at random and bi = M(ai,x).  Assume that k, l, r are such that any submatrix of M of at least 2?k · |A| rows and at least 2?l · |X| columns, has a bias of at most 2?r. We show that any learning algorithm for the learning problem corresponding to M requires either a memory of size at least Ω(k · l ), or at least 2Ω(r) samples. The result holds even if the learner has an exponentially small success probability (of 2?Ω(r)).  In particular, this shows that for a large class of learning problems, any learning algorithm requires either a memory of size at least Ω((log|X|) · (log|A|)) or an exponential number of samples, achieving a tight Ω((log|X|) · (log|A|)) lower bound on the size of the memory, rather than a bound of Ω(min{(log|X|)2,(log|A|)2}) obtained in previous works by Raz [FOCS’17] and Moshkovitz and Moshkovitz [ITCS’18].  Moreover, our result implies all previous memory-samples lower bounds, as well as a number of new applications.  Our proof builds on the work of Raz [FOCS’17] that gave a general technique for proving memory samples lower bounds."
STOC,2018,1003-1012,"Josh Alman, Joshua R. Wang, Huacheng Yu",Cell-probe lower bounds from online communication complexity.,https://doi.org/10.1145/3188745.3188862,"In this work, we introduce an online model for communication complexity. Analogous to how online algorithms receive their input piece-by-piece, our model presents one of the players, Bob, his input piece-by-piece, and has the players Alice and Bob cooperate to compute a result each time before the next piece is revealed to Bob. This model has a closer and more natural correspondence to dynamic data structures than classic communication models do, and hence presents a new perspective on data structures.  We first present a tight lower bound for the online set intersection problem in the online communication model, demonstrating a general approach for proving online communication lower bounds. The online communication model prevents a batching trick that classic communication complexity allows, and yields a stronger lower bound. We then apply the online communication model to prove data structure lower bounds for two dynamic data structure problems: the Group Range problem and the Dynamic Connectivity problem for forests. Both of the problems admit a worst case O(logn)-time data structure. Using online communication complexity, we prove a tight cell-probe lower bound for each: spending o(logn) (even amortized) time per operation results in at best an exp(?δ2 n) probability of correctly answering a (1/2+δ)-fraction of the n queries."
STOC,2018,1013-1020,"Arkadev Chattopadhyay, Michal Koucky 0001, Bruno Loff, Sagnik Mukhopadhyay",Simulation beats richness: new data-structure lower bounds.,https://doi.org/10.1145/3188745.3188874,"We develop a new technique for proving lower bounds in the setting of asymmetric communication, a model that was introduced in the famous works of Miltersen (STOC’94) and Miltersen, Nisan, Safra and Wigderson (STOC’95). At the core of our technique is the first simulation theorem in the asymmetric setting, where Alice gets a p × n matrix x over F2 and Bob gets a vector y ∈ F2n. Alice and Bob need to evaluate f(x· y) for a Boolean function f: {0,1}p → {0,1}. Our simulation theorems show that a deterministic/randomized communication protocol exists for this problem, with cost C· n for Alice and C for Bob, if and only if there exists a deterministic/randomized *parity decision tree* of cost Θ(C) for evaluating f.  As applications of this technique, we obtain the following results:  1. The first strong lower-bounds against randomized data-structure schemes for the Vector-Matrix-Vector product problem over F2. Moreover, our method yields strong lower bounds even when the data-structure scheme has tiny advantage over random guessing.  2. The first lower bounds against randomized data-structures schemes for two natural Boolean variants of Orthogonal Vector Counting.  3. We construct an asymmetric communication problem and obtain a deterministic lower-bound for it which is provably better than any lower-bound that may be obtained by the classical Richness Method of Miltersen et al. (STOC ’95). This seems to be the first known limitation of the Richness Method in the context of proving deterministic lower bounds."
STOC,2018,1021-1034,"Samuel B. Hopkins, Jerry Li 0001","Mixture models, robustness, and sum of squares proofs.",https://doi.org/10.1145/3188745.3188748,"We use the Sum of Squares method to develop new efficient algorithms for learning well-separated mixtures of Gaussians and robust mean estimation, both in high dimensions, that substantially improve upon the statistical guarantees achieved by previous efficient algorithms. Our contributions are:  Mixture models with separated means: We study mixtures of poly(k)-many k-dimensional distributions where the means of every pair of distributions are separated by at least kε. In the special case of spherical Gaussian mixtures, we give a kO(1/ε)-time algorithm that learns the means assuming separation at least kε, for any ε> 0. This is the first algorithm to improve on greedy (“single-linkage”) and spectral clustering, breaking a long-standing barrier for efficient algorithms at separation k1/4.  Robust estimation: When an unknown (1?ε)-fraction of X1,…,Xn are chosen from a sub-Gaussian distribution with mean μ but the remaining points are chosen adversarially, we give an algorithm recovering μ to error ε1?1/t in time kO(t), so long as sub-Gaussian-ness up to O(t) moments can be certified by a Sum of Squares proof. This is the first polynomial-time algorithm with guarantees approaching the information-theoretic limit for non-Gaussian distributions. Previous algorithms could not achieve error better than ε1/2. As a corollary, we achieve similar results for robust covariance estimation.  Both of these results are based on a unified technique. Inspired by recent algorithms of Diakonikolas et al. in robust statistics, we devise an SDP based on the Sum of Squares method for the following setting: given X1,…,Xn ∈ ?k for large k and n = poly(k) with the promise that a subset of X1,…,Xn were sampled from a probability distribution with bounded moments, recover some information about that distribution."
STOC,2018,1035-1046,"Pravesh K. Kothari, Jacob Steinhardt, David Steurer",Robust moment estimation and improved clustering via sum of squares.,https://doi.org/10.1145/3188745.3188970,"We develop efficient algorithms for estimating low-degree moments of unknown distributions in the presence of adversarial outliers and design a new family of convex relaxations for k-means clustering based on sum-of-squares method. As an immediate corollary, for any γ > 0, we obtain an efficient algorithm for learning the means of a mixture of k arbitrary distributions in d in time dO(1/γ) so long as the means have separation Ω(kγ). This in particular yields an algorithm for learning Gaussian mixtures with separation Ω(kγ), thus partially resolving an open problem of Regev and Vijayaraghavan regev2017learning. The guarantees of our robust estimation algorithms improve in many cases significantly over the best previous ones, obtained in the recent works. We also show that the guarantees of our algorithms match information-theoretic lower-bounds for the class of distributions we consider. These improved guarantees allow us to give improved algorithms for independent component analysis and learning mixtures of Gaussians in the presence of outliers.  We also show a sharp upper bound on the sum-of-squares norms for moment tensors of any distribution that satisfies the Poincare inequality. The Poincare inequality is a central inequality in probability theory, and a large class of distributions satisfy it including Gaussians, product distributions, strongly log-concave distributions, and any sum or uniformly continuous transformation of such distributions. As a consequence, this yields that all of the above algorithmic improvements hold for distributions satisfying the Poincare inequality."
STOC,2018,1047-1060,"Ilias Diakonikolas, Daniel M. Kane, Alistair Stewart",List-decodable robust mean estimation and learning mixtures of spherical gaussians.,https://doi.org/10.1145/3188745.3188758,"We study the problem of list-decodable (robust) Gaussian mean estimation and the related problem of learning mixtures of separated spherical Gaussians. In the former problem, we are given a set T of points in n with the promise that an α-fraction of points in T, where 0< α < 1/2, are drawn from an unknown mean identity covariance Gaussian G, and no assumptions are made about the remaining points. The goal is to output a small list of candidate vectors with the guarantee that at least one of the candidates is close to the mean of G. In the latter problem, we are given samples from a k-mixture of spherical Gaussians on n and the goal is to estimate the unknown model parameters up to small accuracy. We develop a set of techniques that yield new efficient algorithms with significantly improved guarantees for these problems. Specifically, our main contributions are as follows:  List-Decodable Mean Estimation. Fix any d ∈ + and 0< α <1/2. We design an algorithm with sample complexity Od ((nd/α)) and runtime Od ((n/α)d) that outputs a list of O(1/α) many candidate vectors such that with high probability one of the candidates is within ?2-distance Od(α?1/(2d)) from the mean of G. The only previous algorithm for this problem achieved error ?(α?1/2) under second moment conditions. For d = O(1/), where >0 is a constant, our algorithm runs in polynomial time and achieves error O(α). For d = Θ(log(1/α)), our algorithm runs in time (n/α)O(log(1/α)) and achieves error O(log3/2(1/α)), almost matching the information-theoretically optimal bound of Θ(log1/2(1/α)) that we establish. We also give a Statistical Query (SQ) lower bound suggesting that the complexity of our algorithm is qualitatively close to best possible.  Learning Mixtures of Spherical Gaussians. We give a learning algorithm for mixtures of spherical Gaussians, with unknown spherical covariances, that succeeds under significantly weaker separation assumptions compared to prior work. For the prototypical case of a uniform k-mixture of identity covariance Gaussians we obtain the following: For any >0, if the pairwise separation between the means is at least Ω(k+√log(1/δ)), our algorithm learns the unknown parameters within accuracy δ with sample complexity and running time (n, 1/δ, (k/)1/). Moreover, our algorithm is robust to a small dimension-independent fraction of corrupted data. The previously best known polynomial time algorithm required separation at least k1/4 (k/δ). Finally, our algorithm works under separation of ?(log3/2(k)+√log(1/δ)) with sample complexity and running time (n, 1/δ, klogk). This bound is close to the information-theoretically minimum separation of Ω(√logk).  Our main technical contribution is a new technique, using degree-d multivariate polynomials, to remove outliers from high-dimensional datasets where the majority of the points are corrupted."
STOC,2018,1061-1073,"Ilias Diakonikolas, Daniel M. Kane, Alistair Stewart",Learning geometric concepts with nasty noise.,https://doi.org/10.1145/3188745.3188754,"We study the efficient learnability of geometric concept classes — specifically, low-degree polynomial threshold functions (PTFs) and intersections of halfspaces — when a fraction of the training data is adversarially corrupted. We give the first polynomial-time PAC learning algorithms for these concept classes with dimension-independent error guarantees in the presence of nasty noise under the Gaussian distribution. In the nasty noise model, an omniscient adversary can arbitrarily corrupt a small fraction of both the unlabeled data points and their labels. This model generalizes well-studied noise models, including the malicious noise model and the agnostic (adversarial label noise) model. Prior to our work, the only concept class for which efficient malicious learning algorithms were known was the class of origin-centered halfspaces.  At the core of our results is an efficient algorithm to approximate the low-degree Chow-parameters of any bounded function in the presence of nasty noise. Our robust approximation algorithm for the Chow parameters provides near-optimal error guarantees for a range of distribution families satisfying mild concentration bounds and moment conditions. At the technical level, this algorithm employs an iterative “spectral” technique for outlier detection and removal inspired by recent work in robust unsupervised learning, which makes essential use of low-degree multivariate polynomials.  Our robust learning algorithm for low-degree PTFs provides dimension-independent error guarantees for a class of tame distributions, including Gaussians and, more generally, any logconcave distribution with (approximately) known low-degree moments. For LTFs under the Gaussian distribution, using a refinement of the localization technique, we give a polynomial-time algorithm that achieves a near-optimal error of O(?), where ? is the noise rate. Our robust learning algorithm for intersections of halfspaces proceeds by projecting down to an appropriate low-dimensional subspace. Its correctness makes essential use of a novel robust inverse independence lemma that is of independent interest."
STOC,2018,1074-1087,"Vatsal Sharan, Sham M. Kakade, Percy Liang, Gregory Valiant",Prediction with a short memory.,https://doi.org/10.1145/3188745.3188954,"We consider the problem of predicting the next observation given a sequence of past observations, and consider the extent to which accurate prediction requires complex algorithms that explicitly leverage long-range dependencies. Perhaps surprisingly, our positive results show that for a broad class of sequences, there is an algorithm that predicts well on average, and bases its predictions only on the most recent few observation together with a set of simple summary statistics of the past observations. Specifically, we show that for any distribution over observations, if the mutual information between past observations and future observations is upper bounded by I, then a simple Markov model over the most recent I/? observations obtains expected KL error ?—and hence ?1 error √?—with respect to the optimal predictor that has access to the entire past and knows the data generating distribution. For a Hidden Markov Model with n hidden states, I is bounded by logn, a quantity that does not depend on the mixing time, and we show that the trivial prediction algorithm based on the empirical frequencies of length O(logn/?) windows of observations achieves this error, provided the length of the sequence is dΩ(logn/?), where d is the size of the observation alphabet.  We also establish that this result cannot be improved upon, even for the class of HMMs, in the following two senses: First, for HMMs with n hidden states, a window length of logn/? is information-theoretically necessary to achieve expected KL error ?, or ?1 error √?. Second, the dΘ(logn/?) samples required to accurately estimate the Markov model when observations are drawn from an alphabet of size d is necessary for any computationally tractable learning/prediction algorithm, assuming the hardness of strongly refuting a certain class of CSPs."
