booktitle,year,pages,author,title,ee,abstract
STOC,2018,339-352,"Debbie W. Leung, Ashwin Nayak 0001, Ala Shayeghi, Dave Touchette, Penghui Yao, Nengkun Yu",Capacity approaching coding for low noise interactive quantum communication.,https://doi.org/10.1145/3188745.3188908,"We consider the problem of implementing two-party interactive quantum communication over noisy channels, a necessary endeavor if we wish to fully reap quantum advantages for communication. For an arbitrary protocol with n messages, designed for noiseless qudit channels (where d is arbitrary), our main result is a simulation method that fails with probability less than 2?Θ (n?) and uses a qudit channel n (1 + Θ (√?)) times, of which an ? fraction can be corrupted adversarially. The simulation is thus capacity achieving to leading order, and we conjecture that it is optimal up to a constant factor in the √? term. Furthermore, the simulation is in a model that does not require pre-shared resources such as randomness or entanglement between the communicating parties. Perhaps surprisingly, this outperforms the best known overhead of 1 + O(√? loglog1/?) in the corresponding classical model, which is also conjectured to be optimal [Haeupler, FOCS’14]. Our work also improves over the best previously known quantum result where the overhead is a non-explicit large constant [Brassard et al., FOCS’14] for low ?."
STOC,2018,353-362,"Mark Braverman, Gil Cohen, Sumegha Garg",Hitting sets with near-optimal error for read-once branching programs.,https://doi.org/10.1145/3188745.3188780,"Nisan (Combinatorica’92) constructed a pseudorandom generator for length n, width n read-once branching programs (ROBPs) with error ε and seed length O(log2n + logn · log(1/ε)). A major goal in complexity theory is to reduce the seed length, hopefully, to the optimal O(logn+log(1/ε)), or to construct improved hitting sets, as these would yield stronger derandomization of BPL and RL, respectively. In contrast to a successful line of work in restricted settings, no progress has been made for general, unrestricted, ROBPs. Indeed, Nisan’s construction is the best pseudorandom generator and, prior to this work, also the best hitting set for unrestricted ROBPs.  In this work, we make the first improvement for the general case by constructing a hitting set with seed length O(log2n+log(1/ε)). That is, we decouple ε and n, and obtain near-optimal dependence on the former. The regime of parameters in which our construction strictly improves upon prior works, namely, log(1/ε) ? logn, is well-motivated by the work of Saks and Zhou (J.CSS’99) who use pseudorandom generators with error ε = 2?(logn)2 in their proof for BPL ? L3/2. We further suggest a research program towards proving that BPL ? L4/3 in which our result achieves one step.  As our main technical tool, we introduce and construct a new type of primitive we call pseudorandom pseudo-distributions. Informally, this is a generalization of pseudorandom generators in which one may assign negative and unbounded weights to paths as opposed to working with probability distributions. We show that such a primitive yields hitting sets and, for derandomization purposes, can be used to derandomize two-sided error algorithms."
STOC,2018,363-375,"Eshan Chattopadhyay, Pooya Hatami, Omer Reingold, Avishay Tal",Improved pseudorandomness for unordered branching programs through local monotonicity.,https://doi.org/10.1145/3188745.3188800,"We present an explicit pseudorandom generator with seed length ?((logn)w+1) for read-once, oblivious, width w branching programs that can read their input bits in any order. This improves upon the work of Impagliazzo, Meka and Zuckerman (FOCS’12) where they required seed length n1/2+o(1).  A central ingredient in our work is the following bound that we prove on the Fourier spectrum of branching programs. For any width w read-once, oblivious branching program B:{0,1}n→ {0,1}, any k ∈ {1,…,n}, [complex formula not displayed]  This settles a conjecture posed by Reingold, Steinke and Vadhan (RANDOM’13).  Our analysis crucially uses a notion of local monotonicity on the edge labeling of the branching program. We carry critical parts of our proof under the assumption of local monotonicity and show how to deduce our results for unrestricted branching programs."
STOC,2018,376-389,"Irit Dinur, Subhash Khot, Guy Kindler, Dor Minzer, Muli Safra",Towards a proof of the 2-to-1 games conjecture?,https://doi.org/10.1145/3188745.3188804,"We present a polynomial time reduction from gap-3LIN to label cover with 2-to-1 constraints. In the “yes” case the fraction of satisfied constraints is at least 1 ?ε, and in the “no” case we show that this fraction is at most ε, assuming a certain (new) combinatorial hypothesis on the Grassmann graph. In other words, we describe a combinatorial hypothesis that implies the 2-to-1 conjecture with imperfect completeness. The companion submitted paper [Dinur, Khot, Kindler, Minzer and Safra, STOC 2018] makes some progress towards proving this hypothesis.  Our work builds on earlier work by a subset of the authors [Khot, Minzer and Safra, STOC 2017] where a slightly different hypothesis was used to obtain hardness of approximating vertex cover to within factor of √2?ε.  The most important implication of this work is (assuming the hypothesis) an NP-hardness gap of 1/2?ε vs. ε for unique games. In addition, we derive optimal NP-hardness for approximating the max-cut-gain problem, NP-hardness of coloring an almost 4-colorable graph with any constant number of colors, and the same √2?ε NP-hardness for approximate vertex cover that was already obtained based on a slightly different hypothesis.  Recent progress towards proving our hypothesis [Barak, Kothari and Steurer, ECCC TR18-077], [Dinur, Khot, Kindler, Minzer and Safra, STOC 2018] directly implies some new unconditional NP-hardness results. These include new points of NP-hardness for unique games and for 2-to-1 and 2-to-2 games. More recently, the full version of our hypothesis was proven [Khot, Minzer and Safra, ECCC TR18-006]."
STOC,2018,390-403,"Daniel Dadush, Sophie Huiberts",A friendly smoothed analysis of the simplex method.,https://doi.org/10.1145/3188745.3188826,"Explaining the excellent practical performance of the simplex method for linear programming has been a major topic of research for over 50 years. One of the most successful frameworks for understanding the simplex method was given by Spielman and Teng (JACM ‘04), who the developed the notion of smoothed analysis. Starting from an arbitrary linear program with d variables and n constraints, Spielman and Teng analyzed the expected runtime over random perturbations of the LP (smoothed LP), where variance σ Gaussian noise is added to the LP data. In particular, they gave a two-stage shadow vertex simplex algorithm which uses an expected O(n86 d55 σ?30) number of simplex pivots to solve the smoothed LP. Their analysis and runtime was substantially improved by SpielmanDeshpande (FOCS ‘05) and later Vershynin (SICOMP ‘09). The fastest current algorithm, due to Vershynin, solves the smoothed LP using an expected O(d3 log3 n? σ?4 + d9log7 n) number of pivots, improving the dependence on n from polynomial to logarithmic.  While the original proof of SpielmanTeng has now been substantially simplified, the resulting analyses are still quite long and complex and the parameter dependencies far from optimal. In this work, we make substantial progress on this front, providing an improved and simpler analysis of shadow simplex methods, where our main algorithm requires an expected O(d2 √logn σ?2 + d5 log3/2 n) number of simplex pivots. We obtain our results via an improved shadow bound, key to earlier analyses as well, combined with algorithmic techniques of Borgwardt (ZOR ‘82) and Vershynin. As an added bonus, our analysis is completely modular, allowing us to obtain non-trivial bounds for perturbations beyond Gaussians, such as Laplace perturbations."
STOC,2018,404-417,"Rasmus Kyng, Richard Peng, Robert Schwieterman, Peng Zhang 0052",Incomplete nested dissection.,https://doi.org/10.1145/3188745.3188960,"We present an asymptotically faster algorithm for solving linear systems in well-structured 3-dimensional truss stiffness matrices. These linear systems arise from linear elasticity problems, and can be viewed as extensions of graph Laplacians into higher dimensions. Faster solvers for the 2-D variants of such systems have been studied using generalizations of tools for solving graph Laplacians [Daitch-Spielman CSC’07, Shklarski-Toledo SIMAX’08].  Given a 3-dimensional truss over n vertices which is formed from a union of k convex structures (tetrahedral meshes) with bounded aspect ratios, whose individual tetrahedrons are also in some sense well-conditioned, our algorithm solves a linear system in the associated stiffness matrix up to accuracy ? in time O(k1/3 n5/3 log(1 / ?)). This asymptotically improves the running time O(n2) by Nested Dissection for all k ? n.  We also give a result that improves on Nested Dissection even when we allow any aspect ratio for each of the k convex structures (but we still require well-conditioned individual tetrahedrons). In this regime, we improve on Nested Dissection for k ? n1/44.  The key idea of our algorithm is to combine nested dissection and support theory. Both of these techniques for solving linear systems are well studied, but usually separately. Our algorithm decomposes a 3-dimensional truss into separate and balanced regions with small boundaries. We then bound the spectrum of each such region separately, and utilize such bounds to obtain improved algorithms by preconditioning with partial states of separator-based Gaussian elimination."
STOC,2018,418-430,"Mohsen Ghaffari 0001, Fabian Kuhn, Yannic Maus, Jara Uitto",Deterministic distributed edge-coloring with fewer colors.,https://doi.org/10.1145/3188745.3188906,"We present a deterministic distributed algorithm, in the LOCAL model, that computes a (1+o(1))Δ-edge-coloring in polylogarithmic-time, so long as the maximum degree Δ=Ω(logn). For smaller Δ, we give a polylogarithmic-time 3Δ/2-edge-coloring. These are the first deterministic algorithms to go below the natural barrier of 2Δ?1 colors, and they improve significantly on the recent polylogarithmic-time (2Δ?1)(1+o(1))-edge-coloring of Ghaffari and Su [SODA’17] and the (2Δ?1)-edge-coloring of Fischer, Ghaffari, and Kuhn [FOCS’17], positively answering the main open question of the latter. The key technical ingredient of our algorithm is a simple and novel gradual packing of judiciously chosen near-maximum matchings, each of which becomes one of the color classes."
STOC,2018,431-444,"Mohsen Ghaffari 0001, Jason Li 0006",Improved distributed algorithms for exact shortest paths.,https://doi.org/10.1145/3188745.3188948,"Computing shortest paths is one of the central problems in the theory of distributed computing. For the last few years, substantial progress has been made on the approximate single source shortest paths problem, culminating in an algorithm of Henzinger, Krinninger, and Nanongkai?[STOC’16] which deterministically computes (1+o(1))-approximate shortest paths in ?(D+√n) time, where D is the hop-diameter of the graph. Up to logarithmic factors, this time complexity is optimal, matching the lower bound of Elkin?[STOC’04].  The question of exact shortest paths however saw no algorithmic progress for decades, until the recent breakthrough of Elkin [STOC’17], which established a sublinear-time algorithm for exact single source shortest paths on undirected graphs. Shortly after, Huang et al. [FOCS’17] provided improved algorithms for exact all pairs shortest paths problem on directed graphs.  In this paper, we provide an alternative single-source shortest path algorithm with complexity ?(n3/4D1/4). For polylogarithmic D, this improves on Elkin’s ?(n5/6) bound and gets closer to the Ω(n1/2) lower bound of Elkin?[STOC’04]. For larger values of D, we present an improved variant of our algorithm which achieves complexity ?(max{ n3/4+o(1) , n3/4D1/6} + D ), and thus compares favorably with Elkin’s bound of ?(max{ n5/6, n2/3D1/3} + D ) in essentially the entire range of parameters. This algorithm provides also a qualitative improvement, because it works for the more challenging case of directed graph (i.e., graphs where the two directions of an edge can have different weights), constituting the first sublinear-time algorithm for directed graphs. Our algorithm also extends to the case of exact r-source shortest paths, in which we provide the fastest algorithm for moderately small r and D, improving on those of Huang et al."
STOC,2018,445-456,"Yi-Jun Chang, Wenzheng Li, Seth Pettie",An optimal distributed (Δ+1)-coloring algorithm?,https://doi.org/10.1145/3188745.3188964,"Vertex coloring is one of the classic symmetry breaking problems studied in distributed computing. In this paper we present a new algorithm for (Δ+1)-list coloring in the randomized LOCAL model running in O(log?n + Detd(poly logn)) time, where Detd(n′) is the deterministic complexity of (deg+1)-list coloring (v’s palette has size deg(v)+1) on n′-vertex graphs. This improves upon a previous randomized algorithm of Harris, Schneider, and Su (STOC 2016). with complexity O(√logΔ + loglogn + Detd(poly logn)), and (when Δ is sufficiently large) is much faster than the best known deterministic algorithm of Fraigniaud, Heinrich, and Kosowski (FOCS 2016), with complexity O(√Δlog2.5Δ + log* n).  Our algorithm appears to be optimal. It matches the Ω(log?n) randomized lower bound, due to Naor (SIDMA 1991) and sort of matches the Ω(Det(poly logn)) randomized lower bound due to Chang, Kopelowitz, and Pettie (FOCS 2016), where Det is the deterministic complexity of (Δ+1)-list coloring. The best known upper bounds on Detd(n′) and Det(n′) are both 2O(√logn′) by Panconesi and Srinivasan (Journal of Algorithms 1996), and it is quite plausible that the complexities of both problems are the same, asymptotically."
STOC,2018,457-470,Jeremy T. Fineman,Nearly work-efficient parallel algorithm for digraph reachability.,https://doi.org/10.1145/3188745.3188926,"One of the simplest problems on directed graphs is that of identifying the set of vertices reachable from a designated source vertex. This problem can be solved easily sequentially by performing a graph search, but efficient parallel algorithms have eluded researchers for decades. For sparse high-diameter graphs in particular, there is no known work-efficient parallel algorithm with nontrivial parallelism. This amounts to one of the most fundamental open questions in parallel graph algorithms: Is there a parallel algorithm for digraph reachability with nearly linear work? This paper shows that the answer is yes.  This paper presents a randomized parallel algorithm for digraph reachability and related problems with expected work ?(m) and span ?(n2/3), and hence parallelism Ω(m/n2/3) = Ω(n1/3), on any graph with n vertices and m arcs. This is the first parallel algorithm having both nearly linear work and strongly sublinear span, i.e., span ?(n1??) for any constant ?>0. The algorithm can be extended to produce a directed spanning tree, determine whether the graph is acyclic, topologically sort the strongly connected components of the graph, or produce a directed ear decomposition, all with work ?(m) and span ?(n2/3).  The main technical contribution is an efficient Monte Carlo algorithm that, through the addition of ?(n) shortcuts, reduces the diameter of the graph to ?(n2/3) with high probability. While both sequential and parallel algorithms are known with those combinatorial properties, even the sequential algorithms are not efficient, having sequential runtime Ω(mnΩ(1)). This paper presents a surprisingly simple sequential algorithm that achieves the stated diameter reduction and runs in ?(m) time. Parallelizing that algorithm yields the main result, but doing so involves overcoming several other challenges."
STOC,2018,471-484,"Artur Czumaj, Jakub Lacki, Aleksander Madry, Slobodan Mitrovic, Krzysztof Onak, Piotr Sankowski",Round compression for parallel matching algorithms.,https://doi.org/10.1145/3188745.3188764,"For over a decade now we have been witnessing the success of massive parallel computation (MPC) frameworks, such as MapReduce, Hadoop, Dryad, or Spark. One of the reasons for their success is the fact that these frameworks are able to accurately capture the nature of large-scale computation. In particular, compared to the classic distributed algorithms or PRAM models, these frameworks allow for much more local computation. The fundamental question that arises in this context is though: can we leverage this additional power to obtain even faster parallel algorithms?  A prominent example here is the maximum matching problem—one of the most classic graph problems. It is well known that in the PRAM model one can compute a 2-approximate maximum matching in O(logn) rounds. However, the exact complexity of this problem in the MPC framework is still far from understood. Lattanzi et al. (SPAA 2011) showed that if each machine has n1+Ω(1) memory, this problem can also be solved 2-approximately in a constant number of rounds. These techniques, as well as the approaches developed in the follow up work, seem though to get stuck in a fundamental way at roughly O(logn) rounds once we enter the (at most) near-linear memory regime. It is thus entirely possible that in this regime, which captures in particular the case of sparse graph computations, the best MPC round complexity matches what one can already get in the PRAM model, without the need to take advantage of the extra local computation power.  In this paper, we finally refute that possibility. That is, we break the above O(logn) round complexity bound even in the case of slightly sublinear memory per machine. In fact, our improvement here is almost exponential: we are able to deliver a (2+?)-approximate maximum matching, for any fixed constant ?>0, in O((loglogn)2) rounds.  To establish our result we need to deviate from the previous work in two important ways that are crucial for exploiting the power of the MPC model, as compared to the PRAM model. Firstly, we use vertex–based graph partitioning, instead of the edge–based approaches that were utilized so far. Secondly, we develop a technique of round compression. This technique enables one to take a (distributed) algorithm that computes an O(1)-approximation of maximum matching in O(logn) independent PRAM phases and implement a super-constant number of these phases in only a constant number of MPC rounds."
STOC,2018,485-492,"Jaroslaw Blasiok, Venkatesan Guruswami, Preetum Nakkiran, Atri Rudra, Madhu Sudan 0001",General strong polarization.,https://doi.org/10.1145/3188745.3188816,"Ar?kan’s exciting discovery of polar codes has provided an altogether new way to efficiently achieve Shannon capacity. Given a (constant-sized) invertible matrix M, a family of polar codes can be associated with this matrix and its ability to approach capacity follows from the polarization of an associated [0, 1]-bounded martingale, namely its convergence in the limit to either 0 or 1 with probability 1. Ar?kan showed appropriate polarization of the martingale associated with the matrix (G2 = ( 1 1 0 1) to get capacity achieving codes. His analysis was later extended to all matrices M that satisfy an obvious necessary condition for polarization. While Ar?kan’s theorem does not guarantee that the codes achieve capacity at small blocklengths (specifically in length, which is a polynomial in ( 1ε ) where (ε) is the difference between the capacity of a channel and the rate of the code), it turns out that a “strong” analysis of the polarization of the underlying martingale would lead to such constructions. Indeed for the martingale associated with (G2) such a strong polarization was shown in two independent works (Guruswami and Xia (IEEE IT’15) and Hassani et?al. (IEEE IT’14)), thereby resolving a major theoretical challenge associated with the efficient attainment of Shannon capacity. In this work we extend the result above to cover martingales associated with all matrices that satisfy the necessary condition for (weak) polarization. In addition to being vastly more general, our proofs of strong polarization are (in our view) also much simpler and modular. Key to our proof is a notion of local polarization that only depends on the evolution of the martingale in a single time step. We show that local polarization always implies strong polarization. We then apply relatively simple reasoning about conditional entropies to prove local polarization in very general settings. Specifically, our result shows strong polarization over all prime fields and leads to efficient capacity-achieving source codes for compressing arbitrary i.i.d. sources, and capacity-achieving channel codes for arbitrary symmetric memoryless channels. We show how to use our analyses to achieve exponentially small error probabilities at lengths inverse polynomial in the gap to capacity. Indeed we show that we can essentially match any error probability while maintaining lengths that are only inverse polynomial in the gap to capacity."
STOC,2018,493-506,Mahdi Cheraghchi,Capacity upper bounds for deletion-type channels.,https://doi.org/10.1145/3188745.3188768,"We develop a systematic approach, based on convex programming and real analysis for obtaining upper bounds on the capacity of the binary deletion channel and, more generally, channels with i.i.d. insertions and deletions. Other than the classical deletion channel, we give special attention to the Poisson-repeat channel introduced by Mitzenmacher and Drinea (IEEE Transactions on Information Theory, 2006). Our framework can be applied to obtain capacity upper bounds for any repetition distribution (the deletion and Poisson-repeat channels corresponding to the special cases of Bernoulli and Poisson distributions). Our techniques essentially reduce the task of proving capacity upper bounds to maximizing a univariate, real-valued, and often concave function over a bounded interval. The corresponding univariate function is carefully designed according to the underlying distribution of repetitions, and the choices vary depending on the desired strength of the upper bounds as well as the desired simplicity of the function (e.g., being only efficiently computable versus having an explicit closed-form expression in terms of elementary, or common special, functions). Among our results, we show the following: (1) The capacity of the binary deletion channel with deletion probability d is at most (1 ? d) φ for d ≥ 1/2 and, assuming that the capacity function is convex, is at most 1 ? d log(4/φ) for d < 1/2, where φ = (1 + √5)/2 is the golden ratio. This is the first nontrivial capacity upper bound for any value of d outside the limiting case d → 0 that is fully explicit and proved without computer assistance. (2) We derive the first set of capacity upper bounds for the Poisson-repeat channel. Our results uncover further striking connections between this channel and the deletion channel and suggest, somewhat counter-intuitively, that the Poisson-repeat channel is actually analytically simpler than the deletion channel and may be of key importance to a complete understanding of the deletion channel. (3) We derive several novel upper bounds on the capacity of the deletion channel. All upper bounds are maximums of efficiently computable, and concave, univariate real functions over a bounded domain. In turn, we upper bound these functions in terms of explicit elementary and standard special functions, whose maximums can be found even more efficiently (and sometimes analytically, for example, for d = 1/2)."
STOC,2018,507-520,"Klim Efremenko, Gillat Kol, Raghuvansh Saxena",Interactive coding over the noisy broadcast channel.,https://doi.org/10.1145/3188745.3188884,"A set of n players, each holding a private input bit, communicate over a noisy broadcast channel. Their mutual goal is for all players to learn all inputs. At each round one of the players broadcasts a bit to all the other players, and the bit received by each player is flipped with a fixed constant probability (independently for each recipient). How many rounds are needed?  This problem was first suggested by El Gamal in 1984. In 1988, Gallager gave an elegant noise-resistant protocol requiring only O(n loglogn) rounds. The problem got resolved in 2005 by a seminal paper of Goyal, Kindler, and Saks, proving that Gallager’s protocol is essentially optimal.  We revisit the above noisy broadcast problem and show that O(n) rounds suffice. This is possible due to a relaxation of the model assumed by the previous works. We no longer demand that exactly one player broadcasts in every round, but rather allow any number of players to broadcast. However, if it is not the case that exactly one player chooses to broadcast, each of the other players gets an adversely chosen bit.  We generalized the above result and initiate the study of interactive coding over the noisy broadcast channel. We show that any interactive protocol that works over the noiseless broadcast channel can be simulated over our restrictive noisy broadcast model with constant blowup of the communication. Our results also establish that modern techniques for interactive coding can help us make progress on the classical problems."
