booktitle,year,pages,author,title,ee,abstract
STOC,2019,343-354,"Mohit Daga, Monika Henzinger, Danupon Nanongkai, Thatchaphol Saranurak",Distributed edge connectivity in sublinear time.,https://doi.org/10.1145/3313276.3316346,"We present the first sublinear-time algorithm that can compute the edge connectivity λ of a network exactly on distributed message-passing networks (the CONGEST model), as long as the network contains no multi-edge. We present the first sublinear-time algorithm for a distributed message-passing network sto compute its edge connectivity λ exactly in the CONGEST model, as long as there are no parallel edges. Our algorithm takes Õ(n1−1/353D1/353+n1−1/706) time to compute λ and a cut of cardinality λ with high probability, where n and D are the number of nodes and the diameter of the network, respectively, and Õ hides polylogarithmic factors. This running time is sublinear in n (i.e. Õ(n1−є)) whenever D is. Previous sublinear-time distributed algorithms can solve this problem either (i) exactly only when λ=O(n1/8−є) [Thurimella PODC’95; Pritchard, Thurimella, ACM Trans. Algorithms’11; Nanongkai, Su, DISC’14] or (ii) approximately [Ghaffari, Kuhn, DISC’13; Nanongkai, Su, DISC’14]. To achieve this we develop and combine several new techniques. First, we design the first distributed algorithm that can compute a k-edge connectivity certificate for any k=O(n1−є) in time Õ(√nk+D). The previous sublinear-time algorithm can do so only when k=o(√n) [Thurimella PODC’95]. In fact, our algorithm can be turned into the first parallel algorithm with polylogarithmic depth and near-linear work. Previous near-linear work algorithms are essentially sequential and previous polylogarithmic-depth algorithms require Ω(mk) work in the worst case (e.g. [Karger, Motwani, STOC’93]). Second, we show that by combining the recent distributed expander decomposition technique of [Chang, Pettie, Zhang, SODA’19] with techniques from the sequential deterministic edge connectivity algorithm of [Kawarabayashi, Thorup, STOC’15], we can decompose the network into a sublinear number of clusters with small average diameter and without any mincut separating a cluster (except the “trivial” ones). This leads to a simplification of the Kawarabayashi-Thorup framework (except that we are randomized while they are deterministic). This might make this framework more useful in other models of computation. Finally, by extending the tree packing technique from [Karger STOC’96], we can find the minimum cut in time proportional to the number of components. As a byproduct of this technique, we obtain an Õ(n)-time algorithm for computing exact minimum cut for weighted graphs."
STOC,2019,355-364,"Hsin-Hao Su, Hoa T. Vu",Towards the locality of Vizing's theorem.,https://doi.org/10.1145/3313276.3316393,"Vizing showed that it suffices to color the edges of a simple graph using Δ + 1 colors, where Δ is the maximum degree of the graph. However, up to this date, no efficient distributed edge-coloring algorithm is known for obtaining such coloring, even for constant degree graphs. The current algorithms that get closest to this number of colors are the randomized (Δ + Θ(√Δ))-edge-coloring algorithm that runs in (n) rounds by Chang et al. [SODA 2018] and the deterministic (Δ + (n))-edge-coloring algorithm that runs in (Δ, logn) rounds by Ghaffari et al. [STOC 2018].  We present two distributed edge-coloring algorithms that run in (Δ,logn) rounds. The first algorithm, with randomization, uses only Δ+2 colors. The second algorithm is a deterministic algorithm that uses Δ+ O(logn/ loglogn) colors. Our approach is to reduce the distributed edge-coloring problem into an online and restricted version of balls-into-bins problem. If ℓ is the maximum load of the bins, our algorithm uses Δ + 2ℓ − 1 colors. We show how to achieve ℓ = 1 with randomization and ℓ = O(logn / loglogn) without randomization."
STOC,2019,365-376,"Aaron Bernstein, Maximilian Probst, Christian Wulff-Nilsen",Decremental strongly-connected components and single-source reachability in near-linear time.,https://doi.org/10.1145/3313276.3316335,"Computing the Strongly-Connected Components (SCCs) in a graph G=(V,E) is known to take only O(m+n) time using an algorithm by Tarjan from 1972[SICOMP 72] where m = |E|, n=|V|. For fully-dynamic graphs, conditional lower bounds provide evidence that the update time cannot be improved by polynomial factors over recomputing the SCCs from scratch after every update. Nevertheless, substantial progress has been made to find algorithms with fast update time for decremental graphs, i.e. graphs that undergo edge deletions.  In this paper, we present the first algorithm for general decremental graphs that maintains the SCCs in total update time Õ(m), thus only a polylogarithmic factor from the optimal running time. Previously such a result was only known for the special case of planar graphs [Italiano et al, STOC 17]. Our result should be compared to the formerly best algorithm for general graphs achieving Õ(m√n) total update time by Chechik et.al. [FOCS 16] which improved upon a breakthrough result leading to O(mn0.9 + o(1)) total update time by Henzinger, Krinninger and Nanongkai [STOC 14, ICALP 15]; these results in turn improved upon the longstanding bound of O(mn) by Roditty and Zwick [STOC 04].  All of the above results also apply to the decremental Single-Source Reachability (SSR) problem, which can be reduced to decrementally maintaining SCCs. A bound of O(mn) total update time for decremental SSR was established already in 1981 by Even and Shiloach [JACM 81]."
STOC,2019,377-388,"Sebastian Forster, Gramoz Goranci",Dynamic low-stretch trees via dynamic low-diameter decompositions.,https://doi.org/10.1145/3313276.3316381,"Spanning trees of low average stretch on the non-tree edges, as introduced by Alon et al. [SICOMP 1995], are a natural graph-theoretic object. In recent years, they have found significant applications in solvers for symmetric diagonally dominant (SDD) linear systems. In this work, we provide the first dynamic algorithm for maintaining such trees under edge insertions and deletions to the input graph. Our algorithm has update time n1/2 + o(1) and the average stretch of the maintained tree is no(1) , which matches the stretch in the seminal result of Alon et al.  Similar to Alon et al., our dynamic low-stretch tree algorithm employs a dynamic hierarchy of low-diameter decompositions (LDDs). As a major building block we use a dynamic LDD that we obtain by adapting the random-shift clustering of Miller et al. [SPAA 2013] to the dynamic setting.  The major technical challenge in our approach is to control the propagation of updates within our hierarchy of LDDs: each update to one level of the hierarchy could potentially induce several insertions and deletions to the next level of the hierarchy. We achieve this goal by a sophisticated amortization approach. In particular, we give a bound on the number of changes made to the LDD per update to the input graph that is significantly better than the trivial bound implied by the update time.  We believe that the dynamic random-shift clustering might be useful for independent applications. One of these applications is the dynamic spanner problem. By combining the random-shift clustering with the recent spanner construction of Elkin and Neiman [SODA 2017]. We obtain a fully dynamic algorithm for maintaining a spanner of stretch 2k − 1 and size O (n1 + 1/k logn) with amortized update time O (k log2 n) for any integer 2 ≤ k ≤ logn . Compared to the state-of-the art in this regime Baswana et al. [TALG 2012], we improve upon the size of the spanner and the update time by a factor of k ."
STOC,2019,389-400,"Julia Chuzhoy, Sanjeev Khanna",A new algorithm for decremental single-source shortest paths with applications to vertex-capacitated flow and cut problems.,https://doi.org/10.1145/3313276.3316320,"We study the vertex-decremental Single-Source Shortest Paths (SSSP) problem: given an undirected graph G=(V,E) with lengths ℓ(e)≥ 1 on its edges that undergoes vertex deletions, and a source vertex s, we need to support (approximate) shortest-path queries in G: given a vertex v, return a path connecting s to v, whose length is at most (1+є) times the length of the shortest such path, where є is a given accuracy parameter. The problem has many applications, for example to flow and cut problems in vertex-capacitated graphs. Decremental SSSP is a fundamental problem in dynamic algorithms that has been studied extensively, especially in the more standard edge-decremental setting, where the input graph G undergoes edge deletions. The classical algorithm of Even and Shiloach supports exact shortest-path queries in O(mn) total update time. A series of recent results have improved this bound to O(m1+o(1)logL), where L is the largest length of any edge. However, these improved results are randomized algorithms that assume an oblivious adversary. To go beyond the oblivious adversary restriction, recently, Bernstein, and Bernstein and Chechik designed deterministic algorithms for the problem, with total update time Õ(n2logL), that by definition work against an adaptive adversary. Unfortunately, their algorithms introduce a new limitation, namely, they can only return the approximate length of a shortest path, and not the path itself. Many applications of the decremental SSSP problem, including the ones considered in this paper, crucially require both that the algorithm returns the approximate shortest paths themselves and not just their lengths, and that it works against an adaptive adversary. Our main result is a randomized algorithm for vertex-decremental SSSP with total expected update time O(n2+o(1)logL), that responds to each shortest-path query in Õ(nlogL) time in expectation, returning a (1+є)-approximate shortest path. The algorithm works against an adaptive adversary. The main technical ingredient of our algorithm is an Õ(|E(G)|+ n1+o(1))-time algorithm to compute a core decomposition of a given dense graph G, which allows us to compute short paths between pairs of query vertices in G efficiently. We use our result for vertex-decremental SSSP to obtain (1+є)-approximation algorithms for maximum s-t flow and minimum s-t cut in vertex-capacitated graphs, in expected time n2+o(1), and an O(log4n)-approximation algorithm for the vertex version of the sparsest cut problem with expected running time n2+o(1). These results improve upon the previous best known algorithms for these problems in the regime where m= ω(n1.5 + o(1))."
STOC,2019,401-412,"Alexander A. Sherstov, Pei Wu",Near-optimal lower bounds on the threshold degree and sign-rank of AC0.,https://doi.org/10.1145/3313276.3316408,"The threshold degree of a Boolean function f∶{0,1}n→{0,1} is the minimum degree of a real polynomial p that represents f in sign: sgn  p(x)=(−1)f(x). A related notion is sign-rank, defined for a Boolean matrix F=[Fij] as the minimum rank of a real matrix M with sgn  Mij=(−1)Fij. Determining the maximum threshold degree and sign-rank achievable by constant-depth circuits (AC0) is a well-known and extensively studied open problem, with complexity-theoretic and algorithmic applications.  We give an essentially optimal solution to this problem. For any є>0, we construct an AC0 circuit in n variables that has threshold degree Ω(n1−є) and sign-rank exp(Ω(n1−є)), improving on the previous best lower bounds of Ω(√n) and exp(Ω(√n)), respectively. Our results subsume all previous lower bounds on the threshold degree and sign-rank of AC0 circuits of any given depth, with a strict improvement starting at depth 4. As a corollary, we also obtain near-optimal bounds on the discrepancy, threshold weight, and threshold density of AC0, strictly subsuming previous work on these quantities. Our work gives some of the strongest lower bounds to date on the communication complexity of AC0."
STOC,2019,413-424,"Neeraj Kayal, Chandan Saha 0001",Reconstruction of non-degenerate homogeneous depth three circuits.,https://doi.org/10.1145/3313276.3316360,"A homogeneous depth three circuit C computes a polynomial f = T1 + T2 + ... + Ts, where each Ti is a product of d linear forms in n variables over some underlying field F. Given black-box access to f, can we efficiently reconstruct (i.e. proper learn) a homogeneous depth three circuit computing f? Learning various subclasses of circuits is natural and interesting from both theoretical and practical standpoints and in particular, properly learning homogeneous depth three circuits efficiently is stated as an open problem in a work by Klivans and Shpilka (COLT 2003) and is well-studied. Unfortunately, there is substantial amount of evidence to show that this is a hard problem in the worst case. We give a (randomized) poly(n,d,s)-time algorithm to reconstruct non-degenerate homogeneous depth three circuits for n = Ω(d2) (with some additional mild requirements on s and the characteristic of F). We call a circuit C as non-degenerate if the dimension of the partial derivative space of f equals the sum of the dimensions of the partial derivative spaces of the terms T1, T2, …, Ts. In this sense, the terms are “independent” of each other in a non-degenerate circuit. A random homogeneous depth three circuit (where the coefficients of the linear forms are chosen according to the uniform distribution or any other reasonable distribution) is almost surely non-degenerate. In comparison, previous learning algorithms for this circuit class were either improper (with an exponential dependence on d), or they only worked for s < n (with a doubly exponential dependence of the running time on s). The main contribution of this work is to formulate the following paradigm for efficiently handling addition gates and to successfully implement it for the class of homogeneous depth three circuits. The problem of finding the children of an addition gate with large fan-in s is first reduced to the problem of decomposing a suitable vector space U into a (direct) sum of simpler subspaces U1, U2, …, Us. One then constructs a suitable space of operators S consisting of linear maps acting on U such that analyzing the simultaneous global structure of S enables us to efficiently decompose U. In our case, we exploit the structure of the set of low rank matrices in S and of the invariant subspaces of U induced by S. We feel that this paradigm is novel and powerful: it should lead to efficient reconstruction of many other subclasses of circuits for which the efficient reconstruction problem had hitherto looked unapproachable because of the presence of large fan-in addition gates."
STOC,2019,425-429,Amir Yehudayoff,Separating monotone VP and VNP.,https://doi.org/10.1145/3313276.3316311,This work is about the monotone versions of the algebraic complexity classes VP and VNP. The main result is that monotone VNP is strictly stronger than monotone VP.
STOC,2019,430-441,Aaron Potechin,On the approximation resistance of balanced linear threshold functions.,https://doi.org/10.1145/3313276.3316374,"In this paper, we show that there exists a balanced linear threshold function (LTF) which is unique games hard to approximate, refuting a conjecture of Austrin, Benabbas, and Magen. We also show that the almost monarchy predicate P(x) = sign((k−4)x1 + ∑i=2kxi) is approximable for sufficiently large k."
STOC,2019,442-453,"Nutan Limaye, Karteek Sreenivasaiah, Srikanth Srinivasan 0001, Utkarsh Tripathi, S. Venkitesh",A fixed-depth size-hierarchy theorem for AC0[⊕] via the coin problem.,https://doi.org/10.1145/3313276.3316339,"In this work we prove the first Fixed-depth Size-Hierarchy Theorem for uniform AC0[⊕]. In particular, we show that for any fixed d, the class Cd,k of functions that have uniform AC0[⊕] formulas of depth d and size nk form an infinite hierarchy. We show this by exhibiting the first class of explicit functions where we have nearly (up to a polynomial factor) matching upper and lower bounds for the class of AC0[⊕] formulas.  The explicit functions are derived from the δ-Coin Problem, which is the computational problem of distinguishing between coins that are heads with probability (1+δ)/2 or (1−δ)/2, where δ is a parameter that is going to 0. We study the complexity of this problem and make progress on both upper bound and lower bound fronts.  Upper bounds. For any constant d≥ 2, we show that there are explicit monotone AC0 formulas (i.e. made up of AND and OR gates only) solving the δ-coin problem that have depth d, size exp(O(d(1/δ)1/(d−1))), and sample complexity (i.e. number of inputs) poly(1/δ). This matches previous upper bounds of O’Donnell and Wimmer (ICALP 2007) and Amano (ICALP 2009) in terms of size (which is optimal) and improves the sample complexity from exp(O(d(1/δ)1/(d−1))) to poly(1/δ).  Lower bounds. We show that the above upper bounds are nearly tight (in terms of size) even for the significantly stronger model of AC0[⊕] formulas (which are also allowed NOT and Parity gates): formally, we show that any AC0[⊕] formula solving the δ-coin problem must have size exp(Ω(d(1/δ)1/(d−1))). This strengthens a result of Shaltiel and Viola (SICOMP 2010), who prove a exp(Ω((1/δ)1/(d+2))) lower bound for AC0[⊕], and a lower bound of exp(Ω((1/δ)1/(d−1))) shown by Cohen, Ganor and Raz (APPROX-RANDOM 2014) for the class 0.  The upper bound is a derandomization involving a use of Janson’s inequality and classical combinatorial designs. The lower bound involves proving an optimal degree lower bound for polynomials over 2 solving the δ-coin problem."
STOC,2019,454-460,"Shachar Lovett, Jiapeng Zhang",DNF sparsification beyond sunflowers.,https://doi.org/10.1145/3313276.3316323,"There are two natural complexity measures associated with DNFs: their size, which is the number of clauses; and their width, which is the maximal number of variables in a clause. It is a folklore result that DNFs of small size can be approximated by DNFs of small width (logarithmic in the size). The other direction is much less clear.  Gopalan, Meka and Reingold [Computational Complexity 2013] showed that the other direction – DNF sparsification – holds as well. Any DNF of width w can be approximated to within error ε by a DNF of size (w log(1/ε))O(w). Our main interest in this work is the dependence on the width w. The same dependence of ww appears in several other open problems in combinatorics and complexity, such as the Erdős-Rado sunflower conjecture and Mansour’s conjecture. In fact, there are deep connections between these three problems. Our main result is DNF compression with an improved dependence on the width, which overcomes the ww barrier. Concretely, we show that any DNF of width w can be approximated to within error ε by a DNF of size (1/ε)O(w).  The proof centers around a new object which we call the DNF index function. Given a DNF, the DNF index function outputs for an input the first clause that satisfies it (if one exists). Our proof has two parts: a combinatorial part, where we exhibit a switching lemma for the DNF index function; and an analytic part, where we use the switching lemma to bound the noise sensitivity of the DNF index function, and then use it to obtain our DNF compression result."
STOC,2019,461-472,"Kun He 0011, Qian Li 0012, Xiaoming Sun 0001, Jiapeng Zhang",Quantum Lovász local lemma: Shearer's bound is tight.,https://doi.org/10.1145/3313276.3316392,"Lovász Local Lemma (LLL) is a very powerful tool in combinatorics and probability theory to show the possibility of avoiding all “bad” events under some “weakly dependent” condition. Over the last decades, the algorithmic aspect of LLL has also attracted lots of attention in theoretical computer science. A tight criterion under which the abstract version LLL (ALLL) holds was given by Shearer. It turns out that Shearer’s bound is generally not tight for variable version LLL (VLLL). Recently, Ambainis et al. introduced a quantum version LLL (QLLL), which was then shown to be powerful for the quantum satisfiability problem.   In this paper, we prove that Shearer’s bound is tight for QLLL, i.e., the relative dimension of the smallest satisfying subspace is completely characterized by the independent set polynomial, affirming a conjecture proposed by Sattath et al. Our result also shows the tightness of Gilyén and Sattath’s algorithm, and implies that the lattice gas partition function fully characterizes quantum satisfiability for almost all Hamiltonians with large enough qudits.   Commuting LLL (CLLL), LLL for commuting local Hamiltonians which are widely studied in the literature, is also investigated here. We prove that the tight regions of CLLL and QLLL are different in general. This result might imply that it is possible to design an algorithm for CLLL which is still efficient beyond Shearer’s bound.   In applications of LLLs, the symmetric cases are most common, i.e., the events are with the same probability and the Hamiltonians are with the same relative dimension. We give the first lower bound on the gap between the symmetric VLLL and Shearer’s bound. Our result can be viewed as a quantitative study on the separation between quantum and classical constraint satisfaction problems. Additionally, we obtain similar results for the symmetric CLLL. As an application, we give lower bounds on the critical thresholds of VLLL and CLLL for several of the most common lattices."
STOC,2019,473-480,"Joseph F. Fitzsimons, Zhengfeng Ji, Thomas Vidick, Henry Yuen","Quantum proof systems for iterated exponential time, and beyond.",https://doi.org/10.1145/3313276.3316343,"We show that any language solvable in nondeterministic time exp( exp(⋯exp(n))), where the number of iterated exponentials is an arbitrary function R(n), can be decided by a multiprover interactive proof system with a classical polynomial-time verifier and a constant number of quantum entangled provers, with completeness 1 and soundness 1 − exp(−Cexp(⋯exp(n))), where the number of iterated exponentials is R(n)−1 and C>0 is a universal constant. The result was previously known for R=1 and R=2; we obtain it for any time-constructible function R.  The result is based on a compression technique for interactive proof systems with entangled provers that significantly simplifies and strengthens a protocol compression result of Ji (STOC’17). As a separate consequence of this technique we obtain a different proof of Slofstra’s recent result on the uncomputability of the entangled value of multiprover games (Forum of Mathematics, Pi 2019).  Finally, we show that even minor improvements to our compression result would yield remarkable consequences in computational complexity theory and the foundations of quantum mechanics: first, it would imply that the class MIP* contains all computable languages; second, it would provide a negative resolution to a multipartite version of Tsirelson’s problem on the relation between the commuting operator and tensor product models for quantum correlations."
