booktitle,year,pages,author,title,ee,abstract
STOC,2011,519-528,"Boaz Barak, Zeev Dvir, Amir Yehudayoff, Avi Wigderson",Rank bounds for design matrices with applications toc ombinatorial geometry and locally correctable codes.,https://doi.org/10.1145/1993636.1993705,"A (q,k,t)-design matrix is an m x n matrix whose pattern of zeros/non-zeros satisfies the following design-like condition: each row has at most q non-zeros, each column has at least k non-zeros and the supports of every two columns intersect in at most t rows. We prove that for m ≥ n, the rank of any (q,k,t)-design matrix over a field of characteristic zero (or sufficiently large finite characteristic) is at least n - (qtn/2k)2. Using this result we derive the following applications: Impossibility results for 2-query LCCs over large fields: A 2-query locally correctable code (LCC) is an error correcting code in which every codeword coordinate can be recovered, probabilistically, by reading at most two other code positions. Such codes have numerous applications and constructions (with exponential encoding length) are known over finite fields of small characteristic. We show that infinite families of such linear 2-query LCCs do not exist over fields of characteristic zero or large characteristic regardless of the encoding length. Generalization of known results in combinatorial geometry: We prove a quantitative analog of the Sylvester-Gallai theorem: Let v1,...,vm be a set of points in Cd such that for every i ∈ [m] there exists at least δ m values of j ∈ [m] such that the line through vi,vj contains a third point in the set. We show that the dimension of v1,...,vm is at most O(1/δ2). Our results generalize to the high-dimensional case (replaceing lines with planes, etc.) and to the case where the points are colored (as in the Motzkin-Rabin Theorem)."
STOC,2011,529-538,"Jon M. Kleinberg, Sigal Oren",Mechanisms for (mis)allocating scientific credit.,https://doi.org/10.1145/1993636.1993707,"Scientific communities confer many forms of credit --- both implicit and explicit --- on their successful members, and it has long been argued that the motivation provided by these forms of credit helps to shape a community's collective attention toward different lines of research. The allocation of scientific credit, however, has also been the focus of long-documented pathologies: certain research questions are said to command too much credit, at the expense of other equally important questions; and certain researchers (in a version of Robert Merton's Matthew Effect) seem to receive a disproportionate share of the credit, even when the contributions of others are similar. Here we show that the presence of each of these pathologies can in fact increase the collective productivity of a community. We consider a model for the allocation of credit, in which individuals can choose among projects of varying levels of importance and difficulty, and they compete to receive credit with others who choose the same project. Under the most natural mechanism for allocating credit, in which it is divided among those who succeed at a project in proportion to the project's importance, the resulting selection of projects by self-interested, credit-maximizing individuals will in general be socially sub-optimal. However, we show that there exist ways of allocating credit out of proportion to the true importance of the projects, as well as mechanisms that assign credit out of proportion to the relative contributions of the individuals, that lead credit-maximizing individuals to collectively achieve social optimality. These results therefore suggest how well-known forms of misallocation of scientific credit can in fact serve to channel self-interested behavior into socially optimal outcomes."
STOC,2011,539-548,"Richard Cole 0001, José R. Correa, Vasilis Gkatzelis, Vahab S. Mirrokni, Neil Olver",Inner product spaces for MinSum coordination mechanisms.,https://doi.org/10.1145/1993636.1993708,"We study coordination mechanisms aiming to minimize the weighted sum of completion times of jobs in the context of selfish scheduling problems. Our goal is to design local policies that achieve a good price of anarchy in the resulting equilibria for unrelated machine scheduling. To obtain these approximation bounds, we introduce a new technique that while conceptually simple, seems to be quite powerful. The method entails mapping strategy vectors into a carefully chosen inner product space; costs are shown to correspond to the norm in this space, and the Nash condition also has a simple description. With this structure in place, we are able to prove a number of results, as follows. First, we consider Smith's Rule, which orders the jobs on a machine in ascending processing time to weight ratio, and show that it achieves an approximation ratio of 4. We also demonstrate that this is the best possible for deterministic non-preemptive strongly local policies. Since Smith's Rule is always optimal for a given fixed assignment, this may seem unsurprising, but we then show that better approximation ratios can be obtained if either preemption or randomization is allowed. We prove that ProportionalSharing, a preemptive strongly local policy, achieves an approximation ratio of 2.618 for the weighted sum of completion times, and an approximation ratio of 2.5 in the unweighted case. We also observe that these bounds are tight. Next, we consider Rand, a natural non-preemptive but randomized policy. We show that it achieves an approximation ratio of at most 2.13; moreover, if the sum of the weighted completion times is negligible compared to the cost of the optimal solution, this improves to π/2. Finally, we show that both ProportionalSharing and Rand induce potential games, and thus always have a pure Nash equilibrium (unlike Smith's Rule). This allows us to design the first combinatorial constant-factor approximation algorithm minimizing weighted completion time for unrelated machine scheduling. It achieves a factor of 2+ε for any ε > 0, and involves imitating best response dynamics using a variant of ProportionalSharing as the policy."
STOC,2011,549-558,"Uriel Feige, Moshe Tennenholtz","Mechanism design with uncertain inputs: (to err is human, to forgive divine).",https://doi.org/10.1145/1993636.1993709,"We consider a task of scheduling with a common deadline on a single machine. Every player reports to a scheduler the length of his job and the scheduler needs to finish as many jobs as possible by the deadline. For this simple problem, there is a truthful mechanism that achieves maximum welfare in dominant strategies. The new aspect of our work is that in our setting players are uncertain about their own job lengths, and hence are incapable of providing truthful reports (in the strict sense of the word). For a probabilistic model for uncertainty we show that even with relatively little uncertainty, no mechanism can guarantee a constant fraction of the maximum welfare. To remedy this situation, we introduce a new measure of economic efficiency, based on a notion of a fair share of a player, and design mechanisms that are Ω(1)-fair. In addition to its intrinsic appeal, our notion of fairness implies good approximation of maximum welfare in several cases of interest. In our mechanisms the machine is sometimes left idle even though there are jobs that want to use it. We show that this unfavorable aspect is unavoidable, unless one gives up other favorable aspects (e.g., give up Ω(1)-fairness). We also consider a qualitative approach to uncertainty as an alternative to the probabilistic quantitative model. In the qualitative approach we break away from solution concepts such as dominant strategies (they are no longer well defined), and instead suggest an axiomatic approach, which amounts to listing desirable properties for mechanisms. We provide a mechanism that satisfies these properties."
STOC,2011,559-568,"Mihai Patrascu, Mikkel Thorup",Don't rush into a union: take time to find your roots.,https://doi.org/10.1145/1993636.1993711,"We present a new threshold phenomenon in data structure lower bounds where slightly reduced update times lead to exploding query times. Consider incremental connectivity, letting tu be the time to insert an edge and tq be the query time. For tu = Omega(tq), the problem is equivalent to the well-understood union-find problem: proc{InsertEdge}(s,t) can be implemented by Union(Find(s), Find(t)). This gives worst-case time tu = tq = O(lg n / lg lg n) and amortized tu = tq = O(α(n)). By contrast, we show that if tu = o(lg n / lg lg n), the query time explodes to tq ≥ n1-o(1). In other words, if the data structure doesn't have time to find the roots of each disjoint set (tree) during edge insertion, there is no effective way to organize the information! For amortized complexity, we demonstrate a new inverse-Ackermann type trade-off in the regime tu = o(tq). A similar lower bound is given for fully dynamic connectivity, where an update time of o(lg n) forces the query time to be n1-o(1). This lower bound allows for amortization and Las Vegas randomization, and comes close to the known O(lg n • (lg lg n)O(1)) upper bound."
STOC,2011,569-578,"Dan Feldman, Michael Langberg",A unified framework for approximating and clustering data.,https://doi.org/10.1145/1993636.1993712,"Given a set F of n positive functions over a ground set X, we consider the problem of computing x* that minimizes the expression ∑f ∈ Ff(x), over x ∈ X. A typical application is shape fitting, where we wish to approximate a set P of n elements (say, points) by a shape x from a (possibly infinite) family X of shapes. Here, each point p ∈ P corresponds to a function f such that f(x) is the distance from p to x, and we seek a shape x that minimizes the sum of distances from each point in P. In the k-clustering variant, each x\in X is a tuple of k shapes, and f(x) is the distance from p to its closest shape in x."
STOC,2011,579-586,"Sunil Arya, Guilherme Dias da Fonseca, David M. Mount",Approximate polytope membership queries.,https://doi.org/10.1145/1993636.1993713,"We consider an approximate version of a fundamental geometric search problem, polytope membership queries. Given a convex polytope P in REd, presented as the intersection of halfspaces, the objective is to preprocess P so that, given a query point q, it is possible to determine efficiently whether q lies inside P subject to an error bound ε. Previous solutions to this problem were based on straightforward applications of classic polytope approximation techniques by Dudley (1974) and Bentley et al. (1982). The former yields minimum storage, and the latter yields constant query time. A space-time tradeoff can be obtained by interpolating between the two. We present the first significant improvements to this tradeoff. For example, using the same storage as Dudley, we reduce the query time from O(1/ε(d-1)/2) to O(1/ε(d-1)/4). Our approach is based on a very simple algorithm. Both lower bounds and upper bounds on the performance of the algorithm are presented. To establish the relevance of our results, we introduce a reduction from approximate nearest neighbor searching to approximate polytope membership queries. We show that our tradeoff provides significant improvements to the best known space-time tradeoffs for approximate nearest neighbor searching. Furthermore, this is achieved with constructions that are much simpler than existing methods."
STOC,2011,587-596,"Chinmay Karande, Aranyak Mehta, Pushkar Tripathi",Online bipartite matching with unknown distributions.,https://doi.org/10.1145/1993636.1993715,"We consider the online bipartite matching problem in the unknown distribution input model. We show that the Ranking algorithm of [KVV90] achieves a competitive ratio of at least 0.653. This is the first analysis to show an algorithm which breaks the natural 1 - 1/e -barrier' in the unknown distribution model (our analysis in fact works in the stricter, random order model) and answers an open question in [GM08]. We also describe a family of graphs on which Ranking does no better than 0.727 in the random order model. Finally, we show that for graphs which have k > 1 disjoint perfect matchings, Ranking achieves a competitive ratio of at least 1 - √(1/k - 1/k2 + 1/n) -- in particular Ranking achieves a factor of 1 - o(1) for graphs with ω(1) disjoint perfect matchings."
STOC,2011,597-606,"Mohammad Mahdian, Qiqi Yan",Online bipartite matching with random arrivals: an approach based on strongly factor-revealing LPs.,https://doi.org/10.1145/1993636.1993716,"In a seminal paper, Karp, Vazirani, and Vazirani show that a simple ranking algorithm achieves a competitive ratio of 1-1/e for the online bipartite matching problem in the standard adversarial model, where the ratio of 1-1/e is also shown to be optimal. Their result also implies that in the random arrivals model defined by Goel and Mehta, where the online nodes arrive in a random order, a simple greedy algorithm achieves a competitive ratio of 1-1/e. In this paper, we study the ranking algorithm in the random arrivals model, and show that it has a competitive ratio of at least 0.696, beating the 1-1/e ≈ 0.632 barrier in the adversarial model. Our result also extends to the i.i.d. distribution model of Feldman et al., removing the assumption that the distribution is known. Our analysis has two main steps. First, we exploit certain dominance and monotonicity properties of the ranking algorithm to derive a family of factor-revealing linear programs (LPs). In particular, by symmetry of the ranking algorithm in the random arrivals model, we have the monotonicity property on both sides of the bipartite graph, giving good ""strength"" to the LPs. Second, to obtain a good lower bound on the optimal values of all these LPs and hence on the competitive ratio of the algorithm, we introduce the technique of strongly factor-revealing LPs. In particular, we derive a family of modified LPs with similar strength such that the optimal value of any single one of these new LPs is a lower bound on the competitive ratio of the algorithm. This enables us to leverage the power of computer LP solvers to solve for large instances of the new LPs to establish bounds that would otherwise be difficult to attain by human analysis."
STOC,2011,607-616,"Anna Adamaszek, Artur Czumaj, Matthias Englert, Harald Räcke",Almost tight bounds for reordering buffer management.,https://doi.org/10.1145/1993636.1993717,"We give almost tight bounds for the online reordering buffer management problem on the uniform metric. Specifically, we present the first non-trivial lower bounds for this problem by showing that deterministic online algorithms have a competitive ratio of at least Ω(√{log k/log log k}) and randomized online algorithms have a competitive ratio of at least Ω(log log k), where k denotes the size of the buffer. We complement this by presenting a deterministic online algorithm for the reordering buffer management problem that obtains a competitive ratio of O(√log k), almost matching the lower bound. This improves upon an algorithm by Avigdor-Elgrabli and Rabani (SODA 2010) that achieves a competitive ratio of O(log k/ log log k)."
STOC,2011,617-626,Ola Svensson,Santa Claus schedules jobs on unrelated machines.,https://doi.org/10.1145/1993636.1993718,"One of the classic results in scheduling theory is the 2-approximation algorithm by Lenstra, Shmoys, and Tardos for the problem of scheduling jobs to minimize makespan on unrelated machines, i.e., job j requires time pij if processed on machine i. More than two decades after its introduction it is still the algorithm of choice even in the restricted model where processing times are of the form pij ∈ pj, ∞. This problem, also known as the restricted assignment problem, is NP-hard to approximate within a factor less than 1.5 which is also the best known lower bound for the general version. Our main result is a polynomial time algorithm that estimates the optimal makespan of the restricted assignment problem within a factor 33/17 + ε ~ 1.9412 + ε, where ε > 0 is an arbitrarily small constant. The result is obtained by upper bounding the integrality gap of a certain strong linear program, known as configuration LP, that was previously successfully used for the related Santa Claus problem. Similar to the strongest analysis for that problem our proof is based on a local search algorithm that will eventually find a schedule of the mentioned approximation guarantee, but is not known to converge in polynomial time."
STOC,2011,627-636,"Piotr Indyk, Eric Price 0001","K-median clustering, model-based compressive sensing, and sparse recovery for earth mover distance.",https://doi.org/10.1145/1993636.1993720,"We initiate the study of sparse recovery problems under the  Earth-Mover Distance (EMD). Specifically, we design a distribution over m x n matrices A such that for any x, given Ax, we can recover a k-sparse approximation to x under the EMD distance. One construction yields m=O(k log (n/k)) and a 1 + ε approximation factor, which matches the best achievable bound for other error measures, such as the l1 norm. Our algorithms are obtained by exploiting novel connections to other problems and areas, such as streaming algorithms for k-median clustering and model-based compressive sensing. We also provide novel algorithms and results for the latter problems."
STOC,2011,637-644,"Jean Bourgain, Stephen J. Dilworth, Kevin Ford, Sergei Konyagin, Denka Kutzarova",Breaking the k2 barrier for explicit RIP matrices.,https://doi.org/10.1145/1993636.1993721,"We give a new explicit construction of n x N matrices satisfying the Restricted Isometry Property (RIP). Namely, for some ε>0, large k and k2-ε ≤ N ≤ k2+ε, we construct RIP matrices of order k with n=O(k2-ε). This overcomes the natural barrier n >> k2 for proofs based on small coherence, which are used in all previous explicit constructions of RIP matrices. Key ingredients in our proof are new estimates for sumsets in product sets and for exponential sums with the products of sets possessing special additive structure."
STOC,2011,645-654,Zohar Shay Karnin,Deterministic construction of a high dimensional lp section in l1n for any p<2.,https://doi.org/10.1145/1993636.1993722,"For any 0<r<p<2, and ε>0, we give an efficient deterministic construction of a linear subspace V ⊆ Rn, of dimension (1-ε)n in which the lp and lr norms are the same up to a multiplicative factor of poly(ε-1) (after proper normalization). As a corollary we get a deterministic compressed sensing algorithm (Basis Pursuit) for a new range of parameters. In particular, for any constant ε>0 and p<2, we obtain a linear operator A:Rn -> Rε n with the l1/lp guarantee for (n ⋅ poly(ε))-sparse vectors. Namely, let x be a vector in Rn whose l1 distance from a k-sparse vector (for some k=n ⋅ poly(ε)) is δ. The algorithm, given Ax as input, outputs an n dimensional vector y such that ||x-y||p ≤ δ k1/p-1. In particular this gives a weak form of the l2/l1 guarantee. Our construction has the additional benefit that when viewed as a matrix, A has at most O(1) non-zero entries in each row. As a result, both the encoding (computing Ax) and decoding (retrieving x from Ax) can be computed efficiently."
STOC,2011,655-664,"Manuel Bodirsky, Michael Pinsker",Schaefer's theorem for graphs.,https://doi.org/10.1145/1993636.1993724,"Schaefer's theorem is a complexity classification result for so-called Boolean constraint satisfaction problems: it states that every Boolean constraint satisfaction problem is either contained in one out of six classes and can be solved in polynomial time, or is NP-complete. We present an analog of this dichotomy result for the propositional logic of graphs instead of Boolean logic. In this generalization of Schaefer's result, the input consists of a set W of variables and a conjunction Φ of statements (“constraints”) about these variables in the language of graphs, where each statement is taken from a fixed finite set Ψ of allowed quantifier-free first-order formulas; the question is whether Φ is satisfiable in a graph. We prove that either Ψ is contained in one out of 17 classes of graph formulas and the corresponding problem can be solved in polynomial time, or the problem is NP-complete. This is achieved by a universal-algebraic approach, which in turn allows us to use structural Ramsey theory. To apply the universal-algebraic approach, we formulate the computational problems under consideration as constraint satisfaction problems (CSPs) whose templates are first-order definable in the countably infinite random graph. Our method for classifying the computational complexity of those CSPs is based on a Ramsey-theoretic analysis of functions acting on the random graph, and we develop general tools suitable for such an analysis which are of independent mathematical interest."
STOC,2011,665-674,Yuichi Yoshida,Optimal constant-time approximation algorithms and (unconditional) inapproximability results for every bounded-degree CSP.,https://doi.org/10.1145/1993636.1993725,"Raghavendra (STOC 2008) gave an elegant and surprising result: if Khot's Unique Games Conjecture (STOC 2002) is true, then for every constraint satisfaction problem (CSP), the best approximation ratio is attained by a certain simple semidefinite programming and a rounding scheme for it. In this paper, we show that similar results hold for constant-time approximation algorithms in the bounded-degree model. Specifically, we present the following: (i) For every CSP, we construct an oracle that serves an access, in constant time, to a nearly optimal solution to a basic LP relaxation of the CSP. (ii) Using the oracle, we give a constant-time rounding scheme that achieves an approximation ratio coincident with the integrality gap of the basic LP. (iii) Finally, we give a generic conversion from integrality gaps of basic LPs to hardness results. All of those results are unconditional. Therefore, for every bounded-degree CSP, we give the best constant-time approximation algorithm among all. A CSP instance is called ε-far from satisfiability if we must remove at least an ε-fraction of constraints to make it satisfiable. A CSP is called testable if there is a constant-time algorithm that distinguishes satisfiable instances from ε-far instances with probability at least 2/3. Using the results above, we also derive, under a technical assumption, an equivalent condition under which a CSP is testable in the bounded-degree model."
STOC,2011,675-684,"Ilan Newman, Christian Sohler",Every property of hyperfinite graphs is testable.,https://doi.org/10.1145/1993636.1993726,"A property testing algorithm for a property Π in the bounded degree graph model[7] is an algorithm that, given access to the adjacency list representation of a graph G=(V,E) with maximum degree at most d, accepts G with probability at least 2/3 if G has property Π, and rejects G with probability at least 2/3, if it differs on more than ε dn edges from every d-degree bounded graph with property Π. A property is testable, if for every ε,d and n, there is a property testing algorithm Aε,n,d that makes at most q(ε,d) queries to an input graph of n vertices, that is, a non-uniform algorithm that makes a number of queries that is independent of the graph size. A k-disc around a vertex v of a graph G=(V,E) is the subgraph induced by all vertices of distance at most k from v. We show that the structure of a planar graph on large enough number of vertices, n, and with constant maximum degree d, is determined, up to the modification (insertion or deletion) of at most ε d n edges, by the frequency of k-discs for certain k=k(ε,d) that is independent of the size of the graph. We can replace planar graphs by any hyperfinite class of graphs, which includes, for example, every graph class that does not contain a set of forbidden minors. We use this result to obtain new results and improve upon existing results in the area of property testing. In particular, we prove that graph isomorphism is testable for every class of hyperfinite graphs, every graph property is testable for every class of hyperfinite graphs, every hyperfinite graph property is testable in the bounded degree graph model, A large class of graph parameters is approximable for hyperfinite graphs. Our results also give a partial explanation of the success of motifs in the analysis of complex networks."
