booktitle,year,pages,author,title,ee,abstract
STOC,2022,403-415,"Vishwas Bhargava, Sumanta Ghosh, Mrinal Kumar 0001, Chandra Kanta Mohapatra","Fast, algebraic multivariate multipoint evaluation in small characteristic and applications.",https://doi.org/10.1145/3519935.3519968,"Multipoint evaluation is the computational task of evaluating a polynomial given as a list of coefficients at a given set of inputs. Besides being a natural and fundamental question in computer algebra on its own, fast algorithms for this problem are also closely related to fast algorithms for other natural algebraic questions like polynomial factorization and modular composition. And while nearly linear time algorithms have been known for the univariate instance of multipoint evaluation for close to five decades due to a work of Borodin and Moenck, fast algorithms for the multivariate version have been much harder to come by. In a significant improvement to the state of art for this problem, Umans and Kedlaya & Umans gave nearly linear time algorithms for this problem over field of small characteristic and over all finite fields respectively, provided that the number of variables n is at most do(1) where the degree of the input polynomial in every variable is less than d. They also stated the question of designing fast algorithms for the large variable case (i.e. n ? do(1)) as an open problem.  In this work, we show that there is a deterministic algorithm for multivariate multipoint evaluation over a field Fq of characteristic p which evaluates an n-variate polynomial of degree less than d in each variable on N inputs in time                (N + dn)1 + o(1)(logq, d, n, p)  provided that p is at most do(1), and q is at most (exp(? (exp(d)))), where the height of this tower of exponentials is fixed. When the number of variables is large (e.g. n ? do(1)), this is the first nearly linear time algorithm for this problem over any (large enough) field.  Our algorithm is based on elementary algebraic ideas and this algebraic structure naturally leads to the following two independently interesting applications.  We show that there is an algebraic data structure for univariate polynomial evaluation with nearly linear space complexity and sublinear time complexity over finite fields of small characteristic and quasipolynomially bounded size. This provides a counterexample to a conjecture of Milterson who conjectured that over small finite fields, any algebraic data structure for polynomial evaluation using polynomial space must have linear query complexity.  We also show that over finite fields of small characteristic and quasipolynomially bounded size, Vandermonde matrices are not rigid enough to yield size-depth tradeoffs for linear circuits via the current quantitative bounds in Valiant’s program. More precisely, for every fixed prime p, we show that for every constant ? > 0, and large enough n, the rank of any n × n Vandermonde matrix V over the field pa can be reduced to (n/exp(Ω((?)√logn))) by changing at most nΘ(?) entries in every row of V, provided a ≤ (logn). Prior to this work, similar upper bounds on rigidity were known only for special Vandermonde matrices. For instance, the Discrete Fourier Transform matrices and Vandermonde matrices with generators in a geometric progression."
STOC,2022,416-425,"Sébastien Tavenas, Nutan Limaye, Srikanth Srinivasan 0001",Set-multilinear and non-commutative formula lower bounds for iterated matrix multiplication.,https://doi.org/10.1145/3519935.3520044,"An Algebraic Formula for a polynomial P∈ [x1,…,xN] is an algebraic expression for P(x1,…,xN) using variables, field constants, additions and multiplications. Such formulas capture an algebraic analog of the Boolean complexity class NC1. Proving lower bounds against this model is thus an important problem. It is known that, to prove superpolynomial lower bounds against algebraic formulas, it suffices to prove good enough lower bounds against restricted kinds of formulas known as Set-Multilinear formulas, for computing a polynomial P(x1,...,xN) of degree O(logN/loglogN). In the past, many superpolynomial lower bounds were found, but they are of the form Ω(f(d) poly(N)) (where f is typically a subexponential function) which is insufficient to get lower bounds for general formulas. Recently, the authors proved the first non-FPT lower bounds, i.e., a lower bound of the form NΩ(f(d)), against small-depth set-multilinear formulas (and also for circuits). In this work, we extend this result in two directions. Large-depth set-multilinear formulas. In the setting of general set-multilinear formulas, we prove a lower bound of (logn)Ω(logd) for computing the Iterated Matrix Multiplication polynomial IMMn,d. In particular, this implies the first superpolynomial lower bound against unbounded-depth set-multilinear formulas computing IMMn,n. As a corollary, this resolves the homogeneous version of a question of Nisan (asked in 1991) regarding the relative power of Algebraic formulas and Branching programs in the non-commutative setting. Stronger bounds for homogeneous non-commutative small-depth circuits. In the small-depth homogeneous non-commutative case, we prove a lower bound of nd1/Δ/2O(Δ), which yields non-FPT bounds for depths up to o(√logd). In comparison, our previous bound works in the harder commutative set-multilinear setting, but only up to depths o(loglogd). Moreover, our lower bound holds for all values of d, as opposed to the previous set-multilinear lower bound, which holds as long as d is small, i.e., d = O(logn)."
STOC,2022,426-435,"Amitay Kamber, Tali Kaufman",Combinatorics via closed orbits: number theoretic Ramanujan graphs are not unique neighbor expanders.,https://doi.org/10.1145/3519935.3519992,"The question of finding expander graphs with strong vertex expansion properties such as unique neighbor expansion and lossless expansion is central to computer science. A barrier to constructing these is that strong notions of expansion could not be proven via the spectral expansion paradigm.  A very symmetric and structured family of optimal spectral expanders (i.e., Ramanujan graphs) was constructed using number theory by Lubotzky, Phillips and Sarnak, and and was subsequently generalized by others. We call such graphs Number Theoretic Ramanujan Graphs. These graphs are not only spectrally optimal, but also posses strong symmetries and rich structure. Thus, it has been widely conjectured that number theoretic Ramanujan graphs are lossless expanders, or at least unique neighbor expanders.  In this work we disprove this conjecture, by showing that there are number theoretic Ramanujan graphs that are not even unique neighbor expanders. This is done by introducing a new combinatorial paradigm that we term the closed orbit method.  The closed orbit method allows one to construct finite combinatorial objects with extermal substructures. This is done by observing that there exist infinite combinatorial structures with extermal substructures, coming from an action of a subgroup of the automorphism group of the structure. The crux of our idea is a systematic way to construct a finite quotient of the infinite structure containing a simple shadow of the infinite substructure, which maintains its extermal combinatorial property.  Other applications of the method are to the edge expansion of number theoretic Ramanujan graphs and vertex expansion of Ramanujan complexes. Finally, in the field of graph quantum ergodicity we produce number theoretic Ramanujan graphs with an eigenfunction of small support that corresponds to the zero eigenvalue. This again contradicts common expectations.  The closed orbit method is based on the well-established idea from dynamics and number theory of studying closed orbits of subgroups. The novelty of this work is in exploiting this idea to combinatorial questions, and we hope that it will have other applications in the future."
STOC,2022,436-449,"Andrei A. Bulatov, Akbar Rafiey",On the complexity of CSP-based ideal membership problems.,https://doi.org/10.1145/3519935.3520063,"In this paper we consider the Ideal Membership Problem (IMP for short), in which we are given polynomials f0,f1,…,fk and the question is to decide whether f0 belongs to the ideal generated by f1,…,fk. In the more stringent version the task is also to find a proof of this fact. The IMP underlies many proof systems based on polynomials such as Nullstellensatz, Polynomial Calculus, and Sum-of-Squares (SOS). In such applications the IMP usually involves so called combinatorial ideals that arise from a variety of discrete combinatorial problems. This restriction makes the IMP significantly easier and in some cases allows for an efficient solution algorithm. The first part of this paper follows the work of Mastrolilli [SODA 2019] who initiated a systematic study of IMPs arising from Constraint Satisfaction Problems (CSP) of the form CSP(Γ), that is, CSPs in which the type of constraints is limited to relations from a set Γ. We show that many CSP techniques can be translated to IMPs thus allowing us to significantly improve the methods of studying the complexity of the IMP. We also develop universal algebraic techniques for the IMP that have been so useful in the study of the CSP. This allows us to prove a general necessary condition for the tractability of the IMP, and three sufficient ones. The sufficient conditions include IMPs arising from systems of linear equations over GF(p), p prime, and also some conditions defined through special kinds of polymorphisms. Our work has several consequences and applications. First, we introduce a variation of the IMP and based on this propose a unified framework, different from the celebrated Buchberger’s algorithm, to construct a bounded degree Gr?bner Basis. Our algorithm, combined with the universal algebraic techniques, leads to polynomial-time construction of Gr?bner Basis for many combinatorial problems."
STOC,2022,450-463,"Magnús M. Halldórsson, Fabian Kuhn, Alexandre Nolin, Tigran Tonoyan",Near-optimal distributed degree+1 coloring.,https://doi.org/10.1145/3519935.3520023,"We present a new approach to randomized distributed graph coloring that is simpler and more efficient than previous ones. In particular, it allows us to tackle the (deg+1)-list-coloring (D1LC) problem, where each node v of degree dv is assigned a palette of dv+1 colors, and the objective is to find a proper coloring using these palettes. While for (Δ+1)-coloring (where Δ is the maximum degree), there is a fast randomized distributed O(log3logn)-round algorithm due to Chang, Li, and Pettie, no o(logn)-round algorithms are known for the D1LC problem. We give a randomized distributed algorithm for D1LC that is optimal under plausible assumptions about the deterministic complexity of the problem. Using the recent deterministic algorithm of Ghaffari and Kuhn, our algorithm runs in O(log3 logn) time, matching the best bound known for (Δ+1)-coloring. A key contribution is a subroutine to generate slack for D1LC, which almost immediately leads to a palette sparsification theorem for D1LC when placed into the framework of works by Assadi, Chen, and Khanna and Alon and Assadi. That gives fast algorithms for D1LC in three different models: an O(1)-round algorithm in the MPC model with ?(n) memory per machine; a single-pass semi-streaming algorithm in dynamic streams; and an ?(n√n)-time query algorithm."
STOC,2022,464-477,"Alkida Balliu, Sebastian Brandt 0002, Fabian Kuhn, Dennis Olivetti",Distributed ?-coloring plays hide-and-seek.,https://doi.org/10.1145/3519935.3520027,"We prove several new tight or near-tight distributed lower bounds for classic symmetry breaking problems in graphs. As a basic tool, we first provide a new insightful proof that any deterministic distributed algorithm that computes a Δ-coloring on Δ-regular trees requires Ω(logΔn) rounds and any randomized such algorithm requires Ω(logΔlogn) rounds. We prove this by showing that a natural relaxation of the Δ-coloring problem is a fixed point in the round elimination framework. As a first application, we show that our Δ-coloring lower bound proof directly extends to arbdefective colorings. An arbdefective c-coloring of a graph G=(V,E) is given by a c-coloring of V and an orientation of E, where the arbdefect of a color i is the maximum number of monochromatic outgoing edges of any node of color i. We exactly characterize which variants of the arbdefective coloring problem can be solved in O(f(Δ) + log*n) rounds, for some function f, and which of them instead require Ω(logΔn) rounds for deterministic algorithms and Ω(logΔlogn) rounds for randomized ones. As a second application, which we see as our main contribution, we use the structure of the fixed point as a building block to prove lower bounds as a function of Δ for problems that, in some sense, are much easier than Δ-coloring, as they can be solved in O(log* n) deterministic rounds in bounded-degree graphs. More specifically, we prove lower bounds as a function of Δ for a large class of distributed symmetry breaking problems, which can all be solved by a simple sequential greedy algorithm. For example, we obtain novel results for the fundamental problem of computing a (2,β)-ruling set, i.e., for computing an independent set S? V such that every node v∈ V is within distance ≤ β of some node in S. We in particular show that Ω(βΔ1/β) rounds are needed even if initially an O(Δ)-coloring of the graph is given. With an initial O(Δ)-coloring, this lower bound is tight and without, it still nearly matches the existing O(βΔ2/(β+1)+log* n) upper bound. The new (2,β)-ruling set lower bound is an exponential improvement over the best existing lower bound for the problem, which was proven in [FOCS ’20]. As a special case of the lower bound, we also obtain a tight linear-in-Δ lower bound for computing a maximal independent set (MIS) in trees. While such an MIS lower bound was known for general graphs, the best previous MIS lower bounds for trees was Ω(logΔ). Our lower bound even applies to a much more general family of problems that allows for almost arbitrary combinations of natural constraints from coloring problems, orientation problems, and independent set problems, and provides a single unified proof for known and new lower bound results for these types of problems. All of our lower bounds as a function of Δ also imply substantial lower bounds as a function of n. For instance, we obtain that the maximal independent set problem, on trees, requires Ω(logn / loglogn) rounds for deterministic algorithms, which is tight."
STOC,2022,478-487,"Václav Rozhon, Christoph Grunau, Bernhard Haeupler, Goran Zuzic, Jason Li 0006",Undirected (1+ε)-shortest paths via minor-aggregates: near-optimal deterministic parallel and distributed algorithms.,https://doi.org/10.1145/3519935.3520074,"This paper presents near-optimal deterministic parallel and distributed algorithms for computing (1+eps)-approximate single-source shortest paths in any undirected weighted graph. On a high level, we deterministically reduce this and other shortest-path problems to ?(1) Minor-Aggregations. A Minor-Aggregation computes an aggregate (e.g., max or sum) of node-values for every connected component of some subgraph. Our reduction immediately implies: Optimal deterministic parallel (PRAM) algorithms with ?(1) depth and near-linear work. Universally-optimal deterministic distributed (CONGEST) algorithms, whenever deterministic Minor-Aggregate algorithms exist. For example, an optimal ?(hopDiameterG)-round deterministic CONGEST algorithm for excluded-minor networks. Several novel tools developed for the above results are interesting in their own right: A local iterative approach for reducing shortest path computations “up to distance D” to computing low-diameter decompositions “up to distance D/2”. Compared to the recursive vertex-reduction approach of [Li20], our approach is simpler, suitable for distributed algorithms, and eliminates many derandomization barriers. A simple graph-based ?(1)-competitive ?1-oblivious routing based on low-diameter decompositions that can be evaluated in near-linear work. The previous such routing [ZGY+20] was no(1)-competitive and required no(1) more work. A deterministic algorithm to round any fractional single-source transshipment flow into an integral tree solution. The first distributed algorithms for computing Eulerian orientations."
STOC,2022,488-501,"Mohammad Taghi Hajiaghayi, Dariusz R. Kowalski, Jan Olkowski",Improved communication complexity of fault-tolerant consensus.,https://doi.org/10.1145/3519935.3520078,"Consensus is one of the most thoroughly studied problems in distributed computing, yet there are still complexity gaps that have not been bridged for decades. In particular, in the classical message-passing setting with processes’ crashes, since the seminal works of Bar-Joseph and Ben-Or [PODC 1998] and Aspnes and Waarts [SICOMP 1996, JACM 1998] in the previous century, there is still a fundamental unresolved question about communication complexity of fast randomized Consensus against a (strong) adaptive adversary crashing processes arbitrarily online. The best known upper bound on the number of communication bits is Θ(n3/2/√logn) per process, while the best lower bound is Ω(1). This is in contrast to randomized Consensus against a (weak) oblivious adversary, for which time-almost-optimal algorithms guarantee amortized O(1) communication bits per process. We design an algorithm against adaptive adversary that reduces the communication gap by nearly linear factor to O(√n· n) bits per process, while keeping almost-optimal (up to factor O(log3 n)) time complexity O(√n·log5/2 n). More surprisingly, we show this complexity indeed can be lowered further, but at the expense of increasing time complexity, i.e., there is a trade-off between communication complexity and time complexity. More specifically, our main Consensus algorithm allows to reduce communication complexity per process to any value from  n to O(√n· n), as long as Time × Communication = O(n·  n). Similarly, reducing time complexity requires more random bits per process, i.e., Time × Randomness =O(n·  n). Our parameterized consensus solutions are based on a few newly developed paradigms and algorithms for crash-resilient computing, interesting on their own. The first one, called a Fuzzy Counting, provides for each process a number which is in-between the numbers of alive processes at the end and in the beginning of the counting. Our deterministic Fuzzy Counting algorithm works in O(log3 n) rounds and uses only O( n) amortized communication bits per process, unlike previous solutions to counting that required Ω(n) bits. This improvement is possible due to a new Fault-tolerant Gossip solution with O(log3 n) rounds using only O(||·  n) communication bits per process, where || is the length of the rumor binary representation. It exploits distributed fault-tolerant divide-and-conquer idea, in which processes run a Bipartite Gossip algorithm for a considered partition of processes. To avoid passing many long messages, processes use a family of small-degree compact expanders for local signaling to their overlay neighbors if they are in a compact (large and well-connected) party, and switch to a denser overlay graph whenever local signalling in the current one is failed."
STOC,2022,502-514,"Shang-En Huang, Seth Pettie, Leqi Zhu",Byzantine agreement in polynomial time with near-optimal resilience.,https://doi.org/10.1145/3519935.3520015,"It has been known since the early 1980s that Byzantine Agreement in the full information, asynchronous model is impossible to solve deterministically against even one crash fault [FLP 1985], but that it can be solved with probability 1 [Ben-Or 1983], even against an adversary that controls the scheduling of all messages and corrupts up to f<n/3 players [Bracha 1987]. The main downside of [Ben-Or 1983, Bracha 1987] is that they terminate with 2Θ(n) latency in expectation whenever f=Θ(n). King and Saia [KS 2016, KS 2018] developed a polynomial protocol (polynomial latency, polynomial local computation) that is resilient to f < (1.14× 10?9)n Byzantine faults. The new idea in their protocol is to detect—and blacklist—coalitions of likely-bad players by analyzing the deviations of random variables generated by those players over many rounds. In this work we design a simple collective coin-flipping protocol such that if any coalition of faulty players repeatedly does not follow protocol, then they will eventually be detected by one of two simple statistical tests. Using this coin-flipping protocol, we solve Byzantine Agreement in polynomial latency, even in the presence of up to f<n/4 Byzantine faults. This comes close to the f<n/3 upper bound on the maximum number of faults [LSP 1982, BT 1985, FLM 1986]."
STOC,2022,515-528,"Xavier Allamigeon, Stéphane Gaubert, Nicolas Vandame",No self-concordant barrier interior point method is strongly polynomial.,https://doi.org/10.1145/3519935.3519997,"It is an open question to determine if the theory of self-concordant barriers can provide an interior point method with strongly polynomial complexity in linear programming. In the special case of the logarithmic barrier, it was shown in [Allamigeon, Benchimol, Gaubert and Joswig, SIAM J.?on Applied Algebra and Geometry, 2018] that the answer is negative. In this paper, we show that none of the self-concordant barrier interior point methods is strongly polynomial. This result is obtained by establishing that, on parametric families of convex optimization problems, the log-limit of the central path degenerates to a piecewise linear curve, independently of the choice of the barrier function. We provide an explicit linear program that falls in the same class as the Klee–Minty counterexample for the simplex method, i.e., in which the feasible region is a combinatorial cube and the number of iterations is Ω(2n)."
STOC,2022,529-542,"Arun Jambulapati, Yang P. Liu, Aaron Sidford",Improved iteration complexities for overconstrained p-norm regression.,https://doi.org/10.1145/3519935.3519971,"In this paper we obtain improved iteration complexities for solving ?p regression. We provide methods which given any full-rank A ∈ ?n × d with n ≥ d, b ∈ ?n, and p ≥ 2 solve minx ∈ ?d ||A x ? b||p to high precision in time dominated by that of solving Op(dp?2/3p?2) linear systems in A?D A for positive diagonal matrices D. This improves upon the previous best iteration complexity of Op(np?2/3p?2) (Adil, Kyng, Peng, Sachdeva 2019). As a corollary, we obtain an O(d1/3??2/3) iteration complexity for approximate ?∞ regression. Further, for q ∈ (1, 2] and dual norm q = p/(p?1) we provide an algorithm that solves ?q regression in O(dp?2/2p?2) iterations. To obtain this result we analyze row reweightings (closely inspired by ?p-norm Lewis weights) which allow a closer connection between ?2 and ?p regression. We provide adaptations of two different iterative optimization frameworks which leverage this connection and yield our results. The first framework is based on iterative refinement and multiplicative weights based width reduction and the second framework is based on highly smooth acceleration. Both approaches yield Op(dp?2/3p?2) iteration methods but the second has a polynomial dependence on p (as opposed to the exponential dependence of the first algorithm) and provides a new alternative to the previous state-of-the-art methods for ?p regression for large p."
STOC,2022,543-556,"Jan van den Brand, Yu Gao 0001, Arun Jambulapati, Yin Tat Lee, Yang P. Liu, Richard Peng, Aaron Sidford",Faster maxflow via improved dynamic spectral vertex sparsifiers.,https://doi.org/10.1145/3519935.3520068,"We make several advances broadly related to the maintenance of electrical flows in weighted graphs undergoing dynamic resistance updates, including: (1) More efficient dynamic spectral vertex sparsification, achieved by faster length estimation of random walks in weighted graphs using Morris counters [Morris 1978, Nelson-Yu 2020]. (2) A direct reduction from detecting edges with large energy in dynamic electric flows to dynamic spectral vertex sparsifiers. (3) A procedure for turning algorithms for estimating a sequence of vectors under updates from an oblivious adversary to one that tolerates adaptive adversaries via the Gaussian-mechanism from differential privacy. Combining these pieces with modifications to prior robust interior point frameworks gives an algorithm that on graphs with m edges computes a mincost flow with edge costs and capacities in [1, U] in time O(m3/2?1/58 log2 U). In prior and independent work, [Axiotis-M?dry-Vladu FOCS 2021] also obtained an improved algorithm for sparse mincost flows on capacitated graphs. Our algorithm implies a O(m3/2?1/58 logU) time maxflow algorithm, improving over the O(m3/2?1/328logU) time maxflow algorithm of [Gao-Liu-Peng FOCS 2021]."
