booktitle,year,pages,author,title,ee,abstract
STOC,2003,629-638,"Martin Dietzfelbinger, Philipp Woelfel",Almost random graphs with simple hash functions.,https://doi.org/10.1145/780542.780634,"We describe a simple randomized construction for generating pairs of hash functions h1,h2 from a universe U to ranges V = [m] = (0,1,...,m-1) and W = [m] so that for every key set S ⊆ U with n = |S| ≤ m/(1 + ε) the (random) bipartite (multi)graph with node set V ∪ W and edge set (h1(x),h2(x))| x ∈ S exhibits a structure that is essentially random. The construction combines d-wise independent classes for d a relatively small constant with the well-known technique of random offsets. While keeping the space needed to store the description of h1 and h2 at O(nζ), for ζ < 1 fixed arbitrarily, we obtain a much smaller (constant) evaluation time than previous constructions of this kind, which involved Siegel's high-performance hash classes. The main new technique is the combined analysis of the graph structure and the inner structure of the hash functions, as well as a new way of looking at the cycle structure of random (multi)graphs. The construction may be applied to improve on Pagh and Rodler's ""cuckoo hashing"" (2001), to obtain a simpler and faster alternative to a recent construction of Ostlin and Pagh (2002/03) for simulating uniform hashing on a key set S, and to the simulation of shared memory on distributed memory machines. We also describe a novel way of implementing (approximate) d-wise independent hashing without using polynomials."
STOC,2003,639-648,"Haim Kaplan, Eyal Molad, Robert Endre Tarjan",Dynamic rectangular intersection with priorities.,https://doi.org/10.1145/780542.780635,"We present efficient data structures to maintain dynamic set of rectangles, each with priority assigned to it, such that we can efficiently find the rectangle of maximum priority containing a query point. Our data structures support insertions and deletions of rectangles. In one dimension, when rectangles are intervals, our most efficient data structure supports queries and insertions in O(log n) time, deletions in O(log n loglog n) time and requires linear space. When intervals are guaranteed to be nonoverlapping (but one can be nested within the other) we obtain a simpler data structure that supports all operations in O(log n) time."
STOC,2003,649-658,Mikkel Thorup,Space efficient dynamic stabbing with fast queries.,https://doi.org/10.1145/780542.780636,"In dynamic stabbing, we operate on a dynamic set of intervals. A stabbing query asks for an interval containing a given point. This basic problem encodes problems such as method look-up in object oriented programming languages and classification in IP firewalls. For such application, very fast, say constant, query time is extremely important, small space is very important, and fast updates are good but the least important. Previous solutions traded space and update time for fast queries. We show here that space needs not be sacrificed. We get the same trade-off between update time and query time but using only the space necessary for locating a query point among the interval end-points. All our bounds are optimal or near-optimal."
STOC,2003,659-666,"Anna Gál, Adi Rosén",Lower bounds on the amount of randomness in private computation.,https://doi.org/10.1145/780542.780638,"We consider the amount of randomness necessary in information-theoretic private protocols. We prove that at least Ω(log n) random bits are necessary for the t-private computation of the function xor by n players, for any t ≥ 2. In view of the upper bound of O(t2log(n/t))[19], this bound is tight, up to constant factors, for any fixed t. For a class of protocols obeying certain restrictions, we give stronger lower bounds of Ω(t log (n/t)). We note that all known randomness efficient private protocols designed specifically for xor belong to this class. All our lower bounds hold for the ""trusted dealer"" model as well, and the Ω(t log (n/t)) lower bound for restricted protocols is tight, up to constant factors, for any t ≥ 2 in this model.In comparison, the previous lower bounds on the amount of randomness required by t-private computation of explicit functions did not grow with n for constant values of t, and our results improve the previous lower bounds for xor for any 2 ≤ t = o(log n). Our results also show that already for t = 2, Ω(log n) random bits are necessary, while it is known that for the case of t = 1 a single random bit is sufficient for privately computing xor for any number of players.Our proofs use novel techniques by which we extract random variables from a t-private protocol, and then use the t-privacy property of the protocol to prove properties of these random variables. These properties in turn imply that the number of random bits used by the players is large."
STOC,2003,667-672,"T. S. Jayram, Subhash Khot, Ravi Kumar 0001, Yuval Rabani",Cell-probe lower bounds for the partial match problem.,https://doi.org/10.1145/780542.780639,"Given a database of n points in (0,1)d, the partial match problem is: In response to a query x in (0, 1, *)d, find a database point y such that for every i whenever xi ≠ *, we have xi = yi. In this paper we show randomized lower bounds in the cell-probe model for this well-studied problem[18, 11, 19, 16, 4, 6 ].Our lower bounds follow from a two-party asymmetric randomized communication complexity near-optimal lower bound for this problem, where we show that either Alice has to send Ω(d log n) bits or Bob has to send Ω(n1 - o(1)) bits. When applied to the cell-probe model, it means that if the number of cells is restricted to be poly(n, d) where each cell is of size poly(log n, d), then Ω(d/log2 n) probes are needed. This is an exponential improvement over the previously known lower bounds for this problem[16, 4]."
STOC,2003,673-682,"T. S. Jayram, Ravi Kumar 0001, D. Sivakumar 0001",Two applications of information complexity.,https://doi.org/10.1145/780542.780640,"We show the following new lower bounds in two concrete complexity models:(1) In the two-party communication complexity model, we show that the tribes function on n inputs[6] has two-sided error randomized complexity Ω(n), while its nondeterminstic complexity and co-nondeterministic complexity are both Θ(√n). This separation between randomized and nondeterministic complexity is the best possible and it settles an open problem in Kushilevitz and Nisan[17], which was also posed by Beame and Lawry[5].(2) In the Boolean decision tree model, we show that the recursive majority-of-three function on 3h inputs has randomized complexity Ω((7/3)h). The deterministic complexity of this function is Θ(3h), and the nondeterministic complexity is Θ(2h). Our lower bound on the randomized complexity is a substantial improvement over any lower bound for this problem that can be obtained via the techniques of Saks and Wigderson [23], Heiman and Wigderson[14], and Heiman, Newman, and Wigderson[13]. Recursive majority is an important function for which a class of natural algorithms known as directional algorithms does not achieve the best randomized decision tree upper bound.These lower bounds are obtained using generalizations of information complexity, which quantifies the minimum amount of information that will have to be revealed about the inputs by every correct algorithm in a given model of computation."
STOC,2003,683-692,Yehuda Lindell,Bounded-concurrent secure two-party computation without setup assumptions.,https://doi.org/10.1145/780542.780641,"In this paper we study the feasibility of obtaining protocols for general two-party computation that remain secure under concurrent composition. (A general protocol can be used for obtaining secure computation of any functionality.) We consider a scenario where no trusted setup is assumed (and so, for example, there is no common reference string available to the parties); we call this the ""plain model"". We present both negative and positive results for this model. Specifically, we show that a general two-party protocol that remains secure for m concurrent executions and can be proven via black-box simulation, must have more than m rounds of communication. An important corollary of this result is that there do not exist protocols for black-box secure general two-party computation for the case of unbounded concurrency (where any polynomial number of concurrent executions may be run). On the positive side, we show that under general cryptographic assumptions, there exist secure protocols for general two-party computation in the model of bounded concurrent composition (in this model the number of concurrent executions is fixed and the protocol design may depend on this number). Our protocol has O(m) rounds of communication, where m is the bound on the number of concurrent executions, and uses both black-box and non black-box techniques. We note that this protocol constitutes the first feasibility result for general two-party computation without setup assumptions for any model of concurrency."
STOC,2003,693-699,Martin E. Dyer,Approximate counting by dynamic programming.,https://doi.org/10.1145/780542.780643,"We give efficient algorithms to sample uniformly, and count approximately, the solutions to a zero-one knapsack problem. The algorithm is based on using dynamic programming to provide a deterministic relative approximation. Then ""dart throwing"" techniques are used to give arbitrary approximation ratios. We also indicate how further improvements can be obtained using randomized rounding. We extend the approach to several related problems: the m-constraint zero-one knapsack, the general integer knapsack (including its m-constraint version) and contingency tables with constantly many rows."
STOC,2003,700-709,"Noga Alon, Asaf Shapira",Testing subgraphs in directed graphs.,https://doi.org/10.1145/780542.780644,"Let H be a fixed directed graph on h vertices, let G be a directed graph on n vertices and suppose that at least ε n2 edges have to be deleted from it to make it H-free. We show that in this case G contains at least f(ε,H) nh copies of H. This is proved by establishing a directed version of Szemeredi's regularity lemma, and implies that for every H there is a one-sided error property tester whose query complexity is bounded by a function of ε only for testing the property PH of being H-free."
STOC,2003,710-719,"Toshiya Itoh, Yoshinori Takei, Jun Tarui",On the sample size of k-restricted min-wise independent permutations and other k-wise distributions.,https://doi.org/10.1145/780542.780645,"An explicit study of min-wise independent permutation families, together with their variants --- k-restricted, approximate, etc. --- was initiated by Broder, et al[4]. In this paper, we give a lower bound for the size of k-restricted min-wise independent permutation family. A family F of permutations on [0,n-1]=(0,1,...,n-1) is said to be k-restricted min-wise independent if for any subset X ⊆ [0,n-1] with |X| ≤ k and any x ∈ X, Pr[min(π(X))=π(x)] = 1/|X|, when π is randomly chosen from F according to a probability distribution D on the family F. For the minimum size of a family of k-restricted min-wise independent permutations, upper bounds of O(nk) for any fixed k have been shown for uniform and biased probability distributions on F. We show that if a family F of permutations on [0,n-1] is k-restricted min-wise independent, then |F| ≥ m(n-1,k-1), where m(n,d) = ∑i=0d/2(ni) if d is even; m(n,d)= ∑i=0(d-1)/2(ni) + (n-1(d-1)/2) otherwise. The lower bound for the size of F still holds when we allow an arbitrary probability distribution on F. Our proof technique is based on linear algebra methods, and can be regarded as a generalization of the result by Alon, Babai, and Itai[1], i.e., if random variables X1,X2,...,Xn: Ω → (0,1) are k-wise independent and Pr[Xi=1] = pi is neither 0 nor 1, then |Ω| ≥ m(n,k). By applying our proof technique, we also derive lower bounds for the sample size of the related notions, e.g., k-wise symmetrically independent distributions, k-rankwise independent permutation families, etc."
STOC,2003,720-724,Joel Friedman,A proof of Alon's second eigenvalue conjecture.,https://doi.org/10.1145/780542.780646,"A d-regular graph has largest or first (adjacency matrix) eigenvalue λ1 = d. In this paper we show the following conjecture of Alon. Fix an integer d > 2 and a real ε > 0. Then for sufficiently large n we have that ""most"" d-regular graphs on n vertices have all their eigenvalues except λ1 = d bounded above by 2√d-1 + ε. Our methods, being trace methods, also bound those eigenvalues below by -2√d-1 - ε."
