booktitle,year,pages,author,title,ee,abstract
STOC,1985,252-262,"J. W. de Bakker, John-Jules Ch. Meyer, Ernst-Rüdiger Olderog, Jeffery I. Zucker","Transition Systems, Infinitary Languages and the Semantics of Uniform Concurrency",https://doi.org/10.1145/22145.22174,"1. INTRODUCTION Our paper aims at presenting a thorough study of the semantics of a number of concepts in concurrency. We concentrate on shuffle and synchronization merge, local and global nondeterminacy, and deadlocks. Somewhat more specifically, we provide a systematic analysis of these concepts by confronting, for three sample langudqc~ s, semantic techniques inspired by carli. l% r work due to llennessy and Plotkin (113,201) proposing an operational approach, De Bakker et al. transition systems (1141) as employed successfully in 113,201; applications in the analysis of proof systems were developed by Apt c1, 21. Compared with previous instances, our definitions exhibit various novel features:(i) the use of a model involving languages with finite and infinite words (cf. Nivat 1171);(ii) the use ot Eull recursion(based on ttic copy rule) rather than just iteration;(iii) an appealingly simple treatment of synchronization;(iv) a careful distinction between local and global nondeterminacy;(v) the restriction to uniform concurrency.Throughout the paper we only consider uniform statements: by this we mean an approach at the schematic level, leaving the elementary actions uninterpreted and avoiding the introduction of notions such as assignments or states. Many interesting issues arise at this level, and WP feel that it j, acivant ageous to kecg questiotw whicll arise after interpretation for a treatment at a second level (not dealt with in our paper)."
STOC,1985,263-272,"Kim B. Bruce, Giuseppe Longo",Provable Isomorphisms and Domain Equations in Models of Typed Languages (Preliminary Version),https://doi.org/10.1145/22145.22175,"Pcrmlwon IO copy without fee all or par1 of this material IS granted prowdcd thar the copies are not made or distributed for direct cammeruai advantage. the AC ‘M copyrlght notice and the title of the puhllcatlon and IK date appear. and notice is given that copying is by~ rm~ won o (the Aw, clarion for Computing Machinery. l’o copy otherwrse. or 10 repuhhsh. require\a ICC and or specific permlsbion."
STOC,1985,273-284,"Stavros S. Cosmadakis, Paris C. Kanellakis",Equational Theories and Database Constraints,https://doi.org/10.1145/22145.22176,"We present a novel way to formulate database dependencies as sentences of first-order logic, using equational statements instead of Horn clauses. Dependency implication is directly reduced to equational implication. Our approach is powerful enough to express functional and inclusion dependencies, which are the most common database constraints. We present a new proof procedure for these dependencies. We use our equational formulation to derive new upper and lower bounds for the complexity of their implication problems."
STOC,1985,285-290,Samuel R. Buss,The Polynomial Hierarchy and Fragments of Bounded Arithmetic (Extended Abstract),https://doi.org/10.1145/22145.22177,"One of the more important problems of computer science is to esLbhllsh precise bounds on computational complexity and, in partlcular. LO understand the relationship between P, NP, the polynomial hierarchy, I’SP4 (‘1, I: SPTlME, etc. This paper approaches these questions I ram the viewpoint of mathematical logic. in the her that e\~ entually the techniques of mathematical logic can shed light on the nature of compulalion. We define below a set of formal theories of arithmetic called collectively Hounded. Arithmrtic. These formal theories arc related UI computational complexity in that, for each theory. the functions and predicates definable in a “nice” way in that theory have a certain computational complexity and conversely every function of Lhat computation complexity is definable in that way. Thus, we ‘present a theory S: which defines precisely the class of functions in P, another theory Sf which defines precisely the clan of’functions which are polynomial time relative UI NP, a theory rt! which defines the PSPACI? functions. a theory Vi which de-fines the IIS IYI’IRII~ functions, and other theories corresponding to levels of the polynomial hierarchy. We also dixuss the properties of predicates which are definable in these theories. For instance, iT S: proves that a predicate is in NYnco-NP, then that predicate is already in P. The theories we discuss are first-order and second-order theories of arithmetic and are formulated in a manner analogous to Peano arithmetic. The weakest theory, $.. which defines the polynomial time functions, is related to the equational system PV introduced by &ok [3]. The theories S: and PV have the same open PV-equations as theorems. Finally we state some strong versions of the Gdel incompleteness theorems and we give a proof-theoretic principle which is equivalent to Nl’= co-NP."
STOC,1985,291-304,"Shafi Goldwasser, Silvio Micali, Charles Rackoff",The Knowledge Complexity of Interactive Proof-Systems (Extended Abstract),https://doi.org/10.1145/22145.22178,"In the first part of the paper we introduce a new theorem-proving procedure, that is a new efficient method of communicating a proof. Any such method implies, directly or indirectly, a definition of proof. Our “proofs” are probabilistic in nature. On input an n-bits long statement, we may erroneously be convinced of its correctness with very small probability, say, 1"
STOC,1985,305-315,"Ronald Fagin, Moshe Y. Vardi",An Internal Semantics for Modal Logic: Preliminary Report,https://doi.org/10.1145/22145.22179,"In Kripke semantics for modal logic, “possible worlds” and the possibility relation are both primitive notions. This has both technical and conceptual shortcomings. From a technical point of view, the mathematics associated with Kripke semantics is often quite complicated. From a conceptual point of view, it is not clear how to use Kripke structures to model knowledge and belief, where one wants a clearer understanding of the notions that are primitive in Kripke semantics. We introduce modal structures as models for modal logic. We use the idea of possible worlds, but by directly describing the “internal semantics” of each possible world. It is much easier to study the standard logical questions, such as completeness, decidability, and compactness, using modal structures. Furthermore, modal structures offer a much more intuitive approach to modelling knowledge and belief."
STOC,1985,316-326,Gabriel Bracha,An O(\mathop lg n) Expected Rounds Randomized Byzantine Generals Protocol,https://doi.org/10.1145/22145.22180,"Byzantine Generals protocols enable processes to broadcast messages reliably in the presence of faulty processes. These protocols are run in a system that consists of n processes, t of which are faulty. The protocols are conducted in synchronous rounds of message exchange. It is shown that, in the absence of eavesdropping, without using cryptography, for any ε > 0 and t = n/(3 + ε), there is a randomized protocol with O(log n) expected number of rounds. If cryptographic methods are allowed, then, for ε > 0 and t = n/(2 + ε), there is a randomized protocol with O(log n) expected number of rounds. This is an improvement on the lower bound of t + 1 rounds required for deterministic protocols, and on a previous result of t/log n expected number of rounds for randomized noncryptographic protocols."
STOC,1985,327-334,Paul Feldman,Fault Tolerance of Minimal Path Routings in a Network,https://doi.org/10.1145/22145.22181,"We prove the conjectured 2T-1 pound on the diameter of a surviving quote graph from which T edges are removed, under the assumption that a minimal path routing is used we also prove the related conjecture for node failure, and combine the results into a more general theorem."
STOC,1985,335-345,"Brian A. Coan, Danny Dolev, Cynthia Dwork, Larry J. Stockmeyer",The Distributed Firing Squad Problem (Preliminary Version),https://doi.org/10.1145/22145.22182,"Many fault-tolerant distributed algorithms assume a syn-chronous system, in which processing is divided into synchronous unison “steps” separated by rounds of message exchange (see, eg,[DS, LSP]). A message sent at step s from a correct processor p to a correct processor q is received by q at step s+ l. This assumption is justified by the impossibility results of [FLP] and [DDS], which show that if the system is asynchronous then there is no protocol for distributed agreement tolerant to even one benign processor failure. Another common assumption is that all processors begin the algorithm simultaneously, ie, at the same step. In an actual distributed system in which different transactions and algorithms may be executed periodically, this may be unrealistic. Typically an algorithm is executed in response to a request from some specific processor, which may in turn be responding to some external request. If the given processor is correct then all correct processors learn of the request simultaneously, so they can indeed begin the algorithm in unison. However, if the processor is faulty then the correct processors may learn of the request at different steps. In this paper we justify the design assumption of simultaneous starts. Specifically, we provide algorithms to solve the associated synchronizationPermission to copy without fee all or parl of this material is granted provided that the copies are not made or distributed for direct commercial advantage. the ACM copyright notice and the title of the publication and i& date appear, and notice is given that copying is by permission of the Association for Computing Machinery. To copy otherwise. or to republish, requires a fee and,‘or specific permission."
STOC,1985,346-355,"Joseph Y. Halpern, Nimrod Megiddo, Ashfaq A. Munshi",Optimal Precision in the Presence of Uncertainty (Preliminary Version),https://doi.org/10.1145/22145.22183,"We consider the problem of achieving coordinated actions in a real-time distributed system. In particular, we consider how tightly processors can be guaranteed to perform a particular action, in a system where message transmission is guaranteed, but there is some uncertainty in message transmission time. We present an algorithm to achieve optimal precision in arbitrary networks."
STOC,1985,356-362,"Johan Håstad, Adi Shamir",The Cryptographic Security of Truncated Linearly Related Variables,https://doi.org/10.1145/22145.22184,"In this paper we describe a polynomial time algorithm for computing the values of variables x1, … xk when some of their bits and some linear relationships between them are known. The algorithm is essentially optimal in its use of information in the sense that it can be applied as soon as the values of the xi become uniquely determined by the constraints. Its cryptanalytic significance is demonstrated by two applications: breaking linear congruential generators whose outputs are truncated, and breaking Blum's protocol for exchanging secrets."
STOC,1985,363-365,Leonid A. Levin,One-Way Functions and Pseudorandom Generators,https://doi.org/10.1145/22145.22185,"One-way are those functions which are easy to compute, but hard to invert on a non-negligible fraction of instances. The existence of such functions with some additional assumptions was shown to be sufficient for generating perfect pseudorandom strings |Blum, Micali 82|, |Yao 82|, |Goldreich, Goldwasser, Micali 84|. Below, among a few other observations, a weaker assumption about one-way functions is suggested, which is not only sufficient, but also necessary for the existence of pseudorandom generators. The main theorem can be understood without reading the sections 3-6."
STOC,1985,366-378,Umesh V. Vazirani,Towards a Strong Communication Complexity Theory or Generating Quasi-Random Sequences from Two Communicating Slightly-random Sources (Extended Abstract),https://doi.org/10.1145/22145.22186,"Several computational applications, such as randomizing algorithms[Ra], stochastic simulation [SC, KG] and cryptographic protocols [B11, GM, W] assume a fast source of unbiased, independent coin flips. Unfortunately, the available physical sources of randomness, such as noise diodes and geiger counters are at best imperfect[Mu]. Santha and Vazirani [SV] consider a very general model for such imperfect sources of randomness: the slightly random source. A slightly random source is a black boxPermission to copy without fee all or part of this material is granted proviacd that the copies are not made or distributed for direct commercial advantage. the ACM copyright notice and the title of the publication and its date appear, and notice is given that copying is by permission of the Association for Compuling Machinery. To copy otherwise, or to republish, requires a fee and/or specific permission."
STOC,1985,379-387,"Jonathan Goodman, Albert G. Greenberg, Neal Madras, Peter March",On the Stability of the Ethernet,https://doi.org/10.1145/22145.22187,"We consider the stochastic behavior of binary exponential backoff, a probabilistic algorithm for regulating transmissions on a multiple access channel. Ethernet, a local area network, is built upon this algorithm. The fundamental theoretical issue is stability: does the backlog of packets awaiting transmission remain bounded in time, provided the rates of new packet arrivals are small enough? We present a realistic model of n ≥ 2 stations communicating over the channel. Our main result is to establish that the algorithm is stable if the sum of the arrival rates is sufficiently small. We report detailed results on which rates lead to stability when n = 2 stations share the channel. In passing we derive several other results bearing on the efficiency of the conflict resolution process. Lastly, we report results from a simulation study, which, in particular, indicate alternative retransmission strategies can significantly improve performance."
STOC,1985,388-395,"Péter Gács, John H. Reif",A Simple Three-Dimensional Real-Time Reliable Cellular Array,https://doi.org/10.1145/22145.22188,"We build a three-dimensional array of unreliable cellular automata that can simulate a universal Turing machine (more generally, a one-dimensional universal iterative array) reliably. This is the first reliable real-time simulation. The encoding is simple repetition, and no decoding is needed. The construction is based on Toom's work."
STOC,1985,396-404,Anna Lubiw,Doubly Lexical Orderings of Matrices,https://doi.org/10.1145/22145.22189,"A doubly lexical ordering of the rows and columns of any real-valued matrix is defined. This notion extends to graphs. These orderings are used to prove and unify results on several classes of matrices and graphs, including totally balanced matrices and chordal graphs. An almost-linear time doubly lexical ordering algorithm is given."
STOC,1985,405-412,Dung T. Huynh,The Complexity of the Equivalence Problem for Commutative Semigroups and Symmetric Vector Addition Systems,https://doi.org/10.1145/22145.22190,"This paper shows that the equivalence problems for commutative semigroups and symmetric vector addition systems are decidable in space cNlogN for some fixed constant c, solving an open question by Cardoza, Lipton, Mayr, and Meyer. From the exponential-space completeness of the word problems, it follows that our upper bound is nearly optimal."
STOC,1985,413-420,Friedhelm Meyer auf der Heide,Fast Algorithms for N-Dimensional Restrictions of Hard Problems,https://doi.org/10.1145/22145.22191,"Let M be a parallel RAM with p processors and arithmetic operations addition and subtraction recognizing L ⊂ Nn in T steps. (Inputs for M are given integer by integer, not bit by bit.) Then L can be recognized by a (sequential) linear search algorithm (LSA) in O(n4(log(n) + T + log(p))) steps. Thus many n-dimensional restrictions of NP-complete problems (binary programming, traveling salesman problem, etc.) and even that of the uniquely optimum traveling salesman problem, which is ΔP2-complete, can be solved in polynomial time by an LSA. This result generalizes the construction of a polynomial LSA for the n-dimensional restriction of the knapsack problem previously shown by the author, and destroys the hope of proving nonpolynomial lower bounds on LSAs for any problem that can be recognized by a PRAM as above with 2poly(n) processors in poly(n) time."
STOC,1985,421-429,László Babai,Trading Group Theory for Randomness,https://doi.org/10.1145/22145.22192,"In a previous paper [BS] we proved, using the elements of the theory of nilpotent groups, that some of the fundamental computational problems in matriz groups belong to NP. These problems were also shown to belong to coNP, assuming an unproven hypothesis concerning finite simple groups. The aim of this paper is to replace most of the (proven and unproven) group theory of [BS] by elementary combinatorial arguments. The result we prove is that relative to a random oracle B, the mentioned matrix group problems belong to (NP∩coNP)B. The problems we consider are membership in and order of a matrix group given by a list of generators. These problems can be viewed as multidimensional versions of a close relative of the discrete logarithm problem. Hence NP∩coNP might be the lowest natural complexity class they may fit in. We remark that the results remain valid for black box groups where group operations are performed by an oracle. The tools we introduce seem interesting in their own right. We define a new hierarchy of complexity classes AM(k) “just above NP”, introducing Arthur vs. Merlin games, the bounded-away version of Papdimitriou's Games against Nature. We prove that in spite of their analogy with the polynomial time hierarchy, the finite levels of this hierarchy collapse to AM=AM(2). Using a combinatorial lemma on finite groups [BE], we construct a game by which the nondeterministic player (Merlin) is able to convince the random player (Arthur) about the relation [G]=N provided Arthur trusts conclusions based on statistical evidence (such as a Slowly-Strassen type “proof” of primality). One can prove that AM consists precisely of those languages which belong to NPB for almost every oracle B. Our hierarchy has an interesting, still unclarified relation to another hierarchy, obtained by removing the central ingredient from the User vs. Expert games of Goldwasser, Micali and Rackoff."
STOC,1985,430-439,"Béla Bollobás, Trevor I. Fenner, Alan M. Frieze",An Algorithm for Finding Hamilton Cycles in a Random Graph,https://doi.org/10.1145/22145.22193,"This paper describes a polynomial time algorithm HAM that searches for Hamilton cycles in undirected graphs. On a random graph its asymptotic probability of success is that of the existence of such a cycle. If all graphs with n vertices are considered equally likely, then using dynamic programming on failure leads to an algorithm with polynomial expected time. Finally, it is used in an algorithm for solving the symmetric bottleneck travelling salesman problem with probability tending to 1, as n tends to ∞."
STOC,1985,440-448,"Andrew V. Goldberg, Michael Sipser",Compression and Ranking,https://doi.org/10.1145/22145.22194,"A complexity-theoretic approach to the classical data compression problem is to define a notion of language compression by a machine in a certain complexity class, and to study language classes compressible under the above definition. Languages that can be compressed efficiently (e.g. by a probabilistic polynomial time machine) are of special interest. We define the notion of language compressibility, and show that sufficiently sparse “easy” languages (e.g. polynomial time) can be compressed efficiently. We also define a notion of ranking (which is an optimal compression) and show that some “very easy” languages (e.g. unambiguous context-free languages) can be ranked efficiently. We exhibit languages which cannot be compressed or ranked efficiently. The notion of compressibility is closely related to Kolmogorov complexity and randomness. We discuss this relationship and the complexity-theoretic implications of our results."
STOC,1985,449-457,"Larry Carter, Larry J. Stockmeyer, Mark N. Wegman",The Complexity of Backtrack Searches (Preliminary Version),https://doi.org/10.1145/22145.22195,"In this paper, we study the complexity of finding an efficient search for combinatorial problems which are commonly solved by backtracking. First, a formalism is introduced. Backtrack searches are ordinarily thought of as following a tree pattern. Our model is considerably more general, and there are problems where this allows much shorter searches. Next, we look at the complexity of search strategies (probabilistic decision trees) that can solve any problem in a collection of problems. Let C be the collection of problems that can be solved by a (possibly lucky) search involving K or fewer queries. We prove a nonpolynomial lower bound (in terms of K) on any search strategy for C. We conjecture that a matching upper bound exists. Finally, a few heuristics are presented that give the flavor of an interesting line of research: to test the effectiveness of a heuristic that should work on any problem, try it out on a few specific problems of known complexity. On some simple problems, our heuristics allow polynomial-time searches."
STOC,1985,458-463,"Leslie G. Valiant, Vijay V. Vazirani",NP Is as Easy as Detecting Unique Solutions,https://doi.org/10.1145/22145.22196,"For all known NP-complete problems the number of solutions in instances having solutions may vary over an exponentially large range. Furthermore, most of the well-known ones, such as satisfiability, are parsimoniously interreducible, and these can have any number of solutions between zero and an exponentially large number. It is natural to ask whether the inherent intractability of NP-complete problems is caused by this wide variation. In this paper we give a negative answer to this using randomized reductions. We show that the problems of distinguishing between instances of SAT having zero or one solution, or finding solutions to instances of SAT having unique solutions, are as hard as SAT itself. Several corollaries about the difficulty of specific problems follow. For example if the parity of the number of solutions of SAT can be computed in RP then NP = RP. Some further problems can be shown to be hard for NP or DP via randomized reductions."
STOC,1985,464-475,"Richard M. Karp, Eli Upfal, Avi Wigderson",Are Search and Decision Problems Computationally Equivalent?,https://doi.org/10.1145/22145.22197,"From the point of view of sequential polynomial time computation, the answer to the question in the title is 'yes'. The process of self-reducibility is a linear time Turing (oracle) reduction from a given combinatorial search problem to an appropriately defined decision problem. However, from the point of view of fast parallel computation, the answer is not so clear. Many of the sequential algorithms that were 'marked off' as being “inherently sequential” embed within them the self-reducibility process. Can this inherently sequential process be parallelized? To study this problem, we define an abstract setting (namely that of an independence system) in which one, universal search problem captures all combinatorial search problems. We consider several natural decision and function oracles to which this search problem may be reduced. On the positive side, we give efficient probabilistic parallel reductions to these oracles. These reductions constitute a scheme for parallelizing search problems in case the oracles for these problems are themselves efficiently computable in parallel. We give examples of problems that did not yield to parallelism before, but can be parallelized using this scheme. On the negative side, we prove lower bounds on any determininistic parallel reductions to the same oracles. If p processors are used, the sequential (linear) running time cannot be enhanced by more than a factor of Ο(log p) and hence for any polynomial number of processors the problem remains inherently sequential. This proves that randomization can be exponentially more powerful than determinism in our model, and suggests that NC ≠ Random NC. Finally, we state some intriguing conjectures and suggest new directions of research in complexity theory that arise from this work."
STOC,1985,476-483,"Ron Aharoni, Paul Erdös, Nathan Linial",Dual Integer Linear Programs and the Relationship between their Optima,https://doi.org/10.1145/22145.22198,We consider dual pairs of packing and covering integer linear programs. Best possible bounds are found between their optimal values. Tight inequalities are obtained relating the integral optima and the optimal rational solutions.
