booktitle,year,pages,author,title,ee,abstract
STOC,2009,333-342,Chris Peikert,Public-key cryptosystems from the worst-case shortest vector problem: extended abstract.,https://doi.org/10.1145/1536414.1536461,"We construct public-key cryptosystems that are secure assuming theworst-case hardness of approximating the minimum distance on n-dimensional lattices to within small Poly(n) factors. Prior cryptosystems with worst-case connections were based either on the shortest vector problem for a special class of lattices (Ajtai and Dwork, STOC 1997; Regev, J. ACM 2004), or on the conjectured hardness of lattice problems for quantum algorithms (Regev, STOC 2005). Our main technical innovation is a reduction from variants of the shortest vector problem to corresponding versions of the ""learning with errors"" (LWE) problem; previously, only a quantum reduction of this kind was known. As an additional contribution, we construct a natural chosen ciphertext-secure cryptosystem having a much simpler description and tighter underlying worst-case approximation factor than prior schemes."
STOC,2009,343-350,Robin A. Moser,A constructive proof of the Lovász local lemma.,https://doi.org/10.1145/1536414.1536462,"The Lovasz Local Lemma [2] is a powerful tool to prove the existence of combinatorial objects meeting a prescribed collection of criteria. The technique can directly be applied to the satisfiability problem, yielding that a k-CNF formula in which each clause has common variables with at most 2(k-2) other clauses is always satisfiable. All hitherto known proofs of the Local Lemma are non-constructive and do thus not provide a recipe as to how a satisfying assignment to such a formula can be efficiently found. In his breakthrough paper [3], Beck demonstrated that if the neighbourhood of each clause be restricted to O(2(k/48)), a polynomial time algorithm for the search problem exists. Alon simplified and randomized his procedure and improved the bound to O(2(k/8)) [4]. Srinivasan presented in [9] a variant that achieves a bound of essentially O(2(k/4)). In [11], we improved this to O(2(k/2)). In the present paper, we give a randomized algorithm that finds a satisfying assignment to every k-CNF formula in which each clause has a neighbourhood of at most the asymptotic optimum of 2(k-5)-1 other clauses and that runs in expected time polynomial in the size of the formula, irrespective of k. If k is considered a constant, we can also give a deterministic variant. In contrast to all previous approaches, our analysis does not anymore invoke the standard non-constructive versions of the Local Lemma and can therefore be considered an alternative, constructive proof of it."
STOC,2009,351-360,"Arpita Ghosh, Tim Roughgarden, Mukund Sundararajan",Universally utility-maximizing privacy mechanisms.,https://doi.org/10.1145/1536414.1536464,"A mechanism for releasing information about a statistical database with sensitive data must resolve a trade-off between utility and privacy. Publishing fully accurate information maximizes utility while minimizing privacy, while publishing random noise accomplishes the opposite. Privacy can be rigorously quantified using the framework of differential privacy, which requires that a mechanism's output distribution is nearly the same whether or not a given database row is included or excluded. The goal of this paper is strong and general utility guarantees, subject to differential privacy. We pursue mechanisms that guarantee near-optimal utility to every potential user, independent of its side information (modeled as a prior distribution over query results) and preferences (modeled via a loss function). Our main result is: for each fixed count query and differential privacy level, there is a geometric mechanism M* -- a discrete variant of the simple and well-studied Laplace mechanism -- that is simultaneously expected loss-minimizing for every possible user, subject to the differential privacy constraint. This is an extremely strong utility guarantee: every potential user u, no matter what its side information and preferences, derives as much utility from M* as from interacting with a differentially private mechanism Mu that is optimally tailored to u. More precisely, for every user u there is an optimal mechanism Mu for it that factors into a user-independent part (the geometric mechanism M*) followed by user-specific post-processing that can be delegated to the user itself. The first part of our proof of this result characterizes the optimal differentially private mechanism for a fixed but arbitrary user in terms of a certain basic feasible solution to a linear program with constraints that encode differential privacy. The second part shows that all of the relevant vertices of this polytope (ranging over all possible users) are derivable from the geometric mechanism via suitable remappings of its range."
STOC,2009,361-370,"Dan Feldman, Amos Fiat, Haim Kaplan, Kobbi Nissim",Private coresets.,https://doi.org/10.1145/1536414.1536465,"A coreset of a point set P is a small weighted set of points that captures some geometric properties of . Coresets have found use in a vast host of geometric settings. We forge a link between coresets, and differentially private sanitizations that can answer any number of queries without compromising privacy. We define the notion of private coresets, which are simultaneously both coresets and differentially private, and show how they may be constructed. We first show that the existence of a small coreset with low generalized sensitivity (i.e., replacing a single point in the original point set slightly affects the quality of the coreset) implies (in an inefficient manner) the existence of a private coreset for the same queries. This greatly extends the works of Blum, Ligett, and Roth [STOC 2008] and McSherry and Talwar [FOCS 2007]. We also give an efficient algorithm to compute private coresets for k-median and k-mean queries in Red, immediately implying efficient differentially private sanitizations for such queries. Following McSherry and Talwar, this construction also gives efficient coalition proof (approximately dominant strategy) mechanisms for location problems. Unlike coresets which only have a multiplicative approximation factor, we prove that private coresets must have an additive error. We present a new technique for showing lower bounds on this error."
STOC,2009,371-380,"Cynthia Dwork, Jing Lei",Differential privacy and robust statistics.,https://doi.org/10.1145/1536414.1536466,"We show by means of several examples that robust statistical estimators present an excellent starting point for differentially private estimators. Our algorithms use a new paradigm for differentially private mechanisms, which we call Propose-Test-Release (PTR), and for which we give a formal definition and general composition theorems."
STOC,2009,381-390,"Cynthia Dwork, Moni Naor, Omer Reingold, Guy N. Rothblum, Salil P. Vadhan",On the complexity of differentially private data release: efficient algorithms and hardness results.,https://doi.org/10.1145/1536414.1536467,"We consider private data analysis in the setting in which a trusted and trustworthy curator, having obtained a large data set containing private information, releases to the public a ""sanitization"" of the data set that simultaneously protects the privacy of the individual contributors of data and offers utility to the data analyst. The sanitization may be in the form of an arbitrary data structure, accompanied by a computational procedure for determining approximate answers to queries on the original data set, or it may be a ""synthetic data set"" consisting of data items drawn from the same universe as items in the original data set; queries are carried out as if the synthetic data set were the actual input. In either case the process is non-interactive; once the sanitization has been released the original data and the curator play no further role. For the task of sanitizing with a synthetic dataset output, we map the boundary between computational feasibility and infeasibility with respect to a variety of utility measures. For the (potentially easier) task of sanitizing with unrestricted output format, we show a tight qualitative and quantitative connection between hardness of sanitizing and the existence of traitor tracing schemes."
STOC,2009,391-400,Yi-Kai Liu 0001,Quantum algorithms using the curvelet transform.,https://doi.org/10.1145/1536414.1536469,"The curvelet transform is a directional wavelet transform over Rn, which is used to analyze functions that have singularities along smooth surfaces (Candes and Donoho, 2002). I demonstrate how this can lead to new quantum algorithms. I give an efficient implementation of a quantum curvelet transform, together with two applications: a single-shot measurement procedure for approximately finding the center of a ball in Rn, given a quantum-sample over the ball; and, a quantum algorithm for finding the center of a radial function over Rn, given oracle access to the function. I conjecture that these algorithms succeed with constant probability, using one quantum-sample and O(1) oracle queries, respectively, independent of the dimension n -- this can be interpreted as a quantum speed-up. To support this conjecture, I prove rigorous bounds on the distribution of probability mass for the continuous curvelet transform. This shows that the above algorithms work in an idealized ""continuous"" model."
STOC,2009,401-408,Amnon Ta-Shma,Short seed extractors against quantum storage.,https://doi.org/10.1145/1536414.1536470,"In the classical privacy amplification problem Alice and Bob share information that is only partially secret towards an eavesdropper Charlie. Their goal is to distill this information to a shorter string that is completely secret. The classical privacy amplification problem can be solved almost optimally using extractors. An interesting variant of the problem, where the eavesdropper Charlie is allowed to keep quantum information rather than just classical information, was introduced by Konig, Maurer and Renner. In this setting, the eavesdropper Charlie may entangle himself with the input (without changing it) and the only limitation Charlie has is that it may keep at most b qubits of storage. A natural question is whether there are classical extractors that are good even against quantum storage. Recent work has shown that some classical extractors miserably fail against quantum storage. At the same time, it was shown that some other classical extractors work well even against quantum storage, but all these extractors had a large seed length that was either as large as the extractor output, or as large as the quantum storage available to the eavesdropper. In this paper we show that a modified version of Trevisan's extractor is good even against quantum storage, thereby giving the first such construction with logarithmic seed length. The technique we use is a combination of Trevisan's approach of constructing an extractor from a black-box pseudorandom generator, together with locally list-decodable codes and previous work done on quantum random access codes."
STOC,2009,409-416,"Richard Cleve, Daniel Gottesman, Michele Mosca, Rolando D. Somma, David L. Yonge-Mallo",Efficient discrete-time simulations of continuous-time quantum query algorithms.,https://doi.org/10.1145/1536414.1536471,"The continuous-time query model is a variant of the discrete query model in which queries can be interleaved with known operations (called ""driving operations"") continuously in time. We show that any quantum algorithm in this model whose total query time is T can be simulated by a quantum algorithm in the discrete-time query model that makes O(T log T / loglog T) subset O~(T) queries. This is the first such upper bound that is independent of the driving operations (i.e., it holds even if the norm of the driving Hamiltonian is very large). A corollary is that any lower bound of T queries for a problem in the discrete-time query model immediately carries over to a lower bound of Omega(T loglog T / log T) subset Omega~(T) in the continuous-time query model."
STOC,2009,417-426,"Dorit Aharonov, Itai Arad, Zeph Landau, Umesh V. Vazirani",The detectability lemma and quantum gap amplification.,https://doi.org/10.1145/1536414.1536472,"The quantum analogue of the constraint satisfaction problem is the fundamental physics question of finding the minimal energy state of a local Hamiltonian --- each term of the Hamiltonian specifies a local constraint whose violation contributes to the energy of the given quantum state. However, in general it is not meaningful to ask for the probability that a given quantum state violates at least one constraint; the difficulty being that the terms of the Hamiltonian do not commute. We show how to make sense of this notion under mild restrictions on the form of the Hamiltonian. We then provide two main results. We first prove the quantum detectability lemma, which states that the probability of detecting a violation of a constraint in a local Hamiltonian system is bounded from below by some constant times the minimal energy of the system. The proof reveals some intrinsic structure of the Hilbert space of local Hamiltonians, which is captured in the ""exponential decay"" lemma, and formalized using a novel decomposition of the Hilbert space called the XY decomposition. As an application of the detectability lemma, we prove our second main result: a quantum analogue of the classical gap amplification lemma using random walks over expander graphs, which was the seed for Dinur's celebrated new proof of the PCP theorem [6]. We hope that these results will pave the way to better understandings of the computational properties of local Hamiltonians systems, and to the evolving field of quantum Hamiltonian complexity."
STOC,2009,427-434,"Silvio Lattanzi, D. Sivakumar 0001",Affiliation networks.,https://doi.org/10.1145/1536414.1536474,"In the last decade, structural properties of several naturally arising networks (the Internet, social networks, the web graph, etc.) have been studied intensively with a view to understanding their evolution. In recent empirical work, Leskovec, Kleinberg, and Faloutsos identify two new and surprising properties of the evolution of many real-world networks: densification (the ratio of edges to vertices grows over time), and shrinking diameter (the diameter reduces over time to a constant). These properties run counter to conventional wisdom, and are certainly inconsistent with graph models prior to their work. In this paper, we present the first model that provides a simple, realistic, and mathematically tractable generative model that intrinsically explains all the well-known properties of the social networks, as well as densification and shrinking diameter. Our model is based on ideas studied empirically in the social sciences, primarily on the groundbreaking work of Breiger (1973) on bipartite models of social networks that capture the affiliation of agents to societies. We also present algorithms that harness the structural consequences of our model. Specifically, we show how to overcome the bottleneck of densification in computing shortest paths between vertices by producing sparse subgraphs that preserve or approximate shortest distances to all or a distinguished subset of vertices. This is a rare example of an algorithmic benefit derived from a realistic graph model. Finally, our work also presents a modular approach to connecting random graph paradigms (preferential attachment, edge-copying, etc.) to structural consequences (heavy-tailed degree distributions, shrinking diameter, etc.)."
STOC,2009,435-444,"Shiri Chechik, Michael Langberg, David Peleg, Liam Roditty",Fault-tolerant spanners for general graphs.,https://doi.org/10.1145/1536414.1536475,"The paper concerns graph spanners that are resistant to vertex or edge failures. Given a weighted undirected n-vertex graph G=(V,E) and an integer k ≥ 1, the subgraph H=(V,E'), E'⊆ E, is a spanner of stretch k (or, a k-spanner) of G if δH(u,v) ≤ k· δG(u,v) for every u,v ∈ V, where δG'(u,v) denotes the distance between u and v in G'. Graph spanners were extensively studied since their introduction over two decades ago. It is known how to efficiently construct a (2k-1)-spanner of size O(n1+1/k), and this size-stretch tradeoff is conjectured to be tight. The notion of fault tolerant spanners was introduced a decade ago in the geometric setting [Levcopoulos et al., STOC'98]. A subgraph H is an f-vertex fault tolerant k-spanner of the graph G if for any set F⊆ V of size at most f and any pair of vertices u,v ∈ V \ F, the distances in H satisfy δH \ F(u,v) ≤ k· δG \ F(u,v). Levcopoulos et al. presented an efficient algorithm that given a set S of n points in Rd, constructs an f-vertex fault tolerant geometric (1+ε)-spanner for S, that is, a sparse graph H such that for every set F⊆ S of size f and any pair of points u,v ∈ S \ F, δH \ F(u,v) ≤ (1+ε) |uv|, where |uv| is the Euclidean distance between u and v. A fault tolerant geometric spanner with optimal maximum degree and total weight was presented in [Czumaj & Zhao, SoCG'03]. This paper also raised as an open problem the question whether it is possible to obtain a fault tolerant spanner for an arbitrary undirected weighted graph. The current paper answers this question in the affirmative, presenting an f-vertex fault tolerant (2k-1)-spanner of size O(f2 kf+1 · n1+1/klog1-1/kn). Interestingly, the stretch of the spanner remains unchanged while the size of the spanner only increases by a factor that depends on the stretch k, on the number of potential faults f, and on logarithmic terms in n. In addition, we consider the simpler setting of f-edge fault tolerant spanners (defined analogously). We present an f-edge fault tolerant 2k-1 spanner with edge set of size O(f· n1+1/k) (only f times larger than standard spanners). For both edge and vertex faults, our results are shown to hold when the given graph G is weighted."
STOC,2009,445-454,"Ken-ichi Kawarabayashi, Bruce A. Reed",Hadwiger's conjecture is decidable.,https://doi.org/10.1145/1536414.1536476,"The famous Hadwiger's conjecture asserts that every graph with no Kt-minor is (t-1)-colorable. The case t=5 is known to be equivalent to the Four Color Theorem by Wagner, and the case t=6 is settled by Robertson, Seymour and Thomas. So far the cases t ≥ 7 are wide open. In this paper, we prove the following two theorems: There is an O(n2) algorithm to decide whether or not a given graph G satisfies Hadwiger's conjecture for the case t. Every minimal counterexample to Hadwiger's conjecture for the case t has at most f(t) vertices for some explicit bound f(t). The bound f(t) is at most pppt, where p=101010t. Our proofs for both results use the well-known result by Thomassen [46] for 5-list-coloring planar graphs, together with some results (but not the decomposition theorem) of Graph Minors in [36]. Concerning the first result, we prove the following stronger theorem: For a given graph G and any fixed t, there is an O(n2) algorithm to output one of the following: a (t-1)-coloring of G, or a Kt-minor of G, or a minor H of G of order at most f(t) such that H does not have a Kt-minor nor is (t-1)-colorable. The last conclusion implies that H is a counterexample to Hadwiger's conjecture with at most f(t) vertices for the case t. The time complexity of the algorithm matches the best known algorithms for 4-coloring planar graphs (the Four Color Theorem), due to Appel and Hakken, and Robertson, Sanders, Seymour and Thomas, respectively. Let us observe that when t=5, the algorithm gives rise to an algorithm for the Four Color Theorem. The second theorem follows from our structure theorem, which has the following corollary: Every minimal counterexample G to Hadwiger's conjecture for the case t either has at most f(t) vertices, or has a vertex set Z of order at most t-5 such that G-Z is planar. It follows from the Four Color Theorem that the second assertion does not happen to any minimal counterexample to Hadwiger's conjecture for the case t. Thus in constant time, we can decide Hadwiger's conjecture for the case t."
STOC,2009,455-464,"Virginia Vassilevska, Ryan Williams 0001","Finding, minimizing, and counting weighted subgraphs.",https://doi.org/10.1145/1536414.1536477,"For a pattern graph H on k nodes, we consider the problems of finding and counting the number of (not necessarily induced) copies of H in a given large graph G on n nodes, as well as finding minimum weight copies in both node-weighted and edge-weighted graphs. Our results include: The number of copies of an H with an independent set of size s can be computed exactly in O*(2s nk-s+3) time. A minimum weight copy of such an H (with arbitrary real weights on nodes and edges) can be found in O(4s+o(s) nk-s+3) time. (The O* notation omits (k) factors.) These algorithms rely on fast algorithms for computing the permanent of a k x n matrix, over rings and semirings. The number of copies of any H having minimum (or maximum) node-weight (with arbitrary real weights on nodes) can be found in O(nω k/3 + n2k/3+o(1)) time, where ω < 2.4 is the matrix multiplication exponent and k is divisible by 3. Similar results hold for other values of k. Also, the number of copies having exactly a prescribed weight can be found within this time. These algorithms extend the technique of Czumaj and Lingas (SODA 2007) and give a new (algorithmic) application of multiparty communication complexity. Finding an edge-weighted triangle of weight exactly 0 in general graphs requires Ω(n2.5-ε) time for all ε > 0, unless the 3SUM problem on N numbers can be solved in O(N2 - ε) time. This suggests that the edge-weighted problem is much harder than its node-weighted version."
STOC,2009,465-474,"Eyal Kushilevitz, Enav Weinreb",On the complexity of communication complexity.,https://doi.org/10.1145/1536414.1536479,"We consider the following question: given a two-argument boolean function f, represented as an N x N binary matrix, how hard is it to determine the (deterministic) communication complexity of f? We address two aspects of this question. On the computational side, we prove that, under appropriate cryptographic assumptions (such as the intractability of factoring), the deterministic communication complexity of f is hard to approximate to within some constant. Under stronger (yet arguably reasonable) assumptions, we obtain even stronger hardness results that match the best known approximation. On the analytic side, we present a family of (two-argument) functions for which determining the deterministic communication complexity (or even obtaining non-trivial lower bounds on it) implies proving circuit lower bounds for some related functions. Such connections between circuit complexity and communication complexity were known before (Karchmer & Wigderson, 1988) only in the more involved context of relations (search problems) but not in the context of functions (decision problems). This result, in particular, may explain the difficulty of analyzing the communication complexity of certain functions such as the ""clique vs. independent-set"" family of functions, introduced by Yannakakis (1988)."
STOC,2009,475-482,Emanuele Viola,Bit-probe lower bounds for succinct data structures.,https://doi.org/10.1145/1536414.1536480,"We prove lower bounds on the redundancy necessary to represent a set S of objects using a number of bits close to the information-theoretic minimum log2 |S|, while answering various queries by probing few bits. Our main results are: To represent n ternary values t ∈ {0,1,2}n in terms of u bits b ∈ {0,1}u while accessing a single value ti ∈ {0,1,2} by probing q bits of b, one needs u ≥ (log2 3)n + n/2O(q). This matches an exciting representation by Patrascu (FOCS 2008), later refined with Thorup, where u ≤ (log_2 3)n + n/2Ω(q). We also note that results on logarithmic forms imply the lower bound u ≥ (log2 3)n + n/logO(1) n if we access ti by probing one cell of log n bits. To represent sets of size n/3 from a universe of n elements in terms of u bits b ∈ {0,1}u while answering membership queries by probing q bits of b, one needs u ≥ log2 n/(n/3) + n/2O(q) - log n. Both results above hold even if the probe locations are determined adaptively. Ours are the first lower bounds for these fundamental problems; we obtain them drawing on ideas used in lower bounds for locally decodable codes."
STOC,2009,483-492,"Per Austrin, Johan Håstad",Randomly supported independence and resistance.,https://doi.org/10.1145/1536414.1536481,"We prove that for any positive integer k, there is a constant ck such that a randomly selected set of ck nk log n Boolean vectors with high probability supports a balanced k-wise independent distribution. In the case of k ≤ 2 a more elaborate argument gives the stronger bound ck nk. Using a recent result by Austrin and Mossel this shows that a predicate on t bits, chosen at random among predicates accepting c2 t2 input vectors, is, assuming the Unique Games Conjecture, likely to be approximation resistant. These results are close to tight: we show that there are other constants, ck', such that a randomly selected set of cardinality ck' nk points is unlikely to support a balanced k-wise independent distribution and, for some c>0, a random predicate accepting ct2/log t input vectors is non-trivially approximable with high probability. In a different application of the result of Austrin and Mossel we prove that, again assuming the Unique Games Conjecture, any predicate on t bits accepting at least (32/33) • 2t inputs is approximation resistant. The results extend from the Boolean domain to larger finite domains."
