booktitle,year,pages,author,title,ee,abstract
STOC,2018,1,Irene Lo,Dynamic matching in school choice: efficient seat reassignment after late cancellations (invited talk).,https://doi.org/10.1145/3188745.3232193,"In the school choice market, where scarce public school seats are assigned to students, a key issue is how to reassign seats that are vacated after an initial round of centralized assignment. Every year around 10% of students assigned a seat in the NYC public high school system eventually do not use it, and their vacated seats can be reassigned. Practical solutions to the reassignment problem must be simple to implement, truthful and efficient. I propose and axiomatically justify a class of reassignment mechanisms, the Per- muted Lottery Deferred Acceptance (PLDA) mechanisms, which generalize the commonly used Deferred Acceptance (DA) school choice mechanism to a two-round setting and retain its desirable in- centive and efficiency properties. I also provide guidance to school districts as to how to choose the appropriate mechanism in this class for their setting. Centralized admissions are typically conducted in a single round using Deferred Acceptance, with a lottery used to break ties in each school’s prioritization of students. Our proposed PLDA mechanisms reassign vacated seats using a second round of DA with a lottery based on a suitable permutation of the first-round lottery numbers. I demonstrate that under a natural order condition on aggregate student demand for schools, the second-round tie-breaking lottery can be correlated arbitrarily with that of the first round without affecting allocative welfare. I also show how the identifying char- acteristic of PLDA mechanisms, their permutation, can be chosen to control reallocation. vacated after the initial round are reassigned using decentralized waitlists that create significant student movement after the start of the school year, which is costly for both students and schools. I show that reversing the lottery order between rounds minimizes reassignment among all PLDA mechanisms, allowing us to alleviate costly student movement between schools without affecting the ef- ficiency of the final allocation. In a setting without school priorities, I also characterize PLDA mechanisms as the class of mechanisms that provide students with a guarantee at their first-round assign- ment, respect school priorities, and are strategy-proof, constrained Pareto efficient, and satisfy some mild symmetry properties. Finally, I provide simulations of the performance of different PLDA mecha- nisms in the presence of school priorities. All simulated PLDAs have similar allocative efficiency, while the PLDA based on reversing the tie-breaking lottery between rounds minimizes the number of reassigned students. These results support our theoretical findings. This is based on joint work with Itai Feigenbaum, Yash Kanoria, and Jay Sethuraman."
STOC,2018,2,Tengyu Ma 0001,Generalization and equilibrium in generative adversarial nets (GANs) (invited talk).,https://doi.org/10.1145/3188745.3232194,"Generative Adversarial Networks (GANs) have become one of the dominant methods for fitting generative models to complicated real-life data, and even found unusual uses such as designing good cryptographic primitives. In this talk, we will first introduce the ba- sics of GANs and then discuss the fundamental statistical question about GANs — assuming the training can succeed with polynomial samples, can we have any statistical guarantees for the estimated distributions? In the work with Arora, Ge, Liang, and Zhang, we suggested a dilemma: powerful discriminators cause overfitting, whereas weak discriminators cannot detect mode collapse. Such a conundrum may be solved or alleviated by designing discrimina- tor class with strong distinguishing power against the particular generator class (instead of against all possible generators.)"
STOC,2018,3-16,"Sébastien Bubeck, Michael B. Cohen, Yin Tat Lee, James R. Lee, Aleksander Madry",k-server via multiscale entropic regularization.,https://doi.org/10.1145/3188745.3188798,"We present an O((logk)2)-competitive randomized algorithm for the k-server problem on hierarchically separated trees (HSTs). This is the first o(k)-competitive randomized algorithm for which the competitive ratio is independent of the size of the underlying HST. Our algorithm is designed in the framework of online mirror descent where the mirror map is a multiscale entropy. When combined with Bartal’s static HST embedding reduction, this leads to an O((logk)2 logn)-competitive algorithm on any n-point metric space. We give a new dynamic HST embedding that yields an O((logk)3 logΔ)-competitive algorithm on any metric space where the ratio of the largest to smallest non-zero distance is at most Δ."
STOC,2018,17-29,"Zhiyi Huang 0002, Ning Kang 0001, Zhihao Gavin Tang, Xiaowei Wu 0001, Yuhao Zhang 0001, Xue Zhu",How to match when all vertices arrive online.,https://doi.org/10.1145/3188745.3188858,"We introduce a fully online model of maximum cardinality matching in which all vertices arrive online. On the arrival of a vertex, its incident edges to previously-arrived vertices are revealed. Each vertex has a deadline that is after all its neighbors’ arrivals. If a vertex remains unmatched until its deadline, the algorithm must then irrevocably either match it to an unmatched neighbor, or leave it unmatched. The model generalizes the existing one-sided online model and is motivated by applications including ride-sharing platforms, real-estate agency, etc. We show that the Ranking algorithm by Karp et al. (STOC 1990) is 0.5211-competitive in our fully online model for general graphs. Our analysis brings a novel charging mechanic into the randomized primal dual technique by Devanur et al. (SODA 2013), allowing a vertex other than the two endpoints of a matched edge to share the gain. To our knowledge, this is the first analysis of Ranking that beats 0.5 on general graphs in an online matching problem, a first step towards solving the open problem by Karp et al. (STOC 1990) about the optimality of Ranking on general graphs. If the graph is bipartite, we show that the competitive ratio of Ranking is between 0.5541 and 0.5671. Finally, we prove that the fully online model is strictly harder than the previous model as no online algorithm can be 0.6317 < 1?1/e-competitive in our model even for bipartite graphs."
STOC,2018,30-43,"Sungjin Im, Nathaniel Kell, Debmalya Panigrahi, Maryam Shadloo",Online load balancing on related machines.,https://doi.org/10.1145/3188745.3188966,"In this paper, we consider the problem of assigning jobs online to machines with non-uniform speeds (also called related machines) so to optimize a given norm of the machine loads. A long line of work, starting with the seminal work of Graham in the 1960s, has led to tight competitive ratios for all ?q norms for two scenarios: the special case of identical machines (uniform machine speeds) and the more general setting of unrelated machines (jobs have arbitrary processing times on machines). For non-uniform machine speeds, however, the only known result was a constant competitive competitive ratio for the makespan (?∞) norm, via the so-called slowest-fit algorithm (Aspnes, Azar, Fiat, Plotkin, and Waarts, JACM ’97). Our first result in this paper is to obtain the first constant-competitive algorithm for scheduling on related machines for any arbitrary ?q norm.  Recent literature has further expanded the scope of this problem to vector scheduling, to capture multi-dimensional resource requirements in applications such as data centers. As in the scalar case, tight bounds are known for vector scheduling on identical and unrelated machines. Our second set of results is to give tight competitive ratios for vector scheduling on related machines for the makespan and all ?q norms. No previous bounds were known, even for the makespan norm, for related machines.  We employ a convex relaxation of the ?q-norm objective and use a continuous greedy algorithm to solve this convex program online. To round the fractional solution, we then use a novel restructuring of the instance that we call machine smoothing. This is a generic tool that reduces a problem on related machines to a set of problem instances on identical machines, and we hope it will be useful in other settings with non-uniform machine speeds as well."
STOC,2018,44-50,"Constantinos Daskalakis, Christos Tzamos, Manolis Zampetakis",A converse to Banach's fixed point theorem and its CLS-completeness.,https://doi.org/10.1145/3188745.3188968,"Banach's fixed point theorem for contraction maps has been widely used to analyze the convergence of iterative methods in non-convex problems. It is a common experience, however, that iterative maps fail to be globally contracting under the natural metric in their domain, making the applicability of Banach's theorem limited. We explore how generally we can apply Banach's fixed point theorem to establish the convergence of iterative methods when pairing it with carefully designed metrics. Our first result is a strong converse of Banach's theorem, showing that it is a universal analysis tool for establishing global convergence of iterative methods to unique fixed points, and for bounding their convergence rate. In other words, we show that, whenever an iterative map globally converges to a unique fixed point, there exists a metric under which the iterative map is contracting and which can be used to bound the number of iterations until convergence. We illustrate our approach in the widely used power method, providing a new way of bounding its convergence rate through contraction arguments.   We next consider the computational complexity of Banach's fixed point theorem. Making the proof of our converse theorem constructive, we show that computing a fixed point whose existence is guaranteed by Banach's fixed point theorem is CLS-complete. We thus provide the first natural complete problem for the class CLS, which was defined in [DP11] to capture the complexity of problems such as P-matrix LCP, computing KKT-points, and finding mixed Nash equilibria in congestion and network coordination games."
STOC,2018,51-64,"Aris Filos-Ratsikas, Paul W. Goldberg",Consensus halving is PPA-complete.,https://doi.org/10.1145/3188745.3188880,"We show that the computational problem Consensus Halving is PPA-Complete, the first PPA-Completeness result for a problem whose definition does not involve an explicit circuit. We also show that an approximate version of this problem is polynomial-time equivalent to Necklace Splitting, which establishes PPAD-hardness for Necklace Splitting and suggests that it is also PPA-Complete."
STOC,2018,65-73,"Mikkel Abrahamsen, Anna Adamaszek, Tillmann Miltzow",The art gallery problem is ? ?-complete.,https://doi.org/10.1145/3188745.3188868,"Given a simple polygon P, we say that two points p, q∈ P see each other if the line segment pq is contained in P. A set of points G? P is said to guard the polygon P if every point p∈ P is seen by at least one guard д∈ G. Such a set G is called a guard set of P, and the points of G are called guards. A guard set of P is optimal if it is a minimum cardinality guard set of P. In the Art Gallery Problem (AGP), we are given an integer д and a polygon P with corners at rational coordinates, and the goal is to decide if P has a guard set of cardinality д. We consider a polygon as a Jordan curve consisting of finitely many line segments and the region that it encloses. The AGP has been introduced in 1973 by Victor Klee, and it has stimulated extensive research in geometry and in algorithms. However, the complexity status of the AGP has stayed unresolved. We are going to prove that the problem is? R-complete, as defined below."
STOC,2018,74-86,"Mark Bun, Cynthia Dwork, Guy N. Rothblum, Thomas Steinke 0002",Composable and versatile privacy via truncated CDP.,https://doi.org/10.1145/3188745.3188946,"We propose truncated concentrated differential privacy (tCDP), a refinement of differential privacy and of concentrated differential privacy. This new definition provides robust and efficient composition guarantees, supports powerful algorithmic techniques such as privacy amplification via sub-sampling, and enables more accurate statistical analyses. In particular, we show a central task for which the new definition enables exponential accuracy improvement."
STOC,2018,87-99,"Bartlomiej Dudek 0001, Adrian Kosowski",Universal protocols for information dissemination using emergent signals.,https://doi.org/10.1145/3188745.3188818,"We consider a population of n agents which communicate with each other in a decentralized manner, through random pairwise interactions. One or more agents in the population may act as authoritative sources of information, and the objective of the remaining agents is to obtain information from or about these source agents. We study two basic tasks: broadcasting, in which the agents are to learn the bit-state of an authoritative source which is present in the population, and source detection, in which the agents are required to decide if at least one source agent is present in the population or not.  We focus on designing protocols which meet two natural conditions: (1) universality, i.e., independence of population size, and (2) rapid convergence to a correct global state after a reconfiguration, such as a change in the state of a source agent. Our main positive result is to show that both of these constraints can be met. For both the broadcasting problem and the source detection problem, we obtain solutions with an expected convergence time of O(logn), from any starting configuration. The solution to broadcasting is exact, which means that all agents reach the state broadcast by the source, while the solution to source detection admits one-sided error on a ε-fraction of the population (which is unavoidable for this problem). Both protocols are easy to implement in practice and are self-stabilizing, in the sense that the stated bounds on convergence time hold starting from any possible initial configuration of the system.  Our protocols exploit the properties of self-organizing oscillatory dynamics. On the hardness side, our main structural insight is to prove that any protocol which meets the constraints of universality and of rapid convergence after reconfiguration must display a form of non-stationary behavior (of which oscillatory dynamics are an example). We also observe that the periodicity of the oscillatory behavior of the protocol, when present, must necessarily depend on the number #X of source agents present in the population. For instance, our protocols inherently rely on the emergence of a signal passing through the population, whose period is Θ(log(n/#X)) rounds for most starting configurations. The design of phase clocks with tunable frequency may be of independent interest, notably in modeling biological networks."
STOC,2018,100-113,"Hamed Omidvar, Massimo Franceschetti",Shape of diffusion and size of monochromatic region of a two-dimensional spin system.,https://doi.org/10.1145/3188745.3188836,"We consider an agent-based distributed algorithm with exponentially distributed waiting times in which agents with binary states interact locally over a geometric graph, and based on this interaction and on the value of a common intolerance threshold τ, decide whether to change their states. This model is equivalent to an Asynchronous Cellular Automaton (ACA) with extended Moore neighborhoods, a zero-temperature Ising model with Glauber dynamics, or a Schelling model of self-organized segregation in an open system, and has applications in the analysis of social and biological networks, and spin glasses systems.  We prove a shape theorem for the spread of the “affected” nodes during the process dynamics and show that in the steady state, for τ ∈ (τ*,1?τ*) ? {1/2}, where τ* ≈ 0.488, the size of the “mono-chromatic region” at the end of the process is at least exponential in the size of the local neighborhood of interaction with probability approaching one as N grows. Combined with previous results on the expected size of the monochromatic region that provide a matching upper bound, this implies that in the steady state the size of the monochromatic region of any agent is exponential with high probability for the mentioned interval of τ. The shape theorem is based on a novel concentration inequality for the spreading time, and provides a precise geometrical description of the process dynamics. The result on the size of the monochromatic region considerably extends our understanding of the steady state. Showing convergence with high probability, it rules out the possibility that only a small fraction of the nodes are eventually contained in large monochromatic regions, which was left open by previous works."
STOC,2018,114-122,"Thodoris Lykouris, Vahab S. Mirrokni, Renato Paes Leme",Stochastic bandits robust to adversarial corruptions.,https://doi.org/10.1145/3188745.3188918,"We introduce a new model of stochastic bandits with adversarial corruptions which aims to capture settings where most of the input follows a stochastic pattern but some fraction of it can be adversarially changed to trick the algorithm, e.g., click fraud, fake reviews and email spam. The goal of this model is to encourage the design of bandit algorithms that (i) work well in mixed adversarial and stochastic models, and (ii) whose performance deteriorates gracefully as we move from fully stochastic to fully adversarial models.  In our model, the rewards for all arms are initially drawn from a distribution and are then altered by an adaptive adversary. We provide a simple algorithm whose performance gracefully degrades with the total corruption the adversary injected in the data, measured by the sum across rounds of the biggest alteration the adversary made in the data in that round; this total corruption is denoted by C. Our algorithm provides a guarantee that retains the optimal guarantee (up to a logarithmic term) if the input is stochastic and whose performance degrades linearly to the amount of corruption C, while crucially being agnostic to it. We also provide a lower bound showing that this linear degradation is necessary if the algorithm achieves optimal performance in the stochastic setting (the lower bound works even for a known amount of corruption, a special case in which our algorithm achieves optimal performance without the extra logarithm)."
STOC,2018,123-131,Yannai A. Gonczarowski,Bounding the menu-size of approximately optimal auctions via optimal-transport duality.,https://doi.org/10.1145/3188745.3188786,"The question of the minimum menu-size for approximate (i.e., up-to-ε) Bayesian revenue maximization when selling two goods to an additive risk-neutral quasilinear buyer was introduced by Hart and Nisan [2013], who give an upper bound of O(1/ε4) for this problem. Using the optimal-transport duality framework of Daskalakis, Deckelbaum, and Tzamos [2013, 2015], we derive the first lower bound for this problem — of Ω(1/?ε), even when the values for the two goods are drawn i.i.d. from ”nice” distributions, establishing how to reason about approximately optimal mechanisms via this duality framework. This bound implies, for any fixed number of goods, a tight bound of Θ(log1/ε) on the minimum deterministic communication complexity guaranteed to suffice for running some approximately revenue-maximizing mechanism, thereby completely resolving this problem. As a secondary result, we show that under standard economic assumptions on distributions, the above upper bound of Hart and Nisan [2013] can be strengthened to O(1/ε2)."
STOC,2018,132-137,"Darrell Hoy, Samuel Taggart, Zihe Wang 0001",A tighter welfare guarantee for first-price auctions.,https://doi.org/10.1145/3188745.3188944,"This paper proves that the welfare of the first price auction in Bayes-Nash equilibrium is at least a .743-fraction of the welfare of the optimal mechanism assuming agents’ values are independently distributed. The previous best bound was 1?1/e≈.63, derived using smoothness, the standard technique for reasoning about welfare of games in equilibrium. In the worst known example, the first price auction achieves a ≈.869-fraction of the optimal welfare, far better than the theoretical guarantee. Despite this large gap, it was unclear whether the 1?1/e bound was tight. We prove that it is not. Our analysis eschews smoothness, and instead uses the independence assumption on agents’ value distributions to give a more careful accounting of the welfare contribution of agents who win despite not having the highest value."
STOC,2018,138-150,"Daniel Neuen, Pascal Schweitzer",An exponential lower bound for individualization-refinement algorithms for graph isomorphism.,https://doi.org/10.1145/3188745.3188900,"The individualization-refinement paradigm provides a strong toolbox for testing isomorphism of two graphs and indeed, the currently fastest implementations of isomorphism solvers all follow this approach. While these solvers are fast in practice, from a theoretical point of view, no general lower bounds concerning the worst case complexity of these tools are known. In fact, it is an open question what the running time of individualization-refinement algorithms is. For all we know some of the algorithms could have polynomial running time.  In this work we give a negative answer to this question and construct a family of graphs on which algorithms based on the individualization-refinement paradigm require exponential time. Contrary to a previous construction of Miyazaki, that only applies to a specific implementation within the individualization-refinement framework, our construction is immune to changing the cell selector, the refinement operator, the invariant that is used, or adding various heuristic invariants to the algorithm. In fact, our graphs also provide exponential lower bounds in the case when the k-dimensional Weisfeiler-Leman algorithm is used to replace the the 1-dimensional Weisfeiler-Leman algorithm (often called color refinement) that is normally used. Finally, the arguments even work when the entire automorphism group of the inputs is initially provided to the algorithm. The arguments apply to isomorphism testing algorithms as well as canonization algorithms within the framework."
STOC,2018,151-164,"Cornelius Brand, Holger Dell, Thore Husfeldt",Extensor-coding.,https://doi.org/10.1145/3188745.3188902,"We devise an algorithm that approximately computes the number of paths of length?k in a given directed graph with?n vertices up to a multiplicative error of 1 ± ε. Our algorithm runs in time ε?2 4k(n+m) poly(k). The algorithm is based on associating with each vertex an element in the exterior (or, Grassmann) algebra, called an extensor, and then performing computations in this algebra. This connection to exterior algebra generalizes a number of previous approaches for the longest path problem and is of independent conceptual interest. Using this approach, we also obtain a deterministic 2k·poly(n) time algorithm to find a?k-path in a given directed graph that is promised to have few of them. Our results and techniques generalize to the subgraph isomorphism problem when the subgraphs we are looking for have bounded pathwidth. Finally, we also obtain a randomized algorithm to detect k-multilinear terms in a multivariate polynomial given as a general algebraic circuit. To the best of our knowledge, this was previously only known for algebraic circuits not involving negative constants."
STOC,2018,165-171,"Krzysztof Onak, Xiaorui Sun",The query complexity of graph isomorphism: bypassing distribution testing lower bounds.,https://doi.org/10.1145/3188745.3188952,"We study the query complexity of graph isomorphism in the property testing model for dense graphs. We give an algorithm that makes n1+o(1) queries, improving on the previous best bound of ?(n5/4). Since the problem is known to require Ω(n) queries, our algorithm is optimal up to a subpolynomial factor.  While trying to extend a known connection to distribution testing, discovered by Fischer and Matsliah (SICOMP 2008), one encounters a natural obstacle presented by sampling lower bounds such as the Ω(n2/3)-sample lower bound for distribution closeness testing (Valiant, SICOMP 2011). In the context of graph isomorphism testing, these bounds lead to an n1+Ω(1) barrier for Fischer and Matsliah’s approach. We circumvent this and other limitations by exploiting a geometric representation of the connectivity of vertices. An approximate representation of similarities between vertices can be learned with a near-linear number of queries and allows relaxed versions of sampling and distribution testing problems to be solved more efficiently."
