booktitle,year,pages,author,title,ee,abstract
STOC,2018,699-708,"Tianren Liu, Vinod Vaikuntanathan",Breaking the circuit-size barrier in secret sharing.,https://doi.org/10.1145/3188745.3188936,"We study secret sharing schemes for general (non-threshold) access structures. A general secret sharing scheme for n parties is associated to a monotone function F:{0,1}n→{0,1}. In such a scheme, a dealer distributes shares of a secret s among n parties. Any subset of parties T ? [n] should be able to put together their shares and reconstruct the secret s if F(T)=1, and should have no information about s if F(T)=0. One of the major long-standing questions in information-theoretic cryptography is to minimize the (total) size of the shares in a secret-sharing scheme for arbitrary monotone functions F.  There is a large gap between lower and upper bounds for secret sharing. The best known scheme for general F has shares of size 2n?o(n), but the best lower bound is Ω(n2/logn). Indeed, the exponential share size is a direct result of the fact that in all known secret-sharing schemes, the share size grows with the size of a circuit (or formula, or monotone span program) for F. Indeed, several researchers have suggested the existence of a representation size barrier which implies that the right answer is closer to the upper bound, namely, 2n?o(n).  In this work, we overcome this barrier by constructing a secret sharing scheme for any access structure with shares of size 20.994n and a linear secret sharing scheme for any access structure with shares of size 20.999n. As a contribution of independent interest, we also construct a secret sharing scheme with shares of size 2?(√n) for 2n n/2 monotone access structures, out of a total of 2n n/2· (1+O(logn/n)) of them. Our construction builds on recent works that construct better protocols for the conditional disclosure of secrets (CDS) problem."
STOC,2018,709-721,"Saikrishna Badrinarayanan, Yael Tauman Kalai, Dakshita Khurana, Amit Sahai, Daniel Wichs",Succinct delegation for low-space non-deterministic computation.,https://doi.org/10.1145/3188745.3188924,"We construct a delegation scheme for verifying non-deterministic computations, with complexity proportional only to the non-deterministic space of the computation. Specifically, letting n denote the input length, we construct a delegation scheme for any language verifiable in non-deterministic time and space (T(n), S(n)) with communication complexity poly(S(n)), verifier runtime n.polylog(T(n))+poly(S(n)), and prover runtime poly(T(n)).   Our scheme consists of only two messages and has adaptive soundness, assuming the existence of a sub-exponentially secure private information retrieval (PIR) scheme, which can be instantiated under standard (albeit, sub-exponential) cryptographic assumptions, such as the sub-exponential LWE assumption. Specifically, the verifier publishes a (short) public key ahead of time, and this key can be used by any prover to non-interactively prove the correctness of any adaptively chosen non-deterministic computation. Such a scheme is referred to as a non-interactive delegation scheme. Our scheme is privately verifiable, where the verifier needs the corresponding secret key in order to verify proofs.   Prior to our work, such results were known only in the Random Oracle Model, or under knowledge assumptions. Our results yield succinct non-interactive arguments based on sub-exponential LWE, for many natural languages believed to be outside of P."
STOC,2018,722-734,"Talya Eden, Dana Ron, C. Seshadhri 0001",On approximating the number of k-cliques in sublinear time.,https://doi.org/10.1145/3188745.3188810,"We study the problem of approximating the number of k-cliques in a graph when given query access to the graph. We consider the standard query model for general graphs via (1) degree queries, (2) neighbor queries and (3) pair queries. Let n denote the number of vertices in the graph, m the number of edges, and Ck the number of k-cliques. We design an algorithm that outputs a (1+ε)-approximation (with high probability) for Ck, whose expected query complexity and running time are O(n/Ck1/k+mk/2/Ck )(logn, 1/ε,k).  Hence, the complexity of the algorithm is sublinear in the size of the graph for Ck = ω(mk/2?1). Furthermore, we prove a lower bound showing that the query complexity of our algorithm is essentially optimal (up to the dependence on logn, 1/ε and k).  The previous results in this vein are by Feige (SICOMP 06) and by Goldreich and Ron (RSA 08) for edge counting (k=2) and by Eden et al. (FOCS 2015) for triangle counting (k=3). Our result matches the complexities of these results.  The previous result by Eden et al. hinges on a certain amortization technique that works only for triangle counting, and does not generalize for larger cliques. We obtain a general algorithm that works for any k≥ 3 by designing a procedure that samples each k-clique incident to a given set S of vertices with approximately equal probability. The primary difficulty is in finding cliques incident to purely high-degree vertices, since random sampling within neighbors has a low success probability. This is achieved by an algorithm that samples uniform random high degree vertices and a careful tradeoff between estimating cliques incident purely to high-degree vertices and those that include a low-degree vertex."
STOC,2018,735-748,"Clément L. Canonne, Ilias Diakonikolas, Daniel M. Kane, Alistair Stewart",Testing conditional independence of discrete distributions.,https://doi.org/10.1145/3188745.3188756,"We study the problem of testing *conditional independence* for discrete distributions. Specifically, given samples from a discrete random variable (X, Y, Z) on domain [?1]×[?2] × [n], we want to distinguish, with probability at least 2/3, between the case that X and Y are conditionally independent given Z from the case that (X, Y, Z) is ?-far, in ?1-distance, from every distribution that has this property. Conditional independence is a concept of central importance in probability and statistics with important applications in various scientific domains. As such, the statistical task of testing conditional independence has been extensively studied in various forms within the statistics and econometrics community for nearly a century. Perhaps surprisingly, this problem has not been previously considered in the framework of distribution property testing and in particular no tester with *sublinear* sample complexity is known, even for the important special case that the domains of X and Y are binary.  The main algorithmic result of this work is the first conditional independence tester with sublinear sample complexity. To complement our upper bound, we prove information-theoretic lower bounds establishing that the sample complexity of our algorithm is optimal, up to constant factors, for a number of settings. Specifically, for the prototypical setting when ?1, ?2 = O(1), we show that the sample complexity of testing conditional independence (upper bound and matching lower bound) is [complex formula not displayed]  We also achieve sublinear sample complexity for the general case of arbitrary ?1, ?2, and n. To obtain our tester, we employ a variety of tools, including (1) a subtle weighted adaptation of the ”flattening” technique, and (2) the design and analysis of an optimal (unbiased) estimator for the following statistical problem of independent interest: Given a degree-d polynomial Q∶?n → ? and sample access to a distribution p over [n], estimate Q(p1, …, pn) up to small additive error. Obtaining tight variance analyses for specific estimators of this form has been a major technical hurdle in distribution testing. As an important contribution of this work, we develop a general theory providing tight variance bounds for *all* such estimators."
STOC,2018,749-759,"Zhengyang Liu 0002, Xi Chen 0001, Rocco A. Servedio, Ying Sheng 0004, Jinyu Xie",Distribution-free junta testing.,https://doi.org/10.1145/3188745.3188842,"We study the problem of testing whether an unknown n-variable Boolean function is a k-junta in the distribution-free property testing model, where the distance between functions is measured with respect to an arbitrary and unknown probability distribution over {0,1}n. Our first main result is that distribution-free k-junta testing can be performed, with one-sided error, by an adaptive algorithm that uses ?(k2)/ε queries (independent of n). Complementing this, our second main result is a lower bound showing that any non-adaptive distribution-free k-junta testing algorithm must make Ω(2k/3) queries even to test to accuracy ε = 1/3. These bounds establish that while the optimal query complexity of non-adaptive k-junta testing is 2Θ(k), for adaptive testing it is poly(k), and thus show that adaptivity provides an exponential improvement in the distribution-free query complexity of testing juntas."
STOC,2018,760-772,"Lior Gishboliner, Asaf Shapira",A generalized Turán problem and its applications.,https://doi.org/10.1145/3188745.3188778,"Our first theorem in this paper is a hierarchy theorem for the query complexity of testing graph properties with 1-sided error; more precisely, we show that for every sufficiently fast-growing function f, there is a graph property whose 1-sided-error query complexity is precisely f(Θ(1/ε)). No result of this type was previously known for any f which is super-polynomial. Goldreich [ECCC 2005] asked to exhibit a graph property whose query complexity is 2Θ(1/ε). Our hierarchy theorem partially resolves this problem by exhibiting a property whose 1-sided-error query complexity is 2Θ(1/ε). We also use our hierarchy theorem in order to resolve a problem raised by the second author and Alon [STOC 2005] regarding testing relaxed versions of bipartiteness.  Our second theorem states that for any function f there is a graph property whose 1-sided-error query complexity is f(Θ(1/ε)) while its 2-sided-error query complexity is only poly(1/ε). This is the first indication of the surprising power that 2-sided-error testing algorithms have over 1-sided-error ones, even when restricted to properties that are testable with 1-sided error. Again, no result of this type was previously known for any f that is super polynomial.  The above theorems are derived from a graph theoretic result which we think is of independent interest, and might have further applications. Alon and Shikhelman [JCTB 2016] introduced the following generalized Turán problem: for fixed graphs H and T, and an integer n, what is the maximum number of copies of T, denoted by ex(n,T,H), that can appear in an n-vertex H-free graph? This problem received a lot of attention recently, with an emphasis on ex(n,C3,C2? +1). Our third theorem in this paper gives tight bounds for ex(n,Ck,C?) for all the remaining values of k and ?."
STOC,2018,773-786,"Tali Kaufman, Izhar Oppenheim",Construction of new local spectral high dimensional expanders.,https://doi.org/10.1145/3188745.3188782,"High dimensional expanders is a vibrant emerging field of study. Nevertheless, the only known construction of bounded degree high dimensional expanders is based on Ramanujan complexes, whereas one dimensional bounded degree expanders are abundant.   In this work we construct new families of bounded degree high dimensional expanders obeying the local spectral expansion property. A property that implies, geometric overlapping, fast mixing of high dimensional random walks, agreement testing and agreement expansion. The construction also yields new families of expander graphs.   The construction is quite elementary and it is presented in a self contained manner; This is in contrary to the highly involved construction of the Ramanujan complexes. The construction is also strongly symmetric; The symmetry of the construction could be used, for example, to obtain good symmetric LDPC codes that were previously based on Ramanujan graphs."
STOC,2018,787-800,"Alexandr Andoni, Assaf Naor, Aleksandar Nikolov, Ilya P. Razenshteyn, Erik Waingarten",Data-dependent hashing via nonlinear spectral gaps.,https://doi.org/10.1145/3188745.3188846,"We establish a generic reduction from _nonlinear spectral gaps_ of metric spaces to data-dependent Locality-Sensitive Hashing, yielding a new approach to the high-dimensional Approximate Near Neighbor Search problem (ANN) under various distance functions. Using this reduction, we obtain the following results:  * For _general_ d-dimensional normed spaces and n-point datasets, we obtain a _cell-probe_ ANN data structure with approximation O(logd/ε2), space dO(1) n1+ε, and dO(1)nε cell probes per query, for any ε>0. No non-trivial approximation was known before in this generality other than the O(√d) bound which follows from embedding a general norm into ?2. * For ?p and Schatten-p norms, we improve the data structure further, to obtain approximation O(p) and sublinear query _time_. For ?p, this improves upon the previous best approximation 2O(p) (which required polynomial as opposed to near-linear in n space). For the Schatten-p norm, no non-trivial ANN data structure was known before this work.  Previous approaches to the ANN problem either exploit the low dimensionality of a metric, requiring space exponential in the dimension, or circumvent the curse of dimensionality by embedding a metric into a ”tractable” space, such as ?1. Our new generic reduction proceeds differently from both of these approaches using a novel partitioning method."
STOC,2018,801-814,"László Kozma 0002, Thatchaphol Saranurak",Smooth heaps and a dual view of self-adjusting data structures.,https://doi.org/10.1145/3188745.3188864,"We present a new connection between self-adjusting binary search trees (BSTs) and heaps, two fundamental, extensively studied, and practically relevant families of data structures (Allen,Munro, 1978; Sleator, Tarjan, 1983; Fredman, Sedgewick, Sleator, Tarjan, 1986; Wilber, 1989; Fredman, 1999; Iacono, ?zkan, 2014). Roughly speaking, we map an arbitrary heap algorithm within a broad and natural model, to a corresponding BST algorithm with the same cost on a dual sequence of operations (i.e. the same sequence with the roles of time and key-space switched). This is the first general transformation between the two families of data structures.   There is a rich theory of dynamic optimality for BSTs (i.e. the theory of competitiveness between BST algorithms). The lack of an analogous theory for heaps has been noted in the literature (e.g. Pettie; 2005, 2008). Through our connection, we transfer all instance-specific lower bounds known for BSTs to a general model of heaps, initiating a theory of dynamic optimality for heaps.   On the algorithmic side, we obtain a new, simple and efficient heap algorithm, which we call the smooth heap. We show the smooth heap to be the heap-counterpart of Greedy, the BST algorithm with the strongest proven and conjectured properties from the literature, conjectured to be instance-optimal (Lucas, 1988; Munro, 2000; Demaine et al., 2009). Assuming the optimality of Greedy, the smooth heap is also optimal within our model of heap algorithms.   Intriguingly, the smooth heap, although derived from a non-practical BST algorithm, is simple and easy to implement (e.g. it stores no auxiliary data besides the keys and tree pointers). It can be seen as a variation on the popular pairing heap data structure, extending it with a “power-of-two-choices” type of heuristic. For the smooth heap we obtain instance-specific upper bounds, with applications in adaptive sorting, and we see it as a promising candidate for the long-standing question of a simpler alternative to Fibonacci heaps."
STOC,2018,815-826,"Sepehr Assadi, Krzysztof Onak, Baruch Schieber, Shay Solomon",Fully dynamic maximal independent set with sublinear update time.,https://doi.org/10.1145/3188745.3188922,"A maximal independent set (MIS) can be maintained in an evolving m-edge graph by simply recomputing it from scratch in O(m) time after each update. But can it be maintained in time sublinear in m in fully dynamic graphs?  We answer this fundamental open question in the affirmative. We present a deterministic algorithm with amortized update time O(min{Δ,m3/4}), where Δ is a fixed bound on the maximum degree in the graph and m is the (dynamically changing) number of edges.  We further present a distributed implementation of our algorithm with O(min{Δ,m3/4}) amortized message complexity, and O(1) amortized round complexity and adjustment complexity (the number of vertices that change their output after each update). This strengthens a similar result by Censor-Hillel, Haramaty, and Karnin (PODC’16) that required an assumption of a non-adaptive oblivious adversary."
STOC,2018,827-840,"Dominik Kempa, Nicola Prezza",At the roots of dictionary compression: string attractors.,https://doi.org/10.1145/3188745.3188814,"A well-known fact in the field of lossless text compression is that high-order entropy is a weak model when the input contains long repetitions. Motivated by this fact, decades of research have generated myriads of so-called dictionary compressors: algorithms able to reduce the text’s size by exploiting its repetitiveness. Lempel-Ziv 77 is one of the most successful and well-known tools of this kind, followed by straight-line programs, run-length Burrows-Wheeler transform, macro schemes, collage systems, and the compact directed acyclic word graph. In this paper, we show that these techniques are different solutions to the same, elegant, combinatorial problem: to find a small set of positions capturing all distinct text’s substrings. We call such a set a string attractor. We first show reductions between dictionary compressors and string attractors. This gives the approximation ratios of dictionary compressors with respect to the smallest string attractor and allows us to uncover new asymptotic relations between the output sizes of different dictionary compressors. We then show that the k-attractor problem — deciding whether a text has a size-t set of positions capturing all substrings of length at most k — is NP-complete for k≥ 3. This, in particular, includes the full string attractor problem. We provide several approximation techniques for the smallest k-attractor, show that the problem is APX-complete for constant k, and give strong inapproximability results. To conclude, we provide matching lower and upper bounds for the random access problem on string attractors. The upper bound is proved by showing a data structure supporting queries in optimal time. Our data structure is universal: by our reductions to string attractors, it supports random access on any dictionary-compression scheme. In particular, it matches the lower bound also on LZ77, straight-line programs, collage systems, and macro schemes, and therefore essentially closes (at once) the random access problem for all these compressors."
STOC,2018,841-854,"Bernhard Haeupler, Amirbehshad Shahrasbi","Synchronization strings: explicit constructions, local decoding, and applications.",https://doi.org/10.1145/3188745.3188940,"This paper gives new results for synchronization strings, a powerful combinatorial object introduced by [Haeupler, Shahrasbi; STOC’17] that allows to efficiently deal with insertions and deletions in various communication problems:  - We give a deterministic, linear time synchronization string construction, improving over an O(n5) time randomized construction. Independently of this work, a deterministic O(n log2 logn) time construction was proposed by Cheng, Li, and Wu.  - We give a deterministic construction of an infinite synchronization string which outputs the first n symbols in O(n) time. Previously it was not known whether such a string was computable.  - Both synchronization string constructions are highly explicit, i.e., the ith symbol can be deterministically computed in O(logi) time.  - This paper also introduces a generalized notion we call long-distance synchronization strings. Such strings allow for local and very fast decoding. In particular only O(log3 n) time and access to logarithmically many symbols is required to decode any index.  The paper also provides several applications for these improved synchronization strings:  - For any δ < 1 and ? > 0 we provide an insdel error correcting block code with rate 1 ? δ ? ? which can correct any δ/3 fraction of insertion and deletion errors in O(n log3 n) time. This near linear computational efficiency is surprising given that we do not even know how to compute the (edit) distance between the decoding input and output in sub-quadratic time.  - We show that local decodability implies that error correcting codes constructed with long-distance synchronization strings can not only efficiently recover from δ fraction of insdel errors but, similar to [Schulman, Zuckerman; TransInf’99], also from any O(δ / logn) fraction of block transpositions and block replications. These block corruptions allow arbitrarily long substrings to be swapped or replicated anywhere.  - We show that highly explicitness and local decoding allow for infinite channel simulations with exponentially smaller memory and decoding time requirements. These simulations can then be used to give the first near linear time interactive coding scheme for insdel errors, similar to the result of [Brakerski, Naor; SODA’13] for Hamming errors."
STOC,2018,855-865,Roei Tell,Quantified derandomization of linear threshold circuits.,https://doi.org/10.1145/3188745.3188822,"One of the prominent current challenges in complexity theory is the attempt to prove lower bounds for TC0, the class of constant-depth, polynomial-size circuits with majority gates. Relying on the results of Williams (2013), an appealing approach to prove such lower bounds is to construct a non-trivial derandomization algorithm for TC0. In this work we take a first step towards the latter goal, by proving the first positive results regarding the derandomization of TC0 circuits of depth d>2.  Our first main result is a quantified derandomization algorithm for TC0 circuits with a super-linear number of wires. Specifically, we construct an algorithm that gets as input a TC0 circuit C over n input bits with depth d and n1+exp(?d) wires, runs in almost-polynomial-time, and distinguishes between the case that C rejects at most 2n1?1/5d inputs and the case that C accepts at most 2n1?1/5d inputs. In fact, our algorithm works even when the circuit C is a linear threshold circuit, rather than just a TC0 circuit (i.e., C is a circuit with linear threshold gates, which are stronger than majority gates).  Our second main result is that even a modest improvement of our quantified derandomization algorithm would yield a non-trivial algorithm for standard derandomization of all of TC0, and would consequently imply that NEXP?TC0. Specifically, if there exists a quantified derandomization algorithm that gets as input a TC0 circuit with depth d and n1+O(1/d) wires (rather than n1+exp(?d) wires), runs in time at most 2nexp(?d), and distinguishes between the case that C rejects at most 2n1?1/5d inputs and the case that C accepts at most 2n1?1/5d inputs, then there exists an algorithm with running time 2n1?Ω(1) for standard derandomization of TC0."
STOC,2018,866-877,"Albert Atserias, Ilario Bonacina, Susanna F. de Rezende, Massimo Lauria, Jakob Nordstr?m, Alexander A. Razborov",Clique is hard on average for regular resolution.,https://doi.org/10.1145/3188745.3188856,We prove that for k ? 4√n regular resolution requires length nΩ(k) to establish that an Erd?s–Rényi graph with appropriately chosen edge density does not contain a k-clique. This lower bound is optimal up to the multiplicative constant in the exponent and also implies unconditional nΩ(k) lower bounds on running time for several state-of-the-art algorithms for finding maximum cliques in graphs.
STOC,2018,878-889,"Christian Ikenmeyer, Balagopal Komarath, Christoph Lenzen 0001, Vladimir Lysikov, Andrey Mokhov, Karteek Sreenivasaiah",On the complexity of hazard-free circuits.,https://doi.org/10.1145/3188745.3188912,"The problem of constructing hazard-free Boolean circuits dates back to the 1940s and is an important problem in circuit design. Our main lower-bound result unconditionally shows the existence of functions whose circuit complexity is polynomially bounded while every hazard-free implementation is provably of exponential size. Previous lower bounds on the hazard-free complexity were only valid for depth 2 circuits. The same proof method yields that every subcubic implementation of Boolean matrix multiplication must have hazards. These results follow from a crucial structural insight: Hazard-free complexity is a natural generalization of monotone complexity to all (not necessarily monotone) Boolean functions. Thus, we can apply known monotone complexity lower bounds to find lower bounds on the hazard-free complexity. We also lift these methods from the monotone setting to prove exponential hazard-free complexity lower bounds for non-monotone functions. As our main upper-bound result, we show how to efficiently convert a Boolean circuit into a bounded-bit hazard-free circuit with only a polynomially large blow-up in the number of gates. Previously, the best known method yielded exponentially large circuits in the worst case, so our algorithm gives an exponential improvement. As a side result, we establish the NP-completeness of several hazard detection problems."
