booktitle,year,pages,author,title,ee,abstract
STOC,2005,1-10,"Boaz Barak, Guy Kindler, Ronen Shaltiel, Benny Sudakov, Avi Wigderson","Simulating independence: new constructions of condensers, ramsey graphs, dispersers, and extractors.",https://doi.org/10.1145/1060590.1060592,"A distribution X over binary strings of length n has min-entropy k if every string has probability at most 2-k in X. We say that X is a δ-source if its rate k⁄n is at least δ.We give the following new explicit instructions (namely, poly(n)- time computable functions) of deterministicextractors, dispersers and related objects. All work for any fixed rate δ>0. No previous explicit construction was known for either of these, for any δ‹1⁄2. The first two constitute major progress to very long-standing open problems. Bipartite Ramsey f1: (0,1)n)2 →0,1, such that for any two independent δ-sources X1, X2 we have f1(X1,X2) = 0,1 This implies a new explicit construction of 2N-vertex bipartite graphs where no induced Nδ by Nδ subgraph is complete or empty. Multiple source extraction f2: (0,1n)3→0,1 such that for any three independent δ-sources X1,X2,X3 we have that f2(X1,X2,X3) is (o(1)-close to being) an unbiased random bit. Constant seed condenser2 f3: n →(0,1m)c, such that for any δ-source X, one of the c output distributions f3(X)i, is a 0.9-source over 0,1m. Here c is a constant depending only on δ.Subspace Ramsey f4: 0,1n→0,1 such that for any affine-δ-source3 X we have f4(X)= 0,1.The constructions are quite involved and use as building blocks other new and known gadgets. But we can point out two important themes which recur in these constructions. One is that gadgets which were designed to work with independent inputs, sometimes perform well enough with correlated, high entropy inputs. The second is using the input to (introspectively) find high entropy regions within itself."
STOC,2005,11-20,Ran Raz,Extractors with weak random seeds.,https://doi.org/10.1145/1060590.1060593,"We show how to extract random bits from two or more independent weak random sources in cases where only one source is of linear min-entropy and all other sources are of logarithmic min-entropy. Our main results are as follows: A long line of research, starting by Nisan and Zuckerman[14], gives explicit constructions of seeded-extractors, that is, extractors that use a short seed of truly random bits to extract randomness from a weak random source. For every such extractor E, with seed of length d, we construct an extractor E′, with seed of length d′=O(d), that achieves the same parameters as E but only requires the seed to be of min-entropy larger than (1⁄2+δ) •d′ (rather than fully random), where δ is an arbitrary small constant. Fundamental results of Chor and Goldreich and Vazirani [6,21] show how to extract Ω(n) random bits from two (independent) sources of length n and min-entropy larger than (1⁄2δ) • n, where δ is an arbitrary small constant. We show how to extract Ω(n) random bits (with optimal probability of error) when only one source is of min-entropy (1⁄2+δ) •n and the other source is of logarithmic min entropy.3 A recent breakthrough of Barak, Impagliazzo and Wigderson[4] shows how to extract Ω(n) random bits from a constant number of (independent) sources of length n and min-entropy larger than δ n, where δ is an arbitrary small constant. We show how to extract Ω (n) random bits (with optimal probability of error) when only one source is of min-entropy δ n and all other (constant number of) sources are of logarithmic min-entropy.A very recent result of Barak, Kindler, Shaltiel, Sudakov and Wigderson[5] shows how to extract a constant number of random bits from three (independent) sources of length n and min-entropy larger than δn, where δ is an arbitrary small constant. We show how to extract Ω(n)/ random bits, with sub-constant probability of error, from one source of min-entropy δ n and two sources of logarithmic min-entropy.In the same paper, Barak, Kindler, Shaltiel, Sudakov and Wigderson[5] give an explicit coloring of the complete bipartite graph of size 2n x 2n with two colors, such that there is no monochromatic subgraph of size larger than 2δn x 2 2δn, where δ is an arbitrary small constant. We give an explicit coloring of the complete bipartite graph of size 2n x 2n with a constant number of colors, such that there is no monochromatic subgraph of size larger than 2δn x n5.We also give improved constructions of mergers and condensers. In particular, We show that using a constant number of truly random bits, one can condense a source of length n and min-entropy rate δ into a source of length Ω (n) and min-entropy rate 1-δ, where δ is an arbitrary small constant.We show that using a constant number of truly random bits, one can merge a constant number of sources of length n, such that at least one of them is of min-entropy rate 1-δ, into one source of length Ω(n) and min-entropy rate slightly less than 1-δ, where δ is any small constant."
STOC,2005,21-30,Andrej Bogdanov,Pseudorandom generators for low degree polynomials.,https://doi.org/10.1145/1060590.1060594,"We investigate constructions of pseudorandom generators that fool polynomial tests of degree d in m variables over finite fields F. Our main construction gives a generator with seed length O(d4 log m (1 + log(d ⁄ ε) ⁄ log log m) + log |F|) bits that achieves arbitrarily small bias ε and works whenever |F| is at least polynomial in d, log m, and 1⁄ε. We also present an alternate construction that uses a seed that can be described by O(c2d8m6⁄(c-2) log(d⁄ε) + log |F|) bits (more precisely, O(c2d8m6⁄(c-2)) field elements, each chosen from a set of size poly(cd⁄ε), plus two field elements ranging over all of F), works whenever |F| is at least polynomial in c, d, and 1⁄ε, and has the property that every element of the output is a function of at most c field elements in the input. Both generators are computable by small arithmetic circuits. The main tool used in the construction is a reduction that allows us to transform any ""dense"" hitting set generator for polynomials into a pseudorandom generator."
STOC,2005,31-38,Luca Trevisan,On uniform amplification of hardness in NP.,https://doi.org/10.1145/1060590.1060595,"We continue the study of amplification of average-case complexity within NP, and we focus on the uniform case.We prove that if every problem in NP admits an efficient uniform algorithm that (averaged over random inputs and over the internal coin tosses of the algorithm) succeeds with probability at least 1 ⁄ 2 +1 (log n )α, then for every problem in NP there is an efficient uniform algorithm that succeeds with probability at least 1 - 1 poly(n). Above, α > 0 is an absolute constant.Previously, Trevisan (FOCS'03) presented a similar redution between success 3⁄4 + 1 (log n) and 1 - 1 (log n)α Stronger reductions, due to O'Donnell (STOC'02) and Healy, Vadhan and Viola (FOCS'04) are known in the non-uniform case."
STOC,2005,39-48,"Patrick Briest, Piotr Krysta, Berthold Vöcking",Approximation techniques for utilitarian mechanism design.,https://doi.org/10.1145/1060590.1060597,"This paper deals with the design of efficiently computable incentive compatible, or truthful, mechanisms for combinatorial optimization problems with multi-parameter agents. We focus on approximation algorithms for NP-hard mechanism design problems. These algorithms need to satisfy certain monotonicity properties to ensure truthfulness. Since most of the known approximation techniques do not fulfill these properties, we study alternative techniques.Our first contribution is a quite general method to transform a pseudopolynomial algorithm into a monotone FPTAS. This can be applied to various problems like, e.g., knapsack, constrained shortest path, or job scheduling with deadlines. For example, the monotone FPTAS for the knapsack problem gives a very efficient, truthful mechanism for single-minded multi-unit auctions. The best previous result for such auctions was a 2-approximation. In addition, we present a monotone PTAS for the generalized assignment problem with any bounded number of parameters per agent.The most efficient way to solve packing integer programs (PIPs) is LP-based randomized rounding, which also is in general not monotone. We show that primal-dual greedy algorithms achieve almost the same approximation ratios for PIPs as randomized rounding. The advantage is that these algorithms are inherently monotone. This way, we can significantly improve the approximation ratios of truthful mechanisms for various fundamental mechanism design problems like single-minded combinatorial auctions (CAs), unsplittable flow routing and multicast routing. Our approximation algorithms can also be used for the winner determination in CAs with general bidders specifying their bids through an oracle."
STOC,2005,49-56,Christos H. Papadimitriou,Computing correlated equilibria in multi-player games.,https://doi.org/10.1145/1060590.1060598,"We develop polynomial-time algorithms for finding correlated equilibria—a well-studied notion of rationality that generalizes the Nash equilibrium—in a broad class of succinctly representable multiplayer games, encompassing graphical games, anonymous games, polymatrix games, congestion games, scheduling games, local effect games, as well as several generalizations. Our algorithm is based on a variant of the existence proof due to Hart and Schmeidler, and employs linear programming duality, the ellipsoid algorithm, Markov chain steady state computations, as well as application-specific methods for computing multivariate expectations over product distributions. For anonymous games and graphical games of bounded tree-width, we provide a different polynomial-time algorithm for optimizing an arbitrary linear function over the set of correlated equilibria of the game. In contrast to our sweeping positive results for computing an arbitrary correlated equilibrium, we prove that optimizing over correlated equilibria is NP-hard in all of the other classes of games that we consider."
STOC,2005,57-66,"Baruch Awerbuch, Yossi Azar, Amir Epstein",The Price of Routing Unsplittable Flow.,https://doi.org/10.1145/1060590.1060599,"The essence of the routing problem in real networks is that the traffic demand from a source to destination must be satisfied by choosing a single path between source and destination. The splittable version of this problem is when demand can be satisfied by many paths, namely a flow from source to destination. The unsplittable, or discrete version of the problem is more realistic yet is more complex from the algorithmic point of view; in some settings optimizing such unsplittable traffic flow is computationally intractable.In this paper, we assume this more realistic unsplittable model, and investigate the ""price of anarchy"", or deterioration of network performance measured in total traffic latency under the selfish user behavior. We show that for linear edge latency functions the price of anarchy is exactly $2.618 for weighted demand and exactly $2.5 for unweighted demand. These results are easily extended to (weighted or unweighted) atomic ""congestion games"", where paths are replaced by general subsets. We also show that for polynomials of degree d edge latency functions the price of anarchy is dδ(d). Our results hold also for mixed strategies.Previous results of Roughgarden and Tardos showed that for linear edge latency functions the price of anarchy is exactly 4/3 under the assumption that each user controls only a negligible fraction of the overall traffic (this result also holds for the splittable case). Note that under the assumption of negligible traffic pure and mixed strategies are equivalent and also splittable and unsplittable models are equivalent."
STOC,2005,67-73,"George Christodoulou 0001, Elias Koutsoupias",The price of anarchy of finite congestion games.,https://doi.org/10.1145/1060590.1060600,"We consider the price of anarchy of pure Nash equilibria in congestion games with linear latency functions. For asymmetric games, the price of anarchy of maximum social cost is Θ(√N), where N is the number of players. For all other cases of symmetric or asymmetric games and for both maximum and average social cost, the price of anarchy is 5/2. We extend the results to latency functions that are polynomials of bounded degree. We also extend some of the results to mixed Nash equilibria."
STOC,2005,74-83,"Bruno Codenotti, Benton McCune, Kasturi R. Varadarajan",Market equilibrium via the excess demand function.,https://doi.org/10.1145/1060590.1060601,"We consider the problem of computing market equilibria and show three results. (i) For exchange economies satisfying weak gross substitutability we analyze a simple discrete version of tâtonnement, and prove that it converges to an approximate equilibrium in polynomial time. This is the first polynomial-time approximation scheme based on a simple atonnement process. It was only recently shown, using vastly more sophisticated techniques, that an approximate equilibrium for this class of economies is computable in polynomial time. (ii) For Fisher's model, we extend the frontier of tractability by developing a polynomial-time algorithm that applies well beyond the homothetic case and the gross substitutes case. (iii) For production economies, we obtain the first polynomial-time algorithms for computing an approximate equilibrium when the consumers' side of the economy satisfies weak gross substitutability and the producers' side is restricted to positive production."
STOC,2005,84-93,Oded Regev 0001,"On lattices, learning with errors, random linear codes, and cryptography.",https://doi.org/10.1145/1060590.1060603,"Our main result is a reduction from worst-case lattice problems such as GapSVP and SIVP to a certain learning problem. This learning problem is a natural extension of the “learning from parity with error” problem to higher moduli. It can also be viewed as the problem of decoding from a random linear code. This, we believe, gives a strong indication that these problems are hard. Our reduction, however, is quantum. Hence, an efficient solution to the learning problem implies a quantum algorithm for GapSVP and SIVP. A main open question is whether this reduction can be made classical (i.e., nonquantum).We also present a (classical) public-key cryptosystem whose security is based on the hardness of the learning problem. By the main result, its security is also based on the worst-case quantum hardness of GapSVP and SIVP. The new cryptosystem is much more efficient than previous lattice-based cryptosystems: the public key is of size Õ(n2) and encrypting a message increases its size by a factor of Õ(n) (in previous cryptosystems these values are Õ(n4) and Õ(n2), respectively). In fact, under the assumption that all parties share a random bit string of length Õ(n2), the size of the public key can be reduced to Õ(n)."
STOC,2005,94-103,Miklós Ajtai,Representing hard lattices with O(n log n) bits.,https://doi.org/10.1145/1060590.1060604,"We present a variant of the Ajtai-Dwork public-key cryptosystem where the size of the public-key is only O(nlog n) bits and the encrypted text/clear text ratio is also O(nlog n). This is true with the assumption that all of the participants in the cryptosystem share O(n2log n) random bits which has to be picked only once and the users of the cryptosystem get them e.g. together with the software implementing the protocol. The public key is a random lattice with an nc-unique nonzero shortest vector, where the constant c>1‾2 can be picked arbitrarily close to 1‾2, and we pick the lattice according to a distribution described in the paper. We do not prove a worst-case average-case equivalence but the security of the system follows from the hardness of a randomized diophantine approximation problem related to a well-known theorem of Dirichlet."
STOC,2005,104-111,"Christian Worm Mortensen, Rasmus Pagh, Mihai Patrascu",On dynamic range reporting in one dimension.,https://doi.org/10.1145/1060590.1060606,"We consider the problem of maintaining a dynamic set of integers and answering queries of the form: report a point (equivalently, all points) in a given interval. Range searching is a natural and fundamental variant of integer search, and can be solved using predecessor search. However, for a RAM with w-bit words, we show how to perform updates in O(lg w) time and answer queries in O(lg lg w) time. The update time is identical to the van Emde Boas structure, but the query time is exponentially faster. Existing lower bounds show that achieving our query time for predecessor search requires doubly-exponentially slower updates. We present some arguments supporting the conjecture that our solution is optimal.Our solution is based on a new and interesting recursion idea which is ""more extreme"" that the van Emde Boas recursion. Whereas van Emde Boas uses a simple recursion (repeated halving) on each path in a trie, we use a nontrivial, van Emde Boas-like recursion on every such path. Despite this, our algorithm is quite clean when seen from the right angle. To achieve linear space for our data structure, we solve a problem which is of independent interest. We develop the first scheme for dynamic perfect hashing requiring sublinear space. This gives a dynamic Bloomier filter (a storage scheme for sparse vectors) which uses low space. We strengthen previous lower bounds to show that these results are optimal."
STOC,2005,112-119,Mikkel Thorup,Worst-case update times for fully-dynamic all-pairs shortest paths.,https://doi.org/10.1145/1060590.1060607,"We present here the first solution to the fully-dynamic all pairs shortest path problem where every update is faster than a recomputation from scratch in Ω(n3log ⁄n) time. This is for a directed graph with arbitrary non-negative edge weights. An update inserts or deletes a vertex with all incident edges. After each such vertex update, we update a complete distance matrix in Õ(n2.75) time."
STOC,2005,120-127,Lance Fortnow,Beyond NP: the work and legacy of Larry Stockmeyer.,https://doi.org/10.1145/1060590.1060609,"Shortly after Steve Cook and Richard Karp showed the ex-istence of many natural NP-complete languages, researchers started to realize the great importance of the P versus NP problem and the difficulty of settling it. One graduate student at the Massachusetts Institute of Technology started to look beyond NP, asking what problems have a higher complexity and how do we classify them. Larry Stockmeyer discovered an amazing structure of complexity classes that continues to direct the research in complexity to this day. Stockmeyer passed away on July 31, 2004 at the age of 55 and in this paper we review some of his research and the legacy he has left on the community."
STOC,2005,128-137,"Noga Alon, Asaf Shapira",Every monotone graph property is testable.,https://doi.org/10.1145/1060590.1060611,"A graph property is called monotone if it is closed under taking (not necessarily induced) subgraphs (or, equivalently, if it is closed under removal of edges and vertices). Many monotone graph properties are some of the most well-studied properties in graph theory, and the abstract family of all monotone graph properties was also extensively studied. Our main result in this paper is that any monotone graph property can be tested with one-sided error, and with query complexity depending only on ε. This result unifies several previous results in the area of property testing, and also implies the testability of well-studied graph properties that were previously not known to be testable. At the heart of the proof is an application of a variant of Szemerédi's Regularity Lemma. The main ideas behind this application may be useful in characterizing all testable graph properties, and in generally studying graph property testing.As a byproduct of our techniques we also obtain additional results in graph theory and property testing, which are of independent interest. One of these results is that the query complexity of testing testable graph properties with one-sided error may be arbitrarily large. Another result, which significantly extends previous results in extremal graph-theory, is that for any monotone graph property P, any graph that is ε -far from satisfying P, contains a subgraph of size depending on ε only, which does not satisfy P. Finally, we prove the following compactness statement: If a graph G is ε-far from satisfying a (possibly infinite) set of graph properties P, then it is at least δ P ε-far from satisfying one of the properties."
STOC,2005,138-146,"Eldar Fischer, Ilan Newman",Testing versus estimation of graph properties.,https://doi.org/10.1145/1060590.1060612,"The topic of tolerant property testing, that of distinguishing input instances that are far from satisfying a property from those that are close enough to satisfying it (as opposed to distinguishing the far instances only from the satisfying instances), has recently become an active topic of research in the field of combinatorial property testing [13]. In the general setting, there exist properties that are testable but not tolerantly testable [10]. However, we show here that in the setting of the dense graph model, all testable properties are not only tolerantly testable, but also admit a constant query size algorithm that estimates the distance from the property up to any fixed additive constant.In the course of the construction of this algorithm we develop a framework for extending Szemerédi's Regularity Lemma, both as a prerequisite for formulating what kind of information about the input graph will provide us with the correct estimation, and as the means for efficiently gathering this information. This work is also connected to the question of finding a combinatorial characterization of the testable graph properties, and to the question of efficiently finding a regular partition."
STOC,2005,147-156,"Ronitt Rubinfeld, Rocco A. Servedio",Testing monotone high-dimensional distributions.,https://doi.org/10.1145/1060590.1060613,"A monotone distribution P over a (partially) ordered domain has P(y) ≥ P(x) if y ≥ x in the order. We study several natural problems of testing properties of monotone distributions over the n-dimensional Boolean cube, given access to random draws from the distribution being tested. We give a poly(n)-time algorithm for testing whether a monotone distribution is equivalent to or ε-far (in the L1 norm) from the uniform distribution. A key ingredient of the algorithm is a generalization of a known isoperimetric inequality for the Boolean cube. We also introduce a method for proving lower bounds on testing monotone distributions over the n-dimensional Boolean cube, based on a new decomposition technique for monotone distributions. We use this method to show that our uniformity testing algorithm is optimal up to polylog(n) factors, and also to give exponential lower bounds on the complexity of several other problems (testing whether a monotone distribution is identical to or ε-far from a fixed known monotone product distribution and approximating the entropy of an unknown monotone distribution)."
STOC,2005,157-166,"Katalin Friedl, Gábor Ivanyos, Miklos Santha",Efficient testing of groups.,https://doi.org/10.1145/1060590.1060614,"We construct an efficient probabilistic algorithm that, given a finite set with a binary operation, tests if it is an abelian group. The distance used is an analogue of the edit distance for strings. The query complexity of the tester is polylogarithmic in the size of the set. Previous testers used Hamming type distances and had superlinear query complexity. A building block for our construction is a constant query complexity homomorphism tester for functions mapping an given finite group into an arbitrary set equipped with a binary operation."
STOC,2005,167-175,"Joseph Cheriyan, Adrian Vetta",Approximation algorithms for network design with metric costs.,https://doi.org/10.1145/1060590.1060616,"We study undirected networks with edge costs that satisfy the triangle inequality. Let n denote the number of nodes. We present an O(1)-approximation algorithm for a generalization of the metric-cost subset k-node-connectivity problem. Our approximation guarantee is proved via lower bounds that apply to the simple edge-connectivity version of the problem, where the requirements are for edge-disjoint paths rather than for openly node-disjoint paths. A corollary is that, for metric costs and for each k=1,2,…,n-1, there exists a k-node connected graph whose cost is within a factor of 24 of the cost of any simple k-edge connected graph. This resolves an open question in the area. Based on our O(1)-approximation algorithm, we present an O(log rmax)-approximation algorithm for the node-connectivity survivable network design problem where rmax denotes the maximum requirement over all pairs of nodes. Our results contrast with the case of edge costs of zero or one, where Kortsarz et al. [20]recently proved, assuming NP⊈, quasi-P, a hardness-of-approximation lower bound of 2log 1-εn for the subset k-node-connectivity problem, where ε denotes a small positive number."
