booktitle,year,pages,author,title,ee,abstract
STOC,2005,376-385,Omer Reingold,Undirected ST-connectivity in log-space.,https://doi.org/10.1145/1060590.1060647,"We present a deterministic, log-space algorithm that solves st-connectivity in undirected graphs. The previous bound on the space complexity of undirected st-connectivity was log4/3(⋅) obtained by Armoni, Ta-Shma, Wigderson and Zhou (JACM 2000). As undirected st-connectivity is complete for the class of problems solvable by symmetric, nondeterministic, log-space computations (the class SL), this algorithm implies that SL = L (where L is the class of problems solvable by deterministic log-space computations). Independent of our work (and using different techniques), Trifonov (STOC 2005) has presented an O(log n log log n)-space, deterministic algorithm for undirected st-connectivity.Our algorithm also implies a way to construct in log-space a fixed sequence of directions that guides a deterministic walk through all of the vertices of any connected graph. Specifically, we give log-space constructible universal-traversal sequences for graphs with restricted labeling and log-space constructible universal-exploration sequences for general graphs."
STOC,2005,386-395,"Lujun Jia, Guolong Lin, Guevara Noubir, Rajmohan Rajaraman, Ravi Sundaram","Universal approximations for TSP, Steiner tree, and set cover.",https://doi.org/10.1145/1060590.1060649,"We introduce a notion of universality in the context of optimization problems with partial information. Universality is a framework for dealing with uncertainty by guaranteeing a certain quality of goodness for all possible completions of the partial information set. Universal variants of optimization problems can be defined that are both natural and well-motivated. We consider universal versions of three classical problems: TSP, Steiner Tree and Set Cover.We present a polynomial-time algorithm to find a universal tour on a given metric space over n vertices such that for any subset of the vertices, the sub-tour induced by the subset is within O(log4n/log log n) of an optimal tour for the subset. Similarly, we show that given a metric space over n vertices and a root vertex, we can find a universal spanning tree such that for any subset of vertices containing the root, the sub-tree induced by the subset is within O(log4n/log log n) of an optimal Steiner tree for the subset. Our algorithms rely on a new notion of sparse partitions, that may be of independent interest. For the special case of doubling metrics, which includes both constant-dimensional Euclidean and growth-restricted metrics, our algorithms achieve an O(log n) upper bound. We complement our results for the universal Steiner tree problem with a lower bound of Ω(log n/log log n) that holds even for n vertices on the plane. We also show that a slight generalization of the universal Steiner Tree problem is coNP-hard and present nearly tight upper and lower bounds for a universal version of Set Cover."
STOC,2005,396-402,Naveen Garg 0001,Saving an epsilon: a 2-approximation for the k-MST problem in graphs.,https://doi.org/10.1145/1060590.1060650,"N/A"
STOC,2005,403-412,Ben Morris,The mixing time of the Thorp shuffle.,https://doi.org/10.1145/1060590.1060651,The Thorp shuffle is defined as follows. Cut the deck into two equal piles. Drop the first card from the left pile or the right pile according to the outcome of a fair coin flip; then drop from the other pile. Continue this way until both piles are empty. We show that the mixing time for the Thorp shuffle with 2d cards is polynomial in d.
STOC,2005,413-422,"Mary Cryan, Martin E. Dyer, Dana Randall",Approximately counting integral flows and cell-bounded contingency tables.,https://doi.org/10.1145/1060590.1060652,"We consider the problem of approximately counting integral flows in a network. We show that there is an fpras based on volume estimation if all capacities are sufficiently large, generalising a result of Dyer, Kannan and Mount (1997). We apply this to approximating the number of contingency tables with prescribed cell bounds when the number of rows is constant, but the row sums, column sums and cell bounds may be arbitrary. We provide an fpras for this problem via a combination of dynamic programming and volume estimation. This generalises an algorithm of Cryan and Dyer (2002) for standard contingency tables, but the analysis here is considerably more intricate."
STOC,2005,423-430,Van H. Vu,Spectral norm of random matrices.,https://doi.org/10.1145/1060590.1060654,"In this paper, we present a new upper bound for the spectral norm of symmetric random matrices with independent (but not necessarily identical) entries. Our results improve an earlier result of Füredi and Komlós and also correct an incomplete argument in their proof."
STOC,2005,431-440,"Terence Tao, Van H. Vu",On random pm 1 matrices: singularity and determinant.,https://doi.org/10.1145/1060590.1060655,"We proved several results concerning the determinant of a random pm 1 matrix. In particular, we show that with high probability, the determinant has absolute value very close to √n!."
STOC,2005,441-449,"Abraham Flaxman, Alan M. Frieze, Juan Carlos Vera 0001",On the average case performance of some greedy approximation algorithms for the uncapacitated facility location problem.,https://doi.org/10.1145/1060590.1060656,"In combinatorial optimization, a popular approach toNP-hard problems is the design of approximation algorithms. These algorithms typically run in polynomial time and are guaranteed to produce a solution which is within a known multiplicative factor of optimal. Unfortunately, the known factor is often known to be large in pathological instances. Conventional wisdom holds that, in practice, approximation algorithms will produce solutions closer to optimal than their proven guarantees. In this paper, we use the rigorous-analysis-of-heuristics framework to investigate this conventional wisdom.We analyze the performance of 3 related approximation algorithms for the uncapacitated facility location problem (from [Jain, Mahdian, Markakis, Saberi, Vazirani, 2003] and [Mahdian, Ye, Zhang, 2002]) when each is applied to an instances created by placing n points uniformly at random in the unit square. We find that, with high probability, these 3 algorithms do not find asymptotically optimal solutions, and, also with high probability, a simple plane partitioning heuristic does find an asymptotically optimal solution."
STOC,2005,450-459,"Micah Adler, Jeff Edmonds, Jirí Matousek 0001",Towards asymptotic optimality in probabilistic packet marking.,https://doi.org/10.1145/1060590.1060657,"There has been considerable recent interest in probabilistic packet marking schemes for sending information from nodes (routers) along one or more paths traveled by a stream of packets to the end-host receiving that stream. A central consideration for such schemes is the tradeoff between the number B of possible states of the marking bits in a packet, the number of bits n of information being sent by the nodes, and the expected number of packets T required to reconstruct this information. For the case where the packets all travel along the same path, we prove a lower bound of T ≥ Ω(B22n/(B-1)), roughly the square of an earlier lower bound of Adler.For an upper bound, we consider a model where each of m nodes along a single path must send one of s possible messages (thus n = m log2 s total bits are sent). We prove that T ≤ O(m • 22m(log2 s)/(B-1)) suffices (the implicit constant depends on B and s); this almost matches the lower bound, and is roughly the square root of an earlier upper bound of Adler. The new bound holds for all B and s in two slightly relaxed models, while under the strictest requirements we prove it only for some special values of B and s. This is related to a challenging geometric problem: the existence of an s-reptile (B-1)-dimensional simplex, i.e. a simplex S that can be tiled by s congruent simplices similar to S.We also consider the case where the packets travel along multiple paths to the same destination. In this case, we present a new protocol and analysis technique that together allow us to significantly generalize over previous work the scenarios where the protocol is effective."
STOC,2005,460-467,Yaoyun Shi,Tensor norms and the classical communication complexity of nonlocal quantum measurement.,https://doi.org/10.1145/1060590.1060659,"Nonlocality is at the heart of quantum information processing. In this paper we investigate the minimum amount of classical communication required to simulate a nonlocal quantum measurement. We derive general upper bounds, which in turn translate to systematic classical simulations of quantum communication protocols.As a concrete application, we prove that any quantum communication protocol with shared entanglement for computing a Boolean function can be simulated by a classical protocol whose cost does not depend on the amount of the shared entanglement. This implies that if the cost of communication is a constant, quantum and classical protocols, with shared entanglement and shared coins, respectively, compute the same class of functions.Furthermore, we describe a new class of efficient quantum communication protocols based on fast quantum algorithms. While some of them have efficient classical simulations by our method, others appear to be good candidates for separating quantum v.s. classical protocols, and quantum protocols with v.s. without shared entanglement.Yet another application is in the context of simulating quantum correlations using local hidden variable models augmented with classical communications. We give a constant cost, approximate simulation of quantum correlations when the number of correlated variables is a constant, while the dimension of the entanglement and the number of possible measurements can be arbitrary.Our upper bounds are expressed in terms of some tensor norms on the measurement operator. Those norms capture the nonlocality of bipartite operators in their own way and may be of independent interest and further applications."
STOC,2005,468-474,Sean Hallgren,Fast quantum algorithms for computing the unit group and class group of a number field.,https://doi.org/10.1145/1060590.1060660,"Computing the unit group and class group of a number field are two of the main tasks in computational algebraic number theory. Factoring integers reduces to solving Pell's equation, which is a special case of computing the unit group, but a reduction in the other direction is not known and appears more difficult. We give polynomial-time quantum algorithms for computing the unit group and class group when the number field has constant degree."
STOC,2005,475-480,"Arthur Schmidt, Ulrich Vollmer",Polynomial time quantum algorithm for the computation of the unit group of a number field.,https://doi.org/10.1145/1060590.1060661,We present a quantum algorithm for the computation of the irrational period lattice of a function on Zn which is periodic in a relaxed sense. This algorithm is applied to compute the unit group of finite extensions of Q. Execution time for fixed field degree over Q is polynomial in the discriminant of the field. Our algorithms generalize and improve upon Hallgren's work [9] for the one-dimensional case corresponding to real-quadratic fields.
STOC,2005,481-485,"Michael Ben-Or, Avinatan Hassidim",Fast quantum byzantine agreement.,https://doi.org/10.1145/1060590.1060662,"We present a fast quantum Byzantine Agreement protocol that can reach agreement in O(1) expected communication rounds against a strong full information, dynamic adversary, tolerating up to the optimal t‹n3 faulty players in the synchronous setting, and up to t‹n4 faulty players for asynchronous systems. This should be contrasted with the known classical synchronous lower bound of Ω(√ nlog n) [3] when t=(n)."
STOC,2005,486-493,"Noga Alon, Konstantin Makarychev, Yury Makarychev, Assaf Naor",Quadratic forms on graphs.,https://doi.org/10.1145/1060590.1060664,"We introduce a new graph parameter, called the Grothendieck constant of a graph G=(V,E), which is defined as the least constant K such that for every A:E→R,supf:V→S|V|-1 Σ(u,v) ∈ E A(u,v) · ‹f(u),f(v)› ≤ K supf:V→(-1,+1) Σ(u,v)∈ E A(u,v) · f(u)f(v).The classical Grothendieck inequality corresponds to the case of bipartite graphs, but the case of general graphs is shown to have various algorithmic applications. Indeed, our work is motivated by the algorithmic problem of maximizing the quadratic form ∑u,v∈EA(u,v)f(vover all f: V →-1,1, which arises in the study of correlation clustering and in the investigation of the spin glass model. We give upper and lower estimates for the integrality gap of this program. We show that the integrality gap is O(log θḠ)) where θ(Ḡ) is the Lovász Theta Function of the complement of G, which is always smaller than the chromatic number of G. This yields an efficient constant factor approximation algorithm for the above maximization problem for a wide range of graphs G. We also show that the maximum possible integrality gap is always at least Ω(log ω(G)), where Ω(G) is the clique number of G. In particular it follows that the maximum possible integrality gap for the complete graph on n Θ vertices with no loops is ⏷(log n ). More generally, the maximum possible integrality gap for any perfect graph with chromatic number n is ⏷(log n). The lower bound for the complete graph improves a result of Kashin and Szarek on Gram matrices of uniformly bounded functions, and settles a problem of Megretski and of Charikar and Wirth."
STOC,2005,494-503,"Michael Elkin, Yuval Emek, Daniel A. Spielman, Shang-Hua Teng",Lower-stretch spanning trees.,https://doi.org/10.1145/1060590.1060665,"We show that every weighted connected graph G contains as a subgraph a spanning tree into which the edges of G can be embedded with average stretch O (log2 n log log n). Moreover, we show that this tree can be constructed in time O (m log2n) in general, and in time O (mlog n) if the input graph is unweighted. The main ingredient in our construction is a novel graph decomposition technique.Our new algorithm can be immediately used to improve the running time of the recent solver for symmetric diagonally dominant linear systems of Spielman and Teng from m2(O√lognlog log n) to m log O(1)n and to O (n log2n log log n) when the system is planar. Our result can also be used to improve several earlier approximation algorithms that use low-stretch spanning trees."
STOC,2005,504-512,Daniel Gonçalves 0001,Edge partition of planar sraphs into two outerplanar graphs.,https://doi.org/10.1145/1060590.1060666,"An outerplanar graph is a planar graph that can be embedded in the plane without crossing edges, in such a way that all the vertices are on the outer boundary. In this paper, we prove a conjecture of Chartrand, Geller, and Hedetniemi that any planar graph G=(V,E) has a bipartition of its edge set E = A ∪ B such that the graphs induced by these subsets, G[A] and G[B], are outerplanar."
STOC,2005,513-522,"Luis von Ahn, Nicholas J. Hopper, John Langford 0001",Covert two-party computation.,https://doi.org/10.1145/1060590.1060668,"We introduce covert two-party computation, a stronger notion of security than standard secure two-party computation. Like standard secure two-party computation, covert two-party computation allows Alice and Bob, with secret inputs xA and xB respectively, to compute a function f(xA,xB) without leaking any additional information about their inputs. In addition, covert two-party computation guarantees that even the existence of a computation is hidden from all protocol participants unless the value of the function mandates otherwise. This allows the construction of protocols that return f(xA,xB) only when it equals a certain value of interest (such as ""Yes, we are romantically interested in each other"") but for which neither party can determine whether the other even ran the protocol whenever f(xA,xB) is not a value of interest. Since existing techniques for secure function evaluation always reveal that both parties participate in the computation, covert computation requires the introduction of new techniques based on provably secure steganography. We introduce security definitions for covert two-party computation and show that this surprising notion can be achieved by a protocol given the Decisional Diffie-Hellman assumption in the ""honest but curious"" model. Using this protocol as a subroutine, we present another protocol which is fair and secure against malicious adversaries in the Random Oracle Model --- unlike most other protocols against malicious adversaries, this protocol does not rely on zero-knowledge proofs (or similar cut-and-choose techniques), because they inherently reveal that a computation took place. We remark that all our protocols are of comparable efficiency to protocols for standard secure two-party computation."
STOC,2005,523-532,Hoeteck Wee,On obfuscating point functions.,https://doi.org/10.1145/1060590.1060669,"We investigate the possibility of obfuscating point functions in the framework of Barak et al. from Crypto '01. A point function is a Boolean function that assumes the value 1 at exactly one point. Our main results are as follows:We provide a simple construction of efficient obfuscators for point functions for a slightly relaxed notion of obfuscation, for which obfuscating general circuits is nonetheless impossible. Our construction relies on the existence of a very strong one-way permutation, and yields the first non-trivial obfuscator under general assumptions in the standard model. We also obtain obfuscators for point functions with multi-bit output and for prefix matching.Our assumption is that there is a one-way permutation wherein any polynomial-sized circuit inverts the permutation on at most a polynomial number of inputs. We show that a similar assumption is in fact necessary, and that our assumption holds relative to a random permutation oracle.Finally, we establish two impossibility results which indicate that the limitations on our construction, namely simulating only adversaries with single-bit output and using nonuniform advice in our simulator, are in some sense inherent.Previous work gave negative results for the general class of circuits (Barak et al., Crypto '01) and positive results in the random oracle model (Lynn et al., Eurocrypt '04) or under non-standard number-theoretic assumptions (Canetti, Crypto '97). This work represents the first effort to bridge the gap between the two for a natural class of functionalities."
STOC,2005,533-542,"Rafael Pass, Alon Rosen",New and improved constructions of non-malleable cryptographic protocols.,https://doi.org/10.1145/1060590.1060670,"We present a new constant round protocol for non-malleable zero-knowledge. Using this protocol as a subroutine, we obtain a new constant-round protocol for non-malleable commitments. Our constructions rely on the existence of (standard) collision resistant hash functions. Previous constructions either relied on the existence of trapdoor permutations and hash functions that are collision resistant against sub-exponential sized circuits, or required a super-constant number of rounds.Additional results are the first construction of a non-malleable commitment scheme that is statistically hiding (with respect to opening), and the first non-malleable protocols that satisfy a strict polynomial-time simulation requirement. The latter are constructed by additionally assuming the existence of trapdoor permutations.Our approach differs from the approaches taken in previous works in that we view non-malleable zero-knowledge as a building-block rather than an end goal. This gives rise to a modular construction of non-malleable commitments and results in a somewhat simpler analysis.The techniques that we use to construct our zero-knowl-edge protocol are non black-box, but are different than the non black-box techniques previously used in the context of non-malleable coin-tossing."
STOC,2005,543-552,"Matt Lepinski, Silvio Micali, Abhi Shelat",Collusion-free protocols.,https://doi.org/10.1145/1060590.1060671,"Secure protocols attempt to minimize the injuries to privacy and correctness inflicted by malicious participants who collude during run-time. They do not, however, prevent malicious parties from colluding and coordinating their actions in the first place!Eliminating such collusion of malicious parties during the execution of a protocol is an important and exciting direction for research in Cryptography. We contribute the first general result in this direction: (1) We provide a rigorous definition of what a collusion-free protocol is; and (2) We prove that, under standard physical and computational assumptions ---i.e., plain envelopes and trapdoor permutations---collusion-free protocols exist for all finite protocol tasks with publicly observable actions. (Note that such tasks are allowed to have secret global state, and thus include Poker, Bridge, and other such games.Our solution is tight in the sense that, for a collusion-free protocol to exist, each of (a) the finiteness of the game of interest, (b) the public observability of its actions, and (c) the use of some type of physically private channel is provably essential."
STOC,2005,553-562,"Sanjeev Arora, James R. Lee, Assaf Naor",Euclidean distortion and the sparsest cut.,https://doi.org/10.1145/1060590.1060673,"We prove that every n-point metric space of negative type (in particular, every n-point subset of L1) embeds into a Euclidean space with distortion O(√log n log log n), a result which is tight up to the O(log log n) factor. As a consequence, we obtain the best known polynomial-time approximation algorithm for the Sparsest Cut problem with general demands. If the demand is supported on a subset of size k, we achieve an approximation ratio of O(√log k log log k)."
STOC,2005,563-572,"Uriel Feige, Mohammad Taghi Hajiaghayi, James R. Lee",Improved approximation algorithms for minimum-weight vertex separators.,https://doi.org/10.1145/1060590.1060674,"We develop the algorithmic theory of vertex separators, and its relation to the embeddings of certain metric spaces. Unlike in the edge case, we show that embeddings into L1 (and even Euclidean embeddings) are insufficient, but that the additional structure provided by many embedding theorems does suffice for our purposes.We obtain an O(√log n) approximation for min-ratio vertex cuts in general graphs, based on a new semidefinite relaxation of the problem, and a tight analysis of the integrality gap which is shown to be Θ(√log n). We also prove various approximate max-flow/min-vertex-cut theorems, which in particular give a constant-factor approximation for min-ratio vertex cuts in any excluded-minor family of graphs. Previously, this was known only for planar graphs, and for general excluded-minor families the best-known ratio was O(log n).These results have a number of applications. We exhibit an O(√log n) pseudo-approximation for finding balanced vertex separators in general graphs. In fact, we achieve an approximation ratio of O(√log opt) where opt is the size of an optimal separator, improving over the previous best bound of O(log opt). Likewise, we obtain improved approximation ratios for treewidth: In any graph of treewidth k, we show how to find a tree decomposition of width at most O(k √log k), whereas previous algorithms yielded O(k log k). For graphs excluding a fixed graph as a minor (which includes, e.g., bounded genus graphs), we give a constant-factor approximation for the treewidth; this can be used to obtain the first polynomial-time approximation schemes for problems like minimum feedback vertex set and minimum connected dominating set in such graphs."
STOC,2005,573-581,"Amit Agarwal, Moses Charikar, Konstantin Makarychev, Yury Makarychev","O(sqrt(log n)) approximation algorithms for min UnCut, min 2CNF deletion, and directed cut problems.",https://doi.org/10.1145/1060590.1060675,"We give O(√log n)-approximation algorithms for the MIN UNCUT, MIN 2CNF DELETION, DIRECTED BALANCED SEPERATOR, and DIRECTED SPARSEST CUT problems. The previously best known algorithms give an O(log n)-approximation for MIN UNCUT [9], DIRECTED BALANCED SEPERATOR [17], DIRECTED SPARSEST CUT [17], and an O(log n log log n)-approximation for MIN 2CNF DELETION [14].We also show that the integrality gap of an SDP relaxation of the MINIMUM MULTICUT problem is Ω(log n)."
