booktitle,year,pages,author,title,ee,abstract
STOC,2022,1325-1338,"Bernhard Haeupler, Harald R?cke, Mohsen Ghaffari 0001","Hop-constrained expander decompositions, oblivious routing, and distributed universal optimality.",https://doi.org/10.1145/3519935.3520026,"This paper studies the fundamental task of establishing routing paths in distributed networks. We prove the existence of compact routing tables that store in each network-node few simple forwarding rules tracing out hop-constrained and oblivious routing paths for any pair of nodes. For any collection of pairs the congestion of these paths is almost-optimal, i.e., competitive with the globally optimal solution up to a sub-polynomial factor.  The key to this result is the algorithmic theory of hop-constrained expanders and expander decompositions developed in this paper. Informally, we say a graph is an h-hop φ-expanders iff for any set of node-pairs, in which each node is paired to O(deg(v)) nodes at hop-distance O(h), there exists an (h)-hop path between each pair such that any edge is used at most (1/φ) often. An h-hop φ-expander is basically a regular (φ)-expander when h = Ω(logn/φ). For shorter path lengths h ? 1/φ, however, h-hop expanders become interesting, powerful, and fundamentally different. We prove that every graph can be decomposed into h-hop (boundary-linked) φ-expanders by cutting at most an O(φ logn)-fraction of its edges.  We also provide efficient constructions for almost-optimal h-hop expander decompositions and our compact routing tables. These are parallel algorithms with almost-linear work and sub-polynomial depth that also have highly-efficient implementations in CONGEST, the standard model for distributed message-passing algorithms. As major implication this gives novel CONGEST algorithms for a large class of important optimization problems, including minimum-spanning tree, (1+?)-min-cut, (1+)-shortest paths. Our algorithms solve these problems in sub-polynomial rounds on any network, as long as a sub-polynomial-round distributed algorithm exists for this network. This strong optimality guarantee is closely related to the notion of universal optimality."
STOC,2022,1339-1352,"Daniel Amir, Tegan Wilson, Vishal Shrivastav, Hakim Weatherspoon, Robert Kleinberg, Rachit Agarwal 0001",Optimal oblivious reconfigurable networks.,https://doi.org/10.1145/3519935.3520020,"Oblivious routing has a long history in both the theory and practice of networking.   In this work we initiate the formal study of oblivious routing in the context of reconfigurable networks, a new architecture that has recently come to the fore in datacenter networking. These networks allow a rapidly   changing bounded-degree pattern of interconnections   between nodes, but the network topology   and the selection of routing paths must both   be oblivious to the traffic demand matrix.   Our focus is   on the trade-off between maximizing throughput   and minimizing latency in these networks.   For every constant throughput rate, we   characterize (up to a constant factor)   the minimum latency achievable by an   oblivious reconfigurable network   design that satisfies the given throughput   guarantee. The trade-off between these two   objectives turns out to be surprisingly subtle:   the curve depicting it has an unexpected   scalloped shape reflecting the fact that   load-balancing becomes more difficult when   the average length of routing paths is not   an integer because equalizing all the path   lengths is not possible. The proof of our   lower bound uses LP duality to verify that   Valiant load balancing is the most efficient   oblivious routing scheme when used in   combination with an optimally-designed   reconfigurable network topology.   The proof of our upper bound uses an   algebraic construction in which the   network nodes are identified with   vectors over a finite field, the   network topology is described by   either the elementary basis or   a sequence of Vandermonde matrices,   and routing paths are constructed by   selecting columns of these matrices   to yield the appropriate mixture   of path lengths within the shortest   possible time interval."
STOC,2022,1353-1363,"Noga Ron-Zewi, Ron D. Rothblum",Proving as fast as computing: succinct arguments with constant prover overhead.,https://doi.org/10.1145/3519935.3519956,"Succinct arguments are proof systems that allow a powerful, but untrusted, prover to convince a weak verifier that an input x belongs to a language L ∈ NP, with communication that is much shorter than the NP witness. Such arguments, which grew out of the theory literature, are now drawing immense interest also in practice, where a key bottleneck that has arisen is the high computational cost of proving correctness. In this work we address this problem by constructing succinct arguments for general computations, expressed as Boolean circuits (of bounded fan-in), with a strictly linear size prover. The soundness error of the protocol is an arbitrarily small constant. Prior to this work, succinct arguments were known with a quasi-linear size prover for general Boolean circuits or with linear-size only for arithmetic circuits, defined over large finite fields. In more detail, for every Boolean circuit C=C(x,w), we construct an O(log|C|)-round argument-system in which the prover can be implemented by a size O(|C|) Boolean circuit (given as input both the instance x and the witness w), with arbitrarily small constant soundness error and using poly(λ,log|C|) communication, where λ denotes the security parameter. The verifier can be implemented by a size O(|x|) + poly(λ, log|C|) circuit following a size O(|C|) private pre-processing step, or, alternatively, by using a purely public-coin protocol (with no pre-processing) with a size O(|C|) verifier. The protocol can be made zero-knowledge using standard techniques (and with similar parameters). The soundness of our protocol is computational and relies on the existence of collision resistant hash functions that can be computed by linear-size circuits, such as those proposed by Applebaum et al. (ITCS, 2017). At the heart of our construction is a new information-theoretic interactive oracle proof (IOP), an interactive analog of a PCP, for circuit satisfiability, with constant prover overhead. The improved efficiency of our IOP is obtained by bypassing a barrier faced by prior IOP constructions, which needed to (either explicitly or implicitly) encode the entire computation using a multiplication code."
STOC,2022,1364-1377,"Divesh Aggarwal, Bhavana Kanukurthi, Sai Lakshmi Bhavana Obbattu, Maciej Obremski, Sruthi Sekar",Rate one-third non-malleable codes.,https://doi.org/10.1145/3519935.3519972,"At ITCS 2010, Dziembowski, Pietrzak, and Wichs introduced Non-malleable Codes (NMCs) which protect against tampering of a codeword of a given message into the codeword of a related message. A well-studied model of tampering is the 2-split-state model where the codeword consists of two independently tamperable states. As with standard error-correcting codes, it is of great importance to build codes with high rates. Following a long line of work, Aggarwal and Obremski (FOCS 2020) showed the first constant rate non-malleable code in the 2?split state model; however, this constant was a minuscule 10?6! In this work, we build a Non-malleable Code with rate 1/3. This nearly matches the rate 1/2 lower bound for this model due to Cheraghchi and Guruswami (ITCS 2014). Our construction is simple, requiring just an inner-product extractor, a seeded extractor, and an affine-evasive function."
STOC,2022,1378-1391,"Andrea Coladangelo, Shafi Goldwasser, Umesh V. Vazirani",Deniable encryption in a Quantum world.,https://doi.org/10.1145/3519935.3520019,"(Sender-)Deniable encryption provides a very strong privacy guarantee: a sender who is coerced by an attacker into “opening” their ciphertext after-the-fact is able to generate “fake” local random choices that are consistent with any plaintext of their choice. The only known fully-efficient constructions of public-key deniable encryption rely on indistinguishability obfuscation (iO) (which currently can only be based on sub-exponential hardness assumptions).  In this work, we study (sender-)deniable encryption in a setting where the encryption procedure is a quantum algorithm, but the ciphertext is classical. First, we propose a quantum analog of the classical definition in this setting. We give a fully efficient construction satisfying this definition, assuming the quantum hardness of the Learning with Errors (LWE) problem.  Second, we show that quantum computation unlocks a fundamentally stronger form of deniable encryption, which we call perfect unexplainability. The primitive at the heart of unexplainability is a quantum computation for which there is provably no efficient way, such as exhibiting the “history of the computation,” to establish that the output was indeed the result of the computation. We give a construction which is secure in the random oracle model, assuming the quantum hardness of LWE. Crucially, this notion implies a form of protection against coercion “before-the-fact”, a property that is impossible to achieve classically."
STOC,2022,1392-1405,"Iftach Haitner, Noam Mazor, Jad Silbak, Eliad Tsfadia",On the complexity of two-party differential privacy.,https://doi.org/10.1145/3519935.3519982,"In distributed differential privacy, the parties perform analysis over their joint data while preserving the privacy for both datasets. Interestingly, for a few fundamental two-party functions such as inner product and Hamming distance, the accuracy of the distributed solution lags way behind what is achievable in the client-server setting. McGregor, Mironov, Pitassi, Reingold, Talwar, and Vadhan [FOCS ’10] proved that this gap is inherent, showing upper bounds on the accuracy of (any) distributed solution for these functions. These limitations can be bypassed when settling for computational differential privacy, where the data is differentially private only in the eyes of a computationally bounded observer, using oblivious transfer.     We prove that the use of public-key cryptography is necessary for bypassing the limitation of McGregor et al., showing that a non-trivial solution for the inner product, or the Hamming distance, implies the existence of a key-agreement protocol. Our bound implies a combinatorial proof for the fact that non-Boolean inner product of independent (strong) Santha-Vazirani sources is a good condenser. We obtain our main result by showing that the inner-product of a (single, strong) SV source with a uniformly random seed is a good condenser, even when the seed and source are dependent."
STOC,2022,1406-1417,"Samuel B. Hopkins, Gautam Kamath 0001, Mahbod Majid",Efficient mean estimation with pure differential privacy via a sum-of-squares exponential mechanism.,https://doi.org/10.1145/3519935.3519947,"We give the first polynomial-time algorithm to estimate the mean of a d-variate probability distribution with bounded covariance from ?(d) independent samples subject to pure differential privacy. Prior algorithms for this problem either incur exponential running time, require Ω(d1.5) samples, or satisfy only the weaker concentrated or approximate differential privacy conditions. In particular, all prior polynomial-time algorithms require d1+Ω(1) samples to guarantee small privacy loss with “cryptographically” high probability, 1?2?dΩ(1), while our algorithm retains ?(d) sample complexity even in this stringent setting. Our main technique is a new approach to use the powerful Sum of Squares method (SoS) to design differentially private algorithms. SoS proofs to algorithms is a key theme in numerous recent works in high-dimensional algorithmic statistics – estimators which apparently require exponential running time but whose analysis can be captured by low-degree Sum of Squares proofs can be automatically turned into polynomial-time algorithms with the same provable guarantees. We demonstrate a similar proofs to private algorithms phenomenon: instances of the workhorse exponential mechanism which apparently require exponential time but which can be analyzed with low-degree SoS proofs can be automatically turned into polynomial-time differentially private algorithms. We prove a meta-theorem capturing this phenomenon, which we expect to be of broad use in private algorithm design. Our techniques also draw new connections between differentially private and robust statistics in high dimensions. In particular, viewed through our proofs-to-private-algorithms lens, several well-studied SoS proofs from recent works in algorithmic robust statistics directly yield key components of our differentially private mean estimation algorithm."
STOC,2022,1418-1430,"Nima Anari, Vishesh Jain, Frederic Koehler, Huy Tuan Pham, Thuy-Duong Vuong",Entropic independence: optimal mixing of down-up random walks.,https://doi.org/10.1145/3519935.3520048,"We introduce a notion called entropic independence that is an entropic analog of spectral notions of high-dimensional expansion. Informally, entropic independence of a background distribution μ on k-sized subsets of a ground set of elements says that for any (possibly randomly chosen) set S, the relative entropy of a single element of S drawn uniformly at random carries at most O(1/k) fraction of the relative entropy of S. Entropic independence is the analog of the notion of spectral independence, if one replaces variance by entropy. We use entropic independence to derive tight mixing time bounds, overcoming the lossy nature of spectral analysis of Markov chains on exponential-sized state spaces. In our main technical result, we show a general way of deriving entropy contraction, a.k.a. modified log-Sobolev inequalities, for down-up random walks from spectral notions. We show that spectral independence of a distribution under arbitrary external fields automatically implies entropic independence.  We furthermore extend our theory to the case where spectral independence does not hold under arbitrary external fields.  To do this, we introduce a framework for obtaining tight mixing time bounds for Markov chains based on what we call restricted modified log-Sobolev inequalities, which guarantee entropy contraction not for all distributions, but for those in a sufficiently large neighborhood of the stationary distribution.  To derive our results, we relate entropic independence to properties of polynomials: μ is entropically independent exactly when a transformed version of the generating polynomial of μ is upper bounded by its linear tangent; this property is implied by concavity of the said transformation, which was shown by prior work to be locally equivalent to spectral independence. We apply our results to obtain (1) tight modified log-Sobolev inequalities and mixing times for multi-step down-up walks on fractionally log-concave distributions, (2) the tight mixing time of O(nlogn) for Glauber dynamics on Ising models whose interaction matrix has eigenspectrum lying within an interval of length smaller than 1, improving upon the prior quadratic dependence on n, and (3) nearly-linear time  Oδ(n) samplers for the hardcore and Ising models on n-node graphs that have δ-relative gap to the tree-uniqueness threshold. In the last application, our bound on the running time does not depend on the maximum degree Δ of the graph, and is therefore optimal even for high-degree graphs, and in fact, is sublinear in the size of the graph for high-degree graphs."
STOC,2022,1431-1444,"Hongyang Liu, Yitong Yin",Simple parallel algorithms for single-site dynamics.,https://doi.org/10.1145/3519935.3519999,"The single-site dynamics are a canonical class of Markov chains for sampling from high-dimensional probability distributions, e.g. the ones represented by graphical models.  We give a simple and generic parallel algorithm that can faithfully simulate single-site dynamics. When the chain asymptotically satisfies the ?p-Dobrushin’s condition, specifically, when the Dobrushin’s influence matrix has constantly bounded ?p-induced operator norm for an arbitrary p∈[1, ∞], the parallel simulation of N steps of single-site updates succeeds within O(N/n+logn) depth of parallel computing using ?(m) processors, where n is the number of sites and m is the size of graphical model. Since the Dobrushin’s condition is almost always satisfied asymptotically by mixing chains, this parallel simulation algorithm essentially transforms single-site dynamics with optimal O(nlogn) mixing time to algorithms for sampling. In particular we obtain samplers, for the Ising models on general graphs in the uniqueness regime, and for satisfying solutions of CNF formulas in a local lemma regime. With non-adaptive simulated annealing, these samplers can be transformed routinely to algorithms for approximate counting.  A key step in our parallel simulation algorithm, is a so-called “universal coupling” procedure, which tries to simultaneously couple all distributions over the same sample space. We construct such a universal coupling, that for every pair of distributions the coupled probability is at least their Jaccard similarity. We also prove that this is optimal in the worst case. The universal coupling and its applications are of independent interests."
STOC,2022,1445-1458,"Reza Gheissari, Alistair Sinclair",Low-temperature Ising dynamics with random initializations.,https://doi.org/10.1145/3519935.3519964,"Glauber dynamics on spin systems are well known to suffer exponential slowdowns at low temperatures due to the emergence of multiple metastable phases, separated by narrow bottlenecks that are hard for the dynamics to cross. It is a folklore belief that if the dynamics is initialized from an appropriate random mixture of ground states, one for each phase, then convergence to the Gibbs distribution should be much faster. However, such phenomena have largely evaded rigorous analysis, as most tools in the study of Markov chain mixing times are tailored to worst-case initializations. In this paper we develop a general framework towards establishing this conjectured behavior for the Ising model. In the classical setting of the Ising model on an N-vertex torus in ?d, our framework implies that the mixing time for the Glauber dynamics, initialized from a 1/2-1/2 mixture of the all-plus and all-minus configurations, is N1+o(1) in dimension d=2, and at most quasi-polynomial in all dimensions d≥ 3, at all temperatures below the critical one. The key innovation in our analysis is the introduction of the notion of ”weak spatial mixing within a phase”, a low-temperature adaptation of the classical concept of weak spatial mixing. We show both that this new notion is strong enough to control the mixing time from the above random initialization (by relating it to the mixing time with plus boundary condition at O(logN) scales), and that it holds at all low temperatures in all dimensions. This framework naturally extends to more general families of graphs. To illustrate this, we use the same approach to establish optimal O(NlogN) mixing for the Ising Glauber dynamics on random regular graphs at sufficiently low temperatures, when initialized from the same random mixture."
STOC,2022,1459-1472,"Charlie Carlson, Ewan Davies, Alexandra Kolla, Will Perkins 0001",Computational thresholds for the fixed-magnetization Ising model.,https://doi.org/10.1145/3519935.3520003,"The ferromagnetic Ising model is a model of a magnetic material and a central topic in statistical physics. It also plays a starring role in the algorithmic study of approximate counting: approximating the partition function of the ferromagnetic Ising model with uniform external field is tractable at all temperatures and on all graphs, due to the randomized algorithm of Jerrum and Sinclair. Here we show that hidden inside the model are hard computational problems. For the class of bounded-degree graphs we find computational thresholds for the approximate counting and sampling problems for the ferromagnetic Ising model at fixed magnetization (that is, fixing the number of +1 and ?1 spins). In particular, letting βc(Δ) denote the critical inverse temperature of the zero-field Ising model on the infinite Δ-regular tree, and ηΔ,β,1+ denote the mean magnetization of the zero-field + measure on the infinite Δ-regular tree at inverse temperature β, we prove, for the class of graphs of maximum degree Δ: (i) for β < βc(Δ) there is an FPRAS and efficient sampling scheme for the fixed-magnetization Ising model for all magnetizations η. (ii) For β > βc(Δ), there is an FPRAS and efficient sampling scheme for the fixed-magnetization Ising model for magnetizations η such that |η| >ηΔ,β,1+. (iii) For β > βc(Δ), there is no FPRAS for the fixed-magnetization Ising model for magnetizations η such that |η| <ηΔ,β,1+  unless NP=RP."
STOC,2022,1473-1486,"Vishesh Jain, Will Perkins 0001, Ashwin Sah, Mehtaab Sawhney",Approximate counting and sampling via local central limit theorems.,https://doi.org/10.1145/3519935.3519957,"We give an FPTAS for computing the number of matchings of size k in a graph G of maximum degree Δ on n vertices, for all k ≤ (1?δ)m*(G), where δ>0 is fixed and m*(G) is the matching number of G, and an FPTAS for the number of independent sets of size k ≤ (1?δ) αc(Δ) n, where αc(Δ) is the NP-hardness threshold for this problem. We also provide quasi-linear time randomized algorithms to approximately sample from the uniform distribution on matchings of size k ≤ (1?δ)m*(G) and independent sets of size k ≤ (1?δ)αc(Δ)n. Our results are based on a new framework for exploiting local central limit theorems as an algorithmic tool. We use a combination of Fourier inversion, probabilistic estimates, and the deterministic approximation of partition functions at complex activities to extract approximations of the coefficients of the partition function. For our results for independent sets, we prove a new local central limit theorem for the hard-core model that applies to all fugacities below λc(Δ), the uniqueness threshold on the infinite Δ-regular tree."
STOC,2022,1487-1500,"Amir Abboud, Karl Bringmann, Seri Khoury, Or Zamir","Hardness of approximation in p via short cycle removal: cycle detection, distance oracles, and beyond.",https://doi.org/10.1145/3519935.3520066,"We present a new technique for efficiently removing almost all short cycles in a graph without unintentionally removing its triangles. Consequently, triangle finding problems do not become easy even in almost k-cycle free graphs, for any constant k≥ 4. Triangle finding is at the base of many conditional lower bounds in P, mainly for distance computation problems, and the existence of many 4- or 5-cycles in a worst-case instance had been the obstacle towards resolving major open questions.  Hardness of approximation: Are there distance oracles with m1+o(1) preprocessing time and mo(1) query time that achieve a constant approximation? Existing algorithms with such desirable time bounds only achieve super-constant approximation factors, while only 3? factors were conditionally ruled out (P?tra?cu, Roditty, and Thorup; FOCS 2012). We prove that no O(1) approximations are possible, assuming the 3-SUM or APSP conjectures. In particular, we prove that k-approximations require Ω(m1+1/ck) time, which is tight up to the constant?c. The lower bound holds even for the offline version where we are given the queries in advance, and extends to other problems such as dynamic shortest paths. The 4-Cycle problem: An infamous open question in fine-grained complexity is to establish any surprising consequences from a subquadratic or even linear-time algorithm for detecting a 4-cycle in a graph. This is arguably one of the simplest problems without a near-linear time algorithm nor a conditional lower bound. We prove that Ω(m1.1194) time is needed for k-cycle detection for all k≥ 4, unless we can detect a triangle in √n-degree graphs in O(n2?δ) time; a breakthrough that is not known to follow even from optimal matrix multiplication algorithms."
