booktitle,year,pages,author,title,ee,abstract
STOC,2022,750-763,"Dorit Aharonov, Sandy Irani",Hamiltonian complexity in the thermodynamic limit.,https://doi.org/10.1145/3519935.3520067,"Despite immense progress in quantum Hamiltonian complexity in the past decade, little is known about the computational complexity of quantum physics at the thermodynamic limit. In fact, even defining the problem properly is not straight forward. We study the complexity of estimating the ground energy of a fixed, translationally-invariant (TI) Hamiltonian in the thermodynamic limit, to within a given precision; this precision (given by n the number of bits of the approximation) is the sole input to the problem. Understanding the complexity of this problem captures how difficult it is for a physicist to measure or compute another digit in the approximation of a physical quantity in the thermodynamic limit. We show that this problem is contained in FEXPQMA-EXP and is hard for FEXPNEXP. This means that the problem is doubly exponentially hard in the size of the input. As an ingredient in our construction, we study the problem of computing the ground energy of translationally invariant finite 1D chains. A single Hamiltonian term, which is a fixed parameter of the problem, is applied to every pair of particles in a finite chain. In the finite case, the length of the chain is the sole input to the problem and the task is to compute an approximation of the ground energy. No thresholds are provided as in the standard formulation of the local Hamiltonian problem. We show that this problem is contained in FPQMA-EXP and is hard for FPNEXP. Our techniques employ a circular clock structure in which the ground energy is calibrated by the length of the cycle. This requires more precise expressions for the ground states of the resulting matrices than was required for previous QMA-completeness constructions and even exact analytical bounds for the infinite case which we derive using techniques from spectral graph theory. To our knowledge, this is the first use of the circuit-to-Hamiltonian construction which shows hardness for a function class."
STOC,2022,764-775,"James D. Watson, Toby S. Cubitt",Computational complexity of the ground state energy density problem.,https://doi.org/10.1145/3519935.3520052,"We study the complexity of finding the ground state energy density of a local Hamiltonian on a lattice in the thermodynamic limit of infinite lattice size.  We formulate this rigorously as a function problem, in which we request an estimate of the ground state energy density to some specified precision; and as an equivalent promise problem, GSED, in which we ask whether the ground state energy density is above or below specified thresholds.  The ground state energy density problem is unusual, in that it concerns a single, fixed Hamiltonian in the thermodynamic limit, whose ground state energy density is just some fixed, real number.  The only input to the computational problem is the precision to which to estimate this fixed real number, corresponding to the ground state energy density.  Hardness of this problem for a complexity class therefore implies that the solutions to all problems in the class are encoded in this single number (analogous to Chaitin’s constant in computability theory).  This captures computationally the type of question most commonly encountered in condensed matter physics, which is typically concerned with the physical properties of a single Hamiltonian in the thermodynamic limit.  We show that for classical, translationally invariant, nearest neighbour Hamiltonians on a 2D square lattice, PNEEXP?EXPGSED? EXPNEXP, and for quantum Hamiltonians PNEEXP?EXPGSED? EXPQMAEXP.  With some technical caveats on the oracle definitions, the EXP in some of these results can be strengthened to PSPACE.  We also give analogous complexity bounds for the function version of GSED."
STOC,2022,776-789,"Matthew B. Hastings, Ryan O'Donnell",Optimizing strongly interacting fermionic Hamiltonians.,https://doi.org/10.1145/3519935.3519960,"The fundamental problem in much of physics and quantum chemistry is to optimize a low-degree polynomial in certain anticommuting variables. Being a quantum mechanical problem, in many cases we do not know an efficient classical witness to the optimum, or even to an approximation of the optimum. One prominent exception is when the optimum is described by a so-called “Gaussian state”, also called a free fermion state. In this work we are interested in the complexity of this optimization problem when no good Gaussian state exists. Our primary testbed is the Sachdev–Ye–Kitaev (SYK) model of random degree-q polynomials, a model of great current interest in condensed matter physics and string theory, and one which has remarkable properties from a computational complexity standpoint. Among other results, we give an efficient classical certification algorithm for upper-bounding the largest eigenvalue in the q=4 SYK model, and an efficient quantum certification algorithm for lower-bounding this largest eigenvalue; both algorithms achieve constant-factor approximations with high probability."
STOC,2022,790-803,Omri Shmueli,Public-key Quantum money with a classical bank.,https://doi.org/10.1145/3519935.3519952,"Quantum money is a main primitive in quantum cryptography, that enables a bank to distribute to parties in the network, called wallets, unclonable quantum banknotes that serve as a medium of exchange between wallets.   While quantum money suggests a theoretical solution to some of the fundamental problems in currency systems, it still requires a strong model to be implemented; quantum computation and a quantum communication infrastructure.   A central open question in this context is whether we can have a quantum money scheme that uses ""minimal quantumness"", namely, local quantum computation and only classical communication.     Public-key semi-quantum money (Radian and Sattath, AFT 2019) is a quantum money scheme where the algorithm of the bank is completely classical, and quantum banknotes are publicly verifiable on any quantum computer. In particular, such scheme relies on local quantum computation and only classical communication.   The only known construction of public-key semi-quantum is based on quantum lightning (Zhandry, EUROCRYPT 2019), which is based on a computational assumption that is now known to be broken.     In this work, we construct public-key semi-quantum money, based on quantum-secure indistinguishability obfuscation and the sub-exponential hardness of the Learning With Errors problem.   The technical centerpiece of our construction is a new 3-message protocol, where a classical computer can delegate to a quantum computer the generation of a quantum state that is both, unclonable and publicly verifiable."
STOC,2022,804-817,"Zvika Brakerski, Henry Yuen",Quantum garbled circuits.,https://doi.org/10.1145/3519935.3520073,"In classical computing, garbled circuits (and their generalization known as randomized encodings) are a versatile cryptographic tool with many applications such as secure multiparty computation, delegated computation, depth-reduction of cryptographic primitives, complexity lower-bounds, and more. Quantum analogues of garbled circuits were not known prior to this work.     In this work, we introduce a definition of quantum randomized encodings and present a construction which allows us to efficiently garble any quantum circuit, assuming the existence of quantum-secure one-way functions. Our construction has comparable properties to the best known classical garbling schemes. We can also achieve perfect information-theoretic security albeit with blowup in the size of the garbled circuits.     We believe that quantum garbled circuits and quantum randomized encodings can be an instrumental concept and building block for quantum computation and in particular quantum cryptography. We present some applications, including a conceptually-simple zero-knowledge proof system for QMA, a protocol for private simultaneous messages, functional encryption, and more."
STOC,2022,818-831,"Russell Impagliazzo, Rex Lei, Toniann Pitassi, Jessica Sorrell",Reproducibility in learning.,https://doi.org/10.1145/3519935.3519973,"We introduce the notion of a reproducible algorithm in the context of learning. A reproducible learning algorithm is resilient to variations in its samples — with high probability, it returns the exact same output when run on two samples from the same underlying distribution. We begin by unpacking the definition, clarifying how randomness is instrumental in balancing accuracy and reproducibility. We initiate a theory of reproducible algorithms, showing how reproducibility implies desirable properties such as data reuse and efficient testability. Despite the exceedingly strong demand of reproducibility, there are efficient reproducible algorithms for several fundamental problems in statistics and learning. First, we show that any statistical query algorithm can be made reproducible with a modest increase in sample complexity, and we use this to construct reproducible algorithms for finding approximate heavy-hitters and medians. Using these ideas, we give the first reproducible algorithm for learning halfspaces via a reproducible weak learner and a reproducible boosting algorithm. Interestingly, we utilize a connection to foams as a higher-dimension randomized rounding scheme. Finally, we initiate the study of lower bounds and inherent tradeoffs for reproducible algorithms, giving nearly tight sample complexity upper and lower bounds for reproducible versus nonreproducible SQ algorithms."
STOC,2022,832-845,"Sitan Chen, Frederic Koehler, Ankur Moitra, Morris Yau",Kalman filtering with adversarial corruptions.,https://doi.org/10.1145/3519935.3520050,"Here we revisit the classic problem of linear quadratic estimation, i.e. estimating the trajectory of a linear dynamical system from noisy measurements. The celebrated Kalman filter gives an optimal estimator when the measurement noise is Gaussian, but is widely known to break down when one deviates from this assumption, e.g. when the noise is heavy-tailed. Many ad hoc heuristics have been employed in practice for dealing with outliers. In a pioneering work, Schick and Mitter gave provable guarantees when the measurement noise is a known infinitesimal perturbation of a Gaussian and raised the important question of whether one can get similar guarantees for large and unknown perturbations.      In this work we give a truly robust filter: we give the first strong provable guarantees for linear quadratic estimation when even a constant fraction of measurements have been adversarially corrupted. This framework can model heavy-tailed and even non-stationary noise processes.    Our algorithm robustifies the Kalman filter in the sense that it competes with the optimal algorithm that knows the locations of the corruptions. Our work is in a challenging Bayesian setting where the number of measurements scales with the complexity of what we need to estimate. Moreover, in linear dynamical systems past information decays over time. We develop a suite of new techniques to robustly extract information across different time steps and over varying time scales."
STOC,2022,846-859,"Constantinos Daskalakis, Noah Golowich",Fast rates for nonparametric online learning: from realizability to learning in games.,https://doi.org/10.1145/3519935.3519950,"We study fast rates of convergence in the setting of nonparametric online regression, namely where regret is defined with respect to an arbitrary function class which has bounded complexity. Our contributions are two-fold: - In the realizable setting of nonparametric online regression with the absolute loss, we propose a randomized proper learning algorithm which gets a near-optimal cumulative loss in terms of the sequential fat-shattering dimension of the hypothesis class. In the setting of online classification with a class of Littlestone dimension d, our bound reduces to d · poly logT. This result answers a question as to whether proper learners could achieve near-optimal cumulative loss; previously, even for online classification, the best known cumulative loss was ?( √dT). Further, for the real-valued (regression) setting, a cumulative loss bound with near-optimal scaling on sequential fat-shattering dimension was not even known for improper learners, prior to this work. - Using the above result, we exhibit an independent learning algorithm for general-sum binary games of Littlestone dimension d, for which each player achieves regret ?(d3/4 · T1/4). This result generalizes analogous results of Syrgkanis et al. (2015) who showed that in finite games the optimal regret can be accelerated from O(√T) in the adversarial setting to O(T1/4) in the game setting. To establish the above results, we introduce several new techniques, including: a hierarchical aggregation rule to achieve the optimal cumulative loss for real-valued classes, a multi-scale extension of the proper online realizable learner of Hanneke et al. (2021), an approach to show that the output of such nonparametric learning algorithms is stable, and a proof that the minimax theorem holds in all online learnable games."
STOC,2022,860-873,"Emmanuel Abbe, Shuangping Li, Allan Sly",Binary perceptron: efficient algorithms can find solutions in a rare well-connected cluster.,https://doi.org/10.1145/3519935.3519975,"It was recently shown that almost all solutions in the symmetric binary perceptron are isolated, even at low constraint densities, suggesting that finding typical solutions is hard. In contrast, some algorithms have been shown empirically to succeed in finding solutions at low density. This phenomenon has been justified numerically by the existence of subdominant and dense connected regions of solutions, which are accessible by simple learning algorithms. In this paper, we establish formally such a phenomenon for both the symmetric and asymmetric binary perceptrons. We show that at low constraint density (equivalently for overparametrized perceptrons), there exists indeed a subdominant connected cluster of solutions with almost maximal diameter, and that an efficient multiscale majority algorithm can find solutions in such a cluster with high probability, settling in particular an open problem posed by Perkins-Xu in STOC'21. In addition, even close to the critical threshold, we show that there exist clusters of linear diameter for the symmetric perceptron, as well as for the asymmetric perceptron under additional assumptions."
STOC,2022,874-885,"Ilias Diakonikolas, Daniel M. Kane, Vasilis Kontonis, Christos Tzamos, Nikos Zarifis",Learning general halfspaces with general Massart noise under the Gaussian distribution.,https://doi.org/10.1145/3519935.3519970,"We study the problem of PAC learning halfspaces on ?d with Massart noise under the Gaussian distribution. In the Massart model, an adversary is allowed to flip the label of each point x with unknown probability η(x) ≤ η, for some parameter η ∈ [0,1/2]. The goal is to find a hypothesis with misclassification error of OPT + ?, where OPT is the error of the target halfspace. This problem had been previously studied under two assumptions: (i) the target halfspace is homogeneous (i.e., the separating hyperplane goes through the origin), and (ii) the parameter η is strictly smaller than 1/2. Prior to this work, no nontrivial bounds were known when either of these assumptions is removed. We study the general problem and establish the following: [leftmargin = *] For η <1/2, we give a learning algorithm for general halfspaces with sample and computational complexity dOη(log(1/γ))poly(1/?), where γ  max{?, min{Pr[f(x) = 1], Pr[f(x) = ?1]} } is the “bias” of the target halfspace f. Prior efficient algorithms could only handle the special case of γ = 1/2. Interestingly, we establish a qualitatively matching lower bound of dΩ(log(1/γ)) on the complexity of any Statistical Query (SQ) algorithm. For η = 1/2, we give a learning algorithm for general halfspaces with sample and computational complexity O?(1) ?dO(log(1/?)). This result is new even for the subclass of homogeneous halfspaces; prior algorithms for homogeneous Massart halfspaces provide vacuous guarantees for η=1/2. We complement our upper bound with a nearly-matching SQ lower bound of dΩ(log(1/?) ), which holds even for the special case of homogeneous halfspaces.  Taken together, our results qualitatively characterize the complexity of learning general halfspaces with general Massart noise under Gaussian marginals. Our techniques rely on determining the existence (or non-existence) of low-degree polynomials whose expectations distinguish Massart halfspaces from random noise."
STOC,2022,886-899,"Fedor V. Fomin, Tuukka Korhonen",Fast FPT-approximation of branchwidth.,https://doi.org/10.1145/3519935.3519996,"Branchwidth determines how graphs, and more generally, arbitrary connectivity (basically symmetric and submodular) functions could be decomposed into a tree-like structure by specific cuts. We develop a general framework for designing fixed-parameter tractable (FPT) 2-approximation algorithms for branchwidth of connectivity functions. The first ingredient of our framework is combinatorial. We prove a structural theorem establishing that either a sequence of particular refinement operations could decrease the width of a branch decomposition or that the width of the decomposition is already within a factor of 2 from the optimum. The second ingredient is an efficient implementation of the refinement operations for branch decompositions that support efficient dynamic programming. We present two concrete applications of our general framework. An algorithm that for a given n-vertex graph G and integer k in time 22O(k) n2 either constructs a rank decomposition of G of width at most 2k or concludes that the rankwidth of G is more than k. It also yields a (22k+1?1)-approximation algorithm for cliquewidth within the same time complexity, which in turn, improves to f(k)n2 the running times of various algorithms on graphs of cliquewidth k. Breaking the “cubic barrier” for rankwidth and cliquewidth was an open problem in the area. An algorithm that for a given n-vertex graph G and integer k in time 2O(k) n either constructs a branch decomposition of G of width at most 2k or concludes that the branchwidth of G is more than k. This improves over the 3-approximation that follows from the recent treewidth 2-approximation of Korhonen [FOCS 2021]."
STOC,2022,900-913,"Bart M. P. Jansen, Michal Wlodarczyk 0001",Lossy planarization: a constant-factor approximate kernelization for planar vertex deletion.,https://doi.org/10.1145/3519935.3520021,"In the F-minor-free deletion problem we are given an undirected graph G and the?goal is to find a minimum vertex set that intersects all minor models of graphs from the family F. This captures numerous important problems including Vertex cover, Feedback vertex set, Treewidth-η modulator, and Vertex planarization. In the latter one, we ask for a?minimum vertex set whose removal makes the graph planar. This is a special case of F-minor-free deletion for the family F = {K5, K3,3}. Whenever the family F contains at least one planar graph, then F-minor-free deletion is known to admit a constant-factor approximation algorithm and a?polynomial kernelization [Fomin, Lokshtanov, Misra, and Saurabh, FOCS’12]. A?polynomial kernelization is a?polynomial-time algorithm that, given a graph G and integer?k, outputs a graph G′ on poly(k) vertices and integer k′, so that  OPT(G) ≤ k if and only if  OPT(G′) ≤ k′. The Vertex planarization problem is arguably the simplest setting for which F does not contain a?planar graph and the existence of?a?constant-factor approximation or a?polynomial kernelization remains a major open problem. In this work we show that Vertex planarization admits an?algorithm which is a combination of both approaches. Namely, we present a?polynomial α-approximate kernelization, for some constant α > 1, based on the framework of lossy kernelization [Lokshtanov, Panolan, Ramanujan, and Saurabh, STOC’17]. Simply speaking, when given a graph G and integer k, we show how to compute a graph G′ on poly(k) vertices so that any β-approximate solution to G′ can be lifted to an (α· β)-approximate solution to G, as long as OPT(G) ≤ k/α· β. In order to achieve this, we develop a?framework for sparsification of planar graphs which approximately preserves all separators and near-separators between subsets of the given terminal set. Our result yields an improvement over the state-of-art approximation algorithms for Vertex planarization. The problem admits a polynomial-time O(n?)-approximation algorithm, for any ? > 0, and a?quasi-polynomial-time (logn)O(1)-approximation algorithm, where n is the input size, both randomized [Kawarabayashi and Sidiropoulos, FOCS’17]. By pipelining these algorithms with our approximate kernelization, we improve the approximation factors to respectively O(OPT?) and (logOPT)O(1)."
STOC,2022,914-923,"Daniel Lokshtanov, Marcin Pilipczuk, Michal Pilipczuk, Saket Saurabh 0001",Fixed-parameter tractability of graph isomorphism in graphs with an excluded minor.,https://doi.org/10.1145/3519935.3520076,"We prove that Graph Isomorphism and Canonization in graphs excluding a fixed graph H as a minor can be solved by an algorithm working in time f(H)· nO(1), where f is some function. In other words, we show that these problems are fixed-parameter tractable when parameterized by the size of the excluded minor, with the caveat that the bound on the running time is not necessarily computable. The underlying approach is based on decomposing the graph in a canonical way into unbreakable (intuitively, well-connected) parts, which essentially provides a reduction to the case where the given H-minor-free graph is unbreakable itself. This is complemented by an analysis of unbreakable H-minor-free graphs, which reveals that every such graph can be canonically decomposed into a part that admits few automorphisms and a part that has bounded treewidth."
STOC,2022,924-937,"édouard Bonnet, Ugo Giocanti, Patrice Ossona de Mendez, Pierre Simon, Stéphan Thomassé, Szymon Torunczyk",Twin-width IV: ordered graphs and matrices.,https://doi.org/10.1145/3519935.3520037,"We establish a list of characterizations of bounded twin-width for hereditary classes of totally ordered graphs: as classes of at most exponential growth studied in enumerative combinatorics, as monadically NIP classes studied in model theory, as classes that do not transduce the class of all graphs studied in finite model theory, and as classes for which model checking first-order logic is fixed-parameter tractable studied in algorithmic graph theory. This has several consequences. First, it allows us to show that every hereditary class of ordered graphs either has at most exponential growth, or has at least factorial growth. This settles a question first asked by Balogh, Bollobás, and Morris [Eur. J. Comb. ’06] on the growth of hereditary classes of ordered graphs, generalizing the Stanley-Wilf conjecture/Marcus-Tardos theorem. Second, it gives a fixed-parameter approximation algorithm for twin-width on ordered graphs. Third, it yields a full classification of fixed-parameter tractable first-order model checking on hereditary classes of ordered binary structures. Fourth, it provides a model-theoretic characterization of classes with bounded twin-width. Finally, it settles our small conjecture [SODA ’21] in the case of ordered graphs."
STOC,2022,938-947,"Eun Jung Kim 0002, Stefan Kratsch, Marcin Pilipczuk, Magnus Wahlstr?m",Directed flow-augmentation.,https://doi.org/10.1145/3519935.3520018,"We show a flow-augmentation algorithm in directed graphs: There exists a randomized polynomial-time algorithm that, given a directed graph G, two integers s,t ∈ V(G), and an integer k, adds (randomly) to G a number of arcs such that for every minimal st-cut Z in G of size at most k, with probability 2?poly(k) the set Z becomes a minimum st-cut in the resulting graph. The directed flow-augmentation tool allows us to prove (randomized) fixed-parameter tractability of a number of problems parameterized by the cardinality of the deletion set, whose parameterized complexity status was repeatedly posed as open problems:  Chain SAT, defined by Chitnis, Egri, and Marx [ESA’13, Algorithmica’17], a number of weighted variants of classic directed cut problems, such as Weighted st-Cut, Weighted Directed Feedback Vertex Set, or Weighted Almost 2-SAT.  By proving that Chain SAT is (randomized) FPT, we confirm a conjecture of Chitnis, Egri, and Marx that, for any graph H, if the List H-Coloring problem is polynomial-time solvable, then the corresponding vertex-deletion problem is fixed-parameter tractable (with the remark that our algorithms are randomized)."
