booktitle,year,pages,author,title,ee,abstract
STOC,2003,417-425,"Rosario Gennaro, Yael Gertner, Jonathan Katz",Lower bounds on the efficiency of encryption and digital signature schemes.,https://doi.org/10.1145/780542.780604,"A central focus of modern cryptography is to investigate the weakest possible assumptions under which various cryptographic algorithms exist. Typically, a proof that a ""weak"" primitive (e.g., a one-way function) implies the existence of a ""strong"" algorithm (e.g., a private-key encryption scheme) proceeds by giving an explicit construction of the latter from the former. In addition to showing the existence of such a construction, an equally important research direction is to explore the efficiency of such constructions.Among the most fundamental cryptographic algorithms are digital signature schemes and schemes for public- or private-key encryption. Here, we show the first lower bounds on the efficiency of any encryption or signature construction based on black-box access to one-way or trapdoor one-way permutations. If S is the assumed security of the permutation π (i.e., no adversary of size S can invert π on a fraction larger than 1/S of its inputs), our results show that:Any public-key encryption scheme for m-bit messages must query π at least Ω(m log S) times.Any private-key encryption scheme for m-bit messages (with k-bit keys) must query π at least Ω(m-k/log S) times.Any signature verification algorithm for m-bit messages must query π at least Ω(m log S) times.Our bounds match known upper bounds for the case of encryption.We prove our results in an extension of the Impagliazzo-Rudich model. That is, we show that any black-box construction beating our lower bounds would imply the unconditional existence of a one-way function."
STOC,2003,426-437,"Ivan Damgård, Jens Groth",Non-interactive and reusable non-malleable commitment schemes.,https://doi.org/10.1145/780542.780605,"We consider non-malleable (NM) and universally composable (UC) commitment schemes in the common reference string (CRS) model. We show how to construct non-interactive NM commitments that remain non-malleable even if the adversary has access to an arbitrary number of commitments from honest players - rather than one, as in several previous schemes. We show this is a strictly stronger security notion. Our construction is the first non-interactive scheme achieving this that can be based on the minimal assumption of existence of one-way functions. But it can also be instantiated in a very efficient version based on the strong RSA assumption. For UC commitments, we show that existence of a UC commitment scheme in the CRS model (interactive or not) implies key exchange and - for a uniform reference string - even implies oblivious transfer. This indicates that UC commitment is a strictly stronger primitive than NM. Finally, we show that our strong RSA based construction can be used to improve the most efficient known UC commitment scheme so it can work with a CRS of size independent of the number of players, without loss of efficiency."
STOC,2003,438-447,"Robert Krauthgamer, James R. Lee",The intrinsic dimensionality of graphs.,https://doi.org/10.1145/780542.780607,"We resolve the following conjecture raised by Levin together with Linial, London, and Rabinovich [16]. Let Z∞d be the infinite graph whose vertex set is Zd and which has an edge (u,v) whenever ||u-v||∞ = 1. Let dim(G) be the smallest d such that G occurs as a (not necessarily induced) subgraph of Z∞d. The growth rate of G, denoted ρG, is the minimum ρ such that every ball of radius r > 1 in G contains at most rρ vertices. By simple volume arguments, dim(G) = Ω(ρG). Levin conjectured that this lower bound is tight, i.e., that dim(G) = O(ρG) for every graph G.Previously, it was not known whether dim(G) could be upper bounded by any function of ρG, even in the special case of trees. We show that a weaker form of Levin's conjecture holds by proving that, for every graph G, dim(G) = O(ρG log ρG). We disprove, however, the specific bound of the conjecture and show that our upper bound is tight by exhibiting graphs for which dim(G) =Ω(ρG log ρG). For families of graphs which exclude a fixed minor, we salvage the strong form, showing that dim(G) = O(ρG). This holds also for graphs without long induced simple cycles. Our results extend to a variant of the conjecture for finite-dimensional Euclidean spaces due to Linial[15]."
STOC,2003,448-455,"Jittat Fakcharoenphol, Satish Rao, Kunal Talwar",A tight bound on approximating arbitrary metrics by tree metrics.,https://doi.org/10.1145/780542.780608,"In this paper, we show that any n point metric space can be embedded into a distribution over dominating tree metrics such that the expected stretch of any edge is O(log n). This improves upon the result of Bartal who gave a bound of O(log n log log n). Moreover, our result is existentially tight; there exist metric spaces where any tree embedding must have distortion Ω(log n)-distortion. This problem lies at the heart of numerous approximation and online algorithms including ones for group Steiner tree, metric labeling, buy-at-bulk network design and metrical task system. Our result improves the performance guarantees for all of these problems."
STOC,2003,456-462,Yuri Rabinovich,On average distortion of embedding metrics into the line and into L1.,https://doi.org/10.1145/780542.780609,"We introduce and study the notion of the average distortion of a nonexpanding embedding of one metric space into another. Less sensitive than the multiplicative metric distortion, the average distortion captures well the global picture, and, overall, is a quite interesting new measure of metric proximity, related to the concentration of measure phenomenon. We establish close mutual relations between the MinCut- MaxFlow gap in a uniform-demand multicommodity flow, and the average distortion of embedding the suitable (dual) metric into l1. These relations are exploited to show that the shortest-path metrics of special (e.g., planar, bounded treewidth, etc.) graphs embed into l1 with constant average distortion. The main result of the paper claims that this remains true even if l1 is replaced with the line. This result is further sharpened for graphs of a bounded treewidth."
STOC,2003,463-472,"Yair Bartal, Nathan Linial, Manor Mendel, Assaf Naor",On metric ramsey-type phenomena.,https://doi.org/10.1145/780542.780610,"This paper deals with Ramsey-type theorems for metric spaces. Such a theorem states that every n point metric space contains a large subspace which can be embedded with some fixed distortion in a metric space from some special class.Our main theorem states that for any ε>0, every n point metric space contains a subspace of size at least n1-ε which is embeddable in an ultrametric with O(log(1/ε)/ε distortion. This in particular provides a bound for embedding in Euclidean spaces. The bound on the distortion is tight up to the log(1/ε) factor even for embedding in arbitrary Euclidean spaces. This result can be viewed as a non-linear analog of Dvoretzky's theorem, a cornerstone of modern Banach space theory and convex geometry.Our main Ramsey-type theorem and techniques naturally extend to give theorems for classes of hierarchically well-separated trees which have algorithmic implications, and can be viewed as the solution of a natural clustering problem.We further include a comprehensive study of various other aspects of the metric Ramsey problem."
STOC,2003,473-482,"Moshe Dror, Alon Efrat, Anna Lubiw, Joseph S. B. Mitchell",Touring a sequence of polygons.,https://doi.org/10.1145/780542.780612,"Given a sequence of k polygons in the plane, a start point s, and a target point, t, we seek a shortest path that starts at s, visits in order each of the polygons, and ends at t. If the polygons are disjoint and convex, we give an algorithm running in time O(kn log (n/k)), where n is the total number of vertices specifying the polygons. We also extend our results to a case in which the convex polygons are arbitrarily intersecting and the subpath between any two consecutive polygons is constrained to lie within a simply connected region; the algorithm uses O(nk2 log n) time. Our methods are simple and allow shortest path queries from s to a query point t to be answered in time O(k log n + m), where m is the combinatorial path length. We show that for nonconvex polygons this ""touring polygons"" problem is NP-hard.The touring polygons problem is a strict generalization of some classic problems in computational geometry, including the safari problem, the zoo-keeper problem, and the watchman route problem in a simple polygon. Our new results give an order of magnitude improvement in the running times of the safari problem and the watchman route problem: We solve the safari problem in O(n2 log n) time and the watchman route problem (through a fixed point s) in time O(n3 log n), compared with the previous time bounds of O(n3) and O(n4), respectively."
STOC,2003,483-492,"Jie Gao 0001, Li Zhang 0001",Well-separated pair decomposition for the unit-disk graph metric and its applications.,https://doi.org/10.1145/780542.780613,"We extend the classic notion of well-separated pair decomposition [10] to the (weighted) unit-disk graph metric: the shortest path distance metric induced by the intersection graph of unit disks. We show that for the unit-disk graph metric of n points in the plane and for any constant c≥1, there exists a c-well-separated pair decomposition with O(n log n) pairs, and the decomposition can be computed in O(n log n) time. We also show that for the unit-ball graph metric in k dimensions where k≥3, there exists a c-well-separated pair decomposition with O(n2-2/k) pairs, and the bound is tight in the worst case. We present the application of the well-separated pair decomposition in obtaining efficient algorithms for approximating the diameter, closest pair, nearest neighbor, center, median, and stretch factor, all under the unit-disk graph metric."
STOC,2003,493-502,"Tamal K. Dey, Joachim Giesen, Matthias John 0003",Alpha-shapes and flow shapes are homotopy equivalent.,https://doi.org/10.1145/780542.780614,"In this paper we establish a topological similarity between two apparently different shape constructors from a set of points. Shape constructors are geometric structures that transform finite point sets into continuous shapes. Due to their immense practical importance in geometric modeling various shape constructors have been proposed recently. Understanding the relations among them often leads to new insights that are potentially helpful in applications. Here we discover a topological equivalence among two such geometric structures, namely α shapes and flow shapes. Both shapes found applications in surface reconstruction and molecular modelin."
STOC,2003,511-520,"Elliot Anshelevich, Anirban Dasgupta 0001, Éva Tardos, Tom Wexler",Near-optimal network design with selfish agents.,https://doi.org/10.1145/780542.780617,"We introduce a simple network design game that models how independent selfish agents can build or maintain a large network. In our game every agent has a specific connectivity requirement, i.e. each agent has a set of terminals and wants to build a network in which his terminals are connected. Possible edges in the network have costs and each agent's goal is to pay as little as possible. Determining whether or not a Nash equilibrium exists in this game is NP-complete. However, when the goal of each player is to connect a terminal to a common source, we prove that there is a Nash equilibrium as cheap as the optimal network, and give a polynomial time algorithm to find a (1+ε)-approximate Nash equilibrium that does not cost much more. For the general connection game we prove that there is a 3-approximate Nash equilibrium that is as cheap as the optimal network, and give an algorithm to find a (4.65+ε)-approximate Nash equilibrium that does not cost much more."
STOC,2003,521-530,"Richard Cole 0001, Yevgeniy Dodis, Tim Roughgarden",Pricing network edges for heterogeneous selfish users.,https://doi.org/10.1145/780542.780618,"We study the negative consequences of selfish behavior in a congested network and economic means of influencing such behavior. We consider a model of selfish routing in which the latency experienced by network traffic on an edge of the network is a function of the edge congestion, and network users are assumed to selfishly route traffic on minimum-latency paths. The quality of a routing of traffic is measured by the sum of travel times (the total latency).It is well known that the outcome of selfish routing (a Nash equilibrium) does not minimize the total latency. An ancient strategy for improving the selfish solution is the principle of marginal cost pricing, which asserts that on each edge of the network, each network user on the edge should pay a tax offsetting the congestion effects caused by its presence. By pricing network edges according to this principle, the inefficiency of selfish routing can always be eradicated.This result, while fundamental, assumes a very strong homogeneity property: all network users are assumed to trade off time and money in an identical way. The guarantee also ignores both the algorithmic aspects of edge pricing and the unfortunate possibility that an efficient routing of traffic might only be achieved with exorbitant taxes. Motivated by these shortcomings, we extend this classical work on edge pricing in several different directions and prove the following results.We prove that the edges of a single-commodity network can always be priced so that an optimal routing of traffic arises as a Nash equilibrium, even for very general heterogeneous populations of network users.When there are only finitely many different types of network users and all edge latency functions are convex, we show how to compute such edge prices efficiently.We prove that an easy-to-check mathematical condition on the population of heterogeneous network users is both necessary and sufficient for the existence of edge prices that induce an optimal routing while requiring only moderate taxes."
STOC,2003,531-540,"Bernard Chazelle, Ding Liu, Avner Magen",Sublinear geometric algorithms.,https://doi.org/10.1145/780542.780620,"We initiate an investigation of sublinear algorithms for geometric problems in two and three dimensions. We give optimal algorithms for intersection detection of convex polygons and polyhedra, point location in two-dimensional Delaunay triangulations and Voronoi diagrams, and ray shooting in convex polyhedra, all of which run in time O(√n), where n is the size of the input. We also provide sublinear solutions for the approximate evaluation of the volume of a convex polytope and the length of the shortest path between two points on the boundary."
STOC,2003,541-546,"Boris Aronov, János Pach, Micha Sharir, Gábor Tardos",Distinct distances in three and higher dimensions.,https://doi.org/10.1145/780542.780621,"Improving an old result of Clarkson et al., we show that the number of distinct distances determined by a set P of n points in three-dimensional space is Ω(n77/141-ε)=Ω(n0.546), for any ε>0. Moreover, there always exists a point p ∈ P from which there are at least these many distinct distances to the remaining elements of P. The same result holds for points on the three-dimensional sphere. As a consequence, we obtain analogous results in higher dimensions."
STOC,2003,547-555,"Boris Aronov, Vladlen Koltun, Micha Sharir",Cutting triangular cycles of lines in space.,https://doi.org/10.1145/780542.780622,"We show that a collection of lines in 3-space can be cut into a subquadratic number of pieces, such that all depth cycles defined by triples of lines are eliminated. This partially resolves a long-standing open problem in computational geometry, motivated by hidden-surface removal in computer graphics."
STOC,2003,556-564,"Adam L. Buchsbaum, Howard J. Karloff, Claire Kenyon, Nick Reingold, Mikkel Thorup",OPT versus LOAD in dynamic storage allocation.,https://doi.org/10.1145/780542.780624,"Given a graph G=(V, E) and positive integral vertex weights w: V→ N, the max-coloring problem seeks to find a proper vertex coloring of G whose color classes C1, C2,..., Ck, minimize∑ k i= 1 maxv∈ Ci w (v). This problem, restricted to interval graphs, arises whenever there is a need to design dedicated memory managers that provide better performance than the general purpose memory management of the operating system. Specifically, companies have tried to solve this problem in the design of memory managers for wireless protocol stacks such as GPRS or 3G.Though this problem seems similar to the well-known dynamic storage allocation problem, we point out fundamental differences. We make a connection between max-coloring and on-line graph coloring and use this to devise a simple 2-approximation algorithm for max-coloring on interval graphs. We also show that a simple first-fit strategy, that is a natural choice for this problem, yields a 10-approximation algorithm. We show this result by proving that the first-fit algorithm for on-line coloring an interval graph G uses no more than 10· χ (G) colors, significantly improving the bound of 26· χ (G) by Kierstead and Qin (Discrete Math., 144, 1995). We also show that the max-coloring problem is NP-hard and claim that our proof can be extended to show a O (1)-factor hardness result for max-coloring interval graphs."
STOC,2003,565-574,"Robert D. Kleinberg, Frank Thomson Leighton",Consistent load balancing via spread minimization.,https://doi.org/10.1145/780542.780625,"Motivated by applications to web caching and other distributed server architectures, we analyze load balancing algorithms from the standpoint of spread, which measures the number of different assignments an item receives across multiple iterations of the algorithm on varying load distributions. Minimizing spread while balancing load is important in order to make efficient use of server resources such as memory and in order to minimize service latency. In the paper, we consider both on-line and off-line versions of the problem. Most importantly, we describe on-line load balancing algorithms with very low spread, which means that the assignments made for most items do not change even when the loads associated with the items do change. This means that load balancing is an example of a problem for which it is possible to find highly stable (or, consistent) on-line algorithms --- i.e. algorithms for which the output changes only slightly (with high probability) even if the inputs change dramatically.This paper is dedicated to the memory of Danny Lewin, who pioneered the notion of consistent hashing and its applications to load balancing and content distribution on the Internet. Danny's ideas furnished many of the underpinnings for the problem and algorithms studied herein."
STOC,2003,575-584,"Micah Adler, Eran Halperin, Richard M. Karp, Vijay V. Vazirani",A stochastic process on the hypercube with applications to peer-to-peer networks.,https://doi.org/10.1145/780542.780626,"Consider the following stochastic process executed on a graph G=(V,E) whose nodes are initially uncovered. In each step, pick a node at random and if it is uncovered, cover it. Otherwise, if it has an uncovered neighbor, cover a random uncovered neighbor. Else, do nothing. This can be viewed as a structured coupon collector process. We show that for a large family of graphs, O(n) steps suffice to cover all nodes of the graph with high probability, where n is the number of vertices. Among these graphs are d-regular graphs with d =Ω(log n log log n), random d-regular graphs with d =Ω(log n) and the k-dimensional hypercube where n=2k.This process arises naturally in answering a question on load balancing in peer-to-peer networks. We consider a distributed hash table in which keys are partitioned across a set of processors, and we assume that the number of processors grows dynamically, starting with a single processor. If at some stage there are n processors, the number of queries required to find a key is log2 n+O(1), the number of pointers maintained by each processor is log2 n+O(1), and moreover the worst ratio between the loads of processors is O(1), with high probability. To the best of our knowledge, this is the first analysis of a distributed hash table that achieves asymptotically optimal load balance, while still requiring only O(log n) pointers per processor and O(log n) queries for locating a key; previous methods required Ω(log2 n) pointers per processor and Ω(log n) queries for locating a key."
STOC,2003,585-594,"Eran Halperin, Robert Krauthgamer",Polylogarithmic inapproximability.,https://doi.org/10.1145/780542.780628,"We provide the first hardness result of a polylogarithmic approximation ratio for a natural NP-hard optimization problem. We show that for every fixed ε>0, the GROUP-STEINER-TREE problem admits no efficient log2-ε k approximation, where k denotes the number of groups (or, alternatively, the input size), unless NP has quasi polynomial Las-Vegas algorithms. This hardness result holds even for input graphs which are Hierarchically Well-Separated Trees, introduced by Bartal [FOCS, 1996]. For these trees (and also for general trees), our bound is nearly tight with the log-squared approximation currently known. Our results imply that for every fixed ε>0, the DIRECTED-STEINER TREE problem admits no log2-ε n--approximation, where n is the number of vertices in the graph, under the same complexity assumption."
STOC,2003,595-601,"Irit Dinur, Venkatesan Guruswami, Subhash Khot, Oded Regev 0001",A new multilayered PCP and the hardness of hypergraph vertex cover.,https://doi.org/10.1145/780542.780629,"Given a k-uniform hyper-graph, the Ek-Vertex-Cover problem is to find the smallest subset of vertices that intersects every hyper-edge. We present a new multilayered PCP construction that extends the Raz verifier. This enables us to prove that Ek-Vertex-Cover is NP-hard to approximate within factor (k-1-ε) for any k ≥ 3 and any ε>0. The result is essentially tight as this problem can be easily approximated within factor k. Our construction makes use of the biased Long-Code and is analyzed using combinatorial properties of s-wise t-intersecting families of subsets."
STOC,2003,602-611,"Chi-Jen Lu, Omer Reingold, Salil P. Vadhan, Avi Wigderson",Extractors: optimal up to constant factors.,https://doi.org/10.1145/780542.780630,"This paper provides the first explicit construction of extractors which are simultaneously optimal up to constant factors in  both seed length and output length. More precisely, for every n,k, our extractor uses a random seed of length O(log n) to transform any random source on n bits with (min-)entropy k, into a distribution on (1-α)k bits that is ε-close to uniform. Here α and ε can be taken to be any positive constants. (In fact, ε can be almost polynomially small.Our improvements are obtained via three new techniques, each of which may be of independent interest. The first is a general construction of mergers [22] from locally decodable error-correcting codes. The second introduces new  condensers that have constant seed length (and retain a constant fraction of the min-entropy in the random source). The third is a way to augment the ""win-win repeated condensing"" paradigm of [17] with error reduction techniques like [15] so that the our constant seed-length condensers can be used without error accumulation."
STOC,2003,612-621,"Eli Ben-Sasson, Madhu Sudan 0001, Salil P. Vadhan, Avi Wigderson",Randomness-efficient low degree tests and short PCPs via epsilon-biased sets.,https://doi.org/10.1145/780542.780631,"We present the first explicit construction of Probabilistically Checkable Proofs (PCPs) and Locally Testable Codes (LTCs) of fixed constant query complexity which have almost-linear (= n * 2Õ(√log n)) size. Such objects were recently shown to exist (nonconstructively) by Goldreich and Sudan[17]. Previous explicit constructions required size n1 + Ω(ε) with 1/ε queries. The key to these constructions is a nearly optimal randomness-efficient version of the low degree test[32]. In a similar way we give a randomness-efficient version of the BLR linearity test[13] (which is used, for instance, in locally testing the Hadamard code). The derandomizations are obtained through ε-biased sets for vector spaces over finite fields. The analysis of the derandomized tests rely on alternative views of ε-biased sets --- as generating sets of Cayley expander graphs for the low degree test, and as defining linear error-correcting codes for the linearity test."
STOC,2003,622-628,"Anna Östlin, Rasmus Pagh",Uniform hashing in constant time and linear space.,https://doi.org/10.1145/780542.780633,"Many algorithms and data structures employing hashing have been analyzed under the uniform hashing assumption, i.e., the assumption that hash functions behave like truly random functions. Starting with the discovery of universal hash functions, many researchers have studied to what extent this theoretical ideal can be realized by hash functions that do not take up too much space and can be evaluated quickly. In this paper we present an almost ideal solution to this problem: A hash function that, on any set of n inputs, behaves like a truly random function with high probability, can be evaluated in constant time on a RAM, and can be stored in O(n) words, which is optimal. For many hashing schemes this is the first hash function that makes their uniform hashing analysis come true, with high probability, without incurring overhead in time or space."
