booktitle,year,pages,author,title,ee,abstract
STOC,2019,840-851,"Navin Goyal, Abhishek Shetty",Non-Gaussian component analysis using entropy methods.,https://doi.org/10.1145/3313276.3316309,"Non-Gaussian component analysis (NGCA) is a problem in multidimensional data analysis which, since its formulation in 2006, has attracted considerable attention in statistics and machine learning. In this problem, we have a random variable X in n-dimensional Euclidean space. There is an unknown subspace Γ of the n-dimensional Euclidean space such that the orthogonal projection of X onto Γ is standard multidimensional Gaussian and the orthogonal projection of X onto Γ⊥, the orthogonal complement of Γ, is non-Gaussian, in the sense that all its one-dimensional marginals are different from the Gaussian in a certain metric defined in terms of moments. The NGCA problem is to approximate the non-Gaussian subspace Γ⊥ given samples of X.  Vectors in Γ⊥ correspond to ‘interesting’ directions, whereas vectors in Γ correspond to the directions where data is very noisy. The most interesting applications of the NGCA model is for the case when the magnitude of the noise is comparable to that of the true signal, a setting in which traditional noise reduction techniques such as PCA don’t apply directly. NGCA is also related to dimension reduction and to other data analysis problems such as ICA. NGCA-like problems have been studied in statistics for a long time using techniques such as projection pursuit.  We give an algorithm that takes polynomial time in the dimension n and has an inverse polynomial dependence on the error parameter measuring the angle distance between the non-Gaussian subspace and the subspace output by the algorithm. Our algorithm is based on relative entropy as the contrast function and fits under the projection pursuit framework. The techniques we develop for analyzing our algorithm maybe of use for other related problems."
STOC,2019,852-860,"Noga Alon, Roi Livni, Maryanthe Malliaris, Shay Moran",Private PAC learning implies finite Littlestone dimension.,https://doi.org/10.1145/3313276.3316312,"We show that every approximately differentially private learning algorithm (possibly improper) for a class H with Littlestone dimension d requires Ω(log*(d)) examples. As a corollary it follows that the class of thresholds over ℕ can not be learned in a private manner; this resolves open questions due to [Bun et al. 2015] and [Feldman and Xiao, 2015]. We leave as an open question whether every class with a finite Littlestone dimension can be learned by an approximately differentially private algorithm."
STOC,2019,861-868,"Sébastien Bubeck, Yin Tat Lee, Yuanzhi Li, Mark Sellke",Competitively chasing convex bodies.,https://doi.org/10.1145/3313276.3316314,"Let F be a family of sets in some metric space. In the F-chasing problem, an online algorithm observes a request sequence of sets in F and responds (online) by giving a sequence of points in these sets. The movement cost is the distance between consecutive such points. The competitive ratio is the worst case ratio (over request sequences) between the total movement of the online algorithm and the smallest movement one could have achieved by knowing in advance the request sequence. The family F is said to be chaseable if there exists an online algorithm with finite competitive ratio. In 1991, Linial and Friedman conjectured that the family of convex sets in Euclidean space is chaseable. We prove this conjecture."
STOC,2019,869-880,"Sitan Chen, Ankur Moitra",Beyond the low-degree algorithm: mixtures of subcubes and their applications.,https://doi.org/10.1145/3313276.3316375,"We introduce the problem of learning mixtures of k subcubes over {0,1}n, which contains many classic learning theory problems as a special case (and is itself a special case of others). We give a surprising nO(logk)-time learning algorithm based on higher-order multilinear moments. It is not possible to learn the parameters because the same distribution can be represented by quite different models. Instead, we develop a framework for reasoning about how multilinear moments can pinpoint essential features of the mixture, like the number of components.  We also give applications of our algorithm to learning decision trees with stochastic transitions (which also capture interesting scenarios where the transitions are deterministic but there are latent variables). Using our algorithm for learning mixtures of subcubes, we can approximate the Bayes optimal classifier within additive error є on k-leaf decision trees with at most s stochastic transitions on any root-to-leaf path in nO(s + logk)·poly(1/є) time. In this stochastic setting, the classic nO(logk)·poly(1/є)-time algorithms of Rivest, Blum, and Ehrenfreucht-Haussler for learning decision trees with zero stochastic transitions break down because they are fundamentally Occam algorithms. The low-degree algorithm of Linial-Mansour-Nisan is able to get a constant factor approximation to the optimal error (again within an additive є) and runs in time nO(s + log(k/є)). The quasipolynomial dependence on 1/є is inherent to the low-degree approach because the degree needs to grow as the target accuracy decreases, which is undesirable when є is small.  In contrast, as we will show, mixtures of k subcubes are uniquely determined by their 2 logk order moments and hence provide a useful abstraction for simultaneously achieving the polynomial dependence on 1/є of the classic Occam algorithms for decision trees and the flexibility of the low-degree algorithm in being able to accommodate stochastic transitions. Using our multilinear moment techniques, we also give the first improved upper and lower bounds since the work of Feldman-O’Donnell-Servedio for the related but harder problem of learning mixtures of binary product distributions."
STOC,2019,881-889,"Constantinos Daskalakis, Nishanth Dikkala, Ioannis Panageas",Regression from dependent observations.,https://doi.org/10.1145/3313276.3316362,"The standard linear and logistic regression models assume that the response variables are independent, but share the same linear relationship to their corresponding vectors of covariates. The assumption that the response variables are independent is, however, too strong. In many applications, these responses are collected on nodes of a network, or some spatial or temporal domain, and are dependent. Examples abound in financial and meteorological applications, and dependencies naturally arise in social networks through peer effects. Regression with dependent responses has thus received a lot of attention in the Statistics and Economics literature, but there are no strong consistency results unless multiple independent samples of the vectors of dependent responses can be collected from these models. We present computationally and statistically efficient methods for linear and logistic regression models when the response variables are dependent on a network. Given one sample from a networked linear or logistic regression model and under mild assumptions, we prove strong consistency results for recovering the vector of coefficients and the strength of the dependencies, recovering the rates of standard regression under independent observations. We use projected gradient descent on the negative log-likelihood, or negative log-pseudolikelihood, and establish their strong convexity and consistency using concentration of measure for dependent random variables."
STOC,2019,890-901,"Vatsal Sharan, Aaron Sidford, Gregory Valiant",Memory-sample tradeoffs for linear regression with small error.,https://doi.org/10.1145/3313276.3316403,"We consider the problem of performing linear regression over a stream of d-dimensional examples, and show that any algorithm that uses a subquadratic amount of memory exhibits a slower rate of convergence than can be achieved without memory constraints. Specifically, consider a sequence of labeled examples (a1,b1), (a2,b2)…, with ai drawn independently from a d-dimensional isotropic Gaussian, and where bi = ⟨ ai, x⟩ + ηi, for a fixed x ∈ ℝd with ||x||2 = 1 and with independent noise ηi drawn uniformly from the interval [−2−d/5,2−d/5]. We show that any algorithm with at most d2/4 bits of memory requires at least Ω(d loglog1/є) samples to approximate x to ℓ2 error є with probability of success at least 2/3, for є sufficiently small as a function of d. In contrast, for such є, x can be recovered to error є with probability 1−o(1) with memory O(d2 log(1/є)) using d examples. This represents the first nontrivial lower bounds for regression with super-linear memory, and may open the door for strong memory/sample tradeoffs for continuous optimization."
STOC,2019,902-913,"Rasmus Kyng, Richard Peng, Sushant Sachdeva, Di Wang",Flows in almost linear time via adaptive preconditioning.,https://doi.org/10.1145/3313276.3316410,"We present algorithms for solving a large class of flow and regression problems on unit weighted graphs to (1 + 1 / poly(n)) accuracy in almost-linear time. These problems include ℓp-norm minimizing flow for p large (p ∈ [ω(1), o(log2/3 n) ]), and their duals, ℓp-norm semi-supervised learning for p close to 1.  As p tends to infinity, p-norm flow and its dual tend to max-flow and min-cut respectively. Using this connection and our algorithms, we give an alternate approach for approximating undirected max-flow, and the first almost-linear time approximations of discretizations of total variation minimization objectives.  Our framework is inspired by the routing-based solver for Laplacian linear systems by Spielman and Teng (STOC ’04, SIMAX ’14), and is based on several new tools we develop, including adaptive non-linear preconditioning, tree-routings, and (ultra-)sparsification for mixed ℓ2 and ℓp norm objectives."
STOC,2019,914-925,"David Durfee, Yu Gao 0001, Gramoz Goranci, Richard Peng",Fully dynamic spectral vertex sparsifiers and applications.,https://doi.org/10.1145/3313276.3316379,"We study dynamic algorithms for maintaining spectral vertex sparsifiers of graphs with respect to a set of terminals T of our choice. Such objects preserve pairwise resistances, solutions to systems of linear equations, and energy of electrical flows between the terminals in T. We give a data structure that supports insertions and deletions of edges, and terminal additions, all in sublinear time. We then show the applicability of our result to the following problems.  (1) A data structure for dynamically maintaining solutions to Laplacian systems L x = b, where L is the graph Laplacian matrix and b is a demand vector. For a bounded degree, unweighted graph, we support modifications to both L and b while providing access to є-approximations to the energy of routing an electrical flow with demand b, as well as query access to entries of a vector x such that ∥x−L† b ∥L ≤ є ∥L† b ∥L in Õ(n11/12є−5) expected amortized update and query time.  (2) A data structure for maintaining fully dynamic All-Pairs Effective Resistance. For an intermixed sequence of edge insertions, deletions, and resistance queries, our data structures returns (1 ± є)-approximation to all the resistance queries against an oblivious adversary with high probability. Its expected amortized update and query times are Õ(min(m3/4,n5/6 є−2) є−4) on an unweighted graph, and Õ(n5/6є−6) on weighted graphs.  The key ingredients in these results are (1) the intepretation of Schur complement as a sum of random walks, and (2) a suitable choice of terminals based on the behavior of these random walks to make sure that the majority of walks are local, even when the graph itself is highly connected and (3) maintenance of these local walks and numerical solutions using data structures.  These results together represent the first data structures for maintain key primitives from the Laplacian paradigm for graph algorithms in sublinear time without assumptions on the underlying graph topologies. The importance of routines such as effective resistance, electrical flows, and Laplacian solvers in the static setting make us optimistic that some of our components can provide new building blocks for dynamic graph algorithms."
STOC,2019,926-937,"Ankur Moitra, Alexander S. Wein",Spectral methods from tensor networks.,https://doi.org/10.1145/3313276.3316357,"A tensor network is a diagram that specifies a way to ``multiply'' a collection of tensors together to produce another tensor (or matrix). Many existing algorithms for tensor problems (such as tensor decomposition and tensor PCA), although they are not presented this way, can be viewed as spectral methods on matrices built from simple tensor networks. In this work we leverage the full power of this abstraction to design new algorithms for certain continuous tensor decomposition problems.   An important and challenging family of tensor problems comes from orbit recovery, a class of inference problems involving group actions (inspired by applications such as cryo-electron microscopy). Orbit recovery problems over finite groups can often be solved via standard tensor methods. However, for infinite groups, no general algorithms are known. We give a new spectral algorithm based on tensor networks for one such problem: continuous multi-reference alignment over the infinite group SO(2). Our algorithm extends to the more general heterogeneous case."
STOC,2019,938-942,"Michael B. Cohen, Yin Tat Lee, Zhao Song 0002",Solving linear programs in the current matrix multiplication time.,https://doi.org/10.1145/3313276.3316303,"This article shows how to solve linear programs of the form minAx=b,x≥ 0 c⊤ x with n variables in time O*((nω+n2.5−α/2+n2+1/6) log (n/δ)), where ω is the exponent of matrix multiplication, α is the dual exponent of matrix multiplication, and δ is the relative accuracy. For the current value of ω δ 2.37 and α δ 0.31, our algorithm takes O*(nω log (n/δ)) time. When ω = 2, our algorithm takes O*(n2+1/6 log (n/δ)) time.  Our algorithm utilizes several new concepts that we believe may be of independent interest: • We define a stochastic central path method. • We show how to maintain a projection matrix √ WA⊤ (AWA⊤)−1A√ W in sub-quadratic time under \ell2 multiplicative changes in the diagonal matrix W."
STOC,2019,943-954,"Karl Bringmann, Marvin Künnemann, Karol Wegrzycki",Approximating APSP without scaling: equivalence of approximate min-plus and exact min-max.,https://doi.org/10.1145/3313276.3316373,"Zwick’s (1+ε)-approximation algorithm for the All Pairs Shortest Path (APSP) problem runs in time Õ(nω/ε logW), where ω ≤ 2.373 is the exponent of matrix multiplication and W denotes the largest weight. This can be used to approximate several graph characteristics including the diameter, radius, median, minimum-weight triangle, and minimum-weight cycle in the same time bound.  Since Zwick’s algorithm uses the scaling technique, it has a factor logW in the running time. In this paper, we study whether APSP and related problems admit approximation schemes avoiding the scaling technique. That is, the number of arithmetic operations should be independent of W; this is called strongly polynomial. Our main results are as follows.  (1) We design approximation schemes in strongly polynomial time O(nω/ε polylog(n/ε)) for APSP on undirected graphs as well as for the graph characteristics diameter, radius, median, minimum-weight triangle, and minimum-weight cycle on directed or undirected graphs.  (2) For APSP on directed graphs we design an approximation scheme in strongly polynomial time O(nω + 3/2 ε−1 polylog(n/ε)). This is significantly faster than the best exact algorithm.  (3) We explain why our approximation scheme for APSP on directed graphs has a worse exponent than ω: Any improvement over our exponent ω + 3/2 would improve the best known algorithm for Min-Max Product. In fact, we prove that approximating directed APSP and exactly computing the Min-Max Product are equivalent.  Our techniques yield a framework for approximation problems over the (min,+)-semiring that can be applied more generally. In particular, we obtain the first strongly polynomial approximation scheme for Min-Plus Convolution in strongly subquadratic time, and we prove an equivalence of approximate Min-Plus Convolution and exact Min-Max Convolution."
STOC,2019,955-966,Huacheng Yu,Optimal succinct rank data structure via approximate nonnegative tensor decomposition.,https://doi.org/10.1145/3313276.3316352,"Given an n-bit array A, the succinct rank data structure problem asks to construct a data structure using space n+r bits for r≪ n, supporting rank queries of form <pre>rank</pre>(u)=∑i=0u−1 A[i]. In this paper, we design a new succinct rank data structure with r=n/(logn)Ω(t)+n1−c and query time O(t) for some constant c>0, improving the previous best-known by Pǎtraşcu, which has r=n/(logn/t)Ω(t)+Õ(n3/4) bits of redundancy. For r>n1−c, our space-time tradeoff matches the cell-probe lower bound by Pǎtraşcu and Viola, which asserts that r must be at least n/(logn)O(t). Moreover, one can avoid an n1−c-bit lookup table when the data structure is implemented in the cell-probe model, achieving r=⌈ n/(logn)Ω(t)⌉. It matches the lower bound for the full range of parameters.  En route to our new data structure design, we establish an interesting connection between succinct data structures and approximate nonnegative tensor decomposition. Our connection shows that for specific problems, to construct a space-efficient data structure, it suffices to approximate a particular tensor by a sum of (few) nonnegative rank-1 tensors. For the rank problem, we explicitly construct such an approximation, which yields an explicit construction of the data structure."
STOC,2019,967-978,"Zeev Dvir, Alexander Golovnev, Omri Weinstein",Static data structure lower bounds imply rigidity.,https://doi.org/10.1145/3313276.3316348,"We show that static data structure lower bounds in the group (linear) model imply semi-explicit lower bounds on matrix rigidity. In particular, we prove that an explicit lower bound of t ≥ ω(log2 n) on the cell-probe complexity of linear data structures in the group model, even against arbitrarily small linear space (s= (1+)n), would already imply a semi-explicit (PNP) construction of rigid matrices with significantly better parameters than the current state of art (Alon, Panigrahy and Yekhanin, 2009). Our results further assert that polynomial (t≥ nδ) data structure lower bounds against near-optimal space, would imply super-linear circuit lower bounds for log-depth linear circuits (a four-decade open question). In the succinct space regime (s=n+o(n)), we show that any improvement on current cell-probe lower bounds in the linear model would also imply new rigidity bounds. Our results rely on a new connection between the “inner” and “outer” dimensions of a matrix (Paturi and Pudlák, 2006), and on a new reduction from worst-case to average-case rigidity, which is of independent interest."
STOC,2019,979-985,"Omar Alrabiah, Venkatesan Guruswami",An exponential lower bound on the sub-packetization of MSR codes.,https://doi.org/10.1145/3313276.3316387,
STOC,2019,986-996,"Dan Alistarh, James Aspnes, Faith Ellen, Rati Gelashvili, Leqi Zhu",Why extension-based proofs fail.,https://doi.org/10.1145/3313276.3316407,"It is impossible to deterministically solve wait-free consensus in an asynchronous system. The classic proof uses a valency argument, which constructs an infinite execution by repeatedly extending a finite execution. We introduce extension-based proofs, a class of impossibility proofs that are modelled as an interaction between a prover and a protocol and that include valency arguments.  Using proofs based on combinatorial topology, it has been shown that it is impossible to deterministically solve k-set agreement among n > k ≥ 2 processes in a wait-free manner. However, it was unknown whether proofs based on simpler techniques were possible. We show that this impossibility result cannot be obtained by an extension-based proof and, hence, extension-based proofs are limited in power."
STOC,2019,997-1008,"Alireza Farhadi 0001, MohammadTaghi Hajiaghayi, Kasper Green Larsen, Elaine Shi",Lower bounds for external memory integer sorting via network coding.,https://doi.org/10.1145/3313276.3316337,"Sorting extremely large datasets is a frequently occuring task in practice. These datasets are usually much larger than the computer’s main memory; thus external memory sorting algorithms, first introduced by Aggarwal and Vitter (1988), are often used. The complexity of comparison based external memory sorting has been understood for decades by now, however the situation remains elusive if we assume the keys to be sorted are integers. In internal memory, one can sort a set of n integer keys of Θ(lgn) bits each in O(n) time using the classic Radix Sort algorithm, however in external memory, there are no faster integer sorting algorithms known than the simple comparison based ones. Whether such algorithms exist has remained a central open problem in external memory algorithms for more than three decades.  In this paper, we present a tight conditional lower bound on the complexity of external memory sorting of integers. Our lower bound is based on a famous conjecture in network coding by Li and Li (2004), who conjectured that network coding cannot help anything beyond the standard multicommodity flow rate in undirected graphs.  The only previous work connecting the Li and Li conjecture to lower bounds for algorithms is due to Adler et al. (2006). Adler et al. indeed obtain relatively simple lower bounds for oblivious algorithms (the memory access pattern is fixed and independent of the input data). Unfortunately obliviousness is a strong limitations, especially for integer sorting: we show that the Li and Li conjecture implies an Ω(n logn) lower bound for internal memory oblivious sorting when the keys are Θ(lgn) bits. This is in sharp contrast to the classic (non-oblivious) Radix Sort algorithm. Indeed going beyond obliviousness is highly non-trivial; we need to introduce several new methods and involved techniques, which are of their own interest, to obtain our tight lower bound for external memory integer sorting."
STOC,2019,1009-1020,"Tyler Helmuth, Will Perkins 0001, Guus Regts",Algorithmic Pirogov-Sinai theory.,https://doi.org/10.1145/3313276.3316305,We develop an efficient algorithmic approach for approximate counting and sampling in the low-temperature regime of a broad class of statistical physics models on finite subsets of the lattice ℤd and on the torus (ℤ/n ℤ)d. Our approach is based on combining contour representations from Pirogov–Sinai theory with Barvinok’s approach to approximate counting using truncated Taylor series. Some consequences of our main results include an FPTAS for approximating the partition function of the hard-core model at sufficiently high fugacity on subsets of ℤd with appropriate boundary conditions and an efficient sampling algorithm for the ferromagnetic Potts model on the discrete torus (ℤ/n ℤ)d at sufficiently low temperature.
STOC,2019,1021-1026,Daniel Dadush,On approximating the covering radius and finding dense lattice subspaces.,https://doi.org/10.1145/3313276.3316397,"In this work, we give a novel algorithm for computing dense lattice subspaces, a conjecturally tight characterization of the lattice covering radius, and provide a bound on the slicing constant of lattice Voronoi cells. Our work is motivated by the pursuit of faster algorithms for integer programming, for which we give a conditional speedup based on the recent resolution of the ℓ2 Kannan-Lovász conjecture. Through these results, we hope to motivate further study of the interplay between the recently developed reverse Minkowski theory, lattice algorithms and convex geometry.  On the algorithmic side, our main contribution is a 2O(n)-time algorithm for computing a O(Cη(n))-approximate sublattice of minimum normalized determinant on any n-dimensional lattice, where Cη(n) = O(logn) is the reverse Minkowski constant in dimension n. Our method for finding dense lattice subspaces is surprisingly simple: we iteratively descend to a random co-dimension 1 subspace chosen to be the orthogonal space to a discrete Gaussian sample from the dual lattice. Applying this algorithm within a “filtration reduction” scheme, we further show how to compute a O(Cη(n))-approximate canonical filtration of any lattice, which corresponds to a canonical way of decomposing a lattice into dense blocks. As a primary application, we get the first 2O(n)-time algorithm for computing a sparse lattice projection whose “volume radius” provides a lower bound on the lattice covering radius that is tight within a O(log2.5 n)-factor. This provides an efficient algorithmic version of the ℓ2 Kannan-Lovász conjecture, which was recently resolved by Regev and Stephens-Davidowitz (STOC ’2017).  On the structural side, we prove a new lower bound on the covering radius which combines volumetric lower bounds across a chain of lattice projections. Assuming Bourgain’s slicing conjecture restricted to Voronoi cells of stable lattices, our lower bound implies (somewhat surprisingly) that the problem of approximating the lattice covering radius to within a constant factor is in . Complementing this result, we show that the slicing constant of any n-dimensional Voronoi cell is bounded by O(CKL,2(n)) = O(log1.5 n), the ℓ2 Kannan-Lovász constant, which complements the O(logn) bound of Regev and Stephens-Davidowitz for stable Voronoi cells."
