booktitle,year,pages,author,title,ee,abstract
STOC,2011,363-372,"Atish Das Sarma, Stephan Holzer, Liah Kor, Amos Korman, Danupon Nanongkai, Gopal Pandurangan, David Peleg, Roger Wattenhofer",Distributed verification and hardness of distributed approximation.,https://doi.org/10.1145/1993636.1993686,"We study the verification problem in distributed networks, stated as follows. Let H be a subgraph of a network G where each vertex of G knows which edges incident on it are in H. We would like to verify whether H has some properties, e.g., if it is a tree or if it is connected (every node knows in the end of the process whether H has the specified property or not). We would like to perform this verification in a decentralized fashion via a distributed algorithm. The time complexity of verification is measured as the number of rounds of distributed communication. In this paper we initiate a systematic study of distributed verification, and give almost tight lower bounds on the running time of distributed verification algorithms for many fundamental problems such as connectivity, spanning connected subgraph, and s-t cut verification. We then show applications of these results in deriving strong unconditional time lower bounds on the hardness of distributed approximation for many classical optimization problems including minimum spanning tree, shortest paths, and minimum cut. Many of these results are the first non-trivial lower bounds for both exact and approximate distributed computation and they resolve previous open questions. Moreover, our unconditional lower bound of approximating minimum spanning tree (MST) subsumes and improves upon the previous hardness of approximation bound of Elkin [STOC 2004] as well as the lower bound for (exact) MST computation of Peleg and Rubinovich [FOCS 1999]. Our result implies that there can be no distributed approximation algorithm for MST that is significantly faster than the current exact algorithm, for any approximation factor. Our lower bound proofs show an interesting connection between communication complexity and distributed computing which turns out to be useful in establishing the time complexity of exact and approximate distributed computation of many problems."
STOC,2011,373-382,"Wojciech M. Golab, Lisa Higham, Philipp Woelfel",Linearizable implementations do not suffice for randomized distributed computation.,https://doi.org/10.1145/1993636.1993687,"Linearizability is the gold standard among algorithm designers for deducing the correctness of a distributed algorithm using implemented shared objects from the correctness of the corresponding algorithm using atomic versions of the same objects. We show that linearizability does not suffice for this purpose when processes can exploit randomization, and we discuss the existence of alternative correctness conditions. This paper makes the following contributions: 1. Various examples demonstrate that using well-known linearizable implementations of objects (e.g., snapshots) in place of atomic objects can change the probability distribution of the outcomes that the adversary is able to generate. In some cases, an oblivious adversary can create a probability distribution of outcomes for an algorithm with implemented, linearizable objects, that not even a strong adversary can generate for the same algorithm with atomic objects. 2. A new correctness condition for shared object implementations, called strong inearizability, is defined. We prove that a strong adversary (i.e., one that sees the outcome of each coin flip immediately) gains no additional power when atomic objects are replaced by strongly linearizable implementations. In general, no strictly weaker correctness condition suffices to ensure this. We also show that strong linearizability is a local and composable property. 3. In contrast to the situation for the strong adversary, for a natural weaker adversary (one that cannot see a process' coin flip until its next operation on a shared object) we prove that there is no correspondingly general correctness condition. Specifically, any linearizable implementation of counters called terminating. from atomic registers and load-linked/store-conditional objects, that satisfies a natural locality property, necessarily gives the weak adversary more power than it has with atomic counters."
STOC,2011,383-392,"Erez Kantor, Zvi Lotker, Merav Parter, David Peleg",The topology of wireless communication.,https://doi.org/10.1145/1993636.1993688,"In this paper we study the topological properties of wireless communication maps and their usability in algorithmic design. We consider the SINR model, which compares the received power of a signal at a receiver against the sum of strengths of other interfering signals plus background noise. To describe the behavior of a multi-station network, we use the convenient representation of a reception map. In the SINR model, the resulting SINR diagram partitions the plane into reception zones, one per station, and the complementary region of the plane where no station can be heard. SINR diagrams have been studied in [3] for the specific case where all stations use the same power. It is shown that the reception zones are convex (hence connected) and fat, and this is used to devise an efficient algorithm for the fundamental problem of point location. Here we consider the more general (and common) case where transmission energies are arbitrary (or non-uniform). Under that setting, the reception zones are not necessarily convex or even connected. This poses the algorithmic challenge of designing efficient point location techniques for the non-uniform setting, as well as the theoretical challenge of understanding the geometry of SINR diagrams (e.g., the maximal number of connected components they might have). We achieve several results in both directions. We establish a form of weaker convexity in the case where stations are aligned on a line and use this to derive a tight bound on the number of connected components in this case. In addition, one of our key results concerns the behavior of a (d+1)-dimensional map, i.e., a map in one dimension higher than the dimension in which stations are embedded. Specifically, although the d-dimensional map might be highly fractured, drawing the map in one dimension higher ""heals"" the zones, which become connected (in fact hyperbolically connected). In addition, as a step toward establishing a weaker form of convexity for the d-dimensional map, we study the interference function and show that it satisfies the maximum principle. This is done through an analysis technique based on looking at the behavior of systems composed on lines of densely placed weak stations, as the number of stations tends to infinity, keeping their total transmission energy fixed. Finally, we turn to consider algorithmic applications, and propose a new variant of approximate point location."
STOC,2011,393-402,"George Giakkoupis, Nicolas Schabanel",Optimal path search in small worlds: dimension matters.,https://doi.org/10.1145/1993636.1993689,"We consider Kleinberg's celebrated small-world model (2000). This model is based on a d-dimensional grid graph of n nodes, augmented by a constant number of ""long-range links"" per node. It is known that this graph has diameter O(log n), and that a simple greedy search algorithm visits an expected number of O(log2 n) nodes, which is asymptotically optimal over all decentralized search algorithms. Besides the number of nodes visited, a relevant measure is the length of the path constructed by the search algorithm. A decentralized algorithm by Lebhar and Schabanel (2003) constructs paths of expected length O(log n (loglog n)2) by visiting the same number of nodes as greedy search. A natural question, posed by Kleinberg (2006), is whether there are decentralized algorithms that construct paths of length O(log n) while visiting only a poly-logarithmic number of nodes. In this paper we resolve this question. For grid dimension d=1, we answer the question in the negative, by showing that any decentralized algorithm that visits a poly-logarithmic number of nodes constructs paths of expected length O(log n loglog n). Further we show that this bound is tight; a simple variant of the algorithm by Lebhar and Schabanel matches this bound. For dimension de2, however, we answer the question in the affirmative; the bound is achieved by essentially the same algorithm we used for d=1. This is the first time that such a dichotomy, based on the dimension d, has been observed for an aspect of this model. Our results may be applicable to the design of peer-to-peer networks, where the length of the path along which data are transferred is critical for the network's performance."
STOC,2011,403-412,"Andrew Novocin, Damien Stehlé, Gilles Villard",An LLL-reduction algorithm with quasi-linear time complexity: extended abstract.,https://doi.org/10.1145/1993636.1993691,"We devise an algorithm, L1, with the following specifications: It takes as input an arbitrary basis B=(bi)i ∈ Zd x d of a Euclidean lattice L; It computes a basis of L which is reduced for a mild modification of the Lenstra-Lenstra-Lovász reduction; It terminates in time O(d5+ε β + dω+1+ε β1+ε) where β = log max |bi| (for any ε>0 and ω is a valid exponent for matrix multiplication). This is the first LLL-reducing algorithm with a time complexity that is quasi-linear in β and polynomial in d. The backbone structure of L1 is able to mimic the Knuth-Schönhage fast gcd algorithm thanks to a combination of cutting-edge ingredients. First the bit-size of our lattice bases can be decreased via truncations whose validity are backed by recent numerical stability results on the QR matrix factorization. Also we establish a new framework for analyzing unimodular transformation matrices which reduce shifts of reduced bases, this includes bit-size control and new perturbation tools. We illustrate the power of this framework by generating a family of reduction algorithms."
STOC,2011,413-420,"Subhash Khot, Dana Moshkovitz",NP-hardness of approximately solving linear equations over reals.,https://doi.org/10.1145/1993636.1993692,"In this paper, we consider the problem of approximately solving a system of homogeneous linear equations over reals, where each equation contains at most three variables. Since the all-zero assignment always satisfies all the equations exactly, we restrict the assignments to be ""non-trivial"". Here is an informal statement of our result: it is NP-hard to distinguish whether there is a non-trivial assignment that satisfies 1-δ fraction of the equations or every non-trivial assignment fails to satisfy a constant fraction of the equations with a ""margin"" of Ω(√δ). We develop linearity and dictatorship testing procedures for functions f: Rn -> R over a Gaussian space, which could be of independent interest. We believe that studying the complexity of linear equations over reals, apart from being a natural pursuit, can lead to progress on the Unique Games Conjecture."
STOC,2011,421-430,"Shubhangi Saraf, Ilya Volkovich",Black-box identity testing of depth-4 multilinear circuits.,https://doi.org/10.1145/1993636.1993693,"We study the problem of identity testing for multilinear ΣΠΣΠ(k) circuits, i.e. multilinear depth-4 circuits with fan-in k at the top + gate. We give the first polynomial-time deterministic identity testing algorithm for such circuits. Our results also hold in the black-box setting. The running time of our algorithm is (ns)O(k3), where n is the number of variables, s is the size of the circuit and k is the fan-in of the top gate. The importance of this model arises from [3], where it was shown that derandomizing black-box polynomial identity testing for general depth-4 circuits implies a derandomization of polynomial identity testing (PIT) for general arithmetic circuits. Prior to our work, the best PIT algorithm for multilinear ΣΠΣΠ(k) circuits [13] ran in quasi-polynomial-time, with the running time being nO(k6 log(k) log2 s ). We obtain our results by showing a strong structural result for multilinear ΣΠΣΠ(k) circuits that compute the zero polynomial. We show that under some mild technical conditions, any gate of such a circuit must compute a sparse polynomial. We then show how to combine the structure theorem with a result by Klivans and Spielman [17], on the identity testing for sparse polynomials, to yield the full result."
STOC,2011,431-440,"Nitin Saxena 0001, C. Seshadhri 0001",Blackbox identity testing for bounded top fanin depth-3 circuits: the field doesn't matter.,https://doi.org/10.1145/1993636.1993694,"Let C be a depth-3 circuit with n variables, degree d and top fanin k (called ΣΠΣ(k,d,n) circuits) over base field FF. It is a major open problem to design a deterministic polynomial time blackbox algorithm that tests if C is identically zero. Klivans & Spielman (STOC 2001) observed that the problem is open even when k is a constant. This case has been subjected to a serious study over the past few years, starting from the work of Dvir & Shpilka (STOC 2005). We give the first polynomial time blackbox algorithm for this problem. Our algorithm runs in time poly(n)dk, regardless of the base field. The only field for which polynomial time algorithms were previously known is FF = QQ (Kayal & Saraf, FOCS 2009, and Saxena & Seshadhri, FOCS 2010). This is the first blackbox algorithm for depth- circuits that does not use the rank based approaches of Karnin & Shpilka (CCC 2008). We prove an important tool for the study of depth-3 identities. We design a blackbox polynomial time transformation that reduces the number of variables in a ΣΠΣ(k,d,n) circuit to k variables, but preserves the identity structure."
STOC,2011,441-450,"Erik D. Demaine, MohammadTaghi Hajiaghayi, Ken-ichi Kawarabayashi",Contraction decomposition in h-minor-free graphs and algorithmic applications.,https://doi.org/10.1145/1993636.1993696,"We prove that any graph excluding a fixed minor can have its edges partitioned into a desired number k of color classes such that contracting the edges in any one color class results in a graph of treewidth linear in k. This result is a natural finale to research in contraction decomposition, generalizing previous such decompositions for planar and bounded-genus graphs, and solving the main open problem in this area (posed at SODA 2007). Our decomposition can be computed in polynomial time, resulting in a general framework for approximation algorithms, particularly PTASs (with k ∼ 1/ε), and fixed-parameter algorithms, for problems closed under contractions in graphs excluding a fixed minor. For example, our approximation framework gives the first PTAS for TSP in weighted H-minor-free graphs, solving a decade-old open problem of Grohe; and gives another fixed-parameter algorithm for k-cut in H-minor-free graphs, which was an open problem of Downey et al. even for planar graphs. To obtain our contraction decompositions, we develop new graph structure theory to realize virtual edges in the clique-sum decomposition by actual paths in the graph, enabling the use of the powerful Robertson--Seymour Graph Minor decomposition theorem in the context of edge contractions (without edge deletions). This requires careful construction of paths to avoid blowup in the number of required paths beyond 3. Along the way, we strengthen and simplify contraction decompositions for bounded-genus graphs, so that the partition is determined by a simple radial ball growth independent of handles, starting from a set of vertices instead of just one, as long as this set is tight in a certain sense. We show that this tightness property holds for a constant number of approximately shortest paths in the surface, introducing several new concepts such as dives and rainbows."
STOC,2011,451-458,"Ken-ichi Kawarabayashi, Paul Wollan",A simpler algorithm and shorter proof for the graph minor decomposition.,https://doi.org/10.1145/1993636.1993697,"At the core of the Robertson-Seymour theory of graph minors lies a powerful decomposition theorem which captures, for any fixed graph H, the common structural features of all the graphs which do not contain H as a minor. Robertson and Seymour used this result to prove Wagner's Conjecture that finite graphs are well-quasi-ordered under the graph minor relation, as well as give a polynomial time algorithm for the disjoint paths problem when the number of the terminals is fixed. The theorem has since found numerous applications, both in graph theory and theoretical computer science. The original proof runs more than 400 pages and the techniques used are highly non-trivial. In this paper, we give a simplified algorithm for finding the decomposition based on a new constructive proof of the decomposition theorem for graphs excluding a fixed minor H. The new proof is both dramatically simpler and shorter, making these results and techniques more accessible. The algorithm runs in time O(n3), as does the original algorithm of Robertson and Seymour. Moreover, our proof gives an explicit bound on the constants in the O notation, whereas the original proof of Robertson and Seymour does not."
STOC,2011,459-468,"Nicolas Bousquet, Jean Daligault, Stéphan Thomassé",Multicut is FPT.,https://doi.org/10.1145/1993636.1993698,"Let G=(V,E) be a graph on n vertices and R be a set of pairs of vertices in V called requests. A multicut is a subset F of E such that every request xy of R is cut by F, i.e. every xy-path of G intersects F. We show that there exists an O(f(k)nc) algorithm which decides if there exists a multicut of size at most k. In other words, the Multicut problem parameterized by the solution size k is Fixed-Parameter Tractable."
STOC,2011,469-478,"Dániel Marx, Igor Razgon",Fixed-parameter tractability of multicut parameterized by the size of the cutset.,https://doi.org/10.1145/1993636.1993699,"Given an undirected graph , a collection {(s1,t1), ..., (sl,tl)} of pairs of vertices, and an integer p, the Edge Multicut problem ask if there is a set S of at most p edges such that the removal of S disconnects every si from the corresponding ti. Vertex Multicut is the analogous problem where S is a set of at most p vertices. Our main result is that both problems can be solved in time 2O(p3) ⋅ nO(1), i.e., fixed-parameter tractable parameterized by the size p of the cutset in the solution. By contrast, it is unlikely that an algorithm with running time of the form f(p) ⋅ nO(1) exists for the directed version of the problem, as we show it to be W[1]-hard parameterized by the size of the cutset."
STOC,2011,479-488,"Martin Grohe, Ken-ichi Kawarabayashi, Dániel Marx, Paul Wollan",Finding topological subgraphs is fixed-parameter tractable.,https://doi.org/10.1145/1993636.1993700,"We prove that for every fixed undirected graph H, there is an O(|V(G)|3) time algorithm that, given a graph G, tests if G contains H as a topological subgraph (that is, a subdivision of H is subgraph of G). This shows that topological subgraph testing is fixed-parameter tractable, resolving a longstanding open question of Downey and Fellows from 1992. As a corollary, for every H we obtain an O(|V(G)|3) time algorithm that tests if there is an immersion of H into a given graph G. This answers another open question raised by Downey and Fellows in 1992."
STOC,2011,489-498,Swastik Kopparty,On the complexity of powering in finite fields.,https://doi.org/10.1145/1993636.1993702,"We study the complexity of computing the kth-power of an element of F2n by constant depth arithmetic circuits over F2 (also known as ACP). Our study encompasses the complexity of basic arithmetic operations such as computing cube-root and computing cubic-residuosity of elements of F2n. Our main result is that these problems require exponential size circuits. We also derive strong average-case versions of these results. For example, we show that no subexponential-size, constant-depth, arithmetic circuit over F2 can correctly compute the cubic residue symbol for more than 1/3 + o(1) fraction of the elements of F2n. As a corollary, we deduce a character sum bound showing that the cubic residue character over F2n is uncorrelated with all degree-d n-variate F2 polynomials (viewed as functions over F2n in a natural way), provided d l nε for some universal ε > 0. Classical methods (based on van der Corput differencing and the Weil bounds) show this only for d l log(n). Our proof revisits the classical Razborov-Smolensky method for circuit lower bounds, and executes an analogue of it in the land of univariate polynomials over F2n. The tools we use come from both F2n and F2n. In recent years, this interplay between F2n and F2n has played an important role in many results in pseudorandomness, property testing and coding theory."
STOC,2011,499-508,"Steve Chien, Prahladh Harsha, Alistair Sinclair, Srikanth Srinivasan 0001",Almost settling the hardness of noncommutative determinant.,https://doi.org/10.1145/1993636.1993703,"In this paper, we study the complexity of computing the determinant of a matrix over a noncommutative algebra. In particular, we ask the question: ""Over which algebras is the determinant easier to compute than the permanent?"" Towards resolving this question, we show the following results for noncommutative determinant computation: [Hardness] Computing the determinant of an n x n matrix whose entries are themselves 2 x 2 matrices over any field of zero or odd characteristic is as hard as computing the permanent over the field. This extends the recent result of Arvind and Srinivasan, which required the entries to be matrices of dimension linear in n. [Easiness] The determinant of an n x n matrix whose entries are themselves d x d upper triangular matrices can be computed in poly(nd) time. Combining the above with the decomposition theorem for finite dimensional algebras (and in particular exploiting the simple structure of 2 x 2 matrix algebras), we can extend the above hardness and easiness statements to more general algebras as follows. Let A be a finite dimensional algebra over a finite field of odd characteristic with radical R(A). [Hardness] If the quotient A/R(A) is noncommutative, then computing the determinant over the algebra A is as hard as computing the permanent. [Easiness] If the quotient A/R(A) is commutative, and furthermore R(A) has nilpotency index d (i.e., d is the smallest integer such that R(A)d =0), then there exists a poly(nd)-time algorithm that computes determinants over the algebra A. In particular, for any constant dimensional algebra A over a finite field of odd characteristic, since the nilpotency index of R(A) is at most a constant, we have the following dichotomy theorem: if A/R(A) is commutative then efficient determinant computation is possible, and otherwise determinant is as hard as permanent."
STOC,2011,509-518,"Peter Bürgisser, Christian Ikenmeyer",Geometric complexity theory and tensor rank.,https://doi.org/10.1145/1993636.1993704,"Mulmuley and Sohoni [GCT1, SICOMP 2001; GCT2, SICOMP 2008] proposed to view the permanent versus determinant problem as a specific orbit closure problem and to attack it by methods from geometric invariant and representation theory. We adopt these ideas towards the goal of showing lower bounds on the border rank of specific tensors, in particular for matrix multiplication. We thus study specific orbit closure problems for the group G =GL(W1) x GL(W2) x GL(W3) acting on the tensor product W=W1 ⊗ W2 ⊗ W3 of complex finite dimensional vector spaces. Let Gs =SL(W1) x SL(W2) x SL(W3). A key idea from [GCT2] is that the irreducible Gs-representations occurring in the coordinate ring of the G-orbit closure of a stable tensor w ∈ W are exactly those having a nonzero invariant with respect to the stabilizer group of w. However, we prove that by considering Gs-representations, only trivial lower bounds on border rank can be shown. It is thus necessary to study G-representations, which leads to geometric extension problems that are beyond the scope of the subgroup restriction problems emphasized in [GCT1, GCT2] and its follow up papers. We prove a very modest lower bound on the border rank of matrix multiplication tensors using G-representations. This shows at least that the barrier for Gs-representations can be overcome. To advance, we suggest the coarser approach to replace the semigroup of representations of a tensor by its moment polytope. We prove first results towards determining the moment polytopes of matrix multiplication and unit tensors."
