booktitle,year,pages,author,title,ee,abstract
STOC,2022,1-11,"Hamoon Mousavi, Seyed Sajjad Nezhadi, Henry Yuen","Nonlocal games, compression theorems, and the arithmetical hierarchy.",https://doi.org/10.1145/3519935.3519949,"We investigate the connection between the complexity of nonlocal games and the arithmetical hierarchy, a classification of languages according to the complexity of arithmetical formulas defining them. It was recently shown by Ji, Natarajan, Vidick, Wright and Yuen that deciding whether the (finite-dimensional) quantum value of a nonlocal game is 1 or at most 1/2 is complete for the class Σ1 (i.e., ). A result of Slofstra implies that deciding whether the commuting operator value of a nonlocal game is equal to 1 is complete for the class Π1 (i.e., coRE). We prove that deciding whether the quantum value of a two-player nonlocal game is exactly equal to 1 is complete for Π2; this class is in the second level of the arithmetical hierarchy and corresponds to formulas of the form “? x ? ? y ? φ(x,y)”. This shows that exactly computing the quantum value is strictly harder than approximating it, and also strictly harder than computing the commuting operator value (either exactly or approximately). We explain how results about the complexity of nonlocal games all follow in a unified manner from a technique known as compression. At the core of our Π2-completeness result is a new “gapless” compression theorem that holds for both quantum and commuting operator strategies. All previous works only study the setting of finite-dimensional quantum strategies; ours is the first to study compression of games in the commuting operator setting. Our compression theorem yields as a byproduct an alternative proof of Slofstra’s result that the set of quantum correlations is not closed. We also show how a “gap-preserving” compression theorem for commuting operator strategies would imply that approximating the commuting operator value is complete for Π1."
STOC,2022,12-18,"Anurag Anshu, Itai Arad, David Gosset",An area law for 2d frustration-free spin systems.,https://doi.org/10.1145/3519935.3519962,"We prove that the entanglement entropy of the ground state of a locally gapped frustration-free 2D lattice spin system satisfies an area law with respect to a vertical bipartition of the lattice into left and right regions. We first establish that the ground state projector of any locally gapped frustration-free 1D spin system can be approximated to within error ? by a degree O(√nlog(??1)) multivariate polynomial in the interaction terms of the Hamiltonian. This generalizes the optimal bound on the approximate degree of the boolean AND function, which corresponds to the special case of commuting Hamiltonian terms. For 2D spin systems we then construct an approximate ground state projector (AGSP) that employs the optimal 1D approximation in the vicinity of the boundary of the bipartition of interest. This AGSP has sufficiently low entanglement and error to establish the area law using a known technique."
STOC,2022,19-32,"Sevag Gharibian, Fran?ois Le Gall",Dequantizing the Quantum singular value transformation: hardness and applications to Quantum chemistry and the Quantum PCP conjecture.,https://doi.org/10.1145/3519935.3519991,"The Quantum Singular Value Transformation (QSVT) is a recent technique that gives a unified framework to describe most quantum algorithms discovered so far, and may lead to the development of novel quantum algorithms. In this paper we investigate the hardness of classically simulating the QSVT. A recent result by Chia, Gilyén, Li, Lin, Tang and Wang (STOC 2020) showed that the QSVT can be efficiently “dequantized” for low-rank matrices, and discussed its implication to quantum machine learning. In this work, motivated by establishing the superiority of quantum algorithms for quantum chemistry and making progress on the quantum PCP conjecture, we focus on the other main class of matrices considered in applications of the QSVT, sparse matrices.  We first show how to efficiently “dequantize”, with arbitrarily small constant precision, the QSVT associated with a low-degree polynomial. We apply this technique to design classical algorithms that estimate, with constant precision, the singular values of a sparse matrix. We show in particular that a central computational problem considered by quantum algorithms for quantum chemistry (estimating the ground state energy of a local Hamiltonian when given, as an additional input, a state sufficiently close to the ground state) can be solved efficiently with constant precision on a classical computer. As a complementary result, we prove that with inverse-polynomial precision, the same problem becomes BQP-complete. This gives theoretical evidence for the superiority of quantum algorithms for chemistry, and strongly suggests that said superiority stems from the improved precision achievable in the quantum setting. We also discuss how this dequantization technique may help make progress on the central quantum PCP conjecture."
STOC,2022,33-43,"Arjan Cornelissen, Yassine Hamoudi, Sofiène Jerbi",Near-optimal Quantum algorithms for multivariate mean estimation.,https://doi.org/10.1145/3519935.3520045,"We propose the first near-optimal quantum algorithm for estimating in Euclidean norm the mean of a vector-valued random variable with finite mean and covariance. Our result aims at extending the theory of multivariate sub-Gaussian estimators [Lugosi and Mendelson, 2019] to the quantum setting. Unlike classically, where any univariate estimator can be turned into a multivariate estimator with at most a logarithmic overhead in the dimension, no similar result can be proved in the quantum setting. Indeed, [Heinrich, 2004] ruled out the existence of a quantum advantage for the mean estimation problem when the sample complexity is smaller than the dimension. Our main result is to show that, outside this low-precision regime, there does exist a quantum estimator that outperforms any classical estimator. More precisely, we prove that the approximation error can be decreased by a factor of about the square root of the ratio between the dimension and the sample complexity. Our approach is substantially more involved than in the univariate setting, where most quantum estimators rely only on phase estimation. We exploit a variety of additional algorithmic techniques such as linear amplitude amplification, the Bernstein-Vazirani algorithm, and quantum singular value transformation. Our analysis is also deeply rooted in proving concentration inequalities for multivariate truncated statistics. Finally, we describe several applications of our algorithms, notably in measuring the expectation values of commuting observables and in the field of machine learning."
STOC,2022,44-51,"Anurag Anshu, Zeph Landau, Yunchao Liu",Distributed Quantum inner product estimation.,https://doi.org/10.1145/3519935.3519974,"As small quantum computers are becoming available on different physical platforms, a benchmarking task known as cross-platform verification has been proposed that aims to estimate the fidelity of states prepared on two quantum computers. This task is fundamentally distributed, as no quantum communication can be performed between the two physical platforms due to hardware constraints, which prohibits a joint SWAP test. In this paper we settle the sample complexity of this task across all measurement and communication settings. The essence of the task, which we call distributed quantum inner product estimation, involves two players Alice and Bob who have k copies of unknown states ρ,σ (acting on ?d) respectively. Their goal is to estimate Tr(ρσ) up to additive error ε∈(0,1), using local quantum operations and classical communication. In the weakest setting where only non-adaptive single-copy measurements and simultaneous message passing are allowed, we show that k=O(max{1/ε2,√d/ε}) copies suffice. This achieves a savings compared to full tomography which takes Ω(d3) copies with single-copy measurements. Surprisingly, we also show that the sample complexity must be at least Ω(max{1/ε2,√d/ε}), even in the strongest setting where adaptive multi-copy measurements and arbitrary rounds of communication are allowed. This shows that the success achieved by shadow tomography, for sample-efficiently learning the properties of a single system, cannot be generalized to the distributed setting. Furthermore, the fact that the sample complexity remains the same with single and multi-copy measurements contrasts with single system quantum property testing, which often demonstrate exponential separations in sample complexity with single and multi-copy measurements."
STOC,2022,52-63,"Nikhil Bansal 0001, Ohad N. Feldheim",The power of two choices in graphical allocation.,https://doi.org/10.1145/3519935.3519995,"The graphical balls-into-bins process is a generalization of the classical 2-choice balls-into-bins process, where the bins correspond to vertices of an arbitrary underlying graph G. At each time step an edge of G is chosen uniformly at random, and a ball must be assigned to either of the two endpoints of this edge. The standard 2-choice process corresponds to the case of G=Kn. For any k(n)-edge-connected, d(n)-regular graph on n vertices, and any number of balls, we give an allocation strategy that, with high probability, ensures a gap of O((d/k) log4n loglogn), between the load of any two bins. In particular, this implies polylogarithmic bounds for natural graphs such as cycles and tori, for which the classical greedy allocation strategy is conjectured to have a polynomial gap between the bin loads. For every graph G, we also show an Ω((d/k) + logn) lower bound on the gap achievable by any allocation strategy. This implies that our strategy achieves the optimal gap, up to polylogarithmic factors, for every graph G. Our allocation algorithm is simple to implement and requires only O(log(n)) time per allocation. It can be viewed as a more global version of the greedy strategy that compares average load on certain fixed sets of vertices, rather than on individual vertices. A key idea is to relate the problem of designing a good allocation strategy to that of finding suitable multi-commodity flows. To this end, we consider R?cke’s cut-based decomposition tree and define certain orthogonal flows on it."
STOC,2022,64-76,George Giakkoupis,Expanders via local edge flips in quasilinear time.,https://doi.org/10.1145/3519935.3520022,"Mahlmann and Schindelhaue (2005) proposed the following simple process, called flip-chain, for transforming any given connected d-regular graph into a d-regular expander: In each step, a random 3-path abcd is selected, and edges ab and cd are replaced by two new edges ac and bd, provided that ac and bd do not exist already. A motivation for the study of the flip-chain arises in the design of overlay networks, where it is common practice that adjacent nodes periodically exchange random neighbors, to maintain good connectivity properties. It is known that the flip-chain converges to the uniform distribution over connected d-regular graphs, and it is conjectured that an expander graph is obtained after O(ndlogn) steps, w.h.p., where n is the number of vertices. However, the best known upper bound on the number of steps is O(n2d2√logn), and the best bound on the mixing time of the chain is O(n16d36logn). We provide a new analysis of a natural flip-chain instantiation, which shows that starting from any connected d-regular graph, for d = Ω(log2 n), an expander is obtained after O(ndlog2n) steps, w.h.p. This result is tight within logarithmic factors, and almost matches the conjectured bound. Moreover, it justifies the use of edge flip operations in practice: for any d-regular graph with d = poly(logn), an expander is reached after each vertex participates in at most poly(logn) operations, w.h.p. Our analysis is arguably more elementary than previous approaches. It uses the novel notion of the strain of a cut, a value that depends both on the crossing edges and their adjacent edges. By keeping track of the cut strains, we form a recursive argument that bounds the time before all sets of a given size have large expansion, after all smaller sets have already attained large expansion."
STOC,2022,77-90,"Zhihao Gavin Tang, Jinzhao Wu, Hongxun Wu",(Fractional) online stochastic matching via fine-grained offline statistics.,https://doi.org/10.1145/3519935.3519994,"Motivated by display advertising on the internet, the online stochastic matching problem is proposed by Feldman, Mehta, Mirrokni, and Muthukrishnan (FOCS 2009). Consider a stochastic bipartite graph with offline vertices on one side and with i.i.d. online vertices on the other side. The algorithm knows the offline vertices and the distribution of the online vertices in advance. Upon the arrival of each online vertex, its type is realized and the algorithm immediately and irrevocably decides how to match it. In the vertex-weighted version of the problem, each offline vertex is associated with a weight and the goal is to maximize the total weight of the matching. In this paper, we generalize the model to allow non-identical online vertices and focus on the fractional version of the vertex-weighted stochastic matching. We design fractional algorithms that are 0.718-competitive and 0.731-competitive for non i.i.d. arrivals and i.i.d. arrivals respectively. We also prove that no fractional algorithm can achieve a competitive ratio better than 0.75 for non i.i.d. arrivals. Furthermore, we round our fractional algorithms by applying the recently developed multiway online correlated selection by Gao et al. (FOCS 2021) and achieve 0.666-competitive and 0.704-competitive integral algorithms for non i.i.d. arrivals and i.i.d. arrivals. Our results for non i.i.d. arrivals are the first algorithms beating the 1?1/e ≈ 0.632 barrier of the classical adversarial setting. Our 0.704-competitive integral algorithm for i.i.d. arrivals slightly improves the state-of-the-art 0.701-competitive ratio by Huang and Shu (STOC 2021)."
STOC,2022,91-103,"Zhiyi Huang 0002, Xinkai Shu, Shuyi Yan",The power of multiple choices in online stochastic matching.,https://doi.org/10.1145/3519935.3520046,"We study the power of multiple choices in online stochastic matching. Despite a long line of research, existing algorithms still only consider two choices of offline neighbors for each online vertex because of the technical challenge in analyzing multiple choices. This paper introduces two approaches for designing and analyzing algorithms that use multiple choices. For unweighted and vertex-weighted matching, we adopt the online correlated selection (OCS) technique into the stochastic setting, and improve the competitive ratios to 0.716, from 0.711 and 0.7 respectively. For edge-weighted matching with free disposal, we propose the Top Half Sampling algorithm. We directly characterize the progress of the whole matching instead of individual vertices, through a differential inequality. This improves the competitive ratio to 0.706, breaking the 1?1/e barrier in this setting for the first time in the literature. Finally, for the harder edge-weighted problem without free disposal, we prove that no algorithms can be 0.703 competitive, separating this setting from the aforementioned three."
STOC,2022,104-116,"Janardhan Kulkarni, Yang P. Liu, Ashwin Sah, Mehtaab Sawhney, Jakub Tarnawski",Online edge coloring via tree recurrences and correlation decay.,https://doi.org/10.1145/3519935.3519986,"We give an online algorithm that with high probability computes a (e/e?1 + o(1))Δ edge coloring on a graph G with maximum degree Δ = ω(logn) under online edge arrivals against oblivious adversaries, making first progress on the conjecture of Bar-Noy, Motwani, and Naor in this general setting. Our algorithm is based on reducing to a matching problem on locally treelike graphs, and then applying a tree recurrences based approach for arguing correlation decay."
STOC,2022,117-130,"Andreas Bj?rklund, Thore Husfeldt, Petteri Kaski",The shortest even cycle problem is tractable.,https://doi.org/10.1145/3519935.3520030,"Given a directed graph as input, we show how to efficiently find a shortest (directed, simple) cycle on an even number of vertices. As far as we know, no polynomial-time algorithm was previously known for this problem. In fact, finding any even cycle in a directed graph in polynomial time was open for more than two decades until Robertson, Seymour, and Thomas (Ann.?of?Math.?(2)?1999) and, independently, McCuaig (Electron.?J.?Combin.?2004; announced jointly at STOC?1997) gave an efficiently testable structural characterisation of even-cycle-free directed graphs. Methodologically, our algorithm relies on the standard framework of algebraic fingerprinting and randomized polynomial identity testing over a finite field, and in fact relies on a generating polynomial implicit in a paper of Vazirani and Yannakakis (Discrete?Appl.?Math.?1989) that enumerates weighted cycle covers by the parity of their number of cycles as a difference of a permanent and a determinant polynomial. The need to work with the permanent—known to be #P-hard apart from a very restricted choice of coefficient rings (Valiant, Theoret.?Comput.?Sci. 1979)—is where our main technical contribution occurs. We design a family of finite commutative rings of characteristic?4 that simultaneously (i) give a nondegenerate representation for the generating polynomial identity via the permanent and the determinant, (ii) support efficient permanent computations by extension of Valiant’s techniques, and (iii) enable emulation of finite-field arithmetic in characteristic 2. Here our work is foreshadowed by that of Bj?rklund and Husfeldt (SIAM?J.?Comput.?2019), who used a considerably less efficient commutative ring design—in particular, one lacking finite-field emulation—to obtain a polynomial-time algorithm for the shortest two disjoint paths problem in undirected graphs. Building on work of Gilbert and Tarjan (Numer.?Math.?1978) as well as Alon and Yuster (J.?ACM?2013), we also show how ideas from the nested dissection technique for solving linear equation systems—introduced by George (SIAM J.?Numer.?Anal.?1973) for symmetric positive definite real matrices—leads to faster algorithm designs in our present finite-ring randomized context when we have control on the separator structure of the input graph; for example, this happens when the input has bounded genus."
STOC,2022,131-136,"Zhiyang He, Jason Li 0006",Breaking the nk barrier for minimum k-cut on simple graphs.,https://doi.org/10.1145/3519935.3519948,"In the minimum k-cut problem, we want to find the minimum number of edges whose deletion breaks the input graph into at least k connected components. The classic algorithm of Karger and Stein runs in ?(n2k?2) time, and recent, exciting developments have improved the running time to O(nk). For general, weighted graphs, this is tight assuming popular hardness conjectures. In this work, we show that perhaps surprisingly, O(nk) is not the right answer for simple, unweighted graphs. We design an algorithm that runs in time O(n(1??)k+O(1)) where ?>0 is an absolute constant, breaking the natural nk barrier. This establishes a separation of the two problems in the unweighted and weighted cases."
STOC,2022,137-150,"Ruoxu Cen, Jason Li 0006, Debmalya Panigrahi",Edge connectivity augmentation in near-linear time.,https://doi.org/10.1145/3519935.3520038,We give an ?(m)-time algorithm for the edge connectivity augmentation problem and the closely related edge splitting-off problem. This is optimal up to lower order terms and closes the long line of work on these problems.
STOC,2022,151-161,"Seth Pettie, Thatchaphol Saranurak, Longhui Yin",Optimal vertex connectivity oracles.,https://doi.org/10.1145/3519935.3519945,"A k-vertex connectivity oracle for undirected G is a data structure that, given u,v∈ V(G), reports min{k,κ(u,v)}, where κ(u,v) is the pairwise vertex connectivity between u,v. There are three main measures of efficiency: construction time, query time, and space. Prior work of Izsak and Nutov [Inf. Process. Lett. 2012] shows that a data structure of total size O(knlogn), which can even be encoded as a O(klog3 n)-bit labeling scheme, can answer vertex-connectivity queries in O(klogn) time. The construction time is polynomial, but unspecified. In this paper we address the top three complexity measures. The first is the space consumption. We prove that any k-vertex connectivity oracle requires Ω(kn) bits of space. This answers a long-standing question on the structural complexity of vertex connectivity, and gives a strong separation between the complexity of vertex- and edge-connectivity. Both Izsak and Nutov [Inf. Process. Lett. 2012] and the data structure we will present in this work match this lower bound up to polylogarithmic factors. The second is the query time. We answer queries in O(logn) time, independent of k, improving on Ω(klogn) time of Izsak and Nutov [Inf. Process. Lett. 2012]. The main idea is to build instances of SetIntersection data structures, with additional structure based on affine planes. This structure allows for optimum query time that is linear in the output size (This evades the general k1/2?o(1) and k1?o(1) lower bounds on SetIntersection from the 3SUM or OMv hypotheses, resp. Kopelowitz et al. [SODA 2016] and Henzinger et al. [STOC 2015].) The third is the construction time. We build the data structure in time of roughly a max-flow computation on a unit-capacity graph, which is m4/3+o(1) using state-of-the-art algorithm by Tarun et al. [FOCS 2020]. Max-flow is a natural barrier for many problems that have an all-pairs-min-cut flavor. The main technical contribution here is a fast algorithm for computing a k-bounded version of a Gomory-Hu tree for element connectivity, a notion that generalizes edge and vertex connectivity."
STOC,2022,162-175,"Sam Coy, Artur Czumaj",Deterministic massively parallel connectivity.,https://doi.org/10.1145/3519935.3520055,"We consider the problem of designing fundamental graph algorithms on the model of Massive Parallel Computation (MPC). The input to the problem is an undirected graph G with n vertices and m edges, and with D being the maximum diameter of any connected component in G. We consider the MPC with low local space, allowing each machine to store only Θ(nδ) words for an arbitrary constant δ>0, and with linear global space (which is the number of machines times the local space available), that is, with optimal utilization. In a recent breakthrough, Andoni et al. (FOCS’18) and Behnezhad et al. (FOCS’19) designed parallel randomized algorithms that in O(logD + loglogn) rounds on an MPC with low local space determine all connected components of a graph, improving on the classic bound of O(logn) derived from earlier works on PRAM algorithms. In this paper, we show that asymptotically identical bounds can be also achieved for deterministic algorithms: we present a deterministic MPC low local space algorithm that in O(logD + loglogn) rounds determines connected components of the input graph. Our result matches the complexity of state of the art randomized algorithms for this task. The techniques developed in our paper can be also applied to several related problems, giving new deterministic MPC algorithms for problems like finding a spanning forest, minimum spanning forest, etc. We complement our upper bounds by extending a recent lower bound for connectivity on an MPC conditioned on the 1-vs-2-cycles conjecture (which requires D ≥ log1+Ω(1)n), by showing a related conditional hardness of Ω(logD) MPC rounds for the entire spectrum of D, covering a particularly interesting range when D ≤ O(logn)."
STOC,2022,176-184,"Tom Gur, Noam Lifshitz, Siqi Liu 0005",Hypercontractivity on high dimensional expanders.,https://doi.org/10.1145/3519935.3520004,"We prove hypercontractive inequalities on high dimensional expanders. As in the settings of the p-biased hypercube, the symmetric group, and the Grassmann scheme, our inequalities are effective for global functions, which are functions that are not significantly affected by a restriction of a small set of coordinates. As applications, we obtain Fourier concentration, small-set expansion, and Kruskal–Katona theorems for high dimensional expanders. Our techniques rely on a new approximate Efron–Stein decomposition for high dimensional link expanders."
