booktitle,year,pages,author,title,ee,abstract
STOC,2009,1-2,Avi Wigderson,The work of Leslie Valiant.,https://doi.org/10.1145/1536414.1536415,"On Saturday, May 30, one day before the start of the regular STOC 2009 program, a workshop was held in celebration of Leslie Valiant's 60th birthday. Talks were given by Jin-Yi Cai, Stephen Cook, Vitaly Feldman, Mark Jerrum, Michael Kearns, Mike Paterson, Michael Rabin, Rocco Servedio, Paul Valiant, Vijay Vazirani, and Avi Wigderson. The workshop was organized by Michael Kearns, Rocco Servedio, and Salil Vadhan, with support from the STOC local arrangements team and program committee. To accompany the workshop, here we briefly survey Valiant's many fundamental contributions to the theory of computing."
STOC,2009,3-12,"Sanjeev Arora, Constantinos Daskalakis, David Steurer",Message passing algorithms and improved LP decoding.,https://doi.org/10.1145/1536414.1536418,"Linear programming decoding for low-density parity check codes (and related domains such as compressed sensing) has received increased attention over recent years because of its practical performance --coming close to that of iterative decoding algorithms--- and its amenability to finite-blocklength analysis. Several works starting with the work of Feldman et al. showed how to analyze LP decoding using properties of expander graphs. This line of analysis works for only low error rates, about a couple of orders of magnitude lower than the empirically observed performance. It is possible to do better for the case of random noise, as shown by Daskalakis et al. and Koetter and Vontobel. Building on work of Koetter and Vontobel, we obtain a novel understanding of LP decoding, which allows us to establish a 0.05-fraction of correctable errors for rate-1/2 codes; this comes very close to the performance of iterative decoders and is significantly higher than the best previously noted correctable bit error rate for LP decoding. Unlike other techniques, our analysis directly works with the primal linear program and exploits an explicit connection between LP decoding and message passing algorithms. An interesting byproduct of our method is a notion of a ""locally optimal"" solution that we show to always be globally optimal (i.e., it is the nearest codeword). Such a solution can in fact be found in near-linear time by a ""re-weighted"" version of the min-sum algorithm, obviating the need for linear programming. Our analysis implies, in particular, that this re-weighted version of the min-sum decoder corrects up to a 0.05-fraction of errors."
STOC,2009,13-22,"Parikshit Gopalan, Venkatesan Guruswami, Prasad Raghavendra",List decoding tensor products and interleaved codes.,https://doi.org/10.1145/1536414.1536419,"We design the first efficient algorithms and prove new combinatorial bounds for list decoding tensor products of codes and interleaved codes. (1) We show that for every code, the ratio of its list decoding radius to its minimum distance stays unchanged under the tensor product operation (rather than squaring, as one might expect). This gives the first efficient list decoders and new combinatorial bounds for some natural codes including multivariate polynomials where the degree in each variable is bounded. (2) We show that for every code, its list decoding radius remains unchanged under m-wise interleaving for an integer m. This generalizes a recent result of Dinur.et.al, who proved such a result for interleaved Hadamard codes (equivalently, linear transformations). (3)Using the notion of generalized Hamming weights, we give better list size bounds for both tensoring and interleaving of binary linear codes. By analyzing the weight distribution of these codes, we reduce the task of bounding the list size to bounding the number of close-by low-rank codewords. For decoding linear transformations, using rank-reduction together with other ideas, we obtain tight list size bounds for small fields. Our results give better bounds on the list decoding radius than what is obtained from the Johnson bound, and yield rather general families of codes decodable beyond the Johnson bound."
STOC,2009,23-32,Venkatesan Guruswami,"Artin automorphisms, cyclotomic function fields, and folded list-decodable codes.",https://doi.org/10.1145/1536414.1536420,"Algebraic codes that achieve list decoding capacity were recently constructed by a careful ""folding"" of the Reed-Solomon code. The ""low-degree"" nature of this folding operation was crucial to the list decoding algorithm. We show how such folding schemes arise out of the Artin-Frobenius automorphism at primes in Galois extensions. Using this approach, we construct new folded algebraic-geometric codes for list decoding based on cyclotomic function fields with a cyclic Galois group. Such function fields are obtained by adjoining torsion points of the Carlitz action of an irreducible M ∈ Fq[T]. The Reed-Solomon case corresponds to the simplest such extension (corresponding to the case M=T). In the general case, we need to descend to the fixed field of a suitable Galois subgroup in order to ensure the existence of many degree one places that can be used for encoding. Our methods shed new light on algebraic codes and their list decoding, and lead to new codes achieving list decoding capacity. Quantitatively, these codes provide list decoding (and list recovery/soft decoding) guarantees similar to folded Reed-Solomon codes but with an alphabet size that is only polylogarithmic in the block length. In comparison, for folded RS codes, the alphabet size is a large polynomial in the block length. This has applications to fully explicit (with no brute-force search) binary concatenated codes for list decoding up to the Zyablov radius."
STOC,2009,33-38,"Qi Cheng 0001, Daqing Wan",A deterministic reduction for the gap minimum distance problem: [extended abstract].,https://doi.org/10.1145/1536414.1536421,"Determining the minimum distance of a linear code is one of the most important problems in algorithmic coding theory. The exact version of the problem was shown to be NP-complete in [14]. In [8], the gap version of the problem was shown to be NP-hard for any constant factor under a randomized reduction. It was shown in the same paper that the minimum distance problem is not approximable in randomized polynomial time to the factor 2log1-ε n unless NP ⊆ RTIME(2polylog(n)). In this paper, we derandomize the reduction and thus prove that there is no deterministic polynomial time algorithm to approximate the minimum distance to any constant factor unless P=NP. We also prove that the minimum distance is not approximable in deterministic polynomial time to the factor 2log1-εn unless NP ⊆ DTIME(2polylog(n)). As the main technical contribution, for any constant 2/3< ρ < 1, we present a deterministic algorithm that given a positive integer s, runs in time poly(s) and constructs a code C of length poly(s) with an explicit Hamming ball of radius ρ d(C) such that a projection at some s coordinates sends the codewords in the ball surjectively onto a linear subspace of dimension s, where d(C) denotes the minimum distance of C. The codes are obtained by concatenating Reed-Solomon codes with Hadamard codes."
STOC,2009,39-44,Klim Efremenko,3-query locally decodable codes of subexponential length.,https://doi.org/10.1145/1536414.1536422,"Locally Decodable Codes (LDC) allow one to decode any particular symbol of the input message by making a constant number of queries to a codeword, even if a constant fraction of the codeword is damaged. In a recent work [Yek08] Yekhanin constructs a 3-query LDC with sub-exponential length of size exp(exp(O((log n)/(log log n)))). However, this construction requires a conjecture that there are infinitely many Mersenne primes. In this paper we give the first unconditional constant query LDC construction with subexponantial codeword length. In addition our construction reduces codeword length. We give construction of 3-query LDC with codeword length exp(exp(O(√{log n log log n ))). Our construction could also be extended to higher number of queries. We give a 2r-query LDC with length of exp(exp(O(☂[r] log n (log log n)r-1)))."
STOC,2009,45-54,Linda Sellie,Exact learning of random DNF over the uniform distribution.,https://doi.org/10.1145/1536414.1536424,"We show that randomly generated c log(n)-DNF formula can be learned exactly in probabilistic polynomial time using randomly generated examples. Our notion of randomly generated is with respect to a uniform distribution. To prove this we extend the concept of well behaved c log(n)-Monotone DNF formulae to c log(n)-DNF formulae, and show that almost every DNF formula is well-behaved, and that there exists a probabilistic polynomial time algorithm that exactly learns all well behaved c log(n)-DNF formula. This is the first algorithm that properly learns (non-monotone) DNF with a polynomial number of terms from random examples alone."
STOC,2009,55-64,"László Babai, Robert Beals, Ákos Seress",Polynomial-time theory of matrix groups.,https://doi.org/10.1145/1536414.1536425,"We consider matrix groups, specified by a list of generators, over finite fields. The two most basic questions about such groups are membership in and the order of the group. Even in the case of abelian groups it is not known how to answer these questions without solving hard number theoretic problems (factoring and discrete log); in fact, constructive membership testing in the case of 1 × 1 matrices is precisely the discrete log problem. So the reasonable question is whether these problems are solvable in randomized polynomial time using number theory oracles. Building on 25 years of work, including remarkable recent developments by several groups of authors, we are now able to determine the order of a matrix group over a finite field of odd characteristic, and to perform constructive membership testing in such groups, in randomized polynomial time, using oracles for factoring and discrete log. One of the new ingredients of this result is the following. A group is called semisimple if it has no abelian normal subgroups. For matrix groups over finite fields, we show that the order of the largest semisimple quotient can be determined in randomized polynomial time (no number theory oracles required and no restriction on parity). As a by-product, we obtain a natural problem that belongs to BPP and is not known to belong either to RP or to coRP. No such problem outside the area of matrix groups appears to be known. The problem is the decision version of the above: Given a list A of nonsingular d × d matrices over a finite field and an integer N, does the group generated by A have a semisimple quotient of order > N? We also make progress in the area of constructive recognition of simple groups, with the corollary that for a large class of matrix groups, our algorithms become Las Vegas."
STOC,2009,65-74,"Eli Ben-Sasson, Swastik Kopparty",Affine dispersers from subspace polynomials.,https://doi.org/10.1145/1536414.1536426,"An affine disperser over F2n for sources of dimension d is a function f: F2n → F2 such that for any affine space S ⊆ F2n of dimension at least d, we have {f(s) : s in S} = F2. Affine dispersers have been considered in the context of deterministic extraction of randomness from structured sources of imperfect randomness. Previously, explicit constructions of affine dispersers were known for every d = Ω(n), due to Barak et. al.[2] and Bourgain[10] (the latter in fact gives stronger objects called affine extractors). In this work we give the first explicit affine dispersers for sublinear dimension. Specifically, our dispersers work even when d = Ω(n4/5). The main novelty in our construction lies in the method of proof, which relies on elementary properties of subspace polynomials. In contrast, the previous works mentioned above relied on sum-product theorems for finite fields."
STOC,2009,75-84,"Constantinos Daskalakis, Christos H. Papadimitriou",On oblivious PTAS's for nash equilibrium.,https://doi.org/10.1145/1536414.1536427,"If a class of games is known to have a Nash equilibrium with probability values that are either zero or Ω(1) -- and thus with support of bounded size -- then obviously this equilibrium can be found exhaustively in polynomial time. Somewhat surprisingly, we show that there is a PTAS for the class of games whose equilibria are guaranteed to have small --- O(1/n) -- values, and therefore large -- Ω(n) -- supports. We also point out that there is a PTAS for games with sparse payoff matrices, a family for which the exact problem is known to be PPAD-complete [Chen, Deng, Teng 2006]. Both algorithms are of a special kind that we call oblivious: The algorithm just samples a fixed distribution on pairs of mixed strategies, and the game is only used to determine whether the sampled strategies comprise an ε-Nash equilibrium; the answer is ""yes"" with inverse polynomial probability (in the second case, the algorithm is actually deterministic). These results bring about the question: Is there an oblivious PTAS for finding a Nash equilibrium in general games? We answer this question in the negative; our lower bound comes close to the quasi-polynomial upper bound of [Lipton, Markakis, Mehta 2003]. Another recent PTAS for anonymous games [Daskalakis, Papadimitriou 2007 and 2008, Daskalakis 2008] is also oblivious in a weaker sense appropriate for this class of games (it samples from a fixed distribution on unordered collections of mixed strategies), but its running time is exponential in 1/ε. We prove that any oblivious PTAS for anonymous games with two strategies and three player types must have 1/εα in the exponent of the running time for some α ≥ 1/3, rendering the algorithm in [Daskalakis 2008] (which works with any bounded number of player types) essentially optimal within oblivious algorithms. In contrast, we devise a poly n • (1/ε)O(\log2(1/ε)) non-oblivious PTAS for anonymous games with two strategies and any bounded number of player types. The key idea of our algorithm is to search not over unordered sets of mixed strategies, but over a carefully crafted set of collections of the first O(log 1/ε) moments of the distribution of the number of players playing strategy 1 at equilibrium. The algorithm works because of a probabilistic result of more general interest that we prove: the total variation distance between two sums of independent indicator random variables decreases exponentially with the number of moments of the two sums that are equal, independent of the number of indicators."
STOC,2009,85-92,Eli Gafni,The extended BG-simulation and the characterization of t-resiliency.,https://doi.org/10.1145/1536414.1536428,"A distributed task T on n processors is an input/output relation between a collection of processors' inputs and outputs. While all tasks are solvable if no processor may ever crash, the FLP result revealed that the possibility of a failure of just a single processor precludes a solution to the task of consensus. That is consensus is not solvable 1-resiliently. Yet, some nontrivial tasks are wait-free solvable, i.e. n-1-resiliently. What tasks are solvable if at most t<n processors may crash? I.e. what tasks are solvable t-resiliently? The Herlihy-Shavit condition characterizes wait-free solvability, i.e., when t=n-1. The Borowsky-Gafni (BG) simulation extends this characterization to the t-resilient case for the case ""colorless"" tasks - tasks like consensus in which one processor can adopt the output of any other processor. It does this by reducing questions about t-resilient solvability, to a question of wait-free solvability. The latter question has been characterized. In this paper, we amend the BG-simulation to result in the Extended-BG-simulation, an extension that yields a full characterization of t-resilient solvability: A task T on n processors is solvable t-resiliently iff all tasks T' on t+1 simulators s0,..., st created as follows are wait-free solvable. Simulator si is given an input of processor pi as well as the input to a set of processors of size n-(t+1) with ids higher than i. Simulator si outputs for pi as well as for a (possibly different) set of processors of size n-(t+1) with ids higher than i. The input/output of the t+1 simulators have to be a projection of a single original input/output tuple-pair in T. We demonstrate the convenience that the characterization provides, in two ways. First, we prove a new equivalence result: We show that n processes can solve t-resiliently weak renaming with n+(t+1)-2 names, where n>1 and 0<t<n, iff weak-renaming on t+1 processors is wait-free solvable with 2t names. Second, we reproduce the result that the solvability of n-processors tasks, t-resiliently, for t>1 and n>2, is undecidable, by a simple reduction to the undecidability of the wait-free solvability of 3-processors tasks."
STOC,2009,93-100,"Jean Cardinal, Samuel Fiorini, Gwenaël Joret, Raphaël M. Jungers, J. Ian Munro",An efficient algorithm for partial order production.,https://doi.org/10.1145/1536414.1536430,"We consider the problem of partial order production: arrange the elements of an unknown totally ordered set T into a target partially ordered set S, by comparing a minimum number of pairs in T. Special cases of this problem include sorting by comparisons, selection, multiple selection, and heap construction. We give an algorithm performing ITLB + o(ITLB) + O(n) comparisons in the worst case. Here, n denotes the size of the ground sets, and ITLB denotes a natural information-theoretic lower bound on the number of comparisons needed to produce the target poset. The overall complexity of our algorithm is polynomial. This answers a question of Yao (SICOMP, 1989). Our strategy is to extend the poset S to a weak order W whose corresponding information-theoretic lower bound is provably not much larger than that for S. Taking W instead of S as a target poset, we then solve the problem by applying a multiple selection algorithm that performs not much more than ITLB comparisons. We base our analysis on the entropy of the target poset S, a quantity that can be efficiently computed and provides a good estimate of ITLB."
STOC,2009,101-110,"Aaron Bernstein, David R. Karger",A nearly optimal oracle for avoiding failed vertices and edges.,https://doi.org/10.1145/1536414.1536431,"We present an improved oracle for the distance sensitivity problem. The goal is to preprocess a directed graph G = (V,E) with non-negative edge weights to answer queries of the form: what is the length of the shortest path from x to y that does not go through some failed vertex or edge f. The previous best algorithm produces an oracle of size ~O(n2) that has an O(1) query time, and an ~O(n2√m) construction time. It was a randomized Monte Carlo algorithm that worked with high probability. Our oracle also has a constant query time and an ~O(n2) space requirement, but it has an improved construction time of ~O(mn), and it is deterministic. Note that O(1) query, O(n2) space, and O(mn) construction time is also the best known bound (up to logarithmic factors) for the simpler problem of finding all pairs shortest paths in a weighted, directed graph. Thus, barring improved solutions to the all pairs shortest path problem, our oracle is optimal up to logarithmic factors."
STOC,2009,111-120,"Leonid Barenboim, Michael Elkin",Distributed (delta+1)-coloring in linear (in delta) time.,https://doi.org/10.1145/1536414.1536432,"The distributed (Δ + 1)-coloring problem is one of most fundamental and well-studied problems in Distributed Algorithms. Starting with the work of Cole and Vishkin in 86, there was a long line of gradually improving algorithms published. The current state-of-the-art running time is O(Δ log Δ + log* n), due to Kuhn and Wattenhofer, PODC'06. Linial (FOCS'87) has proved a lower bound of 1/2 log* n for the problem, and Szegedy and Vishwanathan (STOC'93) provided a heuristic argument that shows that algorithms from a wide family of locally iterative algorithms are unlikely to achieve running time smaller than Θ(Δ log Δ). We present a deterministic (Δ + 1)-coloring distributed algorithm with running time O(Δ) + 1/2 log* n. We also present a tradeoff between the running time and the number of colors, and devise an O(Δ • t)-coloring algorithm with running time O(Δ / t + log* n), for any parameter t, 1 < t ≤ Δ1-ε, for an arbitrarily small constant ε, 0 < ε < 1. Our algorithm breaks the heuristic barrier of Szegedy and Vishwanathan, and achieves running time which is linear in the maximum degree Δ. On the other hand, the conjecture of Szegedy and Vishwanathan may still be true, as our algorithm is not from the family of locally iterative algorithms. On the way to this result we study a generalization of the notion of graph coloring, which is called defective coloring. In an m-defective p-coloring the vertices are colored with p colors so that each vertex has up to m neighbors with the same color. We show that an m-defective p-coloring with reasonably small m and p can be computed very efficiently. We also develop a technique to employ multiple defective colorings of various subgraphs of the original graph G for computing a (Δ+1)-coloring of G. We believe that these techniques are of independent interest."
STOC,2009,121-130,"Tobias Friedrich 0001, Thomas Sauerwald",Near-perfect load balancing by randomized rounding.,https://doi.org/10.1145/1536414.1536433,"We consider and analyze a new algorithm for balancing indivisible loads on a distributed network with n processors. The aim is minimizing the discrepancy between the maximum and minimum load. In every time-step paired processors balance their load as evenly as possible. The direction of the excess token is chosen according to a randomized rounding of the participating loads. We prove that in comparison to the corresponding model of Rabani, Sinclair, and Wanka (1998) with arbitrary roundings, the randomization yields an improvement of roughly a square root of the achieved discrepancy in the same number of time-steps on all graphs. For the important case of expanders we can even achieve a constant discrepancy in O(log n (log log n)3) rounds. This is optimal up to loglog-factors while the best previous algorithms in this setting either require ©(log2 n) time or can only achieve a logarithmic discrepancy. Our new result also demonstrates that with randomized rounding the difference between discrete and continuous load balancing vanishes almost completely."
STOC,2009,131-140,"Russell Impagliazzo, Valentine Kabanets, Avi Wigderson",New direct-product testers and 2-query PCPs.,https://doi.org/10.1145/1536414.1536435,"The ""direct product code"" of a function f gives its values on all k-tuples (f(x1),...,f(xk)). This basic construct underlies ""hardness amplification"" in cryptography, circuit complexity and PCPs. Goldreich and Safra [12] pioneered its local testing and its PCP application. A recent result by Dinur and Goldenberg [5] enabled for the first time testing proximity to this important code in the ""list-decoding"" regime. In particular, they give a 2-query test which works for polynomially small success probability 1/kα, and show that no such test works below success probability 1/k. Our main result is a 3-query test which works for exponentially small success probability exp(-kα). Our techniques (based on recent simplified decoding algorithms for the same code [15]) also allow us to considerably simplify the analysis of the 2-query test of [5]. We then show how to derandomize their test, achieving a code of polynomial rate, independent of k, and success probability 1/kα. Finally we show the applicability of the new tests to PCPs. Starting with a 2-query PCP over an alphabet Σ and with soundness error 1-δ, Rao [19] (building on Raz's (k-fold) parallel repetition theorem [20] and Holenstein's proof [13]) obtains a new 2-query PCP over the alphabet Σk with soundness error exp(-δ2 k). Our techniques yield a 2-query PCP with soundness error exp(-δ √k). Our PCP construction turns out to be essentially the same as the miss-match proof system defined and analyzed by Feige and Kilian [8], but with simpler analysis and exponentially better soundness error."
STOC,2009,141-150,"Oded Goldreich 0001, Dana Ron",On proximity oblivious testing.,https://doi.org/10.1145/1536414.1536436,"We initiate a systematic study of a special type of property testers. These testers consist of repeating a basic test for a number of times that depends on the proximity parameter, whereas the basic test is oblivious of the proximity parameter. We refer to such basic tests by the term Proximity-Oblivious Testers. While proximity-oblivious testers were studied before - most notably in the algebraic setting - the current study seems to be the first one to focus on graph properties. We provide a mix of positive and negative results, and in particular characterizations of the graph properties that have constant-query proximity-oblivious testers in the two standard models (i.e., the adjacency matrix and the bounded-degree models). Furthermore, we show that constant-query proximity-oblivious testers do not exist for many easily testable properties, and that even when proximity-oblivious testers exist, repeating them does not necessarily yield the best standard testers for the corresponding property."
