booktitle,year,pages,author,title,ee,abstract
STOC,2011,1-10,"Mihai Patrascu, Mikkel Thorup",The power of simple tabulation hashing.,https://doi.org/10.1145/1993636.1993638,"Randomized algorithms are often enjoyed for their simplicity, but the hash functions used to yield the desired theoretical guarantees are often neither simple nor practical. Here we show that the simplest possible tabulation hashing provides unexpectedly strong guarantees. The scheme itself dates back to Zobrist in 1970 who used it for game playing programs. Keys are viewed as consisting of c characters. We initialize c tables H1, ..., Hc mapping characters to random hash codes. A key x = (x1, ..., xc) is hashed to H1[x1] ⊕ ⋯ ⊕ Hc[xc], where ⊕ denotes bit-wise exclusive-or. While this scheme is not even 4-independent, we show that it provides many of the guarantees that are normally obtained via higher independence, for example, Chernoff-type concentration, min-wise hashing for estimating set intersection, and cuckoo hashing."
STOC,2011,11-20,"Christoph Lenzen 0001, Roger Wattenhofer",Tight bounds for parallel randomized load balancing: extended abstract.,https://doi.org/10.1145/1993636.1993639,"We explore the fundamental limits of distributed balls-into-bins algorithms, i.e., algorithms where balls act in parallel, as separate agents. This problem was introduced by Adler et al., who showed that non-adaptive and symmetric algorithms cannot reliably perform better than a maximum bin load of Theta(log log n / log log log n) within the same number of rounds. We present an adaptive symmetric algorithm that achieves a bin load of two in log* n+O(1) communication rounds using O(n) messages in total. Moreover, larger bin loads can be traded in for smaller time complexities. We prove a matching lower bound of (1-o(1))log* n on the time complexity of symmetric algorithms that guarantee small bin loads at an asymptotically optimal message complexity of O(n). The essential preconditions of the proof are (i) a limit of O(n) on the total number of messages sent by the algorithm and (ii) anonymity of bins, i.e., the port numberings of balls are not globally consistent. In order to show that our technique yields indeed tight bounds, we provide for each assumption an algorithm violating it, in turn achieving a constant maximum bin load in constant time. As an application, we consider the following problem. Given a fully connected graph of n nodes, where each node needs to send and receive up to n messages, and in each round each node may send one message over each link, deliver all messages as quickly as possible to their destinations. We give a simple and robust algorithm of time complexity O(log* n) for this task and provide a generalization to the case where all nodes initially hold arbitrary sets of messages. Completing the picture, we give a less practical, but asymptotically optimal algorithm terminating within O(1) rounds. All these bounds hold with high probability."
STOC,2011,21-30,"Benjamin Doerr, Mahmoud Fouz, Tobias Friedrich 0001",Social networks spread rumors in sublogarithmic time.,https://doi.org/10.1145/1993636.1993640,"With the prevalence of social networks, it has become increasingly important to understand their features and limitations. It has been observed that information spreads extremely fast in social networks. We study the performance of randomized rumor spreading protocols on graphs in the preferential attachment model. The well-known random phone call model of Karp et al. (FOCS 2000) is a push-pull strategy where in each round, each vertex chooses a random neighbor and exchanges information with it. We prove the following. - The push-pull strategy delivers a message to all nodes within Θ(log n) rounds with high probability. The best known bound so far was O(log2 n). - If we slightly modify the protocol so that contacts are chosen uniformly from all neighbors but the one contacted in the previous round, then this time reduces to Θ(log n / log log n), which is the diameter of the graph. This is the first time that a sublogarithmic broadcast time is proven for a natural setting. Also, this is the first time that avoiding double-contacts reduces the run-time to a smaller order of magnitude."
STOC,2011,31-40,"Oded Regev 0001, Bo'az Klartag",Quantum one-way communication can be exponentially stronger than classical communication.,https://doi.org/10.1145/1993636.1993642,"In STOC 1999, Raz presented a (partial) function for which there is a quantum protocol communicating only O(log n) qubits, but for which any classical (randomized, bounded-error) protocol requires poly(n) bits of communication. That quantum protocol requires two rounds of communication. Ever since Raz's paper it was open whether the same exponential separation can be achieved with a quantum protocol that uses only one round of communication. Here we settle this question in the affirmative."
STOC,2011,41-50,Alexander A. Sherstov,Strong direct product theorems for quantum communication and query complexity.,https://doi.org/10.1145/1993636.1993643,"A strong direct product theorem (SDPT) states that solving n instances of a problem requires Omega(n) times the resources for a single instance, even to achieve success probability 2-Ω(n). We prove that quantum communication complexity obeys an SDPT whenever the communication lower bound for a single instance is proved by the generalized discrepancy method, the strongest technique in that model. We prove that quantum query complexity obeys an SDPT whenever the query lower bound for a single instance is proved by the polynomial method, one of the two main techniques in that model. In both models, we prove the corresponding XOR lemmas and threshold direct product theorems."
STOC,2011,51-60,"Amit Chakrabarti, Oded Regev 0001",An optimal lower bound on the communication complexity of gap-hamming-distance.,https://doi.org/10.1145/1993636.1993644,"We prove an optimal Ω(n) lower bound on the randomized communication complexity of the much-studied Gap-Hamming-Distance problem. As a consequence, we obtain essentially optimal multi-pass space lower bounds in the data stream model for a number of fundamental problems, including the estimation of frequency moments. The Gap-Hamming-Distance problem is a communication problem, wherein Alice and Bob receive n-bit strings x and y, respectively. They are promised that the Hamming distance between x and y is either at least n/2+√n or at most n/2-√n, and their goal is to decide which of these is the case. Since the formal presentation of the problem by Indyk and Woodruff (FOCS, 2003), it had been conjectured that the naive protocol, which uses n bits of communication, is asymptotically optimal. The conjecture was shown to be true in several special cases, e.g., when the communication is deterministic, or when the number of rounds of communication is limited. The proof of our aforementioned result, which settles this conjecture fully, is based on a new geometric statement regarding correlations in Gaussian space, related to a result of C. Borell (1985). To prove this geometric statement, we show that random projections of not-too-small sets in Gaussian space are close to a mixture of translated normal variables."
STOC,2011,61-70,"Jian Ding, James R. Lee, Yuval Peres","Cover times, blanket times, and majorizing measures.",https://doi.org/10.1145/1993636.1993646,"We exhibit a strong connection between cover times of graphs, Gaussian processes, and Talagrand's theory of majorizing measures. In particular, we show that the cover time of any graph G is equivalent, up to universal constants, to the square of the expected maximum of the Gaussian free field on G, scaled by the number of edges in G. This allows us to resolve a number of open questions. We give a deterministic polynomial-time algorithm that computes the cover time to within an O(1) factor for any graph, answering a question of Aldous and Fill (1994). We also positively resolve the blanket time conjectures of Winkler and Zuckerman (1996), showing that for any graph, the blanket and cover times are within an O(1) factor. The best previous approximation factor for both these problems was O((log log n)2) for n-vertex graphs, due to Kahn, Kim, Lovasz, and Vu (2000)."
STOC,2011,71-80,"Wai Shing Fung, Ramesh Hariharan, Nicholas J. A. Harvey, Debmalya Panigrahi",A general framework for graph sparsification.,https://doi.org/10.1145/1993636.1993647,"We present a general framework for constructing cut sparsifiers in undirected graphs --- weighted subgraphs for which every cut has the same weight as the original graph, up to a multiplicative factor of (1 ε). Using this framework, we simplify, unify and improve upon previous sparsification results. As simple instantiations of this framework, we show that sparsifiers can be constructed by sampling edges according to their strength (a result of Benczur and Karger), effective resistance (a result of Spielman and Srivastava), edge connectivity, or by sampling random spanning trees. Sampling according to edge connectivity is the most aggressive method, and the most challenging to analyze. Our proof that this method produces sparsifiers resolves an open question of Benczur and Karger. While the above results are interesting from a combinatorial standpoint, we also prove new algorithmic results. In particular, we develop techniques that give the first (optimal) O(m)-time sparsification algorithm for unweighted graphs. Our algorithm has a running time of O(m) + ~O(n/ε2) for weighted graphs, which is also linear unless the input graph is very sparse itself. In both cases, this improves upon the previous best running times (due to Benczur and Karger) of O(m log2 n) (for the unweighted case) and O(m log3 n) (for the weighted case) respectively. Our algorithm constructs sparsifiers that contain O(n log n/ε2) edges in expectation; the only known construction of sparsifiers with fewer edges is by a substantially slower algorithm running in O(n3 m / ε2) time. A key ingredient of our proofs is a natural generalization of Karger's bound on the number of small cuts in an undirected graph. Given the numerous applications of Karger's bound, we suspect that our generalization will also be of independent interest."
STOC,2011,81-88,"Ken-ichi Kawarabayashi, Yusuke Kobayashi 0001",Breaking o(n1/2)-approximation algorithms for the edge-disjoint paths problem with congestion two.,https://doi.org/10.1145/1993636.1993648,"In the maximum edge-disjoint paths problem, we are given a graph and a collection of pairs of vertices, and the objective is to find the maximum number of pairs that can be routed by edge-disjoint paths. An r-approximation algorithm for this problem is a polynomial time algorithm that finds at least OPT / r edge-disjoint paths, where OPT is the maximum possible. Currently, an O(n1/2)-approximation algorithm is best known for this problem even if a congestion of two is allowed, i.e., each edge is allowed to be used in at most two of the paths. In this paper, we give a randomized O(n3/7 • poly (log n))-approximation algorithm with congestion two. This is the first result that breaks the O(n1/2)-approximation algorithm. In particular, we prove the following. 1. If we have a (randomized) polynomial time algorithm for finding Ω(OPT1/p) edge-disjoint paths for some p>1, then, for some α >0, we can give a randomized O(n1/2-α)-approximation algorithm for the maximum edge-disjoint paths problem by using Rao-Zhou's algorithm. 2. Based on the well-linked set of Chekuri, Khanna, and Shepherd, we show that there is a randomized algorithm for finding Ω(OPT1/4) edge-disjoint paths connecting given terminal pairs with congestion two. Our framework for this algorithm is more general. Indeed, the above two ingredients also work for the maximum edge-disjoint paths problem (with congestion one) if the following conjecture is true. Conjecture: There is a (randomized) polynomial time algorithm for finding Ω(OPT1/p/β(n)) edge-disjoint paths connecting given terminal pairs, where β is a poly-logarithmic function."
STOC,2011,89-98,"Thomas Holenstein, Robin Künzler, Stefano Tessaro","The equivalence of the random oracle model and the ideal cipher model, revisited.",https://doi.org/10.1145/1993636.1993650,"We consider the cryptographic problem of constructing an invertible random permutation from a public random function (i.e., which can be accessed by the adversary). This goal is formalized by the notion of indifferentiability of Maurer et al. (TCC 2004). This is the natural extension to the public setting of the well-studied problem of building random permutations from random functions, which was first solved by Luby and Rackoff (Siam J. Comput., '88) using the so-called Feistel construction. The most important implication of such a construction is the equivalence of the random oracle model (Bellare and Rogaway, CCS '93) and the ideal cipher model, which is typically used in the analysis of several constructions in symmetric cryptography. Coron et al. (CRYPTO 2008) gave a rather involved proof that the six-round Feistel construction with independent random round functions is indifferentiable from an invertible random permutation. Also, it is known that fewer than six rounds do not suffice for indifferentiability. The first contribution (and starting point) of our paper is a concrete distinguishing attack which shows that the indifferentiability proof of Coron et al. is not correct. In addition, we provide supporting evidence that an indifferentiability proof for the six-round Feistel construction may be very hard to find. To overcome this gap, our main contribution is a proof that the Feistel construction with fourteen rounds is indifferentiable from an invertible random permutation. The approach of our proof relies on assigning to each of the rounds in the construction a unique and specific role needed in the proof. This avoids many of the problems that appear in the six-round case."
STOC,2011,99-108,"Craig Gentry, Daniel Wichs",Separating succinct non-interactive arguments from all falsifiable assumptions.,https://doi.org/10.1145/1993636.1993651,"An argument system for NP is succinct, if its communication complexity is polylogarithmic the instance and witness sizes. The seminal works of Kilian '92 and Micali '94 show that such arguments can be constructed under standard cryptographic hardness assumptions with four rounds of interaction, and that they be made non-interactive in the random-oracle model. However, we currently do not have any construction of succinct non-interactive arguments (SNARGs) in the standard model with a proof of security under any simple cryptographic assumption. In this work, we give a broad black-box separation result, showing that black-box reductions cannot be used to prove the security of any SNARG construction based on any falsifiable cryptographic assumption. This includes essentially all common assumptions used in cryptography (one-way functions, trapdoor permutations, DDH, RSA, LWE etc.). More generally, we say that an assumption is falsifiable if it can be modeled as an interactive game between an adversary and an efficient challenger that can efficiently decide if the adversary won the game. This is similar, in spirit, to the notion of falsifiability of Naor '03, and captures the fact that we can efficiently check if an adversarial strategy breaks the assumption. Our separation result also extends to designated verifier SNARGs, where the verifier needs a trapdoor associated with the CRS to verify arguments, and slightly succinct SNARGs, whose size is only required to be sublinear in the statement and witness size."
STOC,2011,109-118,Rafael Pass,Limits of provable security from standard assumptions.,https://doi.org/10.1145/1993636.1993652,"We show that the security of some well-known cryptographic protocols, primitives and assumptions (e.g., the Schnorr identification scheme, commitments secure under adaptive selective-decommitment, the 'one-more' discrete logarithm assumption) cannot be based on any standard assumption using a Turing (i.e., black-box) reduction. These results follow from a general result showing that Turing reductions cannot be used to prove security of constant-round sequentially witness-hiding special-sound protocols for unique witness relations, based on standard assumptions; we emphasize that this result holds even if the protocol makes non-black-box use of the underlying assumption."
STOC,2011,119-128,"Christos H. Papadimitriou, George Pierrakos",On optimal single-item auctions.,https://doi.org/10.1145/1993636.1993654,"We revisit the problem of designing the profit-maximizing single-item auction, solved by Myerson in his seminal paper for the case in which bidder valuations are independently distributed. We focus on general joint distributions, seeking the optimal deterministic incentive compatible auction. We give a geometric characterization of the optimal auction through a duality theorem, resulting in an efficient algorithm for finding the optimal deterministic auction in the two-bidder case and an inapproximability result for three or more bidders."
STOC,2011,129-138,"Shahar Dobzinski, Hu Fu 0001, Robert D. Kleinberg",Optimal auctions with correlated bidders are easy.,https://doi.org/10.1145/1993636.1993655,"We consider the problem of designing a revenue-maximizing auction for a single item, when the values of the bidders are drawn from a correlated distribution. We observe that there exists an algorithm that finds the optimal randomized mechanism that runs in time polynomial in the size of the support. We leverage this result to show that in the oracle model introduced by Ronen and Saberi [FOCS'02], there exists a polynomial time truthful in expectation mechanism that provides a (1.5+ε)-approximation to the revenue achievable by an optimal truthful-in-expectation mechanism, and a polynomial time deterministic truthful mechanism that guarantees 5/3 approximation to the revenue achievable by an optimal deterministic truthful mechanism. We show that the 5/3-approximation mechanism provides the same approximation ratio also with respect to the optimal truthful-in-expectation mechanism. This shows that the performance gap between truthful-in-expectation and deterministic mechanisms is relatively small. En route, we solve an open question of Mehta and Vazirani [EC'04]. Finally, we extend some of our results to the multi-item case, and show how to compute the optimal truthful-in-expectation mechanisms for bidders with more complex valuations."
STOC,2011,139-148,Shahar Dobzinski,An impossibility result for truthful combinatorial auctions with submodular valuations.,https://doi.org/10.1145/1993636.1993656,"We show that every universally truthful randomized mechanism for combinatorial auctions with submodular valuations that provides an approximation ratio of m1/ 2 -ε must use exponentially many value queries, where m is the number of items. In contrast, ignoring incentives there exist constant ratio approximation algorithms for this problem. Our approach is based on a novel direct hardness technique that completely skips the notoriously hard step of characterizing truthful mechanisms. The characterization step was the main obstacle for proving impossibility results in algorithmic mechanism design so far. We demonstrate two additional applications of our new technique: (1) an impossibility result for universally-truthful polynomial time flexible combinatorial public projects and (2) an impossibility result for truthful-in-expectation mechanisms for exact combinatorial public projects. The latter is the first result that bounds the power of polynomial-time truthful in expectation mechanisms in any setting."
STOC,2011,149-158,"Shaddin Dughmi, Tim Roughgarden, Qiqi Yan",From convex optimization to randomized mechanisms: toward optimal combinatorial auctions.,https://doi.org/10.1145/1993636.1993657,"We design an expected polynomial time, truthful in expectation, (1-1/e)-approximation mechanism for welfare maximization in a fundamental class of combinatorial auctions. Our results apply to bidders with valuations that are matroid rank sums (MRS), which encompass most concrete examples of submodular functions studied in this context, including coverage functions and matroid weighted-rank functions. Our approximation factor is the best possible, even for known and explicitly given coverage valuations, assuming P ≠ NP. Ours is the first truthful-in-expectation and polynomial-time mechanism to achieve a constant-factor approximation for an NP-hard welfare maximization problem in combinatorial auctions with heterogeneous goods and restricted valuations. Our mechanism is an instantiation of a new framework for designing approximation mechanisms based on randomized rounding algorithms. A typical such algorithm first optimizes over a fractional relaxation of the original problem, and then randomly rounds the fractional solution to an integral one. With rare exceptions, such algorithms cannot be converted into truthful mechanisms. The high-level idea of our mechanism design framework is to optimize directly over the (random) output of the rounding algorithm, rather than over the input to the rounding algorithm. This approach leads to truthful-in-expectation mechanisms, and these mechanisms can be implemented efficiently when the corresponding objective function is concave. For bidders with MRS valuations, we give a novel randomized rounding algorithm that leads to both a concave objective function and a (1-1/e)-approximation of the optimal welfare."
STOC,2011,159-166,"Mark Braverman, Anup Rao 0001",Towards coding for maximum errors in interactive communication.,https://doi.org/10.1145/1993636.1993659,"We show that it is possible to encode any communication protocol between two parties so that the protocol succeeds even if a (1/4-ε) fraction of all symbols transmitted by the parties are corrupted adversarially, at a cost of increasing the communication in the protocol by a constant factor (the constant depends on epsilon). This encoding uses a constant sized alphabet. This improves on an earlier result of Schulman, who showed how to recover when the fraction of errors is bounded by 1/240. We also show how to simulate an arbitrary protocol with a protocol using the binary alphabet, a constant factor increase in communication and tolerating a (1/8-ε) fraction of errors."
STOC,2011,167-176,"Swastik Kopparty, Shubhangi Saraf, Sergey Yekhanin",High-rate codes with sublinear-time decoding.,https://doi.org/10.1145/1993636.1993660,"Locally decodable codes are error-correcting codes that admit efficient decoding algorithms; any bit of the original message can be recovered by looking at only a small number of locations of a corrupted codeword. The tradeoff between the rate of a code and the locality/efficiency of its decoding algorithms has been well studied, and it has widely been suspected that nontrivial locality must come at the price of low rate. A particular setting of potential interest in practice is codes of constant rate. For such codes, decoding algorithms with locality O(k∈) were known only for codes of rate ∈Ω(1/∈), where k is the length of the message. Furthermore, for codes of rate > 1/2, no nontrivial locality had been achieved. In this article, we construct a new family of locally decodable codes that have very efficient local decoding algorithms, and at the same time have rate approaching 1. We show that for every ∈ > 0 and α > 0, for infinitely many k, there exists a code C which encodes messages of length k with rate 1 − α, and is locally decodable from a constant fraction of errors using O(k∈) queries and time. These codes, which we call multiplicity codes, are based on evaluating multivariate polynomials and their derivatives. Multiplicity codes extend traditional multivariate polynomial codes; they inherit the local-decodability of these codes, and at the same time achieve better tradeoffs and flexibility in the rate and minimum distance."
