booktitle,year,pages,author,title,ee,abstract
STOC,2003,1-9,"Katalin Friedl, Gábor Ivanyos, Frédéric Magniez, Miklos Santha, Pranab Sen",Hidden translation and orbit coset in quantum computing.,https://doi.org/10.1145/780542.780544,"We give efficient quantum algorithms for the problems of Hidden Translation and Hidden Subgroup in a large class of non-abelian groups including solvable groups of constant exponent and of constant length derived series. Our algorithms are recursive. For the base case, we solve efficiently Hidden Translation in Z pn, whenever p is a fixed prime. For the induction step, we introduce the problem Orbit Coset generalizing both Hidden Translation and Hidden Subgroup, and prove a powerful self-reducibility result: Orbit Coset in a finite group G is reducible to Orbit Coset in G/N and subgroups of N, for any solvable normal subgroup N of G."
STOC,2003,10-19,Leonid Gurvits,Classical deterministic complexity of Edmonds' Problem and quantum entanglement.,https://doi.org/10.1145/780542.780545,"Generalizing a decision problem for bipartite perfect matching, J. Edmonds introduced in [14] the problem (now known as the Edmonds Problem) of deciding if a given linear subspace of M(N) contains a nonsingular matrix, where M(N) stands for the linear space of complex NxN matrices. This problem led to many fundamental developments in matroid theory etc.Classical matching theory can be defined in terms of matrices with nonnegative entries. The notion of Positive operator, central in Quantum Theory, is a natural generalization of matrices with nonnegative entries. (Here operator refers to maps from matrices to matrices.) First, we reformulate the Edmonds Problem in terms of of completely positive operators, or equivalently, in terms of bipartite density matrices. It turns out that one of the most important cases when Edmonds' problem can be solved in polynomial deterministic time, i.e. an intersection of two geometric matroids, corresponds to unentangled (aka separable) bipartite density matrices. We introduce a very general class (or promise) of linear subspaces of M(N) on which there exists a polynomial deterministic time algorithm to solve Edmonds' problem. The algorithm is a thoroughgoing generalization of algorithms in [23], [26], and its analysis benefits from an operator analog of permanents, so called Quantum Permanents. Finally, we prove that the weak membership problem for the convex set of separable normalized bipartite density matrices is NP-HARD."
STOC,2003,20-29,"Dorit Aharonov, Amnon Ta-Shma",Adiabatic quantum state generation and statistical zero knowledge.,https://doi.org/10.1145/780542.780546,"The design of new quantum algorithms has proven to be an extremely difficult task. This paper considers a different approach to the problem, by studying the problem of 'quantum state generation'.We first show that any problem in Statistical Zero Knowledge (including eg. discrete log, quadratic residuosity and gap closest vector in a lattice) can be reduced to an instance of the quantum state generation problem. Having shown the generality of the state generation problem, we set the foundations for a new paradigm for quantum state generation. We define 'Adiabatic State Generation' (ASG), which is based on Hamiltonians instead of unitary gates. We develop tools for ASG including a very general method for implementing Hamiltonians (The sparse Hamiltonian lemma), and ways to guarantee non negligible spectral gaps (The jagged adiabatic path lemma). We also prove that ASG is equivalent in power to state generation in the standard quantum model. After setting the foundations for ASG, we show how to apply our techniques to generate interesting superpositions related to Markov chains.The ASG approach to quantum algorithms provides intriguing links between quantum computation and many different areas: the analysis of spectral gaps and groundstates of Hamiltonians in physics, rapidly mixing Markov chains, statistical zero knowledge, and quantum random walks. We hope that these links will bring new insights and methods into quantum algorithms."
STOC,2003,30-39,"Moses Charikar, Liadan O'Callaghan, Rina Panigrahy",Better streaming algorithms for clustering problems.,https://doi.org/10.1145/780542.780548,"We study clustering problems in the streaming model, where the goal is to cluster a set of points by making one pass (or a few passes) over the data using a small amount of storage space. Our main result is a randomized algorithm for the k--Median problem which produces a constant factor approximation in one pass using storage space O(k poly log n). This is a significant improvement of the previous best algorithm which yielded a 2O(1/ε) approximation using O(nε) space. Next we give a streaming algorithm for the k--Median problem with an arbitrary distance function. We also study algorithms for clustering problems with outliers in the streaming model. Here, we give bicriterion guarantees, producing constant factor approximations by increasing the allowed fraction of outliers slightly."
STOC,2003,40-49,C. Greg Plaxton,Approximation algorithms for hierarchical location problems.,https://doi.org/10.1145/780542.780549,"We formulate and (approximately) solve hierarchical versions of two prototypical problems in discrete location theory, namely, the metric uncapacitated k-median and facility location problems. Our work yields new insights into hierarchical clustering, a widely used technique in data analysis. First, we show that every metric space admits a hierarchical clustering that is within a constant factor of optimal at every level of granularity with respect to the average (squared) distance objective. Second, we provide a natural solution to the leaf ordering problem encountered in the traditional dendrogram-based approach to the visualization of hierarchical clusterings."
STOC,2003,50-58,"Wenceslas Fernandez de la Vega, Marek Karpinski, Claire Kenyon, Yuval Rabani",Approximation schemes for clustering problems.,https://doi.org/10.1145/780542.780550,"Let k be a fixed integer. We consider the problem of partitioning an input set of points endowed with a distance function into k clusters. We give polynomial time approximation schemes for the following three clustering problems: Metric k-Clustering, l 22 k-Clustering, and l22 k-Median. In the k-Clustering problem, the objective is to minimize the sum of all intra-cluster distances. In the k-Median problem, the goal is to minimize the sum of distances from points in a cluster to the (best choice of) cluster center. In metric instances, the input distance function is a metric. In l 22 instances, the points are in R d and the distance between two points x,y is measured by x−y 22 (notice that (R d, ⋅ 22 is not a metric space). For the first two problems, our results are the first polynomial time approximation schemes. For the third problem, the running time of our algorithms is a vast improvement over previous work."
STOC,2003,59-68,"Andrew M. Childs, Richard Cleve, Enrico Deotto, Edward Farhi, Sam Gutmann, Daniel A. Spielman",Exponential algorithmic speedup by a quantum walk.,https://doi.org/10.1145/780542.780552,"We construct a black box graph traversal problem that can be solved exponentially faster on a quantum computer than on a classical computer. The quantum algorithm is based on a continuous time quantum walk, and thus employs a different technique from previous quantum algorithms based on quantum Fourier transforms. We show how to implement the quantum walk efficiently in our black box setting. We then show how this quantum walk solves our problem by rapidly traversing a graph. Finally, we prove that no classical algorithm can solve the problem in subexponential time."
STOC,2003,69-76,Hartmut Klauck,Quantum time-space tradeoffs for sorting.,https://doi.org/10.1145/780542.780553,"We investigate the complexity of sorting in the model of sequential quantum circuits. While it is known that in general a quantum algorithm based on comparisons alone cannot outperform classical sorting algorithms by more than a constant factor in time complexity, this is wrong in a space bounded setting. We observe that for all storage bounds n/log ≥ S ≥ log3n, one can devise a quantum algorithm that sorts n numbers (using comparisons only) in time T=O(n3/2 log3/2 n/√S). We then show the following lower bound on the time-space tradeoff for sorting n numbers from a polynomial size range in a general sorting algorithm (not necessarily based on comparisons): TS=Ω(n3/2). Hence for small values of S the upper bound is almost tight. Classically the time-space tradeoff for sorting is TS=Θ(n2)."
STOC,2003,77-81,Andrew Chi-Chih Yao,On the power of quantum fingerprinting.,https://doi.org/10.1145/780542.780554,"In the simultaneous message model, two parties holding n-bit integers x,y send messages to a third party, the referee, enabling him to compute a boolean function f(x,y). "
STOC,2003,82-89,"Yossi Azar, Yossi Richter",Management of multi-queue switches in QoS networks.,https://doi.org/10.1145/780542.780556,"The concept of Quality of Service (QoS) networks has gained growing attention recently, as the traffic volume in the Internet constantly increases, and QoS guarantees are essential to ensure proper operation of most communication based applications. A QoS switch serves m incoming queues by transmitting packets arriving at these queues through one output port, one packet per time unit. Each packet is marked with a value indicating its guaranteed quality of service. Since the queues have bounded capacity and the rate of arriving packets can be much higher than the transmission rate, packets can be lost due to insufficient queue space. The goal is to maximize the total value of transmitted packets. This problem encapsulates two dependent questions: admission control, namely which packets to discard in case of queue overflow, and scheduling, i.e. which queue to use for transmission in each time unit. We use competitive analysis to study online switch performance in QoS based networks. Specifically, we provide a novel generic technique that decouples the admission control and scheduling problems. Our technique transforms any single queue admission control strategy (preemptive or nonpreemptive) to a scheduling and admission control algorithm for our general m queues model, whose competitive ratio is at most twice the competitive ratio of the given admission control strategy. We use our technique to derive concrete algorithms for the general preemptive and nonpreemptive cases, as well as for the interesting special cases of the 2-value model and the unit value model. To the best of our knowledge this is the first result combining both scheduling and admission control decisions for arbitrary packets sequences in multi-queue switches. We also provide a 1.58-competitive randomized algorithm for the unit value case. This case is interesting by itself since most current networks (e.g. IP networks) only support a best-effort service in which all packets streams are treated equally."
STOC,2003,90-99,"Eyal Amir, Robert Krauthgamer, Satish Rao",Constant factor approximation of vertex-cuts in planar graphs.,https://doi.org/10.1145/780542.780557,"We devise the first constant factor approximation algorithm for minimum quotient vertex-cuts in planar graphs. Our algorithm achieves approximation ratio 1+4/3(1+ε) with running time O(W• n3+2/ε), where W is the total weight of the vertices. The approximation ratio improves to 4/3(1+ε+o(1)) if there is an optimal quotient vertex-cut (A*,B*,C*) where the weight of C* is of low order compared to those of A* and B*; this holds, for example, when the input graph has uniform weights and costs. The ratio further improves to 1+ε+o(1) if, in addition, min[w(A*),w(B*)] ≤ 1/3 W.We use our algorithm for quotient vertex-cuts to achieve the first constant-factor pseudo-approximation for vertex separators in planar graphs.Our technical contribution is two-fold. First, we prove a structural theorem for planar graphs, showing the existence of a near-optimal quotient vertex-cut whose high-level structure is that of a bounded-depth tree. Second, we develop an algorithm that optimizes over such complex structures in running time that depends (exponentially) not on the size of the structure, but rather only on its depth. These techniques may be applicable in other problems."
STOC,2003,100-105,"Noga Alon, Baruch Awerbuch, Yossi Azar, Niv Buchbinder, Joseph Naor",The online set cover problem.,https://doi.org/10.1145/780542.780558,"Let X=[1,2,•••,n] be a ground set of n elements, and let S be a family of subsets of X, |S|=m, with a positive cost cS associated with each S ∈ S.Consider the following online version of the set cover problem, described as a game between an algorithm and an adversary. An adversary gives elements to the algorithm from X one-by-one. Once a new element is given, the algorithm has to cover it by some set of S containing it. We assume that the elements of X and the members of S are known in advance to the algorithm, however, the set X' ⊆ X of elements given by the adversary is not known in advance to the algorithm. (In general, X' may be a strict subset of X.) The objective is to minimize the total cost of the sets chosen by the algorithm. Let C denote the family of sets in S that the algorithm chooses. At the end of the game the adversary also produces (off-line) a family of sets COPT that covers X'. The performance of the algorithm is the ratio between the cost of C and the cost of COPT. The maximum ratio, taken over all input sequences, is the competitive ratio of the algorithm.We present an O(log m log n) competitive deterministic algorithm for the problem, and establish a nearly matching Ω(log n log m/log log m + log log n) lower bound for all interesting values of m and n. The techniques used are motivated by similar techniques developed in computational learning theory for online prediction (e.g., the WINNOW algorithm) together with a novel way of converting the fractional solution they supply into a deterministic online algorithm."
STOC,2003,106-115,"Iordanis Kerenidis, Ronald de Wolf",Exponential lower bound for 2-query locally decodable codes via a quantum argument.,https://doi.org/10.1145/780542.780560,"A locally decodable code encodes n-bit strings x in m-bit codewords C(x), in such a way that one can recover any bit xi from a corrupted codeword by querying only a few bits of that word. We use a quantum argument to prove that LDCs with 2 classical queries need exponential length: m=2Ω(n). Previously this was known only for linear codes (Goldreich et al. 02). Our proof shows that a 2-query LDC can be decoded with only 1 quantum query, and then proves an exponential lower bound for such 1-query locally quantum-decodable codes. We also show that q quantum queries allow more succinct LDCs than the best known LDCs with q classical queries. Finally, we give new classical lower bounds and quantum upper bounds for the setting of private information retrieval. In particular, we exhibit a quantum 2 server PIR scheme with O(n3/10) qubits of communication, improving upon the O(n1/3) bits of communication of the best known classical 2-server PIR."
STOC,2003,116-125,Gábor Tardos,Optimal probabilistic fingerprint codes.,https://doi.org/10.1145/780542.780561,"We construct binary codes for fingerprinting digital documents. Our codes for n users that are ε-secure against c pirates have length O(c2log(n/ε)). This improves the codes proposed by Boneh and Shaw [1998] whose length is approximately the square of this length. The improvement carries over to works using the Boneh--Shaw code as a primitive, for example, to the dynamic traitor tracing scheme of Tassa [2005]. By proving matching lower bounds we establish that the length of our codes is best within a constant factor for reasonable error probabilities. This lower bound generalizes the bound found independently by Peikert et al. [2003] that applies to a limited class of codes. Our results also imply that randomized fingerprint codes over a binary alphabet are as powerful as over an arbitrary alphabet and the equal strength of two distinct models for fingerprinting."
STOC,2003,126-135,"Venkatesan Guruswami, Piotr Indyk",Linear time encodable and list decodable codes.,https://doi.org/10.1145/780542.780562,"We present the first construction of error-correcting codes which can be (list) decoded from a noise fraction arbitrarily close to 1 in linear time. Specifically, we present an explicit construction of codes which can be encoded in linear time as well as list decoded in linear time from a fraction (1-ε) of errors for arbitrary ε > 0. The rate and alphabet size of the construction are constants that depend only on ε. Our construction involves devising a new combinatorial approach to list decoding, in contrast to all previous approaches which relied on the power of decoding algorithms for algebraic codes like Reed-Solomon codes.Our result implies that it is possible to have, and in fact explicitly specifies, a coding scheme for arbitrarily large noise thresholds with only constant redundancy in the encoding and  constant amount of work (at both the sending and receiving ends) for each bit of information to be communicated. Such a result was known for certain probabilistic error models, and here we show that this is possible under the stronger adversarial noise model as well."
STOC,2003,136-142,"Don Coppersmith, Madhu Sudan 0001",Reconstructing curves in three (and higher) dimensional space from noisy data.,https://doi.org/10.1145/780542.780563,"We consider the task of reconstructing a curve in constant dimensional space from noisy data. We consider curves of the form C = [(x,y1,•••,yc) | yj = pj(x)], where the pj's are polynomials of low degree. Given n points in (c+1)-dimensional space, such that t of these lie on some such unknown curve C while the other n-t are chosen randomly and independently, we give an efficient algorithm to recover the curve C and the identity of the good points. The success of our algorithm depends on the relation between n, t, c and the degree of the curve C, requiring t = Ω (n deg(C)) 1/(c+1). This generalizes, in the restricted setting of random errors, the work of Sudan (J. Complexity, 1997) and of Guruswami and Sudan (IEEE Trans. Inf. Th. 1999) that considered the case c=1."
STOC,2003,143-148,"Lukasz Kowalik, Maciej Kurowski",Short path queries in planar graphs in constant time.,https://doi.org/10.1145/780542.780565,"We present a new algorithm for answering short path queries in planar graphs. For any fixed constant k and a given unweighted planar graph G=(V,E) one can build in O(|V|) time a data structure, which allows to check in O(1) time whether two given vertices are distant by at most k in G and if so a shortest path between them is returned. This significantly improves the previous result of D. Eppstein [5] where after a linear preprocessing the queries are answered in O(log |V|) time. Our approach can be applied to compute the girth of a planar graph and a corresponding shortest cycle in O(|V|) time provided that the constant bound on the girth is known.Our results can be easily generalized to other wide classes of graphs~--~for instance we can take graphs embeddable in a surface of bounded genus or graphs of bounded tree-width."
STOC,2003,149-158,Mikkel Thorup,Integer priority queues with decrease key in constant time and the single source shortest paths problem.,https://doi.org/10.1145/780542.780566,"We consider Fibonacci heap style integer priority queues supporting insert and decrease key operations in constant time. We present a deterministic linear space solution that with n integer keys support delete in O(log log n) time. If the integers are in the range [0,N), we can also support delete in O(log log N) time.Even for the special case of monotone priority queues, where the minimum has to be non-decreasing, the best previous bounds on delete were O((log n)1/(3-ε)) and O((log N)1/(4-ε)). These previous bounds used both randomization and amortization. Our new bounds a deterministic, worst-case, with no restriction to monotonicity, and exponentially faster.As a classical application, for a directed graph with n nodes and m edges with non-negative integer weights, we get single source shortest paths in O(m+n log log n) time, or O(m+n log log C) if C is the maximal edge weight. The later solves an open problem of Ahuja, Mehlhorn, Orlin, and Tarjan from 1990."
STOC,2003,159-166,"Camil Demetrescu, Giuseppe F. Italiano",A new approach to dynamic all pairs shortest paths.,https://doi.org/10.1145/780542.780567,"We study novel combinatorial properties of graphs that allow us to devise a completely new approach to dynamic all pairs shortest paths problems. Our approach yields a fully dynamic algorithm for general directed graphs with non-negative real-valued edge weights that supports any sequence of operations in O(n2log3n) amortized time per update and unit worst-case time per distance query, where n is the number of vertices. We can also report shortest paths in optimal worst-case time. These bounds improve substantially over previous results and solve a long-standing open problem. Our algorithm is deterministic, uses simple data structures, and appears to be very fast in practice."
STOC,2003,167-176,"Richard Cole 0001, Ramesh Hariharan",A fast algorithm for computing steiner edge connectivity.,https://doi.org/10.1145/780542.780568,"Given an undirected graph or an Eulerian directed graph G and a subset S of its vertices, we show how to determine the edge connectivity C of the vertices in S in time O(C3 n log n+m). This algorithm is based on an efficient construction of tree packings which generalizes Edmonds' Theorem. These packings also yield a characterization of all minimal Steiner cuts of size C from which an efficient data structure for maintaining edge connectivity between vertices in S under edge insertion can be obtained. This data structure enables the efficient construction of a cactus tree for representing significant C-cuts among these vertices, called C-separations, in the same time bound. In turn, we use the cactus tree to give a fast implementation of an approximation algorithm for the Survivable Network Design problem due to Williamson, Goemans, Mihail and Vazirani."
STOC,2003,177-185,"Robert Rettinger, Klaus Weihrauch",The computational complexity of some julia sets.,https://doi.org/10.1145/780542.780570,"Although numerous computer programs have been written to compute sets of points which claim to approximate Julia sets, no reliable high precision pictures of non-trivial Julia sets are currently known. Usually, no error estimates are added and even those algorithms which work reliably in theory, become unreliable in practice due to rounding errors and the use of fixed length floating point numbers.In this paper we prove the existence of polynomial time algorithms to approximate the Julia sets of complex functions f(z)=z2+c for |c|<1/4. We will give a strict computable error estimation w.r.t. the Hausdorff metric dH which means that the set is recursive [10]. Although these and many more Julia sets J are proven to be recursive [12] and furthermore recursive compact subsets of the Euclidean plane are known to have a computable Turing machine time complexity [10], hardly anything is known about the computational complexity of non-trivial examples. The algorithms given in this paper compute the Julia sets locally in time O(k2• M(k)) (where M(k) is a time bound for multiplication of two k-bit integers). Roughly speaking, the local time complexity is the number of Turing machine steps to decide for a single point whether it belongs to a grid Kk⊆ (2-k• Z)2 such that dH(Kk,J)≤ 2-k."
STOC,2003,186-195,"Martin Sauerhoff, Philipp Woelfel",Time-space tradeoff lower bounds for integer multiplication and graphs of arithmetic functions.,https://doi.org/10.1145/780542.780571,"We prove exponential size lower bounds for nondeterministic and randomized read-k BPs as well as a time-space tradeoff lower bound for unrestricted, deterministic multi-way BPs computing the middle bit of integer multiplication. The lower bound for randomized read-k BPs is superpolynomial as long as the error probability is superpolynomially small. For polynomially small error, we have a polynomial upper bound on the size of approximating read once BPs for this function. The lower bounds follow from a more general result for the graphs of universal hash classes that is applicable to the graphs of arithmetic functions such as integer multiplication, convolution, and finite field multiplication."
STOC,2003,195-205,"Adam Kalai, Rocco A. Servedio",Boosting in the presence of noise.,https://doi.org/10.1145/780542.780573,"Boosting algorithms are procedures that ""boost"" low accuracy weak learning algorithms to achieve arbitrarily high accuracy. Over the past decade boosting has been widely used in practice and has become a major research topic in computational learning theory. In this paper we study boosting in the presence of random classification noise, giving both positive and negative results.We show that a modified version of a boosting algorithm due to Mansour and McAllester [14] can achieve accuracy arbitrarily close to the noise rate. We also give a matching lower bound by showing that no efficient black-box boosting algorithm can boost accuracy beyond the noise rate (assuming that one-way functions exist). Finally, we consider a variant of the standard scenario for boosting in which the ""weak learner"" satisfies a slightly stronger condition than the usual weak learning guarantee. We give an efficient algorithm in this framework which can boost to arbitrarily high accuracy in the presence of classification noise."
