booktitle,year,pages,author,title,ee,abstract
STOC,2005,176-182,"Moses Charikar, Adriana Karagiozova",On non-uniform multicommodity buy-at-bulk network design.,https://doi.org/10.1145/1060590.1060617,"We study the multicommodity buy-at-bulk network design problem in which we seek to design a network that satisfies the demands between terminals from a given set of source-sink pairs. The key characteristic of this problem is the fact that the cost functions associated with the edges of the graph are sub-additive monotone and hence experience economies of scale. In the non-uniform case, each edge has its own cost function -- possibly different from other edges. Special cases of this problem have been studied extensively: there are approximation algorithms when the edge cost functions are identical or when all source-sink pairs share the same source. We present the first non-trivial approximation algorithm for the general case. Our algorithm is an extremely simple randomized greedy algorithm and has an approximation guarantee of exp(O√ln n ln ln n)) when the instance has at most n source-sink pairs with unit demands. In the case of general demands, this yields an approximation factor of exp(O √ln N ln ln N)), where N is the sum of all demands."
STOC,2005,183-192,"Chandra Chekuri, Sanjeev Khanna, F. Bruce Shepherd","Multicommodity flow, well-linked terminals, and routing problems.",https://doi.org/10.1145/1060590.1060618,"We study multicommodity routing problems in both edge and node capacitated undirected graphs. The input to each problem is a capacitated graph G=(V,E) and a set Τ of node pairs. In the simplest setting, the goal is to route a unit of flow for as many pairs as possible subject to the edge (node) capacity constraints. If the flow for a routed pair is required to be along a single path, it is the well-studied disjoint paths problem. If we allow fractional routings of the flow, it is known as the all-or-nothing flow problem. The nodes in Τ are referred to as terminals.In recent work [8,9], the authors obtained the first poly-logarithmic approximation algorithms for some edge routing problems. A key idea in these algorithms is to decompose an instance into a collection of instances in which the terminals are well-linked. Informally speaking, a set of nodes is well-linked in a graph if it does not have small separators. A decomposition into well-linked instances was previously achieved in [8] via räcke's hierarchical graph decomposition for oblivious routing [32]. In this paper, we design a simple new decomposition algorithm that is based on computing sparse cuts in a graph. Our new algorithm improves the earlier results for edge routing problems. Another important advantage of the algorithm is that it also applies to node-capacitated problems. We note that for oblivious routing with node capacities, an Ω√n) lower bound is known on the congestion [18], and hence the oblivious routing approach cannot yield poly-logarithmic bounds for well-linked decompositions. Using the new decomposition, we obtain a poly-logarithmic approximation for the node capacitated all-or-nothing flow problem in general graphs and node-disjoint path problem in planar graphs with O(1) congestion. We also show that the flow-cut gap for product multicommodity flows in node capacitated planar graphs is O(1), improving upon the O(log n) bound from [28]."
STOC,2005,193-201,"Mohammad Taghi Hajiaghayi, Jeong Han Kim, Tom Leighton, Harald Räcke",Oblivious routing in directed graphs with random demands.,https://doi.org/10.1145/1060590.1060619,"Oblivious routing algorithms for general undirected networks were introduced by Räcke, and this work has led to many subsequent improvements and applications. More precisely, Räcke showed that there is an oblivious routing algorithm with polylogarithmic competitive ratio (w.r.t. edge congestion) for any undirected graph. Comparatively little positive results are known about oblivious routing in general directed networks. Using a novel approach, we present the first oblivious routing algorithm which is O(log2 n) competitive with high probability in directed graphs given that the demands are chosen randomly from a known demand-distribution. On the other hand, we show that no oblivious routing algorithm can be o(logn/log log n) competitive even with constant probability in general directed graphs.Our routing algorithms are not oblivious in the traditional definition, but we add the concept of demand-dependence, i.e., the path chosen for an s-t pair may depend on the demand between s and t. This concept that still preserves that routing decisions are only based on local information proves very powerful in our randomized demand model.Finally, we show that our approach for designing competitive oblivious routing algorithms is quite general and has applications in other contexts like stochastic scheduling."
STOC,2005,202-208,"Piotr Indyk, David P. Woodruff",Optimal approximations of the frequency moments of data streams.,https://doi.org/10.1145/1060590.1060621,"We give a 1-pass Õ(m1-2⁄k)-space algorithm for computing the k-th frequency moment of a data stream for any real k > 2. Together with the lower bounds of [1, 2, 4], this resolves the main problem left open by Alon et al in 1996 [1]. Our algorithm also works for streams with deletions and thus gives an Õ(m 1-2⁄p) space algorithm for the Lp difference problem for any p > 2. This essentially matches the known Ω(m1-2⁄p-o(1)) lower bound of [12, 2]. Finally the update time of our algorithms is Õ(1)."
STOC,2005,209-217,"Gereon Frahling, Christian Sohler",Coresets in dynamic geometric data streams.,https://doi.org/10.1145/1060590.1060622,"A dynamic geometric data stream consists of a sequence of m insert/delete operations of points from the discrete space 1,…,Δd [26]. We develop streaming (1 + ε)-approximation algorithms for k-median, k-means, MaxCut, maximum weighted matching (MaxWM), maximum travelling salesperson (MaxTSP), maximum spanning tree (MaxST), and average distance over dynamic geometric data streams. Our algorithms maintain a small weighted set of points(a coreset) that approximates with probability 2/3 the current point set with respect to the considered problem during the m insert/delete operations of the data stream. They use poly (ε-1, log m, log Δ) space and update time per insert/delete operation for constant k and dimension dHaving a coreset one only needs a fast approximation algorithm for the weighted problem to compute a solution quickly. In fact, even an exponential algorithm is sometimes feasible as its running time may still be polynomial in n. For example one can compute in poly(log n, exp(O((1+log (1⁄ε)⁄ε)d-1))) time a solution to k-median and k-means [21] where n is the size of the current point set and k and d are constants. Finding an implicit solution to MaxCut can be done in poly(log n, exp((1⁄ε)O(1))) time. For MaxST and average distance we require poly(log n, ε-1) time and for MaxWM we require O(n3) time to do this."
STOC,2005,218-224,"Rafail Ostrovsky, Yuval Rabani",Low distortion embeddings for edit distance.,https://doi.org/10.1145/1060590.1060623,"We show that {0, 1}d endowed with edit distance embeds into ℓ1 with distortion 2O(√log d log log d). We further show efficient implementation of the embedding that yield solutions to various computational problems involving edit distance. These include sketching, communication complexity, nearest neighbor search. For all these problems, we improve upon previous bounds."
STOC,2005,225-233,"Mihai Badoiu, Julia Chuzhoy, Piotr Indyk, Anastasios Sidiropoulos",Low-distortion embeddings of general metrics into the line.,https://doi.org/10.1145/1060590.1060624,"A low-distortion embedding between two metric spaces is a mapping which preserves the distances between each pair of points, up to a small factor called distortion. Low-distortion embeddings have recently found numerous applications in computer science.Most of the known embedding results are ""absolute"",that is, of the form: any metric Y from a given class of metrics C can be embedded into a metric X with low distortion c. This is beneficial if one can guarantee low distortion for all metrics Y in C. However, in any situations, the worst-case distortion is too large to be meaningful. For example, if X is a line metric, then even very simple metrics (an n - point star or an n -point cycle) are embeddable into X only with distortion linear in n. Nevertheless, embeddings into the line (or into low-dimensional spaces) are important for many applications.A solution to this issue is to consider ""relative"" (or ""approximation"") embedding problems, where the goal is to design an (a-approxiation) algorithm which, given any metric X from C as an input, finds an embedding of X into Y which has distortion a *cY (X), where cY (X)is the best possible distortion of an embedding of X into Y.In this paper we show algorithms and hardness results for relative embedding problems.In particular we give: •an algorith that, given a general metric M, finds an embedding with distortion O (Δ3⁄4 poly(c line (M))), where Δ is the spread of M•an algorithm that,given a weighted tree etric M, finds an embedding with distortion poly(c line (M)) •a hardness result, showing that computing minimum line distortion is hard to approximate up to a factor polynomial in n,even for weighted tree metrics with spread Δ=n O (1)."
STOC,2005,234-243,"Mikolaj Bojanczyk, Thomas Colcombet",Tree-walking automata do not recognize all regular languages.,https://doi.org/10.1145/1060590.1060626,"Tree-walking automata are a natural sequential model for recognizing tree languages. Every tree language recognized by a tree-walking automaton is regular. In this paper, we present a tree language which is regular but not recognized by any (nondeterministic) tree-walking automaton. This settles a conjecture of Engelfriet, Hoogeboom and Van Best. Moreover, the separating tree language is definable already in first-order logic over a signature containing the left-son, right-son and ancestor relations."
STOC,2005,244-250,"Itai Benjamini, Oded Schramm, David Bruce Wilson",Balanced boolean functions that can be evaluated so that every input bit is unlikely to be read.,https://doi.org/10.1145/1060590.1060627,"A Boolean function of n bits is balanced if it takes the value 1 with probability 1⁄2. We exhibit a balanced Boolean function with a randomized evaluation procedure (with probability 0 of making a mistake) so that on uniformly random inputs, no input bit is read with probability more than Θ(n-1/2√ log n). We construct a balanced monotone Boolean function and a randomized algorithm computing it for which each bit is read with probability Θ(n-1⁄3 log n). We then show that for any randomized algorithm for evaluating a balanced Boolean function, when the input bits are uniformly random, there is some input bit that is read with probability at least Θ(n-1𔊪). For balanced monotone Boolean functions, there is some input bit that is read with probability at least Θ(n-1𔊫)."
STOC,2005,251-256,Michael Alekhnovich,Lower bounds for k-DNF resolution on random 3-CNFs.,https://doi.org/10.1145/1060590.1060628,"We prove exponential lower bounds for the refutation of a random 3-CNF with linear number of clauses by k-DNF Resolution for k ≤ √ log n ⁄ log log n. For this we design a specially tailored random restrictions that preserve the structure of the input random 3-CNF while mapping every k-DNF with large covering number to 1 with high probability. Next we make use of the switching lemma for small restrictions by Segerlind, Buss and Impagliazzo to prove the lower bound.This work improves the previously known lower bound for Res(2) system on random 3-CNFs by Atserias, Bonet and Esteban and the result of Segerlind, Buss, Impagliazzo stating that random O(k2)-CNF do not possess short Res(k) refutations."
STOC,2005,257-265,"Michal Koucký 0001, Pavel Pudlák, Denis Thérien",Bounded-depth circuits: separating wires from gates.,https://doi.org/10.1145/1060590.1060629,"We develop a new method to analyze the flow of communication in constant-depth circuits. This point of view allows usto prove new lower bounds on the number of wires required to recognize certain languages. We are able to provide explicit languages that can be recognized by AC0 circuits with O(n) gates but not with O(n) wires, and similarly for ACC0 circuits. We are also able to characterize exactly the regular languages that can be recognized with O(n) wires, both in AC0 and ACC0 framework."
STOC,2005,266-275,"Eli Ben-Sasson, Madhu Sudan 0001",Simple PCPs with poly-log rate and query complexity.,https://doi.org/10.1145/1060590.1060631,"We give constructions of probabilistically checkable proofs (PCPs) of length n . poly(log n) (to prove satisfiability of circuits of size n) that can verified by querying poly(log n) bits of the proof. We also give constructions of locally testable codes (LTCs) with similar parameters.Previous constructions of short PCPs (from [5]to [9]) relied extensively on properties of low degree multi-variate polynomials. In contrast, our constructions rely on new problems and techniques revolving around the properties of codes based on high degree polynomials in one variable (also known as Reed-Solomon codes). We show how to convert the problem of verifying the satisfaction of a circuit by a given assignment to the task of verifying that a given function is close to being a Reed-Solomon codeword, i.e., a univariate polynomial of specified degree. This reduction is simpler than the corresponding steps in previous reductions, and gives a new alternative to using the popular ""sum-check protocol"". We then give a new PCP for the special task of proving that a function is close to being a Reed-Solomon codeword. This step of the construction is by a self-contained recursion, and the only ingredient needed in the analysis is the bi-variate low-degree test of Polischuk and Spielman[27].Note that our constructions yield LTCs first, which are then converted to PCPs. In contrast, most recent constructions go in the opposite (and less natural) direction of getting LTCs from PCPs."
STOC,2005,276-283,"Matthew Andrews, Lisa Zhang",Hardness of the undirected edge-disjoint paths problem.,https://doi.org/10.1145/1060590.1060632,"We show that there is no log 1 over 3-ε M approximation for the undirected Edge-Disjoint Paths problem unless NP ⊆ ZPTIME(npolylog(n), where M is the size of the graph and ε is any positive constant. This hardness result also applies to the undirected All-or-Nothing Multicommodity Flow problem and the undirected Node-Disjoint Paths problem."
STOC,2005,284-293,"Matthew Andrews, Lisa Zhang",Hardness of the undirected congestion minimization problem.,https://doi.org/10.1145/1060590.1060633,"We show that there is no (log log M)1-ε approximation for the undirected congestion minimization problem unless NP ⊆ ZPTIME(npolylogn), where M is the size of the graph and ε is any positive constant."
STOC,2005,294-303,"Michael Alekhnovich, Sanjeev Arora, Iannis Tourlakis",Towards strong nonapproximability results in the Lovasz-Schrijver hierarchy.,https://doi.org/10.1145/1060590.1060634,"Lovász and Schrijver described a generic method of tightening the LP and SDP relaxation for any 0-1 optimization problem. These tightened relaxations were the basis of several celebrated approximation algorithms (such as for max-cu , max-3sat, and sparsest cut).We prove strong inapproximability results in this model for well-known problems such as max-3sat, hypergraph vertex cover and set cover. We show that the relaxations produced by as many as Ω(n) rounds of the LS+ procedure do not allow nontrivial approximation, thus ruling out the possibility that the LS+ approach gives even slightly subexponential approximation algorithms for these problems.We also point out why our results are somewhat incomparable to known inapproximability results proved using PCPs, and formalize several interesting open questions."
STOC,2005,304-312,"Saugata Basu, Richard Pollack, Marie-Françoise Roy",Computing the first Betti number and the connected components of semi-algebraic sets.,https://doi.org/10.1145/1060590.1060636,"In this paper we describe the first singly exponential algorithm for computing the first Betti number of a given semi-algebraic set. We also describe algorithms for obtaining semi-algebraic descriptions of the semi-algebraically connected components of any given real algebraic or semi-algebraic set. Singly exponential algorithms for computing the zero-th Betti number, and the Euler-Poincaré characteristic, were known before. No singly exponential algorithm was known for computing any of the individual Betti numbers other than the zero-th one."
STOC,2005,313-322,Saugata Basu,Polynomial time algorithm for computing the top Betti numbers of semi-algebraic sets defined by quadratic inequalities.,https://doi.org/10.1145/1060590.1060637,"For any fixed l > 0, we present an algorithm which takes as input a semi-algebraic set, S, defined by P1 ≥ 0,...,Ps ≥ 0, where each Pi ∈ R[X1,...,Xk] has degree ≤ 2, and computes the top l Betti numbers of S, bk-1(S), ..., bk-l(S), in polynomial time. The complexity of the algorithm, stated more precisely, is Σi=0l+2 (si k2O((l,s)). For fixed l, the complexity of the algorithm can be expressed as sl+2 k2O(l), which is polynomial in the input parameters s and k. To our knowledge this is the first polynomial time algorithm for computing non-trivial topological invariants of semi-algebraic sets in Rk defined by polynomial inequalities, where the number of inequalities is not fixed and the polynomials are allowed to have degree greater than one. For fixed s, we obtain by letting l = k, an algorithm for computing all the Betti numbers of S whose complexity is k2O(s)"
STOC,2005,323-330,"Xi Chen 0001, Xiaotie Deng",On algorithms for discrete and approximate brouwer fixed points.,https://doi.org/10.1145/1060590.1060638,"We study the algorithmic complexity of the discrete fixed point problem and develop an asymptotic matching bound for a cube in any constantly bounded finite dimension. To obtain our upper bound, we derive a new fixed point theorem, based on a novel characterization of boundary conditions for the existence of fixed points.In addition, exploring a linkage with the approximation problem of the continuous fixed point problem, we obtain asymptotic matching bounds for complexity of the approximate Brouwer fixed point problem in the continuous case for Lipschitz functions that close a previous exponential gap. It settles a fifteen years old open problem of Hirsch, Papadimitriou and Vavasis by improving both the upper and lower bounds.Our new characterization for existence of a fixed point is also applicable to functions defined on non-convex domain and makes it a potentially useful tool for design and analysis of algorithms for fixed points in general domain."
STOC,2005,331-337,"Yossi Azar, Amir Epstein",Convex programming for scheduling unrelated parallel machines.,https://doi.org/10.1145/1060590.1060639,"We consider the classical problem of scheduling parallel unrelated machines. Each job is to be processed by exactly one machine. Processing job j on machine i requires time pij. The goal is to find a schedule that minimizes the lp norm. Previous work showed a 2-approximation algorithm for the problem with respect to the l∞ norm. For any fixed lp norm the previously known approximation algorithm has a performance of θ(p). We provide a 2-approximation algorithm for any fixed lp norm (p>1). This algorithm uses convex programming relaxation. We also give a √ 2-approximation algorithm for the l2 norm. This algorithm relies on convex quadratic programming relaxation. To the best of our knowledge, this is the first time that general convex programming techniques (apart from SDPs and CQPs) are used in the area of scheduling. We show for any given lp norm a PTAS for any fixed number of machines. We also consider the multidimensional generalization of the problem in which the jobs are d-dimensional. Here the goal is to minimize the lp norm of the generalized load vector, which is a matrix where the rows represent the machines and the columns represent the jobs dimension. For this problem we give a (d+1)-approximation algorithm for any fixed lp norm (p>1)."
STOC,2005,338-347,"Saurabh Sanghvi, Salil P. Vadhan",The round complexity of two-party random selection.,https://doi.org/10.1145/1060590.1060641,"We study the round complexity of two-party protocols for generating a random n-bit string such that the output is guaranteed to have bounded bias (according to some measure) even if one of the two parties deviates from the protocol (even using unlimited computational resources). Specifically, we require that the output's statistical difference from the uniform distribution on zon is bounded by a constant less than 1.We present a protocol for the above problem that has 2 log*n+O(1) rounds, improving a 2n-round protocol that follows from the work of Goldreich, Goldwasser, and Linial (FOCS'91). Like the GGL protocol, our protocol actually provides a stronger guarantee, ensuring that the output lands in any set T⊆zon of density μ with probability at most O(√μ+δ), where δ is an arbitarily small constant.We then prove a matching lower bound, showing that any protocol guaranteeing bounded statistical difference requires at least log*n - log* log*n-O(1) rounds. As far as we know, this is the first nontrivial lower bound on the round complexity of random selection protocols (of any type) that does not impose additional constraints (e.g. on communication or ""simulatability"").We also state several results for the case when the output's bias is measured by the maximum multiplicative factor by which a party can increase the probability of a set T ⊆ zon."
STOC,2005,348-355,"Lance Fortnow, Rahul Santhanam, Luca Trevisan",Hierarchies for semantic classes.,https://doi.org/10.1145/1060590.1060642,"We show that for any constant a, ZPP/b(n) strictly contains ZPTIME(na)/b(n) for some b(n) = O(log n log log n). Our techniques are very general and give the same hierarchy for all common semantic time classes including RTIME, NTIME ∩ coNTIME, UTIME, MATIME, AMTIME and BQTIME.We show a stronger hierarchy for RTIME: For every constant c, RP/1 is not contained in RTIME(nc)/(log n)1/2c. To prove this result we first prove a similar statement for NP by building on Zák's proof of the nondeterministic time hierarchy."
STOC,2005,356-365,"Haim Kaplan, Eyal Kushilevitz, Yishay Mansour",Learning with attribute costs.,https://doi.org/10.1145/1060590.1060644,"We study an extension of the ""standard"" learning models to settings where observing the value of an attribute has an associated cost (which might be different for different attributes). Our model assumes that the correct classification is given by some target function f from a class of functions cal F; most of our results discuss the ability to learn a clause (an OR function of a subset of the variables) in various settings:Offline: We are given both the function f and the distribution D that is used to generate an input x. The goal is to design a strategy to decide what attribute of x to observe next so as to minimize the expected evaluation cost of f(x). (In this setting there is no ""learning"" to be done but only an optimization problem to be solved; this problem to be NP-hard and hence approximation algorithms are presented.)Distributional online: We study two types of ""learning"" problems; one where the target function f is known to the learner but the distribution D is unknown (and the goal is to minimize the expected cost including the cost that stems from ""learning"" D), and the other where f is unknown (except that f∈cal F) but D is known (and the goal is to minimize the expected cost while limiting the prediction error involved in ""learning"" f).Adversarial online: We are given f, however the inputs are selected adversarially. The goal is to compare the learner's cost to that of the best fixed evaluation order (i.e., we analyze the learner's performance by a competitive analysis)."
STOC,2005,366-375,"Elchanan Mossel, Sébastien Roch",Learning nonsingular phylogenies and hidden Markov models.,https://doi.org/10.1145/1060590.1060645,"In this paper, we study the problem of learning phylogenies and hidden Markov models. We call a Markov model nonsingular if all transition matrices have determinants bounded away from 0 (and 1). We highlight the role of the nonsingularity condition for the learning problem. Learning hidden Markov models without the nonsingularity condition is at least as hard as learning parity with noise. On the other hand, we give a polynomial-time algorithm for learning nonsingular phylogenies and hidden Markov models."
