booktitle,year,pages,author,title,ee,abstract
STOC,2009,493-502,"Ryan O'Donnell, Yi Wu 0002",Conditional hardness for satisfiable 3-CSPs.,https://doi.org/10.1145/1536414.1536482,"In this paper we study a fundamental open problem in the area of probabilistic checkable proofs: What is the smallest s such that NP ⊆ naPCP1,s[O(log n),3]? In the language of hardness of approximation, this problem is equivalent to determining the smallest s such that getting an s-approximation for satisfiable 3-bit constraint satisfaction problems (""3-CSPs"") is NP-hard. The previous best upper bound and lower bound for s are 20/27+µ by Khot and Saket [KS06], and 5/8 (assuming NP subseteq BPP) by Zwick [Zwi98]. In this paper we close the gap assuming Khot's d-to-1 Conjecture. Formally, we prove that if Khot's d-to-1 Conjecture holds for any finite constant integer d, then NP naPCP1,5/8+ µ[O(log n),3] for any constant µ > 0. Our conditional result also solves Hastad's open question [Has01] on determining the inapproximability of satisfiable Max-NTW (""Not Two"") instances and confirms Zwick's conjecture [Zwi98] that the 5/8-approximation algorithm for satisfiable 3-CSPs is optimal."
STOC,2009,503-512,"Jing Chen 0017, Silvio Micali",A new approach to auctions and resilient mechanism design.,https://doi.org/10.1145/1536414.1536484,"We put forward a new approach to mechanism design, and exemplify it via a new mechanism guaranteeing significant revenue in unrestricted combinatorial auctions. Our mechanism (1) succeeds in a new and very adversarial collusion model; (2) works in a new, equilibrium-less, and very strong solution concept; (3) benchmarks its performance against the knowledge that the players have about each other; (4) is computationally efficient and preserves the players' privacy to an unusual extent."
STOC,2009,513-522,Tim Roughgarden,Intrinsic robustness of the price of anarchy.,https://doi.org/10.1145/1536414.1536485,"The price of anarchy, defined as the ratio of the worst-case objective function value of a Nash equilibrium of a game and that of an optimal outcome, quantifies the inefficiency of selfish behavior. Remarkably good bounds on this measure are known for a wide range of application domains. However, such bounds are meaningful only if a game's participants successfully reach a Nash equilibrium. This drawback motivates inefficiency bounds that apply more generally to weaker notions of equilibria, such as mixed Nash equilibria and correlated equilibria, and to sequences of outcomes generated by natural experimentation strategies, such as successive best responses and simultaneous regret-minimization.We establish a general and fundamental connection between the price of anarchy and its seemingly more general relatives. First, we identify a “canonical sufficient condition” for an upper bound on the price of anarchy of pure Nash equilibria, which we call a smoothness argument. Second, we prove an “extension theorem”: every bound on the price of anarchy that is derived via a smoothness argument extends automatically, with no quantitative degradation in the bound, to mixed Nash equilibria, correlated equilibria, and the average objective function value of every outcome sequence generated by no-regret learners. Smoothness arguments also have automatic implications for the inefficiency of approximate equilibria, for bicriteria bounds, and, under additional assumptions, for polynomial-length best-response sequences. Third, we prove that in congestion games, smoothness arguments are “complete” in a proof-theoretic sense: despite their automatic generality, they are guaranteed to produce optimal worst-case upper bounds on the price of anarchy."
STOC,2009,523-532,"Eyal Even-Dar, Yishay Mansour, Uri Nadav",On the convergence of regret minimization dynamics in concave games.,https://doi.org/10.1145/1536414.1536486,"We study a general sub-class of concave games which we call socially concave games. We show that if each player follows any no-external regret minimization procedure then the dynamics will converge in the sense that both the average action vector will converge to a Nash equilibrium and that the utility of each player will converge to her utility in that Nash equilibrium. We show that many natural games are indeed socially concave games. Specifically, we show that linear Cournot competition and linear resource allocation games are socially-concave games, and therefore our convergence result applies to them. In addition, we show that a simple best response dynamics might diverge for linear resource allocation games, and is known to diverge for linear Cournot competition. For the TCP congestion games we show that ""near"" the equilibrium the games are socially-concave, and using our general methodology we show the convergence of a specific regret minimization dynamics."
STOC,2009,533-542,"Robert Kleinberg, Georgios Piliouras, Éva Tardos",Multiplicative updates outperform generic no-regret learning in congestion games: extended abstract.,https://doi.org/10.1145/1536414.1536487,"We study the outcome of natural learning algorithms in atomic congestion games. Atomic congestion games have a wide variety of equilibria often with vastly differing social costs. We show that in almost all such games, the well-known multiplicative-weights learning algorithm results in convergence to pure equilibria. Our results show that natural learning behavior can avoid bad outcomes predicted by the price of anarchy in atomic congestion games such as the load-balancing game introduced by Koutsoupias and Papadimitriou, which has super-constant price of anarchy and has correlated equilibria that are exponentially worse than any mixed Nash equilibrium. Our results identify a set of mixed Nash equilibria that we call weakly stable equilibria. Our notion of weakly stable is defined game-theoretically, but we show that this property holds whenever a stability criterion from the theory of dynamical systems is satisfied. This allows us to show that in every congestion game, the distribution of play converges to the set of weakly stable equilibria. Pure Nash equilibria are weakly stable, and we show using techniques from algebraic geometry that the converse is true with probability 1 when congestion costs are selected at random independently on each edge (from any monotonically parametrized distribution). We further extend our results to show that players can use algorithms with different (sufficiently small) learning rates, i.e. they can trade off convergence speed and long term average regret differently."
STOC,2009,543-552,"MohammadHossein Bateni, Moses Charikar, Venkatesan Guruswami",MaxMin allocation via degree lower-bounded arborescences.,https://doi.org/10.1145/1536414.1536488,"We consider the problem of MaxMin allocation of indivisible goods. There are m items to be distributed among n players. Each player  has a nonnegative valuation pij for an item j, and the goal is to allocate items to players so as to maximize the minimum total valuation received by each player. There is a large gap in our understanding of this problem. The best known positive result is an ~O(√ n)-approximation algorithm, while there is only a factor 2 hardness known. Better algorithms are known for the restricted assignment case where each item has exactly one nonzero value for the players. We study the effect of bounded degree for items: each item has a nonzero value for at most D players. We show that essentially the case D = 3 is equivalent to the general case, and give a 4-approximation algorithm for D = 2. The current algorithmic results for MaxMin Allocation are based on a complicated LP relaxation called the configuration LP. We present a much simpler LP which is equivalent in power to the configuration LP. We focus on a special case of MaxMin Allocation-a family of instances on which this LP has a polynomially large gap. The technical core of our result for this case comes from an algorithm for an interesting new optimization problem on directed graphs, MaxMinDegree Arborescence, where the goal is to produce an arborescence of large outdegree. We develop an nε-approximation for this problem that runs in nO(1/ε) time and obtain a a polylogarithmic approximation that runs in quasipolynomial time, using a lift-and-project inspired LP formulation. In fact, we show that our results imply a rounding algorithm for the relaxations obtained by t rounds of the Sherali-Adams hierarchy applied to a natural LP relaxation of the problem. Roughly speaking, the integrality gap of the relaxation obtained from t rounds of Sherali-Adams is at most n1/t. We are able to extend the latter result to a more general class of instances. Along the way, we prove a result about the existence of a perfect matching in a probabilistically pruned graph which may be of independent interest."
STOC,2009,553-560,"Ravi Montenegro, Prasad Tetali",How long does it take to catch a wild kangaroo?,https://doi.org/10.1145/1536414.1536490,"The discrete logarithm problem asks to solve for the exponent x, given the generator g of a cyclic group G and an element h∈ G such that gx=h. We give the first rigorous proof that Pollard's Kangaroo method finds the discrete logarithm in expected time (3+o(1))√{b-a} for the worst value of x∈[a,b], and (2+o(1))√b-a when x∈uar[a,b]. This matches the conjectured time complexity and, rare among the analysis of algorithms based on Markov chains, even the lead constants 2 and 3 are correct."
STOC,2009,561-570,"Ravi Kannan, Hariharan Narayanan",Random walks on polytopes and an affine interior point method for linear programming.,https://doi.org/10.1145/1536414.1536491,"Let K be a polytope in Rn defined by m linear inequalities. We give a new Markov Chain algorithm to draw a nearly uniform sample from K. The underlying Markov Chain is the first to have a mixing time that is strongly polynomial when started from a ""central"" point x0. If s is the supremum over all chords pq passing through x0 of (|p-x0|)/(|q-x0|) and ε is an upper bound on the desired total variation distance from the uniform, it is sufficient to take O(m n( n log (s m) + log 1/ε)) steps of the random walk. We use this result to design an affine interior point algorithm that does a single random walk to solve linear programs approximately. More precisely, suppose Q = {z | Bz ≤ 1} contains a point z such that cT z ≥ d and r := supz ∈ Q |Bz| + 1, where B is an m x n matrix. Then, after τ = O(mn (n ln(mr/ε) + ln 1/δ)) steps, the random walk is at a point xτ for which cT xτ ≥ d(1-ε) with probability greater than 1-δ. The fact that this algorithm has a run-time that is provably polynomial is notable since the analogous deterministic affine algorithm analyzed by Dikin has no known polynomial guarantees."
STOC,2009,571-580,"Fabio Martinelli, Alistair Sinclair",Mixing time for the solid-on-solid model.,https://doi.org/10.1145/1536414.1536492,"We analyze the mixing time of a natural local Markov chain (the Glauber dynamics) on configurations of the solid-on-solid model of statistical physics. This model has been proposed, among other things, as an idealization of the behavior of contours in the Ising model at low temperatures. Our main result is an upper bound on the mixing time of O~(n3.5), which is tight within a factor of O~(√n). The proof, which in addition gives insight into the actual evolution of the contours, requires the introduction of several novel analytical techniques that we conjecture will have other applications."
STOC,2009,581-590,Allan Sly,Reconstruction for the Potts model.,https://doi.org/10.1145/1536414.1536493,"The reconstruction problem on the tree plays a key role in several important computational problems. Deep conjectures in statistical physics link the reconstruction problem to properties of random constraint satisfaction problems including random k-SAT and random colourings of random graphs. At this precise threshold the space of solutions is conjectured to undergo a phase transition from a single collected mass to exponentially many small clusters at which point local search algorithm must fail. In computational biology the reconstruction problem is central in phylogenetics. It has been shown [Mossel 04] that solvability of the reconstruction problem is equivalent to phylogenetic reconstruction with short sequences for the binary symmetric model. Rigorous reconstruction thresholds, however, have only been established in a small number of models. We confirm conjectures made by Mezard and Montanari for the Potts models proving the first exact reconstruction threshold in a non-binary model establishing the so-called Kesten-Stigum bound for the 3-state Potts model on regular trees of large degree. We further establish that the Kesten-Stigum bound is not tight for the -state Potts model when q ≥ 5. Moreover, we determine asymptotics for these reconstruction thresholds."
STOC,2009,591-600,"Martin Dietzfelbinger, Philipp Woelfel",Tight lower bounds for greedy routing in uniform small world rings.,https://doi.org/10.1145/1536414.1536494,"We consider augmented ring-based networks with vertices 0,...,n-1, where each vertex is connected to its left and right neighbor and possibly to some further vertices (called long range contacts). The outgoing edges of a vertex v are obtained by choosing a subset D of {1,2,...n-1}, with 1, n-1 in D, at random according to a probability distribution mu on all such D and then for each i in D connecting v to (v+i) mod n by a unidirectional link. The choices for different v are done independently and uniformly in the sense that the same distribution mu is used for all v. The expected number of long range contacts is l=E(|D|)-2. Motivated by Kleinberg's (2000) Small World Graph model and packet routing strategies for peer-to-peer networks, the greedy routing algorithm on augmented rings, where a packet sitting in a node v is routed to the neighbor of v closest to the destination of the package, has been investigated thoroughly, both for the ""one-sided case"", where packets can travel only in one direction, and the ""two-sided case"", where there is no such restriction. In this paper, for both the one-sided and the two-sided case and for an arbitrary distribution mu, we prove a lower bound of Omega((log n)2/l) on the expected number of hops that are needed by the greedy strategy to route a package between two randomly chosen vertices on the ring. This bound is tight for Ω(1)≤l=O(log n)."
STOC,2009,601-610,"Yevgeniy Dodis, Daniel Wichs",Non-malleable extractors and symmetric key cryptography from weak secrets.,https://doi.org/10.1145/1536414.1536496,"We study the question of basing symmetric key cryptography on weak secrets. In this setting, Alice and Bob share an n-bit secret W, which might not be uniformly random, but the adversary has at least k bits of uncertainty about it (formalized using conditional min-entropy). Since standard symmetric-key primitives require uniformly random secret keys, we would like to construct an authenticated key agreement protocol in which Alice and Bob use W to agree on a nearly uniform key R, by communicating over a public channel controlled by an active adversary Eve. We study this question in the information theoretic setting where the attacker is computationally unbounded. We show that single-round (i.e. one message) protocols do not work when k ≤ n/2, and require poor parameters even when n/2<k<<n. On the other hand, for arbitrary values of k, we design a communication efficient two-round (challenge-response) protocol extracting nearly k random bits. This dramatically improves the previous construction of Renner and Wolf [32], which requires Θ(λ + log(n)) rounds where λ is the security parameter. Our solution takes a new approach by studying and constructing ""non-malleable"" seeded randomness extractors -- if an attacker sees a random seed X and comes up with an arbitrarily related seed X', then we bound the relationship between R= Ext(W;X) and R' = Ext(W;X'). We also extend our two-round key agreement protocol to the ""fuzzy"" setting, where Alice and Bob share ""close"" (but not equal) secrets WA and WB, and to the Bounded Retrieval Model (BRM) where the size of the secret W is huge."
STOC,2009,611-620,"Iftach Haitner, Omer Reingold, Salil P. Vadhan, Hoeteck Wee",Inaccessible entropy.,https://doi.org/10.1145/1536414.1536497,"We put forth a new computational notion of entropy, which measures the (in)feasibility of sampling high entropy strings that are consistent with a given protocol. Specifically, we say that the i'th round of a protocol (A,B) has *accessible entropy* at most k, if no polynomial-time strategy A* can generate messages for A such that the entropy of its message in the i'th round has entropy greater than k when conditioned both on prior messages of the protocol and on prior coin tosses of A*. We say that the protocol has *inaccessible entropy* if the total accessible entropy (summed over the rounds) is noticeably smaller than the real entropy of A's messages, conditioned only on prior messages (but not the coin tosses of A). As applications of this notion, we -- Give a much simpler and more efficient construction of statistically hiding commitment schemes from arbitrary one-way functions. -- Prove that constant-round statistically hiding commitments are necessary for constructing constant-round zero-knowledge proof systems for NP that remain secure under parallel composition (assuming the existence of one-way functions)."
STOC,2009,621-630,"Yevgeniy Dodis, Yael Tauman Kalai, Shachar Lovett",On cryptography with auxiliary input.,https://doi.org/10.1145/1536414.1536498,"We study the question of designing cryptographic schemes which are secure even if an arbitrary function f(sk) of the secret key is leaked, as long as the secret key sk is still (exponentially) hard to compute from this auxiliary input. This setting of auxiliary input is more general than the more traditional setting, which assumes that some of information about the secret key sk may be leaked, but sk still has high min-entropy left. In particular, we deal with situations where f(sk) information-theoretically determines the entire secret key sk. As our main result, we construct CPA/CCA secure symmetric encryption schemes that remain secure with exponentially hard-to-invert auxiliary input. We give several applications of such schemes. * We construct an average-case obfuscator for the class of point functions, which remains secure with exponentially hard-to-invert auxiliary input, and is reusable. * We construct a reusable and robust extractor that remains secure with exponentially hard-to-invert auxiliary input. Our results rely on a new cryptographic assumption, Learning Subspace-with-Noise (LSN), which is related to the well known Learning Parity-with-Noise (LPN) assumption."
STOC,2009,631-638,"Jérémie Chalopin, Daniel Gonçalves 0001",Every planar graph is the intersection graph of segments in the plane: extended abstract.,https://doi.org/10.1145/1536414.1536500,"Given a set S of segments in the plane, the intersection graph of S is the graph with vertex set S in which two vertices are adjacent if and only if the corresponding two segments intersect. We prove a conjecture of Scheinerman (PhD Thesis, Princeton University, 1984) that every planar graph is the intersection graph of some segments in the plane."
STOC,2009,639-648,"Boris Aronov, Esther Ezra, Micha Sharir",Small-size epsilon-nets for axis-parallel rectangles and boxes.,https://doi.org/10.1145/1536414.1536501,"We show the existence of ε-nets of size O(1/ε log log 1/ε) for planar point sets and axis-parallel rectangular ranges. The same bound holds for points in the plane with ""fat"" triangular ranges, and for point sets in reals3 and axis-parallel boxes; these are the first known non-trivial bounds for these range spaces. Our technique also yields improved bounds on the size of ε-nets in the more general context considered by Clarkson and Varadarajan. For example, we show the existence of ε-nets of size O(1/ε log log log 1/ε) for the dual range space of ""fat"" regions and planar point sets (where the regions are the ground objects and the ranges are subsets stabbed by points). Plugging our bounds into the technique of Bronnimann and Goodrich, we obtain improved approximation factors (computable in randomized polynomial time) for the hitting set or the set cover problems associated with the corresponding range spaces."
STOC,2009,649-658,"Yuval Rabani, Amir Shpilka",Explicit construction of a small epsilon-net for linear threshold functions.,https://doi.org/10.1145/1536414.1536502,"We give explicit constructions of epsilon nets for linear threshold functions on the binary cube and on the unit sphere. The size of the constructed nets is polynomial in the dimension n and in 1/ε. To the best of our knowledge no such constructions were previously known. Our results match, up to the exponent of the polynomial, the bounds that are achieved by probabilistic arguments. As a corollary we also construct subsets of the binary cube that have size polynomial in n and covering radius of n/2 - c√{n log n}, for any constant c. This improves upon the well known construction of dual BCH codes that only guarantee covering radius of n/2 - c√n."
STOC,2009,659-668,"Anupam Gupta 0001, Amit Kumar 0001",A constant-factor approximation for stochastic Steiner forest.,https://doi.org/10.1145/1536414.1536504,"We consider the stochastic Steiner forest problem: suppose we were given a collection of Steiner forest instances, and were guaranteed that a random one of these instances would appear tomorrow; moreover, the cost of edges tomorrow will be λ times the cost of edges today. Which edges should we buy today so that we can extend it to a solution for the instance arriving tomorrow, to minimize the expected total cost? While very general results have been developed for many problems in stochastic discrete optimization over the past years, the approximation status of the stochastic Steiner Forest problem has remained open, with previous works yielding constant-factor approximations only for special cases. We resolve the status of this problem by giving a constant-factor primal-dual based approximation algorithm."
STOC,2009,669-678,"Yossi Azar, Iftah Gamzu, Xiaoxin Yin",Multiple intents re-ranking.,https://doi.org/10.1145/1536414.1536505,"One of the most fundamental problems in web search is how to re-rank result web pages based on user logs. Most traditional models for re-ranking assume each query has a single intent. That is, they assume all users formulating the same query have similar preferences over the result web pages. It is clear that this is not true for a large portion of queries as different users may have different preferences over the result web pages. Accordingly, a more accurate model should assume that queries have multiple intents. In this paper, we introduce the multiple intents re-ranking problem. This problem captures scenarios in which some user makes a query, and there is no information about its real search intent. In such cases, one would like to re-rank the search results in a way that minimizes the efforts of all users in finding their relevant web pages. More formally, the setting of this problem consists of various types of users, each of which interested in some subset of the search results. Moreover, each user type has a non-negative profile vector. Consider some ordering of the search results. This order sets a position for each search result, and induces a position vector of the results relevant to each user type. The overhead of a user type is the dot product of its profile vector and its induced position vector. The goal is to order the search results as to minimize the average overhead of the users. Our main result is an O(log r)-approximation algorithm for the problem, where r is the maximum number of search results that are relevant to any user type. The algorithm is based on a new technique, which we call harmonic interpolation. In addition, we consider two important special cases. The first case is when the profile vector of each user type is non-increasing. This case is a generalization of the well-known min-sum set cover problem. We extend the techniques of Feige, Lovasz and Tetali (Algorithmica '04), and present an algorithm achieving 4-approximation. The second case is when the profile vector of each user type is non-decreasing. This case generalizes the minimum latency set cover problem, introduced by Hassin and Levin (ESA '05). We devise an LP-based algorithm that attains 2-approximation for it."
STOC,2009,679-684,"Jivitej S. Chadha, Naveen Garg 0001, Amit Kumar 0001, V. N. Muralidhara",A competitive algorithm for minimizing weighted flow time on unrelatedmachines with speed augmentation.,https://doi.org/10.1145/1536414.1536506,"We consider the online problem of scheduling jobs on unrelated machines so as to minimize the total weighted flow time. This problem has an unbounded competitive ratio even for very restricted settings. In this paper we show that if we allow the machines of the online algorithm to have ε more speed than those of the offline algorithm then we can get an O((1+ε-1)2)-competitive algorithm. Our algorithm schedules jobs preemptively but without migration. However, we compare our solution to an offline algorithm which allows migration. Our analysis uses a potential function argument which can also be extended to give a simpler and better proof of the randomized immediate dispatch algorithm of Chekuri-Goel-Khanna-Kumar for minimizing average flow time on parallel machines."
