booktitle,year,pages,author,title,ee,abstract
STOC,2009,151-158,Eric Blais,Testing juntas nearly optimally.,https://doi.org/10.1145/1536414.1536437,"A function on n variables is called a k-junta if it depends on at most k of its variables. In this article, we show that it is possible to test whether a function is a k-junta or is ""far"" from being a k-junta with O(kε + k log k ) queries, where epsilon is the approximation parameter. This result improves on the previous best upper bound of O (k3/2)ε queries and is asymptotically optimal, up to a logarithmic factor. We obtain the improved upper bound by introducing a new algorithm with one-sided error for testing juntas. Notably, the algorithm is a valid junta tester under very general conditions: it holds for functions with arbitrary finite domains and ranges, and it holds under any product distribution over the domain. A key component of the analysis of the new algorithm is a new structural result on juntas: roughly, we show that if a function f is ""far"" from being a k-junta, then f is ""far"" from being determined by k parts in a random partition of the variables. The structural lemma is proved using the Efron-Stein decomposition method."
STOC,2009,159-166,Asaf Shapira,Green's conjecture and testing linear-invariant properties.,https://doi.org/10.1145/1536414.1536438,"Given a set of linear equations Mx=b, we say that a set of integers S is (M,b)-free if it contains no solution to this system of equations. Motivated by questions related to testing linear-invariant properties of boolean functions, as well as recent investigations in additive number theory, the following conjecture was raised (implicitly) by Green and by Bhattacharyya, Chen, Sudan and Xie: we say that a set of integers S ⊆ [n], is ε-far from being (M,b)-free if one needs to remove at least ε n elements from S in order to make it (M,b)-free. The above conjecture states that for any system of homogenous linear equations Mx=0 and for any ε >0 there is a constant time algorithm that can distinguish with high probability between sets of integers that are (M,0)-free from sets that are ε-far from being (M,0)-free. Or in other words, that for any M there is an efficient testing algorithm for the property of being (M,0)-free. In this paper we confirm the above conjecture by showing that such a testing algorithm exists even for non-homogenous linear equations. As opposed to most results on testing boolean functions, which rely on algebraic and analytic arguments, our proof relies on results from extremal hypergraph theory, such as the recent removal lemmas of Gowers, Rodl et al. and Austin and Tao."
STOC,2009,167-168,Shafi Goldwasser,Athena lecture: Controlling Access to Programs?,https://doi.org/10.1145/1536414.1536416,"Shafi Goldwasser is a professor of Computer Science at the Massachusetts Institute of Technology and at the Weizmann Institute of Science. She received her PhD from the Computer Science Department at the University of California at Berkeley. She is a member of the national academy of science, the national academy of engineering and the American academy of arts and science. She received the ACM Grace Murray Hopper award and the Gödel award for the outstanding papers in theoretical computer science in 1993 and 2001, for her work pioneering interactive zero-knowledge proofs and the connection between the complexity of approximation problems and probabilistically checkable proofs. She is also known for her contributions to property testing and using methods from the theory of elliptic curves for primarily testing."
STOC,2009,169-178,Craig Gentry,Fully homomorphic encryption using ideal lattices.,https://doi.org/10.1145/1536414.1536440,"We propose a fully homomorphic encryption scheme -- i.e., a scheme that allows one to evaluate circuits over encrypted data without being able to decrypt. Our solution comes in three steps. First, we provide a general result -- that, to construct an encryption scheme that permits evaluation of arbitrary circuits, it suffices to construct an encryption scheme that can evaluate (slightly augmented versions of) its own decryption circuit; we call a scheme that can evaluate its (augmented) decryption circuit bootstrappable. Next, we describe a public key encryption scheme using ideal lattices that is almost bootstrappable. Lattice-based cryptosystems typically have decryption algorithms with low circuit complexity, often dominated by an inner product computation that is in NC1. Also, ideal lattices provide both additive and multiplicative homomorphisms (modulo a public-key ideal in a polynomial ring that is represented as a lattice), as needed to evaluate general circuits. Unfortunately, our initial scheme is not quite bootstrappable -- i.e., the depth that the scheme can correctly evaluate can be logarithmic in the lattice dimension, just like the depth of the decryption circuit, but the latter is greater than the former. In the final step, we show how to modify the scheme to reduce the depth of the decryption circuit, and thereby obtain a bootstrappable encryption scheme, without reducing the depth that the scheme can evaluate. Abstractly, we accomplish this by enabling the encrypter to start the decryption process, leaving less work for the decrypter, much like the server leaves less work for the decrypter in a server-aided cryptosystem."
STOC,2009,179-188,"Huijia Lin, Rafael Pass, Muthuramakrishnan Venkitasubramaniam",A unified framework for concurrent security: universal composability from stand-alone non-malleability.,https://doi.org/10.1145/1536414.1536441,"We present a unified framework for obtaining Universally Composable (UC) protocols by relying on stand-alone secure non-malleable commitments. Essentially all results on concurrent secure computation--both in relaxed models (e.g., quasi-polynomial time simulation), or with trusted set-up assumptions (e.g., the CRS model, the imperfect CRS model, or the timing model)--are obtained as special cases of our framework. This not only leads to conceptually simpler solutions, but also to improved set-up assumptions, round-complexity, and computational assumptions. Additionally, this framework allows us to consider new relaxed models of security: we show that UC security where the adversary is a uniform PPT but the simulator is allowed to be a non-uniform PPT (i.e., essentially, traditional UC security, but with a non-uniform reduction) is possible without any trusted set-up. This gives the first results on concurrent secure computation without set-up, which can be used for securely computing ""computationally-sensitive"" functionalities (e.g., data-base queries, ""proof of work""-protocols, or playing bridge on the Internet)."
STOC,2009,189-198,"Huijia Lin, Rafael Pass",Non-malleability amplification.,https://doi.org/10.1145/1536414.1536442,"We show a technique for amplifying commitment schemes that are non-malleable with respect to identities of length t, into ones that are non-malleable with respect to identities of length Ω(2t), while only incurring a constant overhead in round-complexity. As a result we obtain a construction of O(1)log* n-round (i.e., ""essentially"" constant-round) non-malleable commitments from any one-way function, and using a black-box proof of security."
STOC,2009,199-204,"Alexandr Andoni, Krzysztof Onak",Approximating edit distance in near-linear time.,https://doi.org/10.1145/1536414.1536444,"We show how to compute the edit distance between two strings of length n up to a factor of 2(O-tilde(sqrt(log n))) in n(1+o(1)) time. This is the first sub-polynomial approximation algorithm for this problem that runs in near-linear time, improving on the state-of-the-art n(1/3+o(1)) approximation. Previously, approximation of 2Õ √log n) was known only for embedding edit distance into l1, and it is not known if that embedding can be computed in less than a quadratic time."
STOC,2009,205-214,"Kenneth L. Clarkson, David P. Woodruff",Numerical linear algebra in the streaming model.,https://doi.org/10.1145/1536414.1536445,"We give near-optimal space bounds in the streaming model for linear algebra problems that include estimation of matrix products, linear regression, low-rank approximation, and approximation of matrix rank. In the streaming model, sketches of input matrices are maintained under updates of matrix entries; we prove results for turnstile updates, given in an arbitrary order. We give the first lower bounds known for the space needed by the sketches, for a given estimation error ε. We sharpen prior upper bounds, with respect to combinations of space, failure probability, and number of passes. The sketch we use for matrix A is simply STA, where S is a sign matrix. Our results include the following upper and lower bounds on the bits of space needed for 1-pass algorithms. Here A is an n x d matrix, B is an n x d' matrix, and c := d+d'. These results are given for fixed failure probability; for failure probability δ>0, the upper bounds require a factor of log(1/δ) more space. We assume the inputs have integer entries specified by O(log(nc)) bits, or O(log(nd)) bits. (Matrix Product) Output matrix C with F(ATB-C) ≤ ε F(A) F(B). We show that Θ(cε-2log(nc)) space is needed. (Linear Regression) For d'=1, so that B is a vector b, find x so that Ax-b ≤ (1+ε) minx' ∈ Reald Ax'-b. We show that Θ(d2ε-1 log(nd)) space is needed. (Rank-k Approximation) Find matrix tAk of rank no more than k, so that F(A-tAk) ≤ (1+ε) F{A-Ak}, where Ak is the best rank-k approximation to A. Our lower bound is Ω(kε-1(n+d)log(nd)) space, and we give a one-pass algorithm matching this when A is given row-wise or column-wise. For general updates, we give a one-pass algorithm needing [O(kε-2(n + d/ε2)log(nd))] space. We also give upper and lower bounds for algorithms using multiple passes, and a sketching analog of the CUR decomposition."
STOC,2009,215-224,"Nam H. Nguyen, Thong T. Do, Trac D. Tran",A fast and efficient algorithm for low-rank approximation of a matrix.,https://doi.org/10.1145/1536414.1536446,"The low-rank matrix approximation problem involves finding of a rank k version of a m x n matrix A, labeled Ak, such that Ak is as ""close"" as possible to the best SVD approximation version of A at the same rank level. Previous approaches approximate matrix A by non-uniformly adaptive sampling some columns (or rows) of A, hoping that this subset of columns contain enough information about A. The sub-matrix is then used for the approximation process. However, these approaches are often computationally intensive due to the complexity in the adaptive sampling. In this paper, we propose a fast and efficient algorithm which at first pre-processes matrix A in order to spread out information (energy) of every columns (or rows) of A, then randomly selects some of its columns (or rows). Finally, a rank-k approximation is generated from the row space of these selected sets. The preprocessing step is performed by uniformly randomizing signs of entries of A and transforming all columns of A by an orthonormal matrix F with existing fast implementation (e.g. Hadamard, FFT, DCT...). Our main contribution is summarized as follows. 1) We show that by uniformly selecting at random d rows of the preprocessed matrix with d = ( 1/η k max {log k, log 1/β} ), we guarantee the relative Frobenius norm error approximation: (1 + η) norm{A - Ak}F with probability at least 1 - 5β. 2) With d above, we establish a spectral norm error approximation: (2 + √2m/d) norm{A - Ak}2 with probability at least 1 - 2β. 3) The algorithm requires 2 passes over the data and runs in time (mn log d + (m+n) d2) which, as far as the best of our knowledge, is the fastest algorithm when the matrix A is dense. 4) As a bonus, applying this framework to the well-known least square approximation problem min norm{A x - b} where A ∈ Rm x r, we show that by randomly choosing d = (1/η γ r log m), the approximation solution is proportional to the optimal one with a factor of η and with extremely high probability, (1 - 6 m-γ), say."
STOC,2009,225-234,"Yuichi Yoshida, Masaki Yamamoto 0001, Hiro Ito",An improved constant-time approximation algorithm for maximum matchings.,https://doi.org/10.1145/1536414.1536447,"This paper studies approximation algorithms for problems on degree-bounded graphs. Let n and d be the number of vertices and the degree bound, respectively. This paper presents an algorithm to approximate the size of some maximal independent set with additive error ε n whose running time is O(d2). Using this algorithm, it also shows that there are approximation algorithms for many other problems, e.g., the maximum matching problem, the minimum vertex cover problem, and the minimum set cover problem, that run exponentially faster than existing algorithms with respect to d and 1/ε. Its approximation algorithm for the maximum matching problem can be transformed to a testing algorithm for the property of having a perfect matching with two-sided error. On the contrary, it also shows that every one-sided error tester for the property requires at least Ω(n) queries."
STOC,2009,235-244,"Reid Andersen, Yuval Peres",Finding sparse cuts locally using evolving sets.,https://doi.org/10.1145/1536414.1536449,"A local graph partitioning algorithm finds a set of vertices with small conductance (i.e.~a sparse cut) by adaptively exploring a large graph G, starting from a specified vertex. For the algorithm to be local, its complexity must be bounded in terms of the size of the set it outputs, with at most a weak dependence on n, the number of vertices in G. Previous local partitioning algorithms find sparse cuts using random walks and personalized PageRank. In this paper, we introduce a randomized local partitioning algorithm that finds a sparse cut by simulating the volume-biased evolving set process, which is a Markov chain on sets of vertices. We prove that for any set of vertices A that has conductance at most φ, and for at least half of the starting vertices in A, our algorithm will output (with probability at least half) a set of conductance O(φ1/2 log1/2 n). The complexity of a local partitioning algorithm is measured by its work/volume ratio, which is the ratio between the computational complexity of the algorithm on a given run, and the volume of the set output. We prove that for our algorithm, the expected value of the work/volume ratio is polylognoparen(φ-1/2). The best previous local partitioning algorithm, due to Andersen, Chung, and Lang, has the same approximation guarantee but a larger work/volume ratio of polylognoparen(φ-1). As an application of our local partitioning algorithm, we construct a fast algorithm for finding balanced cuts. The resulting algorithm takes as input a graph and a fixed value of φ, has complexity polylog{m+nφ-1/2), and returns a cut with conductance O(φ1/2 log1/2 n) and volume at least vφ/2, where vφ is the volume of the largest set in the graph with conductance at most φ."
STOC,2009,245-254,"James R. Lee, Anastasios Sidiropoulos",On the geometry of graphs with a forbidden minor.,https://doi.org/10.1145/1536414.1536450,"We study the topological simplification of graphs via random embeddings, leading ultimately to a reduction of the Gupta-Newman-Rabinovich-Sinclair (GNRS) L1 embedding conjecture to a pair of manifestly simpler conjectures. The GNRS conjecture characterizes all graphs that have an O(1)-approximate multi-commodity max-flow/min-cut theorem. In particular, its resolution would imply a constant factor approximation for the general Sparsest Cut problem in every family of graphs which forbids some minor. In the course of our study, we prove a number of results of independent interest."
STOC,2009,255-262,"Joshua D. Batson, Daniel A. Spielman, Nikhil Srivastava",Twice-ramanujan sparsifiers.,https://doi.org/10.1145/1536414.1536451,"We prove that every graph has a spectral sparsifier with a number of edges linear in its number of vertices. As linear-sized spectral sparsifiers of complete graphs are expanders, our sparsifiers of arbitrary graphs can be viewed as generalizations of expander graphs. In particular, we prove that for every d > 1 and every undirected, weighted graph G = (V,E,w) on n vertices, there exists a weighted graph H=(V,F,~{w}) with at most ⌈d(n-1)⌉ edges such that for every x ∈ RV, [xT LG x ≤ xT LH x ≤ ((d+1+2√d)/(d+1-2√d)) • xT LG x] where LG and LH are the Laplacian matrices of G and H, respectively. Thus, H approximates G spectrally at least as well as a Ramanujan expander with dn/2 edges approximates the complete graph. We give an elementary deterministic polynomial time algorithm for constructing H."
STOC,2009,263-272,Luca Trevisan,Max cut and the smallest eigenvalue.,https://doi.org/10.1145/1536414.1536452,"We describe a new approximation algorithm for Max Cut. Our algorithm runs in ~O(n2) time, where n is the number of vertices, and achieves an approximation ratio of .531. On instances in which an optimal solution cuts a 1-ε fraction of edges, our algorithm finds a solution that cuts a 1-4√ε + 8ε-o(1) fraction of edges. Our main result is a variant of spectral partitioning, which can be implemented in nearly linear time. Given a graph in which the Max Cut optimum is a 1-ε fraction of edges, our spectral partitioning algorithm finds a set S of vertices and a bipartition L,R=S-L of S such that at least a 1-O(√ε) fraction of the edges incident on S have one endpoint in L and one endpoint in R. (This can be seen as an analog of Cheeger's inequality for the smallest eigenvalue of the adjacency matrix of a graph.) Iterating this procedure yields the approximation results stated above. A different, more complicated, variant of spectral partitioning leads to a polynomial time algorithm that cuts a 1/2 + e-Ω(1/ε) fraction of edges in graphs in which the optimum is 1/2 + ε."
STOC,2009,273-282,"Erin W. Chambers, Jeff Erickson 0001, Amir Nayyeri","Homology flows, cohomology cuts.",https://doi.org/10.1145/1536414.1536453,"We describe the first algorithms to compute maximum flows in surface-embedded graphs in near-linear time. Specifically, given an undirected graph embedded on an orientable surface of genus g, with two specified vertices s and t, we can compute a maximum (s,t)-flow in O(g7 n log2 n log2 C) time for integer capacities that sum to C, or in (g log n)O(g) n time for real capacities. Except for the special case of planar graphs, for which an O(n log n)-time algorithm has been known for 20 years, the best previous time bounds for maximum flows in surface-embedded graphs follow from algorithms for general sparse graphs. Our key insight is to optimize the relative homology class of the flow, rather than directly optimizing the flow itself. A dual formulation of our algorithm computes the minimum-cost cycle or circulation in a given (real or integer) homology class."
STOC,2009,283-292,"Moses Charikar, Konstantin Makarychev, Yury Makarychev",Integrality gaps for Sherali-Adams relaxations.,https://doi.org/10.1145/1536414.1536455,"We prove strong lower bounds on integrality gaps of Sherali-Adams relaxations for MAX CUT, Vertex Cover, Sparsest Cut and other problems. Our constructions show gaps for Sherali-Adams relaxations that survive nδ rounds of lift and project. For MAX CUT and Vertex Cover, these show that even nδ rounds of Sherali-Adams do not yield a better than 2-ε approximation. The main combinatorial challenge in constructing these gap examples is the construction of a fractional solution that is far from an integer solution, but yet admits consistent distributions of local solutions for all small subsets of variables. Satisfying this consistency requirement is one of the major hurdles to constructing Sherali-Adams gap examples. We present a modular recipe for achieving this, building on previous work on metrics with a local-global structure. We develop a conceptually simple geometric approach to constructing Sherali-Adams gap examples via constructions of consistent local SDP solutions. This geometric approach is surprisingly versatile. We construct Sherali-Adams gap examples for Unique Games based on our construction for MAX CUT together with a parallel repetition like procedure. This in turn allows us to obtain Sherali-Adams gap examples for any problem that has a Unique Games based hardness result (with some additional conditions on the reduction from Unique Games). Using this, we construct 2-ε gap examples for Maximum Acyclic Subgraph that rules out any family of linear constraints with support at most nδ."
STOC,2009,293-302,"Claire Mathieu, Alistair Sinclair",Sherali-adams relaxations of the matching polytope.,https://doi.org/10.1145/1536414.1536456,"We study the Sherali-Adams lift-and-project hierarchy of linear programming relaxations of the matching polytope. Our main result is an asymptotically tight expression 1+1/k for the integrality gap after k rounds of this hierarchy. The result is derived by a detailed analysis of the LP after k rounds applied to the complete graph K_{2d+1}. We give an explicit recurrence for the value of this LP, and hence show that its gap exhibits a ""phase transition,"" dropping from close to its maximum value 1+1/2d to close to 1 around the threshold k=2d-Θ(√d). We also show that the rank of the matching polytope (i.e., the number of Sherali-Adams rounds until the integer polytope is reached) is exactly 2d-1."
STOC,2009,303-312,Madhur Tulsiani,CSP gaps and reductions in the lasserre hierarchy.,https://doi.org/10.1145/1536414.1536457,"We study integrality gaps for SDP relaxations of constraint satisfaction problems, in the hierarchy of SDPs defined by Lasserre. Schoenebeck [23] recently showed the first integrality gaps for these problems, showing that for MAX k-XOR, the ratio of the SDP optimum to the integer optimum may be as large as 2 even after Ω(n) rounds of the Lasserre hierarchy. We show that for the general MAX k-CSP problem, this ratio can be as large as 2k/2k - ε when the alphabet is binary and qk/q(q-1)k - ε when the alphabet size a prime q, even after Ω(n) rounds of the Lasserre hierarchy. We also explore how to translate gaps for CSP into integrality gaps for other problems using reductions, and establish SDP gaps for Maximum Independent Set, Approximate Graph Coloring, Chromatic Number and Minimum Vertex Cover. For Independent Set and Chromatic Number, we show integrality gaps of n/2O(√(log n log log n)) even after 2Ω(√(log n log log n)) rounds. In case of Approximate Graph Coloring, for every constant l, we construct graphs with chromatic number Ω(2l/2/l2), which admit a vector l-coloring for the SDP obtained by Ω(n) rounds. For Vertex Cover, we show an integrality gap of 1.36 for Ω(nδ) rounds, for a small constant δ. The results for CSPs provide the first examples of Ω(n) round integrality gaps matching hardness results known only under the Unique Games Conjecture. This and some additional properties of the integrality gap instance, allow for gaps for in case of Independent Set and Chromatic Number which are stronger than the NP-hardness results known even under the Unique Games Conjecture."
STOC,2009,313-322,"Marek Karpinski, Warren Schudy",Linear time approximation schemes for the Gale-Berlekamp game and related minimization problems.,https://doi.org/10.1145/1536414.1536458,"We design a linear time approximation scheme for the Gale-Berlekamp Switching Game and generalize it to a wider class of dense fragile minimization problems including the Nearest Codeword Problem (NCP) and Unique Games Problem. Further applications include, among other things, finding a constrained form of matrix rigidity and maximum likelihood decoding of an error correcting code. As another application of our method we give the first linear time approximation schemes for correlation clustering with a fixed number of clusters and its hierarchical generalization. Our results depend on a new technique for dealing with small objective function values of optimization problems and could be of independent interest."
STOC,2009,323-332,"Jon Lee 0001, Vahab S. Mirrokni, Viswanath Nagarajan, Maxim Sviridenko",Non-monotone submodular maximization under matroid and knapsack constraints.,https://doi.org/10.1145/1536414.1536459,"Submodular function maximization is a central problem in combinatorial optimization, generalizing many important problems including Max Cut in directed/undirected graphs and in hypergraphs, certain constraint satisfaction problems, maximum entropy sampling, and maximum facility location problems. Unlike submodular minimization, submodular maximization is NP-hard. In this paper, we give the first constant-factor approximation algorithm for maximizing any non-negative submodular function subject to multiple matroid or knapsack constraints. We emphasize that our results are for non-monotone submodular functions. In particular, for any constant k, we present a (1/k+2+1/k+ε)-approximation for the submodular maximization problem under k matroid constraints, and a (1/5-ε)-approximation algorithm for this problem subject to k knapsack constraints (ε>0 is any constant). We improve the approximation guarantee of our algorithm to 1/k+1+{1/k-1}+ε for k≥2 partition matroid constraints. This idea also gives a ({1/k+ε)-approximation for maximizing a monotone submodular function subject to k≥2 partition matroids, which improves over the previously best known guarantee of 1/k+1."
