booktitle,year,pages,author,title,ee,abstract
FOCS,2016,365-374,"Zachary Friggstad, Mohsen Rezapour, Mohammad R. Salavatipour",Local Search Yields a PTAS for k-Means in Doubling Metrics.,https://doi.org/10.1109/FOCS.2016.47,"The most well known and ubiquitous clustering problem encountered in nearly every branch of science is undoubtedly k-MEANS: given a set of data points and a parameter k, select k centres and partition the data points into k clusters around these centres so that the sum of squares of distances of the points to their cluster centre is minimized. Typically these data points lie in Euclidean space R d for some d ≥ 2. k-MEANS and the first algorithms for it were introduced in the 1950's. Over the last six decades, hundreds of papers have studied this problem and different algorithms have been proposed for it. The most commonly used algorithm in practice is known as Lloyd-Forgy, which is also referred to as ""the"" k-MEANS algorithm, and various extensions of it often work very well in practice. However, they may produce solutions whose cost is arbitrarily large compared to the optimum solution. Kanungo et al. [2004] analyzed a very simple local search heuristic to get a polynomial-time algorithm with approximation ratio 9 + ε for any fixed ε > 0 for k-Umeans in Euclidean space. Finding an algorithm with a better worst-case approximation guarantee has remained one of the biggest open questions in this area, in particular whether one can get a true PTAS for fixed dimension Euclidean space. We settle this problem by showing that a simple local search algorithm provides a PTAS for k-MEANS for R d for any fixed d. More precisely, for any error parameter ε > 0, the local search algorithm that considers swaps of up to ρ = d O(d) · ε -O(d/ε) centres at a time will produce a solution using exactly k centres whose cost is at most a (1+ε)-factor greater than the optimum solution. Our analysis extends very easily to the more general settings where we want to minimize the sum of q'th powers of the distances between data points and their cluster centres (instead of sum of squares of distances as in k-MEANS) for any fixed q ≥ 1 and where the metric may not be Euclidean but still has fixed doubling dimension."
FOCS,2016,375-384,"Karl Bringmann, Fabrizio Grandoni 0001, Barna Saha, Virginia Vassilevska Williams",Truly Sub-cubic Algorithms for Language Edit Distance and RNA-Folding via Fast Bounded-Difference Min-Plus Product.,https://doi.org/10.1109/FOCS.2016.48,"It is a major open problem whether the -product of two  matrices has a truly subcubic (i.e.,  for ) time algorithm; in particular, since it is equivalent to the famous all-pairs-shortest-paths problem (APSP) in -vertex graphs. Some restrictions of the -product to special types of matrices are known to admit truly subcubic algorithms, each giving rise to a special case of APSP that can be solved faster. In this paper we consider a new, different, and powerful restriction in which all matrix entries are integers and one matrix can be arbitrary, as long as the other matrix has “bounded differences” in either its columns or rows, i.e., any two consecutive entries differ by only a small amount. We obtain the first truly subcubic algorithm for this bounded-difference -product (answering an open problem of Chan and Lewenstein). Our new algorithm, combined with a strengthening of an approach of Valiant for solving context-free grammar parsing with matrix multiplication, yields the first truly subcubic algorithms for the following problems: language edit distance (a major problem in the parsing community), RNA folding (a major problem in bioinformatics), and optimum stack generation (answering an open problem of Tarjan)."
FOCS,2016,385,Noam Nisan,Knuth Prize Lecture: Complexity of Communication in Markets.,https://doi.org/10.1109/FOCS.2016.97,Summary form only given. A classical point of view in Economic Theory is that prices in markets serve as a communication mechanism between the participants (buyers and sellers) in the market. I will analyze the communication complexity (in the standard sense used in Theoretical Computer Science) required for obtaining efficiency and equilibrium in several scenarios of markets of indivisible goods.
FOCS,2016,386-395,"Peter Bürgisser, Christian Ikenmeyer, Greta Panova",No Occurrence Obstructions in Geometric Complexity Theory.,https://doi.org/10.1109/FOCS.2016.49,"The permanent versus determinant conjecture is a major problem in complexity theory that is equivalent to the separation of the complexity classes  and . In 2001 Mulmuley and Sohoni suggested studying a strengthened version of this conjecture over complex numbers that amounts to separating the orbit closures of the determinant and padded permanent polynomials. In that paper it was also proposed to separate these orbit closures by exhibiting occurrence obstructions, which are irreducible representations of , which occur in one coordinate ring of the orbit closure, but not in the other. We prove that this approach is impossible. However, we do not rule out the general approach to the permanent versus determinant problem via multiplicity obstructions as proposed by Mulmuley and Sohoni in 2001. References"
FOCS,2016,396-405,"Christian Ikenmeyer, Greta Panova",Rectangular Kronecker Coefficients and Plethysms in Geometric Complexity Theory.,https://doi.org/10.1109/FOCS.2016.50,"The geometric complexity theory program is an approach to separate algebraic complexity classes, more precisely to show the superpolynomial growth of the determinantal complexity dc(per m ) of the permanent polynomial. Mulmuley and Sohoni showed that the vanishing behaviour of rectangular Kronecker coefficients could in principle be used to show some lower bounds on dc(per m ) and they conjectured that superpolynomial lower bounds on dc(per m ) could be shown in this way. In this paper we disprove this conjecture by Mulmuley and Sohoni, i.e., we prove that the vanishing of rectangular Kronecker coefficients cannot be used to prove superpolynomial lower bounds on dc(per m )."
FOCS,2016,406-415,"Robert Robere, Toniann Pitassi, Benjamin Rossman, Stephen A. Cook",Exponential Lower Bounds for Monotone Span Programs.,https://doi.org/10.1109/FOCS.2016.51,"Monotone span programs are a linear-algebraic model of computation which were introduced by Karchmer and Wigderson in 1993 [1]. They are known to be equivalent to linear secret sharing schemes, and have various applications in complexity theory and cryptography. Lower bounds for monotone span programs have been difficult to obtain because they use non-monotone operations to compute monotone functions, in fact, the best known lower bounds are quasipolynomial for a function in (nonmonotone) P [2]. A fundamental open problem is to prove exponential lower bounds on monotone span program size for any explicit function. We resolve this open problem by giving exponential lower bounds on monotone span program size for a function in monotone P. This also implies the first exponential lower bounds for linear secret sharing schemes. Our result is obtained by proving exponential lower bounds using Razborov's rank method [3], a measure that is strong enough to prove lower bounds for many monotone models. As corollaries we obtain new proofs of exponential lower bounds for monotone formula size, monotone switching network size, and the first lower bounds for monotone comparator circuit size for a function in monotone P. We also obtain new polynomial degree lower bounds for Nullstellensatz refutations using an interpolation theorem of Pudlak and Sgall [4]. Finally, we obtain quasipolynomial lower bounds on the rank measure for the st-connectivity function, implying tight bounds for st-connectivity in all of the computational models mentioned above."
FOCS,2016,416-427,"Haris Aziz 0001, Simon Mackenzie",A Discrete and Bounded Envy-Free Cake Cutting Protocol for Any Number of Agents.,https://doi.org/10.1109/FOCS.2016.52,"We consider the well-studied cake cutting problem in which the goal is to find an envy-free allocation based on queries from n agents. The problem has received attention in computer science, mathematics, and economics. It has been a major open problem whether there exists a discrete and bounded envy-free protocol. We resolve the problem by proposing a discrete and bounded envy-free protocol for any number of agents. The maximum number of queries required by the protocol is nnnnnn. Even if we do not run our protocol to completion, it can find in at most n n+1  queries an envy-free partial allocation of the cake in which each agent gets at least 1/n of the value of the whole cake."
FOCS,2016,428-437,"Boaz Barak, Samuel B. Hopkins, Jonathan A. Kelner, Pravesh Kothari, Ankur Moitra, Aaron Potechin",A Nearly Tight Sum-of-Squares Lower Bound for the Planted Clique Problem.,https://doi.org/10.1109/FOCS.2016.53,"We prove that with high probability over the choice of a random graph  from the Erdo?s--Re?nyi distribution , the -time degree  sum-of-squares (SOS) semidefinite programming relaxation for the clique problem will give a value of at least  for some constant .  This yields a nearly tight  bound on the value of this program for any degree . Moreover, we introduce a new framework that we call pseudocalibration to construct SOS lower bounds. This framework is  inspired by taking a computational analogue of Bayesian probability theory. It yields a general recipe for constructing  good pseudodistributions (i.e., dual certificates for the SOS semidefinite program)  and sheds further light on the ways in which this hierarchy differs from others."
FOCS,2016,438-446,"Tengyu Ma 0001, Jonathan Shi, David Steurer",Polynomial-Time Tensor Decompositions with Sum-of-Squares.,https://doi.org/10.1109/FOCS.2016.54,"We give new algorithms based on the sum-of-squares method for tensor decomposition. Our results improve the best known running times from quasi-polynomial to polynomial for several problems, including decomposing random overcomplete 3-tensors and learning overcomplete dictionaries with constant relative sparsity. We also give the first robust analysis for decomposing overcomplete 4-tensors in the smoothed analysis model. A key ingredient of our analysis is to establish small spectral gaps in moment matrices derived from solutions to sum-of-squares relaxations. To enable this analysis we augment sum-of-squaresrelaxations with spectral analogs of maximum entropy constraints."
FOCS,2016,447-456,"Daniel Dadush, Oded Regev 0001",Towards Strong Reverse Minkowski-Type Inequalities for Lattices.,https://doi.org/10.1109/FOCS.2016.55,"We present a natural reverse Minkowski-type inequality for lattices, which gives upper bounds on the number of lattice points in a Euclidean ball in terms of sublattice determinants, and conjecture its optimal form. The conjecture exhibits a surprising wealth of connections to various areas in mathematics and computer science, including a conjecture motivated by integer programming by Kannan and Lovasz (Annals of Math. 1988), a question from additive combinatorics asked by Green, a question on Brownian motions asked by Saloff-Coste (Colloq. Math. 2010), a theorem by Milman and Pisier from convex geometry (Ann. Probab. 1987), worst-case to average-case reductions in lattice-based cryptography, and more. We present these connections, provide evidence for the conjecture, and discuss possible approaches towards a proof. Our main technical contribution is in proving that our conjecture implies the l2 case of the Kannan and Lovasz conjecture. The proof relies on a novel convex relaxation for the covering radius, and a rounding procedure based on ""uncrossing"" lattice subspaces."
FOCS,2016,457-466,"Arturs Backurs, Piotr Indyk",Which Regular Expression Patterns Are Hard to Match?,https://doi.org/10.1109/FOCS.2016.56,"Regular expressions constitute a fundamental notion in formal language theory and are frequently used in computer science to define search patterns. In particular, regular expression matching and membership testing are widely used computational primitives, employed in many programming languages and text processing utilities. A classic algorithm for these problems constructs and simulates a non-deterministic finite automaton corresponding to the expression, resulting in an O(m n) running time (where m is the length of the pattern and n is the length of the text). This running time can be improved slightly (by a polylogarithmic factor), but no significantly faster solutions are known. At the same time, much faster algorithms exist for various special cases of regular expressions, including dictionary matching, wildcard matching, subset matching, word break problem etc. In this paper, we show that the complexity of regular expression matching can be characterized based on its depth (when interpreted as a formula). Our results hold for expressions involving concatenation, OR, Kleene star and Kleene plus. For regular expressions of depth two (involving any combination of the above operators), we show the following dichotomy: matching and membership testing can be solved in near-linear time, except for ""concatenations of stars"", which cannot be solved in strongly sub-quadratic time assuming the Strong Exponential Time Hypothesis (SETH). For regular expressions of depth three the picture is more complex. Nevertheless, we show that all problems can either be solved in strongly sub-quadratic time, or cannot be solved in strongly sub-quadratic time assuming SETH. An intriguing special case of membership testing involves regular expressions of the form ""a star of an OR of concatenations"", e.g., [a|ab|bc]*. This corresponds to the so-called word break problem, for which a dynamic programming algorithm with a runtime of (roughly) O(n √m) is known. We show that the latter bound is not tight and improve the runtime to O(n m 0.44... )."
FOCS,2016,467-476,"Josh Alman, Timothy M. Chan, R. Ryan Williams",Polynomial Representations of Threshold Functions and Algorithmic Applications.,https://doi.org/10.1109/FOCS.2016.57,"We design new polynomials for representing threshold functions in three different regimes: probabilistic polynomials of low degree, which need far less randomness than previous constructions, polynomial threshold functions (PTFs) with ""nice"" threshold behavior and degree almost as low as the probabilistic polynomials, and a new notion of probabilistic PTFs where we combine the above techniques to achieve even lower degree with similar ""nice"" threshold behavior. Utilizing these polynomial constructions, we design faster algorithms for a variety of problems: · Offline Hamming Nearest (and Furthest) Neighbors: Given n red and n blue points in d-dimensional Hamming space for d = c log n, we can find an (exact) nearest (or furthest) blue neighbor for every red point in randomized time n 2-1 /O(√clog 2/3  c) or deterministic time n 2-1/O(c log2 c) . These improve on a randomized n 2-1/O(c log2 c)  bound by Alman and Williams (FOCS'15), and also lead to faster MAX-SAT algorithms for sparse CNFs. · Offline Approximate Nearest (and Furthest) Neighbors: Given n red and n blue points in d-dimensional ? 1  or Euclidean space, we can find a (1+ε)-approximate nearest (or furthest) blue neighbor for each red point in randomized time near dn+n 2-Ω(ε1/3/log(1/ε)) . This improves on an algorithm by Valiant (FOCS'12) with randomized time near dn+n 2-Ω(√ε) , which in turn improves previous methods based on locality-sensitive hashing. · SAT Algorithms and Lower Bounds for Circuits With Linear Threshold Functions: We give a satisfiability algorithm for AC 0 [m] o LTF LTF circuits with a subquadratic number of LTF gates on the bottom layer, and a subexponential number of gates on the other layers, that runs in deterministic 2 n-n ε  time. This strictly generalizes a SAT algorithm for ACC 0  oLTF circuits of subexponential size by Williams (STOC'14) and also implies new circuit lower bounds for threshold circuits, improving a recent gate lower bound of Kane and Williams (STOC'16). We also give a randomized 2 n-n ε -time SAT algorithm for subexponential-size MAJ o AC 0  oLTF o AC 0  oLTF circuits, where the top MAJ gate and middle LTF gates have O(n 6/5-δ ) fan-in."
FOCS,2016,477-486,"Amir Abboud, S?ren Dahlgaard",Popular Conjectures as a Barrier for Dynamic Planar Graph Algorithms.,https://doi.org/10.1109/FOCS.2016.58,"The dynamic shortest paths problem on planar graphs asks us to preprocess a planar graph G such that we may support insertions and deletions of edges in G as well as distance queries between any two nodes u, v subject to the constraint that the graph remains planar at all times. This problem has been extensively studied in both the theory and experimental communities over the past decades. The best known algorithm performs queries and updates in ?(n2/3) time, based on ideas of a seminal paper by Fakcharoenphol and Rao [FOCS'01]. A (1+ε)-approximation algorithm of Abraham et al. [STOC'12] performs updates and queries in ?(√n) time. An algorithm with a more practical O(polylog(n)) runtime would be a major breakthrough. However, such runtimes are only known for a (1+ε)-approximation in a model where only restricted weight updates are allowed due to Abraham et al. [SODA'16], or for easier problems like connectivity. In this paper, we follow a recent and very active line of work on showing lower bounds for polynomial time problems based on popular conjectures, obtaining the first such results for natural problems in planar graphs. Such results were previously out of reach due to the highly non-planar nature of known reductions and the impossibility of ""planarizing gadgets"". We introduce a new framework which is inspired by techniques from the literatures on distance labelling schemes and on parameterized complexity. Using our framework, we show that no algorithm for dynamic shortest paths or maximum weight bipartite matching in planar graphs can support both updates and queries in amortized O(n1/2-ε) time, for any ε>0, unless the classical all-pairs-shortest-paths problem can be solved in truly subcubic time, which is widely believed to be impossible. We extend these results to obtain strong lower bounds for other related problems as well as for possible trade-offs between query and update time. Interestingly, our lower bounds hold even in very restrictive models where only weight updates are allowed."
FOCS,2016,487-494,"Ryan M. Rogers, Aaron Roth 0001, Adam D. Smith, Om Thakkar 0001","Max-Information, Differential Privacy, and Post-selection Hypothesis Testing.",https://doi.org/10.1109/FOCS.2016.59,"In this paper, we initiate a principled study of how the generalization properties of approximate differential privacy can be used to perform adaptive hypothesis testing, while giving statistically valid p-value corrections. We do this by observing that the guarantees of algorithms with bounded approximate max-information are sufficient to correct the p-values of adaptively chosen hypotheses, and then by proving that algorithms that satisfy (∈,δ)-differential privacy have bounded approximate max information when their inputs are drawn from a product distribution. This substantially extends the known connection between differential privacy and max-information, which previously was only known to hold for (pure) (∈,0)-differential privacy. It also extends our understanding of max-information as a partially unifying measure controlling the generalization properties of adaptive data analyses. We also show a lower bound, proving that (despite the strong composition properties of max-information), when data is drawn from a product distribution, (∈,δ)-differentially private algorithms can come first in a composition with other algorithms satisfying max-information bounds, but not necessarily second if the composition is required to itself satisfy a nontrivial max-information bound. This, in particular, implies that the connection between (∈,δ)-differential privacy and max-information holds only for inputs drawn from product distributions, unlike the connection between (∈,0)-differential privacy and max-information."
FOCS,2016,495-504,"Sofya Raskhodnikova, Adam D. Smith",Lipschitz Extensions for Node-Private Graph Statistics and the Generalized Exponential Mechanism.,https://doi.org/10.1109/FOCS.2016.60,"Lipschitz extensions were proposed as a tool for designing differentially private algorithms for approximating graph statistics. However, efficiently computable Lipschitz extensions were known only for 1-dimensional functions (that is, functions that output a single real value). We study efficiently computable Lipschitz extensions for multi-dimensional (that is, vector-valued) functions on graphs. We show that, unlike for 1-dimensional functions, Lipschitz extensions of higher-dimensional functions on graphs do not always exist, even with a non-unit stretch. We design Lipschitz extensions with small stretch for the sorted degree list and degree distribution of a graph, viewed as functions from the space of graphs equipped with the node distance into real space equipped with l1. Our extensions are from the space of bounded-degree graphs to the space of arbitrary graphs. The extensions use convex programming and are efficiently computable. We also develop a new tool for employing Lipschitz extensions in differentially private algorithms that operate with no prior knowledge of the graph (and, in particular, no knowledge of the degree bound). Specifically, we generalize the exponential mechanism, a widely used tool in data privacy. The exponential mechanism is given a collection of score functions that map datasets to real values. It returns the name of the function with nearly minimum value on the dataset. Our generalized exponential mechanism provides better accuracy than the standard exponential mechanism when the sensitivity of an optimal score function is much smaller than the maximum sensitivity over all score functions. We use our Lipschitz extensions and the generalized exponential mechanism to design a node differentially private algorithm for approximating the degree distribution of a sensitive graph. Our algorithm is much more accurate than those from previous work. In particular, our algorithm is accurate on all graphs whose degree distributions decay at least as fast as those of ""scale-free"" graphs. Using our methodology, we also obtain more accurate node-private algorithms for 1-dimensional statistics."
FOCS,2016,505-514,"Yijia Chen, Bingkai Lin",The Constant Inapproximability of the Parameterized Dominating Set Problem.,https://doi.org/10.1109/FOCS.2016.61,"A set  of vertices of a graph  is a dominating set if every vertex of  is contained in  or adjacent to some vertex of . The number of vertices in a smallest dominating set of  is denoted by . We prove that, under the assumption  from parameterized complexity, for any constant  and computable function  there is no algorithm which on every input graph  finds a dominating set of size at most  in  time. In other words, any constant approximation of the parameterized dominating set problem is -hard. Furthermore, assuming the exponential time hypothesis (ETH) [R. Impagliazzo and R. Paturi, J. Comput. System Sci., 62 (2001), pp. 367--375], we can even rule out the existence of a  -time algorithm which on every input graph  outputs a dominating set of size at most $\sqrt[3+\varepsilon]{{log}\; (\gamma(G))} \cdot \gamma(G)$ for every . Our hardness reduction is built on the second author's recent -hardness proof of the biclique problem [B. Lin, The parameterized complexity of -Biclique, in Proceedings of the 26th Annual ACM--SIAM Symposium on Discrete Algorithms, SODA 2015 (San Diego, CA), ACM, New York, SIAM, Philadelphia, 2015, pp. 605--615]. This yields, among other things, a proof without the probabilistically checkable proof (PCP) machinery that the classic dominating set problem has no polynomial time constant approximation under ETH."
FOCS,2016,515-524,"Fedor V. Fomin, Daniel Lokshtanov, Dániel Marx, Marcin Pilipczuk, Michal Pilipczuk, Saket Saurabh 0001",Subexponential Parameterized Algorithms for Planar and Apex-Minor-Free Graphs via Low Treewidth Pattern Covering.,https://doi.org/10.1109/FOCS.2016.62,"We prove the following theorem. Given a planar graph G and an integer k, it is possible in polynomial time to randomly sample a subset A of vertices of G with the following properties: 1) A induces a subgraph of G of treewidth O(√(k log k)), and 2) for every connected subgraph H of G on at most k vertices, the probability that A covers the whole vertex set of H is at least (2 O(√k log2 k)  · n O(1))-1 , where n is the number of vertices of G. Together with standard dynamic programming techniques for graphs of bounded treewidth, this result gives a versatile technique for obtaining (randomized) subexponential parameterized algorithms for problems on planar graphs, usually with running time bound 2 O (√(k log 2  k))n O(1) . The technique can be applied to problems expressible as searching for a small, connected pattern with a prescribed property in a large host graph, examples of such problems include DIRECTED k-Path, WEIGHTED k-Path, VERTEX COVER LOCAL SEARCH, and SUBGRAPH ISOMORPHISM, among others. Up to this point, it was open whether these problems can be solved in subexponential parameterized time on planar graphs, because they are not amenable to the classic technique of bidimensionality. Furthermore, all our results hold in fact on any class of graphs that exclude a fixed apex graph as a minor, in particular on graphs embeddable in any fixed surface."
