booktitle,year,pages,author,title,ee,abstract
FOCS,2014,336-343,"Oded Goldreich 0001, Dana Ron",On Learning and Testing Dynamic Environments.,https://doi.org/10.1109/FOCS.2014.43,"We initiate a study of learning and testing dynamic environments, focusing on environments that evolve according to a fixed local rule. The (proper) learning task consists of obtaining the initial configuration of the environment, whereas for nonproper learning it suffices to predict its future values. The testing task consists of checking whether the environment has indeed evolved from some initial configuration according to the known evolution rule. We focus on the temporal aspect of these computational problems, which is reflected in two requirements: (1) it is not possible to “go back to the past” and make a query concerning the environment at time t after having made a query concerning time t′ > t, and (2) only a small portion of the environment is inspected in each time unit. We present several general results, extensive studies of two special cases, and a host of open problems. The general results illustrate the significance of the temporal aspect of the current model (i.e., the difference between the current model and the standard model) as well as the preservation of some relations that hold in the standard model. The two special cases that we study are linear rules of evolution and rules of evolution that represent simple movement of objects. Specifically, we show that evolution according to any linear rule can be tested within a total number of queries that is sublinear in the size of the environment, and that evolution according to a simple one-dimensional movement rule can be tested within a total number of queries that is independent of the size of the environment."
FOCS,2014,344-353,"Yuan Li, Alexander A. Razborov, Benjamin Rossman",On the AC0 Complexity of Subgraph Isomorphism.,https://doi.org/10.1109/FOCS.2014.44,"Let  be a fixed graph (hereafter called a “pattern''), and let  denote the problem of deciding whether a given graph  contains a subgraph isomorphic to . We are interested in -complexity of this problem, determined by the smallest possible exponent  for which  possesses bounded-depth circuits of size . Motivated by the previous research in the area, we also consider its “colorful” version  in which the target graph  is -colored, and the average-case version  under the distribution , where  is the threshold exponent of . Defining  and  analogously to , our main contributions can be summarized as follows: (1)  coincides with the treewidth of the pattern  up to a logarithmic factor. This shows that the previously known upper bound by Alon, Yuster, and Zwick [J. ACM, 42 (1995), pp. 844--856] is almost tight. (2) We give a characterization of  in purely combinatorial terms up to a multiplicative factor of 2. This shows that the lower bound technique of Rossman [Proceedings of the  40th ACM Symposium on Theory of Computing, 2008, pp. 721--730] is essentially tight for any pattern  whatsoever. (3) We prove that if  is a minor of , then  is reducible to  via a linear-size monotone projection. At the same time, we show that there is no monotone projection whatsoever that reduces  to  ( is a path on three vertices,   is a matching with  edges, and “+” stands for the disjoint union). This result strongly suggests that the colorful version of the subgraph isomorphism problem is much better structured and well-behaved than the standard (worst-case, uncolored) one."
FOCS,2014,354-363,Shaddin Dughmi,On the Hardness of Signaling.,https://doi.org/10.1109/FOCS.2014.45,"There has been a recent surge of interest in the role of information in strategic interactions. Much of this work seeks to understand how the realized equilibrium of a game is influenced by uncertainty in the environment and the information available to players in the game. Lurking beneath this literature is a fundamental, yet largely unexplored, algorithmic question: how should a ""market maker"" who is privy to additional information, and equipped with a specified objective, inform the players in the game? This is an informational analogue of the mechanism design question, and views the information structure of a game as a mathematical object to be designed, rather than an exogenous variable. We initiate a complexity-theoretic examination of the design of optimal information structures in general Bayesian games, a task often referred to as signaling. We focus on one of the simplest instantiations of the signaling question: Bayesian zero-sum games, and a principal who must choose an information structure maximizing the equilibrium payoff of one of the players. In this setting, we show that optimal signaling is computationally intractable, and in some cases hard to approximate, assuming that it is hard to recover a planted clique from an Erdos-Renyi random graph. This is despite the fact that equilibria in these games are computable in polynomial time, and therefore suggests that the hardness of optimal signaling is a distinct phenomenon from the hardness of equilibrium computation. Necessitated by the non-local nature of information structures, en-route to our results we prove an ""amplification lemma"" for the planted clique problem which may be of independent interest. Specifically, we show that even if we plant many cliques in an Erdos-Renyi random graph, so much so that most nodes in the graph are in some planted clique, recovering a constant fraction of the planted cliques is no easier than the traditional planted clique problem."
FOCS,2014,364-373,"Mrinal Kumar 0001, Shubhangi Saraf",On the Power of Homogeneous Depth 4 Arithmetic Circuits.,https://doi.org/10.1109/FOCS.2014.46,"We prove exponential lower bounds on the size of homogeneous depth 4 arithmetic circuits computing an explicit polynomial in $VP$. Our results hold for the iterated matrix multiplication polynomial---in particular we show that any homogeneous depth 4 circuit computing the (1,1) entry in the product of $n$ generic matrices of dimension $n^{O(1)}$ must have size $n^{\Omega(\sqrt{n})}$. Our results strengthen previous works in two significant ways: (1) Our lower bounds hold for a polynomial in $VP$.  Prior to our work, Kayal et al. [Proceedings of FOCS, 2014, pp. 61--70] proved an exponential lower bound for homogeneous depth 4 circuits (over fields of characteristic zero) computing a poly in $VNP$. The best known lower bounds for a depth 4 homogeneous circuit computing a poly in $VP$ was the bound of $n^{\Omega(\log n)}$ by Kayal et al. Our exponential lower bounds also give the first exponential separation between general arithmetic circuits and homogeneous depth 4 arithmetic circuits. In particular they imply that the depth reduction results of Koiran [Theoret. Comput. Sci., 448 (2012), pp. 56--65] and Tavenas [Proceedings of MFCS, 2013] are tight even for reductions to general homogeneous depth 4 circuits (without the restriction of bounded bottom fan-in). (2) Our lower bound holds over all fields. The lower bound of Kayal et al. worked only over fields of characteristic zero. Prior to our work, the best lower bound for homogeneous depth 4 circuits over fields of positive characteristic was $n^{\Omega(\log n)}$ [Kayal et al., Proceedings of  FOCS, 2014, pp. 61--70]."
FOCS,2014,374-383,"Ilan Komargodski, Tal Moran, Moni Naor, Rafael Pass, Alon Rosen, Eylon Yogev",One-Way Functions and (Im)Perfect Obfuscation.,https://doi.org/10.1109/FOCS.2014.47,"A program obfuscator takes a program and outputs a ""scrambled"" version of it, where the goal is that the obfuscated program will not reveal much about its structure beyond what is apparent from executing it. There are several ways of formalizing this goal. Specifically, in indistinguishability obfuscation, first defined by Barak et al. (CRYPTO 2001), the requirement is that the results of obfuscating any two functionally equivalent programs (circuits) will be computationally indistinguishable. Recently, a fascinating candidate construction for indistinguishability obfuscation was proposed by Garg et al. (FOCS 2013). This has led to a flurry of discovery of intriguing constructions of primitives and protocols whose existence was not previously known (for instance, fully deniable encryption by Sahai and Waters, STOC 2014). Most of them explicitly rely on additional hardness assumptions, such as one-way functions. Our goal is to get rid of this extra assumption. We cannot argue that indistinguishability obfuscation of all polynomial-time circuits implies the existence of one-way functions, since if P ≠ NP, then program obfuscation (under the indistinguishability notion) is possible. Instead, the ultimate goal is to argue that if P ≠ NP and program obfuscation is possible, then one-way functions exist. Our main result is that if NP ?; io-BPP and there is an efficient (even imperfect) indistinguishability obfuscator, then there are one-way functions. In addition, we show that the existence of an indistinguishability obfuscator implies (unconditionally) the existence of SZK-arguments for NP. This, in turn, provides an alternative version of our main result, based on the assumption of hard-on-the average NP problems. To get some of our results we need obfuscators for simple programs such as 3CNF formulas"
FOCS,2014,384-393,"Bartlomiej Bosek, Dariusz Leniowski, Piotr Sankowski, Anna Zych",Online Bipartite Matching in Offline Time.,https://doi.org/10.1109/FOCS.2014.48,"This paper investigates the problem of maintaining maximum size matchings in incremental bipartite graphs. In this problem a bipartite graph G between n clients and n servers is revealed online. The clients arrive in an arbitrary order and request to be matched to a subset of servers. In our model we allow the clients to switch between servers and want to maximize the matching size between them, i.e., after a client arrives we find an augmenting path from a client to a free server. Our goals in this model are twofold. First, we want to minimize the number of times clients are reallocated between the servers. Second, we want to give fast algorithms that recompute such reallocation. As for the number of changes, we propose a greedy algorithm that chooses an augmenting path π that minimizes the maximum number of times each server in π was used by augmenting paths so far. We show that in this algorithm each server has its client reassigned O(√n) times. This gives an O(n 3/2 ) bound on the total number of changes, what gives a progress towards the main open question risen by Chaudhuri et al. (INFOCOM'09) who asked to prove O(n log n) upper bound. Next, we argue that the same bound holds in the decremental case. Moreover, we show incremental and decremental algorithms that maintain (1 - ε)-approximate matching with total of O(ε -1 n) reallocations, for any ε > 0. Finally, we address the question of how to efficiently compute paths given by this greedy algorithm. We show that by introducing proper amortization we can obtain an incremental algorithm that maintains the maximum size matching in total O(√nm) time. This matches the running time of one of the fastest static maximum matching algorithms that was given by Hopcroft and Karp (SIAM J. Comput '73). We extend our result to decremental case where we give the same total bound on the running time. Additionally, we show O(ε -1 m) time incremental and decremental algorithms that maintain (1 - ε)-approximate matching for any ε > 0. Observe that this bound matches the running time of the fastest approximate static solution as well."
FOCS,2014,394-403,"Mohsen Ghaffari 0001, Bernhard Haeupler",Optimal Error Rates for Interactive Coding II: Efficiency and List Decoding.,https://doi.org/10.1109/FOCS.2014.49,"We study coding schemes for error correction in interactive communications. Such interactive coding schemes simulate any n-round interactive protocol using N rounds over an adversarial channel that corrupts up to ρN transmissions. Important performance measures for a coding scheme are its maximum tolerable error rate ρ, communication complexity N, and computational complexity. We give the first coding scheme for the standard setting which performs optimally in all three measures: Our randomized non-adaptive coding scheme has a near-linear computational complexity and tolerates any error rate δ <; 1/4 with a linear N = Θ(n) communication complexity. This improves over prior results [1]-[4] which each performed well in two of these measures. We also give results for other settings of interest, namely, the first computationally and communication efficient schemes that tolerate ρ <; 2/7 adaptively, ρ <; 1/3 if only one party is required to decode, and ρ <; 1/2 if list decoding is allowed. These are the optimal tolerable error rates for the respective settings. These coding schemes also have near linear computational and communication complexity. These results are obtained via two techniques: We give a general black-box reduction which reduces unique decoding, in various settings, to list decoding. We also show how to boost the computational and communication efficiency of any list decoder to become near linear 1 ."
FOCS,2014,404-413,"Craig Gentry, Shai Halevi, Mariana Raykova 0001, Daniel Wichs",Outsourcing Private RAM Computation.,https://doi.org/10.1109/FOCS.2014.50,"We construct the first schemes that allow a client to privately outsource arbitrary program executions to a remote server while ensuring that: (I) the client's work is small and essentially independent of the complexity of the computation being outsourced, and (II) the server's work is only proportional to the run-time of the computation on a random access machine (RAM), rather than its potentially much larger circuit size. Furthermore, our solutions are non-interactive and have the structure of reusable garbled RAM programs, addressing an open question of Lu and Ostrovsky (Eurocrypt 2013). We also construct schemes for an augmented variant of the above scenario, where the client can initially outsource a large private and persistent database to the server, and later outsource arbitrary program executions with read/write access to this database. Our solutions are built from non-reusable garbled RAM in conjunction with new types of reusable garbled circuits that are more efficient than prior solutions but only satisfy weaker security. For the basic setting without a persistent database, we can instantiate the required type of reusable garbled circuits from indistinguishability obfuscation or from functional encryption for circuits as a black-box. For the more complex setting with a persistent database, we can instantiate the required type of reusable garbled circuits using stronger notions of obfuscation. Our basic solution also requires the client to perform a one-time pre-processing step to garble a program at the cost of its RAM run-time, and we can avoid this cost using stronger notions of obfuscation. It remains an open problem to instantiate these new types of reusable garbled circuits under weaker assumptions, possibly avoiding obfuscation altogether. We show several simple extensions of our results and techniques to achieve: efficiency proportional to the input-specific RAM run-time, verifiability of outsourced RAM computation, functional encryption for RAMs, and a candidate obfuscation for RAMs."
FOCS,2014,414-423,Dana Moshkovitz,Parallel Repetition from Fortification.,https://doi.org/10.1109/FOCS.2014.51,"The Parallel Repetition Theorem upper-bounds the value of a repeated (tensored) two prover game in terms of the value of the base game and the number of repetitions. In this work we give a simple transformation on games -- ""fortification"" -- and show that for fortified games, the value of the repeated game decreases perfectly exponentially with the number of repetitions, up to an arbitrarily small additive error. Our proof is combinatorial and short. As corollaries, we obtain: (1) Starting from a PCP Theorem with soundness error bounded away from 1, we get a PCP with arbitrarily small constant soundness error. In particular, starting with the combinatorial PCP of Dinur, we get a combinatorial PCP with low error. The latter can be used for hardness of approximation as in the work of H?stad. (2) Starting from the work of the author and Raz, we get a projection PCP theorem with the smallest soundness error known today. The theorem yields nearly a quadratic improvement in the size compared to previous work. We then discuss the problem of derandomizing parallel repetition, and the limitations of the fortification idea in this setting. We point out a connection between the problem of derandomizing parallel repetition and the problem of composition. This connection could shed light on the so-called Projection Games Conjecture, which asks for projection PCP with minimal error."
FOCS,2014,424-433,"Yin Tat Lee, Aaron Sidford",Path Finding Methods for Linear Programming: Solving Linear Programs in ?(vrank) Iterations and Faster Algorithms for Maximum Flow.,https://doi.org/10.1109/FOCS.2014.52,"In this paper, we present a new algorithm for '/ solving linear programs that requires only ?(√rank(A)L) iterations where A is the constraint matrix of a linear program with m constraints, n variables, and bit complexity L. Each iteration of our method consists of solving ?(1) linear systems and additional nearly linear time computation. Our method improves upon the previous best iteration bounds by factor Ω?((m/rank (A))) 1/4 ) of for methods with polynomial time computable iterations and by Ω?((m/rank (A)) 1/2 ) for methods which solve at most ?(1) linear systems in each iteration each achieved over 20 years ago. Applying our techniques to the linear program formulation of maximum flow yields an ?(|E| √|V| log 2  U) time algorithm for solving the maximum flow problem on directed graphs with |E| edges, |V| vertices, and capacity ratio U. This improves upon the previous fastest running time of O(|E| min{|E| 1/2 , |V| 2/3 } log (|V| 2 /|E|) log(U)) achieved over 15 years ago by Goldberg and Rao and improves upon the previous best running times for solving dense directed unit capacity graphs of ?(|E| min{|E| 1/2 , |V| 2/3 }) achieved by Even and Tarjan over 35 years ago and a running time of ?(|E| 10/7 ) achieved recently by Madry."
FOCS,2014,434-443,"Amir Abboud, Virginia Vassilevska Williams",Popular Conjectures Imply Strong Lower Bounds for Dynamic Problems.,https://doi.org/10.1109/FOCS.2014.53,"We consider several well-studied problems in dynamic algorithms and prove that sufficient progress on any of them would imply a breakthrough on one of five major open problems in the theory of algorithms: 1) Is the 3SUM problem on n numbers in O(n 2-ε ) time for some ε > 0? 2) Can one determine the satisfiability of a CNF formula on n variables and poly n clauses in O(( 2 - ε )npoly n) time for some ε > 0? 3) Is the All Pairs Shortest Paths problem for graphs on n vertices in O(n 3-ε ) time for some ε > 0? 4) Is there a linear time algorithm that detects whether a given graph contains a triangle? 5) Is there an O(n 3-ε ) time combinatorial algorithm for n×n Boolean matrix multiplication? The problems we consider include dynamic versions of bipartite perfect matching, bipartite maximum weight matching, single source reachability, single source shortest paths, strong connectivity, subgraph connectivity, diameter approximation and some nongraph problems such as Pagh's problem defined in a recent paper by Patrascu[STOC 2010]."
FOCS,2014,444-453,"Parinya Chalermsook, Bundit Laekhanukit, Danupon Nanongkai",Pre-reduction Graph Products: Hardnesses of Properly Learning DFAs and Approximating EDP on DAGs.,https://doi.org/10.1109/FOCS.2014.54,"The study of graph products is a major research topic and typically concerns the term f(G * H), e.g., to show that f(G * H) = f(G)f(H). In this paper, we study graph products in a non-standard form f(R[G * H]) where R is a “reduction”, a transformation of any graph into an instance of an intended optimization problem. We resolve some open problems as applications. The first problem is minimum consistent deterministic finite automaton (DFA). We show a tight n 1-?  approximation hardness, improving the n 1/14-?  hardness of [Pitt and Warmuth, STOC 1989 and JACM 1993], where n is the sample size. (In fact, we also give improved hardnesses for the case of acyclic DFA and NFA.) Due to Board and Pitt [Theoretical Computer Science 1992], this implies the hardness of properly learning DFAs assuming NP ≠ RP (the weakest possible assumption). This affirmatively answers an open problem raised 25 years ago in the paper of Pitt and Warmuth and the survey of Pitt [All 1989]. Prior to our results, this hardness only follows from the stronger hardness of improperly learning DFAs, which requires stronger assumptions, i.e., either a cryptographic or an average case complexity assumption [Kearns and Valiant STOC 1989 and J. ACM 1994; Daniely et al. STOC 2014]. The second problem is edge-disjoint paths (EDP) on directed acyclic graphs (DAGs). This problem admits an O(√n)-approximation algorithm [Chekuri, Khanna, and Shepherd, Theory of Computing 2006] and a matching Ω(√n) integrality gap, but so far only an n 1/26-?  hardness factor is known [Chuzhoy et al., STOC 2007]. (n denotes the number of vertices.) Our techniques give a tight n 1/2-?  hardness for EDP on DAGs, thus resolving its approximability status. As by-products of our techniques: (i) We give a tight hardness of packing vertex-disjoint k-cycles for large k, complimenting [Guruswami and Lee, ECCC 2014] and matching [Krivelevich et al., SODA 2005 and ACM Transactions on Algorithms 2007]. (ii) We give an alternative (and perhaps simpler) proof for the hardness of properly learning DNF, CNF and intersection of halfspaces [Alekhnovich et al., FOCS 2004 and J. Comput.Syst. Sci. 2008]. Our new concept reduces the task of proving hardnesses to merely analyzing graph product inequalities, which are often as simple as textbook exercises. This concept was inspired by, and can be viewed as a generalization of, the graph product subadditivity technique we previously introduced in SODA 2013. This more general concept might be useful in proving other hardness results as well."
FOCS,2014,454-463,"Moritz Hardt, Jonathan R. Ullman",Preventing False Discovery in Interactive Data Analysis Is Hard.,https://doi.org/10.1109/FOCS.2014.55,"We show that, under a standard hardness assumption, there is no computationally efficient algorithm that given n samples from an unknown distribution can give valid answers to n3+o(1) adaptively chosen statistical queries. A statistical query asks for the expectation of a predicate over the underlying distribution, and an answer to a statistical query is valid if it is ""close"" to the correct expectation over the distribution. Our result stands in stark contrast to the well known fact that exponentially many statistical queries can be answered validly and efficiently if the queries are chosen non-adaptively (no query may depend on the answers to previous queries). Moreover, Dwork et al. [1], showed how to accurately answer exponentially many adaptively chosen statistical queries via a computationally inefficient algorithm. They also gave efficient algorithm that can answer nearly n2 adaptively chosen queries, which shows our result is almost quantitatively tight. Conceptually, our result demonstrates that achieving statistical validity alone can be a source of computational intractability in adaptive settings. For example, in the modern large collaborative research environment, data analysts typically choose a particular approach based on previous findings. False discovery occurs if a research finding is supported by the data but not by the underlying distribution. While the study of preventing false discovery in Statistics is decades old, to the best of our knowledge our result is the first to demonstrate a computational barrier. In particular, our result suggests that the perceived difficulty of preventing false discovery in today's collaborative research environment may be inherent."
FOCS,2014,464-473,"Raef Bassily, Adam D. Smith, Abhradeep Thakurta",Private Empirical Risk Minimization: Efficient Algorithms and Tight Error Bounds.,https://doi.org/10.1109/FOCS.2014.56,"Convex empirical risk minimization is a basic tool in machine learning and statistics. We provide new algorithms and matching lower bounds for differentially private convex empirical risk minimization assuming only that each data point's contribution to the loss function is Lipschitz and that the domain of optimization is bounded. We provide a separate set of algorithms and matching lower bounds for the setting in which the loss functions are known to also be strongly convex. Our algorithms run in polynomial time, and in some cases even match the optimal nonprivate running time (as measured by oracle complexity). We give separate algorithms (and lower bounds) for (ε, 0)and (ε, δ)-differential privacy; perhaps surprisingly, the techniques used for designing optimal algorithms in the two cases are completely different. Our lower bounds apply even to very simple, smooth function families, such as linear and quadratic functions. This implies that algorithms from previous work can be used to obtain optimal error rates, under the additional assumption that the contributions of each data point to the loss function is smooth. We show that simple approaches to smoothing arbitrary loss functions (in order to apply previous techniques) do not yield optimal error rates. In particular, optimal algorithms were not previously known for problems such as training support vector machines and the high-dimensional median."
