booktitle,year,pages,author,title,ee,abstract
FOCS,2014,1-10,"Per Austrin, Johan H?stad, Venkatesan Guruswami",(2 + epsilon)-Sat Is NP-Hard.,https://doi.org/10.1109/FOCS.2014.9,"We prove the following hardness result for a natural promise variant of the classical CNF-satisfiability problem: Given a CNF-formula where each clause has width  and the guarantee that there exists an assignment satisfying at least  literals in each clause, it is NP-hard to find a satisfying assignment to the formula (that sets at least one literal to true in each clause). On the other hand, when , it is easy to find a satisfying assignment via simple generalizations of the algorithms for 2-Sat. Viewing 2-Sat  as tractability of Sat when 1 in 2 literals are true in every clause, and NP-hardness of 3-Sat as intractability of Sat when 1 in 3 literals are true, our result shows, for any fixed , the difficulty of finding a satisfying assignment to instances of “-Sat” where the density of satisfied literals in each clause is guaranteed to exceed . We also strengthen the results to prove that, given a (2k+1)-uniform hypergraph that can be 2-colored such that each edge has perfect balance (at most k+1 vertices of either color), it is NP-hard to find a 2-coloring that avoids a monochromatic edge. In other words, a set system with discrepancy 1 is hard to distinguish from a set system with worst possible discrepancy. Finally, we prove a general result showing the intractability of promise constraint satisfaction problems based on the paucity of certain “weak polymorphisms.” The core of the above hardness results is the claim that the only weak polymorphisms in these particular cases are juntas depending on few variables."
FOCS,2014,11-20,"Constantinos Daskalakis, Qinxuan Pan",A Counter-example to Karlin's Strong Conjecture for Fictitious Play.,https://doi.org/10.1109/FOCS.2014.10,"Fictitious play is a natural dynamic for equilibrium play in zero-sum games, proposed by Brown [6], and shown to converge by Robinson [33]. Samuel Karlin conjectured in 1959 that fictitious play converges at rate O(t -1/2 ) with respect to the number of steps t. We disprove this conjecture by showing that, when the payoff matrix of the row player is the n × n identity matrix, fictitious play may converge (for some tie-breaking) at rate as slow as Ω(t -1/n )."
FOCS,2014,21-30,"Moshe Babaioff, Nicole Immorlica, Brendan Lucier, S. Matthew Weinberg",A Simple and Approximately Optimal Mechanism for an Additive Buyer.,https://doi.org/10.1109/FOCS.2014.11,"We consider a monopolist seller with n heterogeneous items, facing a single buyer. The buyer has a value for each item drawn independently according to (non-identical) distributions, and her value for a set of items is additive. The seller aims to maximize his revenue. We suggest using the a priori better of two simple pricing methods: selling the items separately, each at its optimal price, and bundling together, in which the entire set of items is sold as one bundle at its optimal price. We show that for any distribution, this mechanism achieves a constant-factor approximation to the optimal revenue. Beyond its simplicity, this is the first computationally tractable mechanism to obtain a constant-factor approximation for this multi-parameter problem. We additionally discuss extensions to multiple buyers and to valuations that are correlated across items."
FOCS,2014,31-40,"Umang Bhaskar, Katrina Ligett, Leonard J. Schulman, Chaitanya Swamy",Achieving Target Equilibria in Network Routing Games without Knowing the Latency Functions.,https://doi.org/10.1109/FOCS.2014.12,"The analysis of network routing games typically assumes, right at the onset, precise and detailed information about the latency functions. Such information may, however, be unavailable or difficult to obtain. Moreover, one is often primarily interested in enforcing a desirable target flow as the equilibrium by suitably influencing player behavior in the routing game. We ask whether one can achieve target flows as equilibria without knowing the underlying latency functions. Our main result gives a crisp positive answer to this question. We show that, under fairly general settings, one can efficiently compute edge tolls that induce a given target multicommodity flow in a nonatomic routing game using a polynomial number of queries to an oracle that takes candidate tolls as input and returns the resulting equilibrium flow. This result is obtained via a novel application of the ellipsoid method, and applies to arbitrary multicommodity settings and non-linear latency functions. Our algorithm extends easily to many other settings, such as (i) when certain edges cannot be tolled or there is an upper bound on the total toll paid by a user, and (ii) general nonatomic congestion games. We obtain tighter bounds on the query complexity for series-parallel networks, and single-commodity routing games with linear latency functions, and complement these with a query-complexity lower bound applicable even to single-commodity routing games on parallel-link graphs with linear latency functions. We also explore the use of Stackelberg routing to achieve target equilibria and obtain strong positive results for series-parallel graphs. Our results build upon various new techniques that we develop pertaining to the computation of, and connections between, different notions of approximate equilibrium, properties of multicommodity flows and tolls in series-parallel graphs, and sensitivity of equilibrium flow with respect to tolls. Our results demonstrate that one can indeed circumvent the potentially-onerous task of modeling latency functions, and yet obtain meaningful results for the underlying routing game."
FOCS,2014,41-50,"Vipul Goyal, Silas Richelson, Alon Rosen, Margarita Vald",An Algebraic Approach to Non-malleability.,https://doi.org/10.1109/FOCS.2014.13,"In their seminal work on non-malleable cryptography, Dolev, Dwork and Naor, showed how to construct a non-malleable commitment with logarithmically-many ""rounds""/""slots"", the idea being that any adversary may successfully maul in some slots but would fail in at least one. Since then new ideas have been introduced, ultimately resulting in constant-round protocols based on any one-way function. Yet, in spite of this remarkable progress, each of the known constructions of non-malleable commitments leaves something to be desired. In this paper we propose a new technique that allows us to construct a non-malleable protocol with only a single ""slot"", and to improve in at least one aspect over each of the previously proposed protocols. Two direct byproducts of our new ideas are a four round non-malleable commitment and a four round non-malleable zero-knowledge argument, the latter matching the round complexity of the best known zero-knowledge argument (without the non-malleability requirement). The protocols are based on the existence of one-way functions and admit very efficient instantiations via standard homomorphic commitments and sigma protocols. Our analysis relies on algebraic reasoning, and makes use of error correcting codes in order to ensure that committers' tags differ in many coordinates. One way of viewing our construction is as a method for combining many atomic sub-protocols in a way that simultaneously amplifies soundness and non-malleability, thus requiring much weaker guarantees to begin with, and resulting in a protocol which is much trimmer in complexity compared to the existing ones."
FOCS,2014,51-60,"Gregory Valiant, Paul Valiant",An Automatic Inequality Prover and Instance Optimal Identity Testing.,https://doi.org/10.1109/FOCS.2014.14,"We consider the problem of verifying the identity of a distribution: Given the description of a distribution over a discrete finite or countably infinite support, , how many samples (independent draws) must one obtain from an unknown distribution, , to distinguish, with high probability, the case that  from the case that the total variation distance ( distance) ?  We resolve this question, up to constant factors, on an instance by instance basis: there exist universal constants  and a function  on the known distribution  and error parameter , such that our tester distinguishes  from  using  samples with success probability , but no tester can distinguish  from  when given  samples.  The function  is upper-bounded by a multiple of  but is more complicated.  This result generalizes and tightens previous results: since distributions of support at most  have  norm bounded by  this result immediately shows that for such distributions,  samples suffice, tightening the previous bound of  and matching the (tight) results for the case that  is      the uniform distribution of support . The analysis of our very simple testing algorithm involves several hairy inequalities.  To facilitate this analysis, we give a complete characterization of a general class of inequalities---generalizing Cauchy--Schwarz, Ho?lder's inequality, and the monotonicity of  norms.   Specifically, we characterize the set of sequences of triples  for which it holds that for all finite sequences of positive numbers  and   For example, the standard Cauchy--Schwarz inequality corresponds to the triples   .  Our characterization is constructive and algorithmic, leveraging linear programming to prove or refute an inequality, which would otherwise have to be investigated, through trial and error, by hand.  We hope the computational nature of our characterization will be useful to others and facilitate analyses like the one here."
FOCS,2014,61-70,"Neeraj Kayal, Nutan Limaye, Chandan Saha 0001, Srikanth Srinivasan 0001",An Exponential Lower Bound for Homogeneous Depth Four Arithmetic Formulas.,https://doi.org/10.1109/FOCS.2014.15,"We show here a 2Ω(√d ? log N) size lower bound for homogeneous depth four arithmetic formulas. That is, we give an explicit family of polynomials of degree d on N variables (with N = d3 in our case) with 0, 1-coefficients such that for any representation of a polynomial f in this family of the form f = Σi ∏j Qij, where the Qij's are homogeneous polynomials (recall that a polynomial is said to be homogeneous if all its monomials have the same degree), it must hold that ∑i, j (Number of monomials of Qij)) ≥2Ω(√d ?log N). The above mentioned family, which we refer to as the Nisan-Wigderson design-based family of polynomials, is in the complexity class VNP. Our work builds on recent lower bound results [1], [2], [3], [4], [5] and yields an improved quantitative bound as compared to the quasi-polynomial lower bound from an earlier work of the same authors and the NΩ(log log N) lower bound in the independent work of [7]."
FOCS,2014,71-80,Tim Roughgarden,Barriers to Near-Optimal Equilibria.,https://doi.org/10.1109/FOCS.2014.16,"This paper explains when and how communication and computational lower bounds for algorithms for an optimization problem translate to lower bounds on the worst-case quality of equilibria in games derived from the problem. We give three families of lower bounds on the quality of equilibria, each motivated by a different set of problems: congestion, scheduling, and distributed welfare games, welfare-maximization in combinatorial auctions with ""black-box"" bidder valuations, and welfare-maximization in combinatorial auctions with succinctly described valuations. The most straightforward use of our lower bound framework is to harness an existing computational or communication lower bound to derive a lower bound on the worst-case price of anarchy (POA) in a class of games. This is a new approach to POA lower bounds, which relies on reductions in lieu of explicit constructions. More generally, the POA lower bounds implied by our framework apply to all classes of games that share the same underlying optimization problem, independent of the details of players' utility functions. For this reason, our lower bounds are particularly significant for problems of game design -- ranging from the design of simple combinatorial auctions to the computation of tolls for routing networks -- where the goal is to design a game that has only near-optimal equilibria. For example, our results imply that the simultaneous first-price auction format is optimal among all ""simple combinatorial auctions"" in several settings."
FOCS,2014,81-89,"Itai Benjamini, Gil Cohen, Igor Shinkar",Bi-Lipschitz Bijection between the Boolean Cube and the Hamming Ball.,https://doi.org/10.1109/FOCS.2014.17,"We construct a bi-Lipschitz bijection from the Boolean cube to the Hamming ball of equal volume. More precisely, we show that for all even n ∈ N there exists an explicit bijection ψ: {0, 1} n  → {x ∈ {0, 1} n+1 : |x| > n/2} such that for every x ≠ y ∈ {0, 1} n ,  where distance(·, ·) denotes the Hamming distance. In particular, this implies that the Hamming ball is bi-Lipschitz transitive. This result gives a strong negative answer to an open problem of Lovett and Viola (2012), who raised the question in the context of sampling distributions in low-level complexity classes. The conceptual implication is that the problem of proving lower bounds in the context of sampling distributions requires ideas beyond the sensitivity-based structural results of Boppana (1997). We study the mapping ψ further and show that it (and its inverse) are computable in DLOGTIME-uniform TC0, but not in AC0. Moreover, we prove that ψ is “approximately local” in the sense that all but the last output bit of ψ are essentially determined by a single input bit."
FOCS,2014,90-99,"Leonid Gurvits, Alex Samorodnitsky",Bounds on the Permanent and Some Applications.,https://doi.org/10.1109/FOCS.2014.18,"We give new lower and upper bounds on the permanent of a doubly stochastic matrix. Combined with previous work, this improves on the deterministic approximation factor. We also give a combinatorial application of the lower bound, proving S. Friedland's ""Asymptotic Lower Matching Conjecture""for the monomer-dimer problem."
FOCS,2014,100-109,"Uriel Feige, Tomer Koren, Moshe Tennenholtz",Chasing Ghosts: Competing with Stateful Policies.,https://doi.org/10.1109/FOCS.2014.19,"We consider sequential decision making in a setting where regret is measured with respect to a set of stateful reference policies, and feedback is limited to observing the rewards of the actions performed (the so-called bandit setting). If either the reference policies are stateless rather than stateful or the feedback includes the rewards of all actions (the so-called experts setting), previous work shows that the optimal regret grows like  in terms of the number of decision rounds . The difficulty in our setting is that the decision maker unavoidably loses track of the internal states of the reference policies and thus cannot reliably attribute rewards observed in a certain round to any of the reference policies. In fact, in this setting it is impossible for the algorithm to estimate which policy gives the highest (or even approximately highest) total reward. Nevertheless, we design an algorithm that achieves expected regret that is sublinear in , of the form . Our algorithm is based on a certain local repetition lemma that may be of independent interest. We also show that no algorithm can guarantee expected regret better than ."
FOCS,2014,110-119,"Joshua A. Grochow, Toniann Pitassi","Circuit Complexity, Proof Complexity, and Polynomial Identity Testing.",https://doi.org/10.1109/FOCS.2014.20,"We introduce a new and natural algebraic proof system, which has tight connections to (algebraic) circuit complexity. In particular, we show that any super-polynomial lower bound on any Boolean tautology in our proof system implies that the permanent does not have polynomial-size algebraic circuits (VNP≠VP). As a corollary, super-polynomial lower bounds on the number of lines in Polynomial Calculus proofs (as opposed to the usual measure of number of monomials) imply the Permanent versus Determinant Conjecture. Note that, prior to our work, there was no proof system for which lower bounds on an arbitrary tautology implied any computational lower bound. Our proof system helps clarify the relationships between previous algebraic proof systems, and begins to shed light on why proof complexity lower bounds for various proof systems have been so much harder than lower bounds on the corresponding circuit classes. In doing so, we highlight the importance of polynomial identity testing (PIT) for understanding proof complexity."
FOCS,2014,120-129,"Toby S. Cubitt, Ashley Montanaro",Complexity Classification of Local Hamiltonian Problems.,https://doi.org/10.1109/FOCS.2014.21,"The calculation of ground-state energies of physical systems can be formalized as the -local Hamiltonian problem, which is a natural quantum analogue of classical constraint satisfaction problems. One way of making the problem more physically meaningful is to restrict the Hamiltonian in question by picking its terms from a fixed set  and scaling them by arbitrary weights. Examples of such special cases are the Heisenberg and Ising models from condensed-matter physics. In this work we characterize the complexity of this problem for all 2-local qubit Hamiltonians. Depending on the subset , the problem falls into one of the following categories: in ; -complete; polynomial-time equivalent to the Ising model with transverse magnetic fields; or -complete. The third of these classes has been shown to be -complete by Bravyi and Hastings. The characterization holds even if  does not contain any 1-local terms; for example, we prove for the first time -completeness of the Heisenberg and XY interactions in this setting. If  is assumed to contain all 1-local terms, which is the setting considered by previous work, we have a characterization that goes beyond 2-local interactions: for any constant , all -local qubit Hamiltonians whose terms are picked from a fixed set  correspond to problems either in ; polynomial-time equivalent to the Ising model with transverse magnetic fields; or -complete. These results are a quantum analogue of the maximization variant of Schaefer's dichotomy theorem for Boolean constraint satisfaction problems."
FOCS,2014,130-139,"Radu Curticapean, Dániel Marx",Complexity of Counting Subgraphs: Only the Boundedness of the Vertex-Cover Number Counts.,https://doi.org/10.1109/FOCS.2014.22,"For a class C of graphs, #Sub(C) is the counting problem that, given a graph H from C and an arbitrary graph G, asks for the number of subgraphs of G isomorphic to H. It is known that if C has bounded vertex-cover number (equivalently, the size of the maximum matching in C is bounded), then #Sub(C) is polynomial-time solvable. We complement this result with a corresponding lower bound: if C is any recursively enumerable class of graphs with unbounded vertexcover number, then #Sub(C) is #W[1]-hard parameterized by the size of H and hence not polynomial-time solvable and not even fixed-parameter tractable, unless FPT is equal to #W[1]. As a first step of the proof, we show that counting kmatchings in bipartite graphs is #W[1]-hard. Recently, Curticapean [ICALP 2013] proved the #W[1]-hardness of counting k-matchings in general graphs; our result strengthens this statement to bipartite graphs with a considerably simpler proof and even shows that, assuming the Exponential Time Hypothesis (ETH), there is no f(k)*n^o(k/log(k)) time algorithm for counting k-matchings in bipartite graphs for any computable function f. As a consequence, we obtain an independent and somewhat simpler proof of the classical result of Flum and Grohe [SICOMP 2004] stating that counting paths of length k is #W[1]-hard, as well as a similar almost-tight ETH-based lower bound on the exponent."
FOCS,2014,140-145,Thomas Rothvo?,Constructive Discrepancy Minimization for Convex Sets.,https://doi.org/10.1109/FOCS.2014.23,"A classical theorem of Spencer shows that any set system with n sets and n elements admits a coloring of discrepancy O(√n). Recent exciting work of Bansal, Lovett and Meka shows that such colorings can be found in polynomial time. In fact, the Lovett-Meka algorithm finds a half integral point in any ""large enough"" polytope. However, their algorithm crucially relies on the facet structure and does not apply to general convex sets. We show that for any symmetric convex set K with measure at least e -- n/500, the following algorithm finds a point y ∈ K ∩ [ -- 1, 1]n with Ω(n) coordinates in ±1: (1) take a random Gaussian vector x, (2) compute the point y in K ∩ [ -- 1, 1]n that is closest to x. (3) return y. This provides another truly constructive proof of Spencer's theorem and the first constructive proof of a Theorem of Giannopoulos."
FOCS,2014,146-155,"Monika Henzinger, Sebastian Krinninger, Danupon Nanongkai",Decremental Single-Source Shortest Paths on Undirected Graphs in Near-Linear Total Update Time.,https://doi.org/10.1109/FOCS.2014.24,"In the decremental single-source shortest paths (SSSP) problem, we want to maintain the distances between a given source node s and every other node in an n-node m-edge graph G undergoing edge deletions. While its static counterpart can be solved in near-linear time, this decremental problem is much more challenging even in the undirected unweighted case. In this case, the classic O(mn) total update time of Even and Shiloach [16] has been the fastest known algorithm for three decades. At the cost of a (1+ε)-approximation factor, the running time was recently improved to n2+o(1) by Bernstein and Roditty [9]. In this article, we bring the running time down to near-linear: We give a (1+ε)-approximation algorithm with m1+o(1) expected total update time, thus obtaining near-linear time. Moreover, we obtain m1+o(1) log W time for the weighted case, where the edge weights are integers from 1 to W. The only prior work on weighted graphs in o(mn) time is the mn0.9 + o(1)-time algorithm by Henzinger et al. [18, 19], which works for directed graphs with quasi-polynomial edge weights. The expected running time bound of our algorithm holds against an oblivious adversary. In contrast to the previous results, which rely on maintaining a sparse emulator, our algorithm relies on maintaining a so-called sparse (h, ε)-hop set introduced by Cohen [12] in the PRAM literature. An (h, ε)-hop set of a graph G=(V, E) is a set F of weighted edges such that the distance between any pair of nodes in G can be (1+ε)-approximated by their h-hop distance (given by a path containing at most h edges) on G′=(V, E ∪ F). Our algorithm can maintain an (no(1), ε)-hop set of near-linear size in near-linear time under edge deletions. It is the first of its kind to the best of our knowledge. To maintain approximate distances using this hop set, we extend the monotone Even-Shiloach tree of Henzinger et al. [20] and combine it with the bounded-hop SSSP technique of Bernstein [4, 5] and M?dry [27]. These two new tools might be of independent interest."
FOCS,2014,156-165,"George Barmpalias, Richard Elwes, Andy Lewis-Pye",Digital Morphogenesis via Schelling Segregation.,https://doi.org/10.1109/FOCS.2014.25,"Schelling's model of segregation looks to explain the way in which particles or agents of two types may come to arrange themselves spatially into configurations consisting of large homogeneous clusters, i.e. connected regions consisting of only one type. As one of the earliest agent based models studied by economists and perhaps the most famous model of self-organising behaviour, it also has direct links to areas at the interface between computer science and statistical mechanics, such as the Ising model and the study of contagion and cascading phenomena in networks. While the model has been extensively studied it has largely resisted rigorous analysis, prior results from the literature generally pertaining to variants of the model which are tweaked so as to be amenable to standard techniques from statistical mechanics or stochastic evolutionary game theory. In BK, Brandt, Immorlica, Kamath and Kleinberg provided the first rigorous analysis of the unperturbed model, for a specific set of input parameters. Here we provide a rigorous analysis of the model's behaviour much more generally and establish some surprising forms of threshold behaviour, notably the existence of situations where an increased level of intolerance for neighbouring agents of opposite type leads almost certainly to decreased segregation."
