booktitle,year,pages,author,title,ee,abstract
FOCS,2016,188-196,Gil Cohen,Making the Most of Advice: New Correlation Breakers and Their Applications.,https://doi.org/10.1109/FOCS.2016.28,"A typical obstacle one faces when constructing pseudorandom objects is undesired correlations between random variables. Identifying this obstacle and constructing certain types of “correlation breakers” was central for recent exciting advances in the construction of multi-source and nonmalleable extractors. One instantiation of correlation breakers is correlation breakers with advice. These are algorithms that break the correlation a “bad” random variable Y ' has with a “good” random variable Y using an “advice” - a fixed string α that is associated with Y which is guaranteed to be distinct from the corresponding string α' associated with Y '. Prior to this work, explicit constructions of correlation breakers with advice require the entropy of the involved random variables to depend linearly on the advice length. In this work, building on independence-preserving mergers, a pseudorandom primitive that was recently introduced by Cohen and Schulman, we devise a new construction of correlation breakers with advice that has optimal, logarithmic, dependence on the advice length. This enables us to obtain the following results. . We construct an extractor for 5 independent n-bit sources with min-entropy (log n) 1+o(1) . This result puts us tantalizingly close to the goal of constructing extractors for 2 sources with min-entropy O(log n), which would have exciting implications to Ramsey theory. . We construct non-malleable extractors with error guarantee ε for n-bit sources, with seed length d = O(log n)+ (log(1/ε)) 1+o(1)  for any min-entropy k = Ω(d). Prior to this work, all constructions require either very high minentropy or otherwise have seed length ω(log n) for any ε. Further, our extractor has near-optimal output length. Prior constructions that achieve comparable output length work only for very high min-entropy k ≈ n/2. . By instantiating the Dodis-Wichs framework with our non-malleable extractor, we obtain near-optimal privacy amplification protocols against active adversaries, improving upon all (incomparable) known protocols."
FOCS,2016,197-208,Zachary Remscrim,"The Hilbert Function, Algebraic Extractors, and Recursive Fourier Sampling.",https://doi.org/10.1109/FOCS.2016.29,"In this paper, we apply tools from algebraic geometry to prove new results concerning extractors for algebraic sets, the recursive Fourier sampling problem, and VC dimension. We present a new construction of an extractor which works for algebraic sets defined by polynomials over GF(2) of substantially higher degree than the current state-of-the-art construction. We also exactly determine the GF(2)-polynomial degree of the recursive Fourier sampling problem and use this to provide new partial results towards a circuit lower bound for this problem. Finally, we answer a question concerning VC dimension, interpolation degree and the Hilbert function."
FOCS,2016,209-218,Shahar Dobzinski,Computational Efficiency Requires Simple Taxation.,https://doi.org/10.1109/FOCS.2016.30,"We characterize the communication complexity of truthful mechanisms. Our departure point is the well known taxation principle. The taxation principle asserts that every truthful mechanism can be interpreted as follows: every player is presented with a menu that consists of a price for each bundle (the prices depend only on the valuations of the other players). Each player is allocated a bundle that maximizes his profit according to this menu. We define the taxation complexity of a truthful mechanism to be the logarithm of the maximum number of menus that may be presented to a player. Our main finding is that in general the taxation complexity essentially equals the communication complexity. The proof consists of two main steps. First, we prove that for rich enough domains the taxation complexity is at most the communication complexity. We then show that the taxation complexity is much smaller than the communication complexity only in ""pathological"" cases and provide a formal description of these extreme cases. Next, we study mechanisms that access the valuations via value queries only. In this setting we establish that the menu complexity - a notion that was already studied in several different contexts - characterizes the number of value queries that the mechanism makes in exactly the same way that the taxation complexity characterizes the communication complexity. Our approach yields several applications, including strengthening the solution concept with low communication overhead, fast computation of prices, and hardness of approximation by computationally efficient truthful mechanisms."
FOCS,2016,219-228,"Constantinos Daskalakis, Vasilis Syrgkanis","Learning in Auctions: Regret is Hard, Envy is Easy.",https://doi.org/10.1109/FOCS.2016.31,"An extensive body of recent work studies the welfare guarantees of simple and prevalent combinatorial auction formats, such as selling m items via simultaneous second price auctions (SiSPAs) [1], [2], [3]. These guarantees hold even when the auctions are repeatedly executed and the players use no-regret learning algorithms to choose their actions. Unfortunately, off-the-shelf no-regret learning algorithms for these auctions are computationally inefficient as the number of actions available to the players becomes exponential. We show that this obstacle is inevitable: there are no polynomial-time no-regret learning algorithms for SiSPAs, unless RP ? NP, even when the bidders are unit-demand. Our lower bound raises the question of how good outcomes polynomially-bounded bidders may discover in such auctions. To answer this question, we propose a novel concept of learning in auctions, termed ""no-envy learning."" This notion is founded upon Walrasian equilibrium, and we show that it is both efficiently implementable and results in approximately optimal welfare, even when the bidders have valuations from the broad class of fractionally subadditive (XOS) valuations (assuming demand oracle access to the valuations) or coverage valuations (even without demand oracles). No-envy learning outcomes are a relaxation of no-regret learning outcomes, which maintain their approximate welfare optimality while endowing them with computational tractability. Our positive and negative results extend to several auction formats that have been studied in the literature via the smoothness paradigm. Our positive results for XOS valuations are enabled by a novel Follow-The-Perturbed-Leader algorithm for settings where the number of experts and states of nature are both infinite, and the payoff function of the learner is non-linear. We show that this algorithm has applications outside of auction settings, establishing significant gains in a recent application of no-regret learning in security games. Our efficient learning result for coverage valuations is based on a novel use of convex rounding schemes and a reduction to online convex optimization."
FOCS,2016,229-238,"Tim Roughgarden, Omri Weinstein",On the Communication Complexity of Approximate Fixed Points.,https://doi.org/10.1109/FOCS.2016.32,"We study the two-party communication complexity of finding an approximate Brouwer fixed point of a composition of two Lipschitz functions g o f: [0,1] n  → [0,1] n , where Alice holds f and Bob holds g. We prove an exponential (in n) lower bound on the deterministic communication complexity of this problem. Our technical approach is to adapt the Raz-McKenzie simulation theorem (FOCS 1999) into geometric settings, thereby ""smoothly lifting"" the deterministic query lower bound for finding an approximate fixed point (Hirsch, Papadimitriou and Vavasis, Complexity 1989) from the oracle model to the two-party model. Our results also suggest an approach to the well-known open problem of proving strong lower bounds on the communication complexity of computing approximate Nash equilibria. Specifically, we show that a slightly ""smoother"" version of our fixed-point computation lower bound (by an absolute constant factor) would imply that: The deterministic two-party communication complexity of finding an ∈ = Ω(1/log 2  N)-approximate Nash equilibrium in an N × N bimatrix game (where each player knows only his own payoff matrix) is at least N γ  for some constant γ > 0. (In contrast, the nondeterministic communication complexity of this problem is only O(log 6  N)). ; The deterministic (Number-In-Hand) multiparty communication complexity of finding an ∈ = Ω(1)-Nash equilibrium in a k-player constant-action game is at least 2 Ω(k/log k)  (while the nondeterministic communication complexity is only O(k))."
FOCS,2016,239-247,"Yiling Chen 0001, Bo Waggoner",Informational Substitutes.,https://doi.org/10.1109/FOCS.2016.33,"We propose definitions of substitutes and complements for pieces of information (""signals"") in the context of a decision or optimization problem, with game-theoretic and algorithmic applications. In a game-theoretic context, substitutes capture diminishing marginal value of information to a rational decision maker. There, we address the main open problem in a fundamental strategic-information-revelation setting, prediction markets. We show that substitutes characterize ""best-possible"" equilibria with immediate information aggregation, while complements characterize ""worst-possible"", delayed aggregation. Game-theoretic applications also include settings such as crowdsourcing contests and question-and-answer forums. In an algorithmic context, where substitutes capture diminishing marginal improvement of information to an optimization problem, substitutes imply efficient approximation algorithms for a very general class of (adaptive) information acquisition problems. In tandem with these broad applications, we examine the structure and design of informational substitutes and complements. They have equivalent, intuitive definitions from disparate perspectives: submodularity, geometry, and information theory. We also consider the design of scoring rules or optimization problems so as to encourage substitutability or complementarity, with positive and negative results. Taken as a whole, the results give some evidence that, in parallel with substitutable items, informational substitutes play a natural conceptual and formal role in game theory and algorithms."
FOCS,2016,248-257,"Alina Ene, Huy L. Nguyen",Constrained Submodular Maximization: Beyond 1/e.,https://doi.org/10.1109/FOCS.2016.34,"In this work, we present a new algorithm for maximizing a non-monotone submodular function subject to a general constraint. Our algorithm finds an approximate fractional solution for maximizing the multilinear extension of the function over a down-closed polytope. The approximation guarantee is 0.372 and it is the first improvement over the 1/e approximation achieved by the unified Continuous Greedy algorithm [Feldman et al., FOCS 2011]."
FOCS,2016,258-265,Aviad Rubinstein,Settling the Complexity of Computing Approximate Two-Player Nash Equilibria.,https://doi.org/10.1109/FOCS.2016.35,"In our recent paper [Rubinstein 2016] we rule out a PTAS for the 2-Player Nash Equilibrium Problem. More precisely, we prove that there exists a constant ? > 0 such that, assuming the Exponential Time Hypothesis for PPAD, computing an ?-approximate Nash equilibrium in a two-player n × n game requires time nlog1?o(1) n. This matches (up to the o (1) term) the algorithm of Lipton, Markakis, and Mehta [Lipton et al. 2003]."
FOCS,2016,266-275,Ran Raz,Fast Learning Requires Good Memory: A Time-Space Lower Bound for Parity Learning.,https://doi.org/10.1109/FOCS.2016.36,"We prove that any algorithm for learning parities requires either a memory of quadratic size or an exponential number of samples. This proves a recent conjecture of ?Steinhardt et al. (2016) and shows that for some learning problems, a large storage space is crucial. More formally, in the problem of parity learning, an unknown string x ∈ {0,1}n was chosen uniformly at random. A learner tries to learn x from a stream of samples (a1, b1), (a2, b2) …, where each?at is uniformly distributed over {0,1}n and bt is the inner product of at and x, modulo?2. We show that any algorithm for parity learning that uses less than n2/25 bits of memory requires an exponential number of samples. Previously, there was no non-trivial lower bound on the number of samples needed for any learning problem, even if the allowed memory size is O(n) (where n is the space needed to store one sample). We also give an application of our result in the field of bounded-storage cryptography. We show an encryption scheme that requires a private key of length n, as well as time complexity of n per encryption/decryption of each bit, and is provably and unconditionally secure as long as the attacker uses less than n2/25 memory bits and the scheme is used at most an exponential number of times. Previous works on bounded-storage cryptography assumed that the memory size used by the attacker is at most linear in the time needed for encryption/decryption."
FOCS,2016,276-281,Michael B. Cohen,Ramanujan Graphs in Polynomial Time.,https://doi.org/10.1109/FOCS.2016.37,"Recent work by Marcus, Spielman and Srivastava proves the existence of bipartite Ramanujan (multi) graphs of all degrees and all sizes. However, that paper did not provide a polynomial time algorithm to actually compute such graphs. Here, we provide a polynomial time algorithm to compute certain expected characteristic polynomials related to this construction. This leads to a deterministic polynomial time algorithm to compute bipartite Ramanujan (multi) graphs of all degrees and all sizes."
FOCS,2016,282-288,"Hamed Hatami, Kaave Hosseini, Shachar Lovett",Structure of Protocols for XOR Functions.,https://doi.org/10.1109/FOCS.2016.38,"Let f be a boolean function on n variables. Its associated XOR function is the two-party function F(x, y) = f(x xor y). We show that, up to polynomial factors, the deterministic communication complexity of F is equal to the parity decision tree complexity of f. This relies on a novel technique of entropy reduction for protocols, combined with existing techniques in Fourier analysis and additive combinatorics."
FOCS,2016,289-294,"W. T. Gowers 0001, Emanuele Viola",The Multiparty Communication Complexity of Interleaved Group Products.,https://doi.org/10.1109/FOCS.2016.39,"Party A i  of k parties A 1 ,...,A k  receives on its forehead a t-tuple (a i1 ,...,a it ) of elements from the group G = SL(2, q). The parties are promised that the interleaved product a 11 ...a k1 a 12 ...a k2 ...a 1t ...a kt  is equal either to the identity e or to some other fixed element g ∈ G. Their goal is to determine which of e and g the interleaved product is equal to, using the least amount of communication. We show that for all fixed k and all sufficiently large t the communication is Ω(t log |G|), which is tight. As an application, we establish the security of the leakage-resilient circuits studied by Miles and Viola (STOC 2013) in the ""only computation leaks"" model. Our main technical contribution is of independent interest. We show that if X is a probability distribution on G m  such that any two coordinates are uniform in G 2 , then a pointwise product of s independent copies of X is nearly uniform in G m , where s depends on m only."
FOCS,2016,295-304,"Susanna F. de Rezende, Jakob Nordstr?m, Marc Vinyals",How Limited Interaction Hinders Real Communication (and What It Means for Proof and Circuit Complexity).,https://doi.org/10.1109/FOCS.2016.40,"We obtain the first true size-space trade-offs for the cutting planes proof system, where the upper bounds hold for size and total space for derivations with constantsize coefficients, and the lower bounds apply to length and formula space (i.e., number of inequalities in memory) even for derivations with exponentially large coefficients. These are also the first trade-offs to hold uniformly for resolution, polynomial calculus and cutting planes, thus capturing the main methods of reasoning used in current state-of-the-art SAT solvers. We prove our results by a reduction to communication lower bounds in a round-efficient version of the real communication model of [Kraj??cek '98], drawing on and extending techniques in [Raz and McKenzie '99] and [G??os et al. '15]. The communication lower bounds are in turn established by a reduction to trade-offs between cost and number of rounds in the game of [Dymond and Tompa '85] played on directed acyclic graphs. As a by-product of the techniques developed to show these proof complexity trade-off results, we also obtain an exponential separation between monotone-AC i-1 and monotone-AC i , improving exponentially over the superpolynomial separation in [Raz and McKenzie '99]. That is, we give an explicit Boolean function that can be computed by monotone Boolean circuits of depth log i n and polynomial size, but for which circuits of depth O(log i-1 n) require exponential size."
FOCS,2016,305-314,"Omri Weinstein, Huacheng Yu",Amortized Dynamic Cell-Probe Lower Bounds from Four-Party Communication.,https://doi.org/10.1109/FOCS.2016.41,"This paper develops a new technique for proving amortized, randomized cell-probe lower bounds on dynamic data structure problems. We introduce a new randomized nondeterministic four-party communication model that enables ""accelerated"", error-preserving simulations of dynamic data structures. We use this technique to prove an Ω(n(log n/log log n)2) cell-probe lower bound for the dynamic 2D weighted orthogonal range counting problem (2D-ORC) with n/poly log n updates and n queries, that holds even for data structures with exp(-Ω?(n)) success probability. This result not only proves the highest amortized lower bound to date, but is also tight in the strongest possible sense, as a matching upper bound can be obtained by a deterministic data structure with worst-case operational time. This is the first demonstration of a ""sharp threshold"" phenomenon for dynamic data structures. Our broader motivation is that cell-probe lower bounds for exponentially small success facilitate reductions from dynamic to static data structures. As a proof-of-concept, we show that a slightly strengthened version of our lower bound would imply an Ω((log n/log log n)2) lower bound for the static 3D-ORC problem with O(n logO(1) n) space. Such result would give a near quadratic improvement over the highest known static cell-probe lower bound, and break the long standing Ω(log n) barrier for static data structures."
FOCS,2016,315-324,"Shiri Chechik, Thomas Dueholm Hansen, Giuseppe F. Italiano, Jakub Lacki, Nikos Parotsidis",Decremental Single-Source Reachability and Strongly Connected Components in ?(m√n) Total Update Time.,https://doi.org/10.1109/FOCS.2016.42,"We present randomized algorithms with a total update time of ?(m √n) for the problems of decremental single source reachability and decremental strongly connected components on directed graphs. This improves recent breakthrough results of Henzinger, Krinninger and Nanongkai [STOC 14, ICALP 15]. In addition, our algorithms are arguably simpler."
FOCS,2016,325-334,Shay Solomon,Fully Dynamic Maximal Matching in Constant Update Time.,https://doi.org/10.1109/FOCS.2016.43,"Baswana, Gupta and Sen [FOCS'11] showed that fully dynamic maximal matching can be maintained in general graphs with logarithmic amortized update time. More specifically, starting from an empty graph on n fixed vertices, they devised a randomized algorithm for maintaining maximal matching over any sequence of t edge insertions and deletions with a total runtime of O(t log n) in expectation and O(t log n + n log 2  n) with high probability. Whether or not this runtime bound can be improved towards O(t) has remained an important open problem. Despite significant research efforts, this question has resisted numerous attempts at resolution even for basic graph families such as forests. In this paper, we resolve the question in the affirmative, by presenting a randomized algorithm for maintaining maximal matching in general graphs with constant amortized update time. The optimal runtime bound O(t) of our algorithm holds both in expectation and with high probability. As an immediate corollary, we can maintain 2-approximate vertex cover with constant amortized update time. This result is essentially the best one can hope for (under the unique games conjecture) in the context of dynamic approximate vertex cover, culminating a long line of research. Our algorithm builds on Baswana et al.'s algorithm, but is inherently different and arguably simpler. As an implication of our simplified approach, the space usage of our algorithm is linear in the (dynamic) graph size, while the space usage of Baswana et al.'s algorithm is always at least Ω(n log n). Finally, we present applications to approximate weighted matchings and to distributed networks."
FOCS,2016,335-344,"Ittai Abraham, David Durfee, Ioannis Koutis, Sebastian Krinninger, Richard Peng",On Fully Dynamic Graph Sparsifiers.,https://doi.org/10.1109/FOCS.2016.44,"We initiate the study of fast dynamic algorithms for graph sparsification problems and obtain fully dynamic algorithms, allowing both edge insertions and edge deletions, that take polylogarithmic time after each update in the graph. Our three main results are as follows. First, we give a fully dynamic algorithm for maintaining a (1 ± ?)-spectral sparsifier with amortized update time poly(log n, ? -1 ). Second, we give a fully dynamic algorithm for maintaining a (1 ± ?)-cut sparsifier with worst-case update time poly(log n, ? -1 ). Both sparsifiers have size n · poly(log n, ? -1 ). Third, we apply our dynamic sparsifier algorithm to obtain a fully dynamic algorithm for maintaining a (1 - ?)-approximation to the value of the maximum flow in an unweighted, undirected, bipartite graph with amortized update time poly(log n, ? -1 )."
FOCS,2016,345-352,Mathias B?k Tejs Knudsen,Linear Hashing Is Awesome.,https://doi.org/10.1109/FOCS.2016.45,"The most classic textbook hash function, e.g. taught in CLRS [MIT Press'09], is h(x) = ((ax + b) mod p) mod m, (?) where x, a, b ε {0, 1, …, p –} and a, b are chosen uniformly at random. It is known that (?) is 2-independent and almost uniform provided p is a prime and p ? m. This implies that when using (?) to build a hash table with chaining that contains n ≤ m keys, the expected query time is O(1) and the expected length of the longest chain is O(√n). This result holds for any 2-independent hash function. No hash function can improve on the expected query time, but the upper bound on the expected length of the longest chain is not known to be tight for (?). Partially addressing this problem, Alon et al. [STOC'97] proved the existence of a class of linear hash functions such that the expected length of the longest chain is (√n) and leave as an open problem to decide which nontrivial properties (?) has. We make the first progress on this fundamental problem, by showing that the expected length of the longest chain is at most n1/3o(1) which means that the performance of (?) is similar to that of a 3-independent hash function for which we can prove an upper bound of O(n1/3). As a lemma we show that within a fixed set of integers there are few pairs such that the height of the ratio of the pairs are small. Given two non-zero coprime integers n, m ε Z with the height of n/m is max t{|n|, |m|}, and the height is a way of measuring how complex a fraction is. This is proved using a mixture of techniques from additive combinatorics and number theory, and we believe that the result might be of independent interest. For a natural variation of (?), we show that it is possible to apply second order moment bounds even when a hash value is fixed. As a consequence: For min-wise hashing it was known that any key from a set of n keys has the smallest hash value with probability O (1√n). We improve this to n–1+o(1). For linear probing it was known that the worst case expected query time is O (√n). We improve this to no(1)."
FOCS,2016,353-364,"Vincent Cohen-Addad, Philip N. Klein, Claire Mathieu",Local Search Yields Approximation Schemes for k-Means and k-Median in Euclidean and Minor-Free Metrics.,https://doi.org/10.1109/FOCS.2016.46,"We give the first polynomial-time approximation schemes (PTASs) for the following problems: (1) uniform facility location in edge-weighted planar graphs; (2) -median and -means in edge-weighted planar graphs; and (3) -means in Euclidean space of bounded dimension. Our first and second results extend to minor-closed families of graphs. All our results extend to cost functions that are the th power of the shortest-path distance. The algorithm is local search, where the local neighborhood of a solution  consists of all solutions obtained from  by removing and adding  centers."
