booktitle,year,pages,author,title,ee,abstract
FOCS,2016,1-10,"Vipul Goyal, Yuval Ishai, Hemanta K. Maji, Amit Sahai, Alexander A. Sherstov",Bounded-Communication Leakage Resilience via Parity-Resilient Circuits.,https://doi.org/10.1109/FOCS.2016.10,"We consider the problem of distributing a computation between two parties, such that any bounded-communication leakage function applied to the local views of the two parties reveals essentially nothing about the input. This problem can be motivated by the goal of outsourcing computations on sensitive data to two servers in the cloud, where both servers can be simultaneously corrupted by viruses that have a limited communication bandwidth. We present a simple and efficient reduction of the above problem to that of constructing parity-resilient circuits, namely circuits that map an encoded input to an encoded output so that the parity of any subset of the wires is essentially independent of the input. We then construct parity-resilient circuits from circuits that are resilient to local leakage, which can in turn be obtained from protocols for secure multiparty computation. Our main reduction builds on a novel generalization of the ε-biased masking lemma that applies to interactive protocols. Applying the above, we obtain two-party protocols with resilience to bounded-communication leakage either in the information-theoretic setting, relying on random oblivious transfer correlations, or in the computational setting, relying on non-committing encryption which can be based on a variety of standard cryptographic assumptions."
FOCS,2016,11-20,"Huijia Lin, Vinod Vaikuntanathan",Indistinguishability Obfuscation from DDH-Like Assumptions on Constant-Degree Graded Encodings.,https://doi.org/10.1109/FOCS.2016.11,"All constructions of general purpose indistinguishability obfuscation (IO) rely on either meta-assumptions that encapsulate an exponential family of assumptions (e.g., Pass, Seth and Telang, CRYPTO 2014 and Lin, EUROCRYPT 2016), or polynomial families of assumptions on graded encoding schemes with a high polynomial degree/multilinearity (e.g., Gentry, Lewko, Sahai and Waters, FOCS 2014). We present a new construction of IO, with a security reduction based on two assumptions: (a) a DDH-like assumption - called the sSXDH assumption - on constant degree graded encodings, and (b) the existence of polynomial-stretch pseudorandom generators (PRG) in NC0. Our assumption on graded encodings is simple, has constant size, and does not require handling composite-order rings. This narrows the gap between the mathematical objects that exist (bilinear maps, from elliptic curve groups) and ones that suffice to construct general purpose indistinguishability obfuscation."
FOCS,2016,21-30,"Vipul Goyal, Dakshita Khurana, Amit Sahai",Breaking the Three Round Barrier for Non-malleable Commitments.,https://doi.org/10.1109/FOCS.2016.12,"We construct two-message non-malleable commitments with respect to opening in the standard model, assuming only one-to-one one-way functions. Our protocol consists of two unidirectional messages by the committer (with no message from the receiver), and is secure against all polynomial-time adversaries in the standard synchronous setting. Pass (TCC 2013) proved that any commitment scheme with non-malleability with respect to commitment, using only 2 rounds of communication, cannot be proved secure via a black-box reduction to any ""standard"" intractability assumption. We extend this by showing a similar impossibility result for commitments with non-malleability with respect to opening, another standard notion of non-malleability for commitments, for any 2-message challenge-response protocol, as well. However, somewhat surprisingly, we show that this barrier breaks down in the setting of two unidirectional messages by the committer (with no message from the receiver), for non-malleability with respect to opening.  °  Our protocol makes only black-box use of any non-interactive statistically binding commitment scheme. Such a scheme can be based on any one-to-one one-way function.  °  Our techniques depart significantly from the commit-challenge-response structure followed by nearly all prior works on non-malleable protocols in the standard model. Our methods are combinatorial in nature.  °  Our protocol resolves the round complexity of commitments with non-malleability with respect to opening via natural (non-embedding) black-box security reductions. We show that completely non-interactive non-malleable commitments w.r.t. opening cannot be proved secure via most natural black-box reductions. This result extends to also rule out bi-directional two-message non-malleable commitments w.r.t. opening in the synchronous or asynchronous setting.  °  Our protocol, together with our impossibility result, also resolves the round complexity of block-wise non-malleable codes (Chandran et al) w.r.t. natural black-box reductions."
FOCS,2016,31-40,"Anne Broadbent, Zhengfeng Ji, Fang Song 0001, John Watrous",Zero-Knowledge Proof Systems for QMA.,https://doi.org/10.1109/FOCS.2016.13,"Prior work has established that all problems in NP admit classical zero-knowledge proof systems, and under reasonable hardness assumptions for quantum computations, these proof systems can be made secure against quantum attacks. We prove a result representing a further quantum generalization of this fact, which is that every problem in the complexity class QMA has a quantum zero-knowledge proof system. More specifically, assuming the existence of an unconditionally binding and quantum computationally concealing commitment scheme, we prove that every problem in the complexity class QMA has a quantum interactive proof system that is zero-knowledge with respect to efficient quantum computations. Our QMA proof system is sound against arbitrary quantum provers, but only requires an honest prover to perform polynomial-time quantum computations, provided that it holds a quantum witness for a given instance of the QMA problem under consideration."
FOCS,2016,41-50,"Amit Chakrabarti, Sagar Kale",Strong Fooling Sets for Multi-player Communication with Applications to Deterministic Estimation of Stream Statistics.,https://doi.org/10.1109/FOCS.2016.14,"We develop a paradigm for studying multi-player deterministic communication, based on a novel combinatorial concept that we call a strong fooling set. Our paradigm leads to optimal lower bounds on the per-player communication required for solving multi-player EQUALITY problems in a private-message setting. This in turn gives a very strong - O(1) versus Ω(n) - separation between private-message and one-way blackboard communication complexities. Applying our communication complexity results, we show that for deterministic data streaming algorithms, even loose estimations of some basic statistics of an input stream require large amounts of space. For instance, approximating the frequency moment F k  within a factor α requires Ω(n/α 1/(1-k) ) space for k > 1 and roughly Ω(n/α k/(k-1) ) space for k > 1. In particular, approximation within any constant factor α, however large, requires linear space, with the trivial exception of k = 1. This is in sharp contrast to the situation for randomized streaming algorithms, which can approximate F k  to within (1±ε) factors using ?(1) space for k ≤ 2 and o(n) space for all finite k and all constant ε > 0. Previous linear-space lower bounds for deterministic estimation were limited to small factors α, such as α <; 2 for approximating F 0  or F 2 . We also provide certain space/approximation tradeoffs in a deterministic setting for the problems of estimating the empirical entropy of a stream as well as the size of the maximum matching and the edge connectivity of a streamed graph."
FOCS,2016,51-60,"Djamal Belazzougui, Qin Zhang 0001","Edit Distance: Sketching, Streaming, and Document Exchange.",https://doi.org/10.1109/FOCS.2016.15,"We show that in the document exchange problem, where Alice holds x ? {0, 1} n  and Bob holds y ? {0, 1} n , Alice can send Bob a message of size O(K(log 2  K + log n)) bits such that Bob can recover x using the message and his input y if the edit distance between x and y is no more than K, and output ""error"" otherwise. Both the encoding and decoding can be done in time ?(n + poly(K)). This result significantly improves on the previous communication bounds under polynomial encoding/decoding time. We also show that in the referee model, where Alice and Bob hold x and y respectively, they can compute sketches of x and y of sizes poly(K log n) bits (the encoding), and send to the referee, who can then compute the edit distance between x and y together with all the edit operations if the edit distance is no more than K, and output ""error"" otherwise (the decoding). To the best of our knowledge, this is the first result for sketching edit distance using poly(K log n) bits. Moreover, the encoding phase of our sketching algorithm can be performed by scanning the input string in one pass. Thus our sketching algorithm also implies the first streaming algorithm for computing edit distance and all the edits exactly using poly(K log n) bits of space."
FOCS,2016,61-70,"Kasper Green Larsen, Jelani Nelson, Huy L. Nguyen, Mikkel Thorup",Heavy Hitters via Cluster-Preserving Clustering.,https://doi.org/10.1109/FOCS.2016.16,"We develop a new algorithm for the turnstile heavy hitters problem in general turnstile streams, the EXPANDERSKETCH, which finds the approximate top-k items in a universe of size n using the same asymptotic O(k log n) words of memory and O(log n) update time as the COUNTMIN and COUNTSKETCH, but requiring only O(k poly(log n)) time to answer queries instead of the O(n log n) time of the other two. The notion of ""approximation"" is the same l2 sense as the COUNTSKETCH, which given known lower bounds is the strongest guarantee one can achieve in sublinear memory. Our main innovation is an efficient reduction from the heavy hitters problem to a clustering problem in which each heavy hitter is encoded as some form of noisy spectral cluster in a graph, and the goal is to identify every cluster. Since every heavy hitter must be found, correctness requires that every cluster be found. We thus need a ""cluster-preserving clustering"" algorithm that partitions the graph into pieces while finding every cluster. To do this we first apply standard spectral graph partitioning, and then we use some novel local search techniques to modify the cuts obtained so as to make sure that the original clusters are sufficiently preserved. Our clustering algorithm may be of broader interest beyond heavy hitters and streaming algorithms."
FOCS,2016,71-78,"Zohar S. Karnin, Kevin J. Lang, Edo Liberty",Optimal Quantile Approximation in Streams.,https://doi.org/10.1109/FOCS.2016.17,"This paper resolves one of the longest standing basic problems in the streaming computational model. Namely, optimal construction of quantile sketches. An ε approximate quantile sketch receives a stream of items x1, ? ,xn and allows one to approximate the rank of any query item up to additive error ε n with probability at least 1-δ.The rank of a query x is the number of stream items such that x i  ≤ x. The minimal sketch size required for this task is trivially at least 1/ε.Felber and Ostrovsky obtain a O((1/ε)log(1/ε)) space sketch for a fixed δ.Without restrictions on the nature of the stream or the ratio between ε and n, no better upper or lower bounds were known to date. This paper obtains an O((1/ε)log log (1/δ)) space sketch and a matching lower bound. This resolves the open problem and proves a qualitative gap between randomized and deterministic quantile sketching for which an Ω((1/ε)log(1/ε)) lower bound is known. One of our contributions is a novel representation and modification of the widely used merge-and-reduce construction. This modification allows for an analysis which is both tight and extremely simple. The same technique was reported, in private communications, to be useful for improving other sketching objectives and geometric coreset constructions."
FOCS,2016,79-88,Johan H?stad,An Average-Case Depth Hierarchy Theorem for Higher Depth.,https://doi.org/10.1109/FOCS.2016.18,"We extend the recent hierarchy results of Rossman, Servedio and Tan [1] to address circuits of almost logarithmic depth. Our proof uses the same basic approach as [1] but a number of small differences enables us to obtain a stronger result by a significantly shorter proof."
FOCS,2016,89-98,"Magnus Gausdal Find, Alexander Golovnev, Edward A. Hirsch, Alexander S. Kulikov",A Better-Than-3n Lower Bound for the Circuit Complexity of an Explicit Function.,https://doi.org/10.1109/FOCS.2016.19,"We consider Boolean circuits over the full binary basis. We prove a (3+1/86)n-o(n) lower bound on the size of such a circuit for an explicitly defined predicate, namely an affine disperser for sublinear dimension. This improves the 3n-o(n) bound of Norbert Blum (1984).The proof is based on the gate elimination technique extended with the following three ideas. We generalize the computational model by allowing circuits to contain cycles, this in turn allows us to perform affine substitutions. We use a carefully chosen circuit complexity measure to track the progress of the gate elimination process. Finally, we use quadratic substitutions that may be viewed as delayed affine substitutions."
FOCS,2016,99-108,"Shiteng Chen, Periklis A. Papakonstantinou",Depth-Reduction for Composites.,https://doi.org/10.1109/FOCS.2016.20,"We show that every circuit with , and  gates,  , of polynomial size and depth  can be reduced to a  depth-2, , circuit of size . This is an exponential size improvement over the traditional Yao--Beigel--Tarui, which has size blowup . Therefore, depth-reduction for composite  matches the size of the Allender--Hertrampf construction for primes from 1989. We also list two among the consequences of our construction. One immediate implication is a near-exponential improvement in the depth, from  to , in Williams' program for  circuit lower bounds. In fact, this pushes William's program to the  frontier. Another, but nontrivial, implication is the strengthening of this  depth lower bound in the Chattopadhyay--Santhanam interactive compression setting."
FOCS,2016,109-117,"Ankit Garg, Leonid Gurvits, Rafael Mendes de Oliveira, Avi Wigderson",A Deterministic Polynomial Time Algorithm for Non-commutative Rational Identity Testing.,https://doi.org/10.1109/FOCS.2016.95,"Symbolic matrices in non-commuting variables, andthe related structural and algorithmic questions, have a remarkablenumber of diverse origins and motivations. They ariseindependently in (commutative) invariant theory and representationtheory, linear algebra, optimization, linear system theory,quantum information theory, and naturally in non-commutativealgebra."
FOCS,2016,118-127,"András Seb?, Anke van Zuylen",The Salesman's Improved Paths: A 3/2+1/34 Approximation.,https://doi.org/10.1109/FOCS.2016.21,"We give a new, strongly polynomial algorithm and improved analysis of the metric s-t path TSP. It finds a tour of cost less than 1.53 times the optimum of the subtour elimination LP, while known examples show that 1.5 is a lower bound for the integrality gap. A key new idea is the deletion of some edges of Christofides' trees, and we show that the arising ""reconnection"" problems can be solved for a minor extra cost. On the one hand our algorithm and analysis extend previous tools, at the same time simplifying the framework. On the other hand new tools are introduced, such as a flow problem used for analyzing the reconnection cost, and the use of a set of more and more restrictive minimum cost spanning trees, each of which can still be found by the greedy algorithm. The latter leads to a simple Christofides-like algorithm completely avoiding the computation of a convex combination of spanning trees. Furthermore, the 3/2 target-bound is easily reached in some relevant new cases."
FOCS,2016,128-137,"Michael Elkin, Ofer Neiman","Hopsets with Constant Hopbound, and Applications to Approximate Shortest Paths.",https://doi.org/10.1109/FOCS.2016.22,"A -hopset for a weighted undirected n-vertex graph  is a set of edges, whose addition to the graph guarantees that every pair of vertices has a path between them that contains at most  edges, whose length is within  of the shortest path. In her seminal paper, Cohen [J. ACM, 47 (2000), pp. 132--166] introduced the notion of hopsets in the context of parallel computation of approximate shortest paths, and since then it has found numerous applications in various  settings, such as dynamic graph algorithms, distributed computing, and the streaming model. Cohen [J. ACM, 47 (2000), pp. 132--166] devised efficient algorithms for constructing hopsets with polylogarithmic in n number of hops. Her constructions remain the state of the art since the publication of her paper in the proceedings of  STOC'94, i.e., for more than two decades. In this paper we exhibit the first construction of sparse hopsets with a constant number of hops. We also find efficient algorithms for hopsets in various computational settings, improving the best-known constructions. Generally, our hopsets strictly outperform the hopsets of [J. ACM, 47 (2000), pp. 132--166] in terms of both their parameters and the resources required to construct them. We demonstrate the applicability of our results for the fundamental problem of computing approximate shortest paths from  sources. Our results improve the running time for this problem in the parallel, distributed, and streaming models for a vast range of s."
FOCS,2016,138-147,"Sungjin Im, Shi Li 0001",Better Unrelated Machine Scheduling for Weighted Completion Time via Random Offsets from Non-uniform Distributions.,https://doi.org/10.1109/FOCS.2016.23,"In this paper we consider the classic scheduling problem of minimizing total weighted completion time on unrelated machines when jobs have release times, i.e, R|r ij | Σ j  w j C j  using the three-field notation. For this problem, a 2-approximation is known based on a novel convex programming (J. ACM 2001 by Skutella). It has been a long standing open problem if one can improve upon this 2-approximation (Open Problem 8 in J. of Sched. 1999 by Schuurman and Woeginger). We answer this question in the affirmative by giving a 1.8786-approximation. We achieve this via a surprisingly simple linear programming, but a novel rounding algorithm and analysis. A key ingredient of our algorithm is the use of random offsets sampled from non-uniform distributions. We also consider the preemptive version of the problem, i.e, R|r ij , pmtn|Σ j w j C j . We again use the idea of sampling offsets from non-uniform distributions to give the first better than 2-approximation for this problem. This improvement also requires use of a configuration LP with variables for each job's complete schedules along with more careful analysis. For both non-preemptive and preemptive versions, we break the approximation barrier of 2 for the first time."
FOCS,2016,148-157,"Yossi Azar, Niv Buchbinder, T.-H. Hubert Chan, Shahar Chen, Ilan Reuven Cohen, Anupam Gupta 0001, Zhiyi Huang 0002, Ning Kang 0001, Viswanath Nagarajan, Joseph Naor, Debmalya Panigrahi",Online Algorithms for Covering and Packing Problems with Convex Objectives.,https://doi.org/10.1109/FOCS.2016.24,"We present online algorithms for covering and packing problems with (non-linear) convex objectives. The convex covering problem is defined as: min x? R + n f(x) s.t. Ax ≥ 1, where f:R + n → R + is a monotone convex function, and A is an m×n matrix with non-negative entries. In the online version, a new row of the constraint matrix, representing a new covering constraint, is revealed in each step and the algorithm is required to maintain a feasible and monotonically non-decreasing assignment x over time. We also consider a convex packing problem defined as: max y?R+ m Σ j=1 m yj - g(A T y), where g:R + n →R + is a monotone convex function. In the online version, each variable yj arrives online and the algorithm must decide the value of yj on its arrival. This represents the Fenchel dual of the convex covering program, when g is the convex conjugate of f. We use a primal-dual approach to give online algorithms for these generic problems, and use them to simplify, unify, and improve upon previous results for several applications."
FOCS,2016,158-167,"Eshan Chattopadhyay, Xin Li 0006","Explicit Non-malleable Extractors, Multi-source Extractors, and Almost Optimal Privacy Amplification Protocols.",https://doi.org/10.1109/FOCS.2016.25,"We make progress in the following three problems: 1. Constructing optimal seeded non-malleable extractors, 2. Constructing optimal privacy amplification protocols with an active adversary, for any possible security parameter, 3. Constructing extractors for independent weak random sources, when the min-entropy is extremely small (i.e., near logarithmic). For the first two problems, the best known non-malleable extractors by Chattopadhyay, Goyal and Li, and by Cohen all require seed length and min-entropy with quadratic loss in parameters. As a result, the best known explicit privacy amplification protocols with an active adversary, which achieve two rounds of communication and optimal entropy loss was sub-optimal in the min-entropy of the source. In this paper we give an explicit non-malleable extractor that works for nearly optimal seed length and min-entropy, and yields a two-round privacy amplification protocol with optimal entropy loss for almost all ranges of the security parameter. For the third problem, we improve upon a very recent result by Cohen and Schulman and give an explicit extractor that uses an absolute constant number of sources, each with almost logarithmic min-entropy. The key ingredient in all our constructions is a generalized, and much more efficient version of the independence preserving merger introduced by Cohen, which we call non-malleable independence preserving merger. Our construction of the merger also simplifies that of Cohen and Schulman, and may be of independent interest."
FOCS,2016,168-177,Xin Li 0006,"Improved Two-Source Extractors, and Affine Extractors for Polylogarithmic Entropy.",https://doi.org/10.1109/FOCS.2016.26,"In a recent breakthrough [1], Chattopadhyay and Zuckerman gave an explicit two-source extractor for min-entropy k ≥ log C  n for some large enough constant C, where n is the length of the source. However, their extractor only outputs one bit. In this paper, we improve the output of the two-source extractor to k Ω(1) , while the error remains n -Ω(1)  and the extractor remains strong in the second source. In the non-strong case, the output can be increased to k. Our improvement is obtained by giving a better extractor for (q, t, γ) non-oblivious bit-fixing sources, which can output t Ω(1)  bits instead of one bit as in [1]. We also give the first explicit construction of deterministic extractors for affine sources over F 2 , with entropy k ≥ log C  n for some large enough constant C, where n is the length of the source. Previously the best known results are by Bourgain [2], Yehudayoff [3] and Li [4], which require the affine source to have entropy at least Ω(n/√log log n). Our extractor outputs k Ω(1)  bits with error n -Ω(1) . This is done by reducing an affine source to a non-oblivious bit-fixing source, where we adapt the alternating extraction based approach in previous work on independent source extractors [5] to the affine setting. Our affine extractors also imply improved extractors for circuit sources studied in [6]. We further extend our results to the case of zero-error dispersers, and give two applications in data structures that rely crucially on the fact that our two-source or affine extractors have large output size."
FOCS,2016,178-187,"Gil Cohen, Leonard J. Schulman",Extractors for Near Logarithmic Min-Entropy.,https://doi.org/10.1109/FOCS.2016.27,"The main contribution of this work is an explicit construction of extractors for near logarithmic min-entropy. For any δ > 0 we construct an extractor for O(1/δ) n-bit sources with min-entropy (logn) 1+δ . This is most interesting when δ is set to a small constant, though the result also yields an extractor for O(log logn) sources with logarithmic min-entropy. Prior to this work, the best explicit extractor in terms of supporting least-possible min-entropy, due to Li (FOCS'15), requires min-entropy (logn) 2+δ  from its O(1/δ) sources. Further, all current techniques for constructing multi-source extractors ""break"" below min-entropy (log n) 2 . In fact, existing techniques do not provide even a disperser for o(log n) sources each with min-entropy (log n) 1.99 . Apart from being a natural problem, supporting logarithmic min-entropy has applications to combinatorics. A two-source disperser, let alone an extractor, for min-entropy O(log n) induces a (log, nO(1))-Ramsey graph on n vertices. Thus, constructing such dispersers would be a significant step towards constructively matching Erd?s' proof for the existence of (2log n)-Ramsey graphs on n vertices. Our construction does not rely on the sophisticated primitives that were key to the substantial recent progress on multi-source extractors, such as non-malleable extractors, correlation breakers, the lightest-bin condenser, or extractors for non-oblivious bit-fixing sources, although some of these primitives can be combined with our construction so to improve the output length and the error guarantee. Instead, at the heart of our construction is a new primitive called an independence-preserving merger. The construction of the latter builds on the alternating extraction technique."
