booktitle,year,pages,author,title,ee,abstract
FOCS,2014,166-175,"Mihai Patrascu, Mikkel Thorup","Dynamic Integer Sets with Optimal Rank, Select, and Predecessor Search.",https://doi.org/10.1109/FOCS.2014.26,"We present a data structure representing a dynamic set S of w-bit integers on a w-bit word RAM. With |S| = n and w ≥ log n and space O(n), we support the following standard operations in O(log n/log w) time: insert(x) sets S = S + {x}. delete(x) sets S = S {x}. predecessor(x) returns max{y ∈ S | y < x}. rank(x) returns #{y ∈ S | y < x}. select (i) returns y ∈ S with rank (y) = i, if any. Our O(log n/log w) bound is optimal for dynamic rank and select, matching a lower bound of Fredman and Saks [STOC'89]. When the word length is large, our time bound is also optimal for dynamic predecessor, matching a static lower bound of Beame and Fich [STOC'99] whenever log n/log w = O(log w/log log w). Technically, the most interesting aspect of our data structure is that it supports all the above operations in constant time for sets of size n = w O(1). This resolves a main open problem of Ajtai, Komlos, and Fredman [FOCS f83]. Ajtai et al. presented such a data structure in Yao fs abstract cell-probe model with w-bit cells/words, but pointed out that the functions used could not be implemented. As a partial solution to the problem, Fredman and Willard [STOC f90] introduced a fusion node that could handle queries in constant time, but used polynomial time on the updates. We call our small set data structure a dynamic fusion node as it does both queries and updates in constant time."
FOCS,2014,176-185,"Anat Ganor, Gillat Kol, Ran Raz",Exponential Separation of Information and Communication.,https://doi.org/10.1109/FOCS.2014.27,"We show an exponential gap between communication complexity and information complexity, by giving an explicit example for a communication task (relation), with information complexity ≤ O(k), and distributional communication complexity ≥2k. This shows that a communication protocol cannot always be compressed to its internal information. By a result of Braverman [1], our gap is the largest possible. By a result of Braverman and Rao [2], our example shows a gap between communication complexity and amortized communication complexity, implying that a tight direct sum result for distributional communication complexity cannot hold."
FOCS,2014,186-195,"Daniel Lokshtanov, Marcin Pilipczuk, Michal Pilipczuk, Saket Saurabh 0001",Fixed-Parameter Tractable Canonization and Isomorphism Test for Graphs of Bounded Treewidth.,https://doi.org/10.1109/FOCS.2014.28,"We give a fixed-parameter tractable algorithm that, given a parameter  and two graphs , either concludes that one of these graphs has treewidth at least  or determines whether  and  are isomorphic. The running time of the algorithm on an -vertex graph is , and this is the first fixed-parameter algorithm for Graph Isomorphism parameterized by treewidth. Our algorithm in fact solves the more general canonization problem. We namely design a procedure working in  time that, for a given graph  on  vertices, either concludes that the treewidth of  is at least  or (i) finds in an isomorphic-invariant way a graph  that is isomorphic to ; (ii) finds an isomorphism-invariant construction term---an algebraic expression that encodes  together with a tree decomposition of  of width less than . Hence, the isomorphism test reduces to verifying whether the computed isomorphic copies or the construction terms for  and  are equal."
FOCS,2014,196-205,"Tobias Christiani, Rasmus Pagh",Generating k-Independent Variables in Constant Time.,https://doi.org/10.1109/FOCS.2014.29,"The generation of pseudorandom elements over finite fields is fundamental to the time, space and randomness complexity of randomized algorithms and data structures. We consider the problem of generating k-independent random values over a finite field F in a word RAM model equipped with constant time addition and multiplication in F, and present the first nontrivial construction of a generator that outputs each value in constant time, not dependent on k. Our generator has period length |F| poly log k and uses k poly (log k) log |F| bits of space, which is optimal up to a poly log k factor. We are able to bypass Siegel's lower bound on the time-space tradeoff for k-independent functions by a restriction to sequential evaluation."
FOCS,2014,206-215,"Subhash Khot, Rishi Saket",Hardness of Coloring 2-Colorable 12-Uniform Hypergraphs with exp(log^{Omega(1)} n) Colors.,https://doi.org/10.1109/FOCS.2014.30,"We show that it is quasi-NP-hard to color 2-colorable 12-uniform hypergraphs with  colors where  is the number of vertices. Previously, Guruswami Harsha, H\aa stad, Srinivasan, and Varma showed that it is quasi-NP-hard to color 2-colorable 8-uniform hypergraphs with  colors. Their result is obtained by composing a standard outer probabilistically checkable proof (PCP) with an inner PCP based on the short code of superconstant degree. Our result is instead obtained by composing a new outer PCP with an inner PCP based on the short code of degree two."
FOCS,2014,216-225,Fran?ois Le Gall,Improved Quantum Algorithm for Triangle Finding via Combinatorial Arguments.,https://doi.org/10.1109/FOCS.2014.31,"In this paper we present a quantum algorithm solving the triangle finding problem in unweighted graphs with query complexity ?(n 5/4 ), where n denotes the number of vertices in the graph. This improves the previous upper bound O(n 9/7 ) = O(n 1.285 ) recently obtained by Lee, Magniez and Santha. Our result shows, for the first time, that in the quantum query complexity setting unweighted triangle finding is easier than its edge-weighted version, since for finding an edge-weighted triangle Belovs and Rosmanis proved that any quantum algorithm requires O(n 9/7 / √log n) queries. Our result also illustrates some limitations of the non-adaptive learning graph approach used to obtain the previous O(n 9/7 ) upper bound since, even over unweighted graphs, any quantum algorithm for triangle finding obtained using this approach requires v(n 9/7 / √log n) queries as well. To bypass the obstacles characterized by these lower bounds, our quantum algorithm uses combinatorial ideas exploiting the graph-theoretic properties of triangle finding, which cannot be used when considering edge-weighted graphs or the non-adaptive learning graph approach."
FOCS,2014,226-235,Bernhard Haeupler,Interactive Channel Capacity Revisited.,https://doi.org/10.1109/FOCS.2014.32,"We provide the first capacity approaching coding schemes that robustly simulate any interactive protocol over an adversarial channel that corrupts any fraction of the transmitted symbols. Our coding schemes achieve a communication rate of 1 - O(∈√loglog1/∈) can be improved to 1 - O(√∈) for random, oblivious, and over any adversarial channel. This computationally bounded channels, or if parties have shared randomness unknown to the channel. Surprisingly, these rates exceed the 1 - Ω( H(?)) = 1 - Ω(?√log1/?) interactive channel capacity bound which [Kol and Raz; STOC'13] recently proved for random errors. We conjecture 1- Θ(? log log 1/?) and 1- Θ(√?) to be the optimal rates for their respective settings and therefore to capture the interactive channel capacity for random and adversarial errors. In addition to being very communication efficient, our randomized coding schemes have multiple other advantages. They are computationally efficient, extremely natural, and significantly simpler than prior (non-capacity approaching) schemes. In particular, our protocols do not employ any coding but allow the original protocol to be performed as-is, interspersed only by short exchanges of hash values. When hash values do not match, the parties backtrack. Our approach is, as we feel, by far the simplest and most natural explanation for why and how robust interactive communication in a noisy environment is possible."
FOCS,2014,236-245,"Mark Braverman, Klim Efremenko",List and Unique Coding for Interactive Communication in the Presence of Adversarial Noise.,https://doi.org/10.1109/FOCS.2014.33,"In this paper,  we extend the notion of list decoding to the setting of interactive communication and study its limits. In particular, we show that any protocol can be encoded, with a constant rate, into a list-decodable protocol which is resilient to a noise rate of up to , and that this is tight. Using our list-decodable construction, we study a more nuanced model of noise where the adversary can corrupt up to a fraction   of Alice's communication and up to a fraction   of Bob's communication. We use list decoding to characterize fully the region   of pairs  for which unique decoding with a constant rate is possible. The region  turns out to be quite unusual in its shape. In particular, it is bounded by a piecewise-differentiable curve with infinitely many pieces. We show that outside this region the rate must be exponential. This suggests that in some error regimes, list decoding is necessary for optimal unique decoding. We also consider the setting where only one party of the communication must output the correct answer. We precisely characterize the region of all pairs  for which one-sided unique decoding is possible in such a way that Alice will output the correct answer."
FOCS,2014,246-255,"Dorit Aharonov, Aram W. Harrow, Zeph Landau, Daniel Nagaj, Mario Szegedy, Umesh V. Vazirani",Local Tests of Global Entanglement and a Counterexample to the Generalized Area Law.,https://doi.org/10.1109/FOCS.2014.34,"We introduce a technique for applying quantum expanders in a distributed fashion, and use it to solve two basic questions: testing whether a bipartite quantum state shared by two parties is the maximally entangled state and disproving a generalized area law. In the process these two questions which appear completely unrelated turn out to be two sides of the same coin. Strikingly in both cases a constant amount of resources are used to verify a global property."
FOCS,2014,256-265,"Hyung-Chan An, Mohit Singh, Ola Svensson",LP-Based Algorithms for Capacitated Facility Location.,https://doi.org/10.1109/FOCS.2014.35,"Linear programming (LP) has played a key role in the study of algorithms for combinatorial optimization problems. In the field of approximation algorithms, this is well illustrated by the uncapacitated facility location problem. A variety of algorithmic methodologies, such as LP-rounding and the primal-dual method, have been applied to and evolved from algorithms for this problem. Unfortunately, this collection of powerful algorithmic techniques had not yet been applicable to the more general capacitated facility location problem. In fact, all of the known algorithms with good performance guarantees were based on a single technique, local search, and no LP relaxation was known to efficiently approximate the problem. In this paper, we present an LP relaxation with a constant integrality gap for the capacitated facility location. We demonstrate that the fundamental theories of multicommodity flows and matchings provide key insights that lead to the strong relaxation. Our algorithmic proof of integrality gap is obtained by finally accessing the rich toolbox of LP-based methodologies: we present a constant factor approximation algorithm based on LP-rounding."
FOCS,2014,266-275,"Nima Anari, Gagan Goel, Afshin Nikzad",Mechanism Design for Crowdsourcing: An Optimal 1-1/e Competitive Budget-Feasible Mechanism for Large Markets.,https://doi.org/10.1109/FOCS.2014.36,"In this paper we consider a mechanism design problem in the context of large-scale crowdsourcing markets such as Amazon's Mechanical Turk mturk, ClickWorker clickworker, CrowdFlower crowdflower. In these markets, there is a requester who wants to hire workers to accomplish some tasks. Each worker is assumed to give some utility to the requester on getting hired. Moreover each worker has a minimum cost that he wants to get paid for getting hired. This minimum cost is assumed to be private information of the workers. The question then is -- if the requester has a limited budget, how to design a direct revelation mechanism that picks the right set of workers to hire in order to maximize the requester's utility? We note that although the previous work (Singer (2010) chen et al. (2011)) has studied this problem, a crucial difference in which we deviate from earlier work is the notion of large-scale markets that we introduce in our model. Without the large market assumption, it is known that no mechanism can achieve a competitive ratio better than 0.414 and 0.5 for deterministic and randomized mechanisms respectively (while the best known deterministic and randomized mechanisms achieve an approximation ratio of 0.292 and 0.33 respectively). In this paper, we design a budget-feasible mechanism for large markets that achieves a competitive ratio of 1 - 1/e ? 0.63. Our mechanism can be seen as a generalization of an alternate way to look at the proportional share mechanism, which is used in all the previous works so far on this problem. Interestingly, we can also show that our mechanism is optimal by showing that no truthful mechanism can achieve a factor better than 1 - 1/e, thus, fully resolving this setting. Finally we consider the more general case of submodular utility functions and give new and improved mechanisms for the case when the market is large."
FOCS,2014,276-285,"Marcin Pilipczuk, Michal Pilipczuk, Piotr Sankowski, Erik Jan van Leeuwen",Network Sparsification for Steiner Problems on Planar and Bounded-Genus Graphs.,https://doi.org/10.1109/FOCS.2014.37,"We propose polynomial-time algorithms that sparsify planar and bounded-genus graphs while preserving optimal or near-optimal solutions to Steiner problems. Our main contribution is a polynomial-time algorithm that, given an unweighted graph G embedded on a surface of genus g and a designated face f bounded by a simple cycle of length k, uncovers a set F in E(G) of size polynomial in g and k that contains an optimal Steiner tree for any set of terminals that is a subset of the vertices of f. We apply this general theorem to prove that: (2) given an unweighted graph G embedded on a surface of genus g and a terminal set S in V(G), one can in polynomial time find a set F in E(G) that contains an optimal Steiner tree T for S and that has size polynomial in g and |E(T)|; (2) an analogous result holds for an optimal Steiner forest for a set S of terminal pairs, (3) given an unweighted planar graph G and a terminal set S in V(G), one can in polynomial time find a set F in E(G) that contains an optimal (edge) multiway cut C separating S (i.e., a cutset that intersects any path with endpoints in different terminals from S) and has size polynomial in |C|. In the language of parameterized complexity, these results imply the first polynomial kernels for Steiner Tree and Steiner Forest on planar and bounded-genus graphs (parameterized by the size of the tree and forest, respectively) and for (Edge) Multiway Cut on planar graphs (parameterized by the size of the cutset). Steiner Tree and similar ""subset"" problems were identified in [Demaine, Hajiaghayi, Computer J., 2008] as important to the quest to widen the reach of the theory of bidimensionality ([Demaine et al., JACM 2005], [Fomin et al., SODA 2010]). Therefore, our results can be seen as a leap forward to achieve this broader goal. Additionally, we obtain a weighted variant of our main contribution: a polynomial-time algorithm that, given an edge-weighted planar graph G, a designated face f bounded by a simple cycle of weight w(f), and an accuracy parameter ε > 0, uncovers a set F in E(G) of total weight at most poly(1/ε) w(f) that, for any set of terminal pairs that lie on f, contains a Steiner forest within additive error ε w(f) from the optimal Steiner forest. This result deepens the understanding of the recent framework of approximation schemes for network design problems on planar graphs ([Klein, SICOMP 2008], [Borradaile, Klein, Mathieu, ACM TALG 2009], and later works) by explaining the structure of the solution space within a brick of the so-called mortar graph -- the central notion of this framework."
FOCS,2014,286-295,"Xi Chen 0001, Rocco A. Servedio, Li-Yang Tan",New Algorithms and Lower Bounds for Monotonicity Testing.,https://doi.org/10.1109/FOCS.2014.38,"We consider the problem of testing whether an unknown Boolean function f : {- 1, 1} n  → {-1, 1} is monotone versus ε-far from every monotone function. The two main results of this paper are a new lower bound and a new algorithm for this well-studied problem. Lower bound: We prove an Ω?(n 1/5 ) lower bound on the query complexity of any non-adaptive two-sided error algorithm for testing whether an unknown Boolean function f is monotone versus constant-far from monotone. This gives an exponential improvement on the previous lower bound of Ω(log n) due to Fischer et al. [1]. We show that the same lower bound holds for monotonicity testing of Boolean-valued functions over hypergrid domains {1,···, m} n  for all m ≥ 2. Upper bound: We present an O(n 5/6 ) poly(1/ε)-query algorithm that tests whether an unknown Boolean function f is monotone versus ε-far from monotone. Our algorithm, which is non-adaptive and makes one-sided error, is a modified version of the algorithm of Chakrabarty and Seshadhri[2], which makes O(n 7/8 ) poly(1/ε) queries."
FOCS,2014,296-305,"Gilles Brassard, Ashwin Nayak 0001, Alain Tapp, Dave Touchette, Falk Unger",Noisy Interactive Quantum Communication.,https://doi.org/10.1109/FOCS.2014.39,"We study the problem of simulating protocols in a quantum communication setting over noisy channels. This problem falls at the intersection of quantum information theory and quantum communication complexity, and will be of importance for eventual real-world applications of interactive quantum protocols, which can be proved to have exponentially lower communication costs than their classical counterparts for some problems. These are the first results concerning the quantum version of this problem, originally studied by Schulman in a classical setting (FOCS '92, STOC '93). We simulate a length N quantum communication protocol by a length O(N) protocol with arbitrarily small error. Our simulation strategy has a far higher communication rate than a naive one that encodes separately each particular round of communication to achieve comparable success. Such a strategy would have a communication rate going to 0 in the worst interaction case as the length of the protocols increases, in contrast to our strategy, which has a communication rate proportional to the capacity of the channel used. Under adversarial noise, our strategy can withstand, for arbitrarily small ε > 0, error rates as high as 1/2 -- ε when parties preshare perfect entanglement, but the classical channel is noisy. We show that this is optimal. Note that in this model, the naive strategy would not work for any constant fraction of errors. We provide extension of these results in several other models of communication, including when also the entanglement is noisy, and when there is no pre-shared entanglement but communication is quantum and noisy. We also study the case of random noise, for which we provide simulation protocols with positive communication rates and no pre-shared entanglement over some quantum channels with quantum capacity Q = 0, proving that Q is in general not the right characterization of a channel's capacity for interactive quantum communication. Our results are stated for a general quantum communication protocol in which Alice and Bob collaborate, and hold in particular in the quantum communication complexity settings of the Yao and Cleve-Buhrman models."
FOCS,2014,306-315,"Eshan Chattopadhyay, David Zuckerman",Non-malleable Codes against Constant Split-State Tampering.,https://doi.org/10.1109/FOCS.2014.40,"Non-malleable codes were introduced by Dziembowski, Pietrzak and Wichs [1] as an elegant generalization of the classical notions of error detection, where the corruption of a codeword is viewed as a tampering function acting on it. Informally, a non-malleable code with respect to a family of tampering functions F consists of a randomized encoding function Enc and a deterministic decoding function Dec such that for any m, Dec(Enc(m)) = m. Further, for any tampering function f ∈ F and any message m, Dec(f(Enc(m))) is either m or is ∈-close to a distribution D f  independent of m, where ∈ is called the error. Of particular importance are non-malleable codes in the C-split-state model. In this model, the codeword is partitioned into C equal sized blocks and the tampering function family consists of functions (f 1 , . . . , f C ) such that fi acts on the ith block. For C = 1 there cannot exist non-malleable codes. For C = 2, the best known explicit construction is by Aggarwal, Dodis and Lovett [2] who achieve rate = Ω(n -6/7 ) and error = 2 -Ω(n-1/7) , where n is the block length of the code. In our main result, we construct efficient non-malleable codes in the C-split-state model for C = 10 that achieve constant rate and error = 2 -Ω(n) . These are the first explicit codes of constant rate in the C-split-state model for any C = o(n), that do not rely on any unproven assumptions. We also improve the error in the explicit nonmalleable codes constructed in the bit tampering model by Cheraghchi and Guruswami [3]. Our constructions use an elegant connection found between seedless non-malleable extractors and non-malleable codes by Cheraghchi and Guruswami [3]. We explicitly construct such seedless non-malleable extractors for 10 independent sources and deduce our results on non-malleable codes based on this connection. Our constructions of extractors use encodings and a new variant of the sumproduct theorem."
FOCS,2014,316-325,"Sian-Jheng Lin, Wei-Ho Chung, Yunghsiang S. Han",Novel Polynomial Basis and Its Application to Reed-Solomon Erasure Codes.,https://doi.org/10.1109/FOCS.2014.41,"In this paper, we present a new basis of polynomial over finite fields of characteristic two and then apply it to the encoding/decoding of Reed-Solomon erasure codes. The proposed polynomial basis allows that h-point polynomial evaluation can be computed in O(hlog 2 (h)) finite field operations with small leading constant. As compared with the canonical polynomial basis, the proposed basis improves the arithmetic complexity of addition, multiplication, and the determination of polynomial degree from O(hlog 2 (h)log 2 log 2 (h)) to O(hlog 2 (h)). Based on this basis, we then develop the encoding and erasure decoding algorithms for the (n=2 r , k) Reed-Solomon codes. Thanks to the efficiency of transform based on the polynomial basis, the encoding can be completed in O(nlog 2 (k)) finite field operations, and the erasure decoding in O(nlog 2 (n)) finite field operations. To the best of our knowledge, this is the first approach supporting Reed-Solomon erasure codes over characteristic-2 finite fields while achieving a complexity of O(nlog 2 (n)), in both additive and multiplicative complexities. As the complexity leading factor is small, the algorithms are advantageous in practical applications."
FOCS,2014,326-335,Oded Lachish,O(log log Rank) Competitive Ratio for the Matroid Secretary Problem.,https://doi.org/10.1109/FOCS.2014.42,"In the Matroid Secretary Problem (MSP), the elements of the ground set of a Matroid are revealed on-line one by one, each together with its value. An algorithm for the MSP is called Matroid-Unknown if, at every stage of its execution, it only knows (i) the elements that have been revealed so far and their values and (ii) an oracle for testing whether or not a subset the elements that have been revealed so far forms an independent set. An algorithm is called Known-Cardinality if it knows (i), (ii) and also knows from the start the cardinality n of the ground set of the Matroid. We present here a Known-Cardinality algorithm with a competitive-ratio of order log log the rank of the Matroid. The prior known results for a OC algorithm are a competitive-ratio of log the rank of the Matroid, by Babaioff et al. (2007), and a competitive-ratio of square root of log the rank of the Matroid, by Chakraborty and Lachish (2012)."
