booktitle,year,pages,author,title,ee,abstract
SODA,2012,1132-1139,"Noga Alon, Ronitt Rubinfeld, Shai Vardi, Ning Xie 0002",Space-efficient local computation algorithms.,https://doi.org/10.1137/1.9781611973099.89,"Recently Rubinfeld et al. (ICS 2011, pp. 223–238) proposed a new model of sublinear algorithms called local computation algorithms. In this model, a computation problem F may have more than one legal solution and each of them consists of many bits. The local computation algorithm for F should answer in an online fashion, for any index i, the ith bit of some legal solution of F. Further, all the answers given by the algorithm should be consistent with at least one solution of F. In this work, we continue the study of local computation algorithms. In particular, we develop a technique which under certain conditions can be applied to construct local computation algorithms that run not only in polylogarithmic time but also in polylogarithmic space. Moreover, these local computation algorithms are easily parallelizable and can answer all parallel queries consistently. Our main technical tools are pseudorandom numbers with bounded independence and the theory of branching processes."
SODA,2012,1140-1149,"Arnab Bhattacharyya 0001, Elena Grigorescu, Prasad Raghavendra, Asaf Shapira",Testing odd-cycle-freeness in Boolean functions.,https://doi.org/10.1137/1.9781611973099.90,"A function f: 2n → {0,1} is odd-cycle-free if there are no x1,. . .,xk ∈ 2n with k an odd integer such that f(x1) = ··· = f(xk) = 1 and x1 + ··· + xk = 0. We show that one can distinguish odd-cycle-free functions from those ε-far from being odd-cycle-free by making poly(1/ε) queries to an evaluation oracle. We give two proofs of this result, each shedding light on a different connection between testability of properties of Boolean functions and of dense graphs.The first issue we study is directly reducing testing of linear-invariant properties of Boolean functions to testing associated graph properties. We show a black-box reduction from testing odd-cycle-freeness to testing bipartiteness of graphs. Such reductions have already been shown (Král’, Serra and Vena, and Shapira) for monotone linear-invariant properties defined by forbidding solutions to a finite number of equations. But for odd-cycle-freeness whose description involves an infinite number of forbidden equations, a reduction to graph property testing was not previously known. If one could show such a reduction more generally for any linear-invariant property closed under restrictions to subspaces, then it would likely lead to a characterization of the one-sided testable linear-invariant properties, an open problem raised by Sudan.The second issue we study is whether there is an efficient canonical tester for linear-invariant properties of Boolean functions. A canonical tester for linear-invariant properties operates by picking a random linear subspace and then checking whether the restriction of the input function to the subspace satisfies a fixed property. The question is if, for every linear-invariant property, there is a canonical tester for which there is only a polynomial blow-up from the optimal query complexity. We answer the question affirmatively for odd-cycle-freeness. The general question remains open."
SODA,2012,1150-1162,"Silvio Frischknecht, Stephan Holzer, Roger Wattenhofer",Networks cannot compute their diameter in sublinear time.,https://doi.org/10.1137/1.9781611973099.91,"We study the problem of computing the diameter of a network in a distributed way. The model of distributed computation we consider is: in each synchronous round, each node can transmit a different (but short) message to each of its neighbors. We provide an  lower bound for the number of communication rounds needed, where n denotes the number of nodes in the network. This lower bound is valid even if the diameter of the network is a small constant. We also show that a (3/2 − ε)-approximation of the diameter requires  rounds. Furthermore we use our new technique to prove an  lower bound on approximating the girth of a graph by a factor 2 − ε."
SODA,2012,1163-1182,"Ho-Lin Chen, David Doty",Parallelism and time in hierarchical self-assembly.,https://doi.org/10.1137/1.9781611973099.92,"We study the role that parallelism plays in time complexity of variants of Winfree's abstract Tile Assembly Model (aTAM), a model of molecular algorithmic self-assembly. In the “hierarchical” aTAM, two assemblies, both consisting of multiple tiles, are allowed to aggregate together, whereas in the “seeded” aTAM, tiles attach one at a time to a growing assembly. Adleman, Cheng, Goel, and Huang (Running Time and Program Size for Self-Assembled Squares, STOC 2001) showed how to assemble an n×n square in O(n) time in the seeded aTAM using  unique tile types, where both of these parameters are optimal. They asked whether the hierarchical aTAM could allow a tile system to use the ability to form large assemblies in parallel before they attach to break the Ω(n) lower bound for assembly time. We show that there is a tile system with the optimal  tile types that assembles an n×n square using O(log2 n) parallel “stages”, which is close to the optimal Ω(log n) stages, forming the final n×n square from four n/2 × n/2 squares, which are themselves recursively formed from n/4 × n/4 squares, etc. However, despite this nearly maximal parallelism, the system requires superlinear time to assemble the square. We extend the definition of partial order tile systems studied by Adleman et al. in a natural way to hierarchical assembly and show that no hierarchical partial order tile system can build any shape with diameter N in less than time Ω(N), demonstrating that in this case the hierarchical model affords no speedup whatsoever over the seeded model. We also strengthen the Ω(N) time lower bound for deterministic seeded systems of Adleman et al. to nondeterministic seeded systems. Finally, we show that for infinitely many n, a tile system can assemble an n × n′ rectangle, with n × n′, in time O(n4/5 log n), breaking the linear-time lower bound that applies to all seeded systems and partial order hierarchical systems."
SODA,2012,1183-1194,"Haitham Hassanieh, Piotr Indyk, Dina Katabi, Eric Price 0001",Simple and practical algorithm for sparse Fourier transform.,https://doi.org/10.1137/1.9781611973099.93,"We consider the sparse Fourier transform problem: given a complex vector x of length n, and a parameter k, estimate the k largest (in magnitude) coefficients of the Fourier transform of x. The problem is of key interest in several areas, including signal processing, audio/image/video compression, and learning theory. We propose a new algorithm for this problem. The algorithm leverages techniques from digital signal processing, notably Gaussian and Dolph-Chebyshev filters. Unlike the typical approach to this problem, our algorithm is not iterative. That is, instead of estimating “large” coefficients, subtracting them and recursing on the reminder, it identifies and estimates the k largest coefficients in “one shot”, in a manner akin to sketching/streaming algorithms. The resulting algorithm is structurally simpler than its predecessors. As a consequence, we are able to extend considerably the range of sparsity, k, for which the algorithm is faster than FFT, both in theory and practice."
SODA,2012,1195-1206,"Daniel M. Kane, Jelani Nelson",Sparser Johnson-Lindenstrauss transforms.,https://doi.org/10.1137/1.9781611973099.94,"We give two different and simple constructions for dimensionality reduction in ℓ2 via linear mappings that are sparse: only an O(ε)-fraction of entries in each column of our embedding matrices are non-zero to achieve distortion 1 + ε with high probability, while still achieving the asymptotically optimal number of rows. These are the first constructions to provide subconstant sparsity for all values of parameters, improving upon previous works of Achlioptas [2003] and Dasgupta et al. [2010]. Such distributions can be used to speed up applications where ℓ2 dimensionality reduction is used."
SODA,2012,1207-1214,"Venkatesan Guruswami, Ali Kemal Sinop",Optimal column-based low-rank matrix reconstruction.,https://doi.org/10.1137/1.9781611973099.95,"We prove that for any real-valued matrix X ∊ ℝm×n, and positive integers r ≥ k, there is a subset of r columns of X such that projecting X onto their span gives a -approximation to best rank-k approximation of X in Frobenius norm. We show that the trade-off we achieve between the number of columns and the approximation ratio is optimal up to lower order terms. Furthermore, there is a deterministic algorithm to find such a subset of columns that runs in O(rnmω log m) arithmetic operations where ω is the exponent of matrix multiplication. We also give a faster randomized algorithm that runs in O(rnm2) arithmetic operations."
SODA,2012,1215-1227,"Ely Porat, Martin J. Strauss","Sublinear time, measurement-optimal, sparse recovery for all.",https://doi.org/10.1137/1.9781611973099.96,"An approximate sparse recovery system in ℓ1 norm makes a small number of measurements of a noisy vector with at most k large entries and recovers those heavy hitters approximately. Formally, it consists of parameters N, k, ∊, an m-by-N measurement matrix, Φ, and a decoding algorithm, D. Given a vector, x, where xk denotes the optimal k-term approximation to x, the system approximates x by , which must satisfyAmong the goals in designing such systems are minimizing the number m of measurements and the runtime of the decoding algorithm, D. We consider the “forall” model, in which a single matrix Φ, possibly “constructed” non-explicitly using the probabilistic method, is used for all signals x.Many previous papers have provided algorithms for this problem. But all such algorithms that use the optimal number m = O(k log(N/k)) of measurements require superlinear time Ω(N log(N/k)). In this paper, we give the first algorithm for this problem that uses the optimum number of measurements (up to constant factors) and runs in sublinear time o(N) when k is sufficiently less than N. Specifically, for any positive integer ℓ, our approach uses time O(ℓ5 ∊−3k(N/k)1/ℓ) and uses m = O(ℓ8 ∊−3k log (N/k)) measurements, with access to a data structure requiring space and preprocessing time O(ℓNk0.2/∊)."
SODA,2012,1228-1241,"S. Anand 0002, Naveen Garg 0001, Amit Kumar 0001",Resource augmentation for weighted flow-time explained by dual fitting.,https://doi.org/10.1137/1.9781611973099.97,"We propose a general dual-fitting technique for analyzing online scheduling algorithms in the unrelated machines setting where the objective function involves weighted flow-time, and we allow the machines of the on-line algorithm to have (1 + ε)-extra speed than the offline optimum (the so-called speed augmentation model). Typically, such algorithms are analyzed using non-trivial potential functions which yield little insight into the proof technique. We propose that one can often analyze such algorithms by looking at the dual (or Lagrangian dual) of the linear (or convex) program for the corresponding scheduling problem, and finding a feasible dual solution as the on-line algorithm proceeds. As representative cases, we get the following results:  For the problem of minimizing weighted flow-time, we give an O (1/ε)-competitive greedy algorithm. This is an improvement by a factor of 1/ε on the competitive ratio of the greedy algorithm of Chadha-Garg-Kumar-Muralidhara. For the problem of minimizing weighted ℓk norm of flow-time, we show that a greedy algorithm gives an -competitive ratio. This marginally improves the result of Im and Moseley. For the problem of minimizing weighted flow-time plus energy, and when the energy function f(s) is equal to sγ, γ > 1, we show that a natural greedy algorithm is O(γ2)-competitive. Prior to our work, such a result was known for the related machines setting only (Gupta-Krishnaswamy-Pruhs)."
SODA,2012,1242-1253,"Anupam Gupta 0001, Sungjin Im, Ravishankar Krishnaswamy, Benjamin Moseley, Kirk Pruhs",Scheduling heterogeneous processors isn't as easy as you think.,https://doi.org/10.1137/1.9781611973099.98,"We consider preemptive online scheduling algorithms to minimize the total weighted/unweighted flow time plus energy for speed-scalable heterogeneous multiprocessors. We show that the well-known priority scheduling algorithms Highest Density First, Weighted Shortest Elapsed Time First, and Weighted Late Arrival Processor Sharing, are not O(1)-speed O(1)-competitive for the objective of weighted flow even in the special case of fixed variable speed processors (aka the related machines setting). This illustrates that scheduling heterogeneous multiprocessors is a different, and algorithmically more challenging problem, than scheduling homogeneous multiprocessors. We then show that a variation of the non-clairvoyant algorithm Late Arrival Processor Sharing coupled with a non-obvious speed scaling algorithm is scalable for the objective of unweighted flow plus energy on speed-scalable multiprocessors. This is the first provably scalable non-clairvoyant algorithm on heterogeneous multiprocessors, even in the related machines setting, for the objective of total (unweighted) flow time."
SODA,2012,1254-1265,"Sungjin Im, Benjamin Moseley, Kirk Pruhs",Online scheduling with general cost functions.,https://doi.org/10.1137/1.9781611973099.99,"We consider a general online scheduling problem  where the goal is to minimize , where  is the weight/importance of job ,  is the flow time of the job in the schedule, and  is an arbitrary nondecreasing cost function. Numerous natural scheduling objectives are special cases of this general framework. We show that the scheduling algorithm Highest Density First (HDF) is -speed -competitive for all cost functions  simultaneously. We give lower bounds that show that the HDF algorithm and this analysis are essentially optimal. Finally, we show that scalable algorithms are achievable in some special cases."
SODA,2012,1266-1285,"Susanne Albers, Antonios Antoniadis 0001",Race to idle: new algorithms for speed scaling with a sleep state.,https://doi.org/10.1137/1.9781611973099.100,"We study an energy conservation problem where a variable-speed processor is equipped with a sleep state. Executing jobs at high speeds and then setting the processor asleep is an approach that can lead to further energy savings compared to standard dynamic speed scaling. We consider classical deadline-based scheduling, that is, each job is specified by a release time, a deadline and a processing volume. For general convex power functions, Irani et al. [2007] devised an offline 2-approximation algorithm. Roughly speaking, the algorithm schedules jobs at a critical speed scrit that yields the smallest energy consumption while jobs are processed. For power functions P(s) = sα & γ, where s is the processor speed, Han et al. [2010] gave an αα + 2)-competitive online algorithm. We investigate the offline setting of speed scaling with a sleep state. First, we prove NP-hardness of the optimization problem. Additionally, we develop lower bounds, for general convex power functions: No algorithm that constructs scrit-schedules, which execute jobs at speeds of at least scrit, can achieve an approximation factor smaller than 2. Furthermore, no algorithm that minimizes the energy expended for processing jobs can attain an approximation ratio smaller than 2. We then present an algorithmic framework for designing good approximation algorithms. For general convex power functions, we derive an approximation factor of 4/3. For power functions P(s) = β sα + γ, we obtain an approximation of 137/117 > 1.171. We finally show that our framework yields the best approximation guarantees for the class of scrit-schedules. For general convex power functions, we give another 2-approximation algorithm. For functions P(s) = βsα + γ, we present tight upper and lower bounds on the best possible approximation factor. The ratio is exactly eW−1(−e−1−1/e)/(eW−1(−e−1−1/e)+1) > 1.211, where W-1 is the lower branch of the Lambert W function."
SODA,2012,1286-1297,"Hsien-Chih Chang, Hsueh-I Lu",A faster algorithm to recognize even-hole-free graphs.,https://doi.org/10.1137/1.9781611973099.101,"We study the problem of determining whether an n-node graph G contains an even hole, ie, an induced simple cycle consisting of an even number of nodes. Conforti, Cornuéjols, Kapoor, and Vušković gave the first polynomial-time algorithm for the problem, which runs in O (n 40) time. Later, Chudnovsky, Kawarabayashi, and Seymour reduced the running time to O (n 31). The best previously known algorithm for the problem, due to da Silva and Vušković, runs in O (n 19) time. In this paper, we solve the problem in O (n 11) time via a decomposition-based algorithm that relies on the decomposition theorem of da Silva and Vušković. Moreover, if G contains even holes, then our algorithm also outputs an even hole of G in O (n 11) time."
SODA,2012,1298-1308,"Yuri Faenza, Gianpaolo Oriolo, Gautier Stauffer",Separating stable sets in claw-free graphs via Padberg-Rao and compact linear programs.,https://doi.org/10.1137/1.9781611973099.102,"In this paper, we provide the first linear programming formulations for the stable set problem in claw-free graphs, together with polynomial time separation routines for those formulations (they are not compact). We then exploit one of those extended formulations and propose a new polytime algorithm for solving the separation problem for the stable set polytope of claw-free graphs. This routine combines a separation algorithm for the matching polytope due to Padberg and Rao and the solution of (moderate size) compact linear programs. Hence, it does not rely on the ellipsoid method and seems to be appropriate to be inserted in branch and cut frameworks for solving real world problems."
SODA,2012,1309-1318,"Jeff Erickson 0001, Kyle Fox, Amir Nayyeri",Global minimum cuts in surface embedded graphs.,https://doi.org/10.1137/1.9781611973099.103,"We give a deterministic algorithm to find the minimum cut in a surface-embedded graph in near-linear time. Given an undirected graph embedded on an orientable surface of genus g, our algorithm computes the minimum cut in gO(g)n log log n time, matching the running time of the fastest algorithm known for planar graphs, due to Łącki and Sankowski, for any constant g. Indeed, our algorithm calls Łącki and Sankowski's recent O(n log log n) time planar algorithm as a subroutine. Previously, the best time bounds known for this problem followed from two algorithms for general sparse graphs: a randomized algorithm of Karger that runs in O(n log3 n) time and succeeds with high probability, and a deterministic algorithm of Nagamochi and Ibaraki that runs in O(n2 log n) time. We can also achieve a deterministic gO(g)n2 log log n time bound by repeatedly applying the best known algorithm for minimum (s, t)-cuts in surface graphs. The bulk of our work focuses on the case where the dual of the minimum cut splits the underlying surface into multiple components with positive genus."
SODA,2012,1319-1328,"Prosenjit Bose, Rolf Fagerberg, André van Renssen, Sander Verdonschot",Competitive routing in the half-θ6-graph.,https://doi.org/10.1137/1.9781611973099.104,"We present a deterministic local routing scheme that is guaranteed to find a path between any pair of vertices in a half-θ6-graph whose length is at most 5/√3 = 2.886… times the Euclidean distance between the pair of vertices. The half-θ6-graph is identical to the Delaunay triangulation where the empty region is an equilateral triangle. Moreover, we show that no local routing scheme can achieve a better competitive spanning ratio thereby implying that our routing scheme is optimal. This is somewhat surprising because the spanning ratio of the half-θ6-graph is 2. Since every triangulation can be embedded in the plane as a half-θ6-graph using O(log n) bits per vertex coordinate via Schnyder's embedding scheme (SODA 1990), our result provides a competitive local routing scheme for every such embedded triangulation."
SODA,2012,1329-1342,"Kasturi R. Varadarajan, Xin Xiao",A near-linear algorithm for projective clustering integer points.,https://doi.org/10.1137/1.9781611973099.105,"We consider the problem of projective clustering in Euclidean spaces of non-fixed dimension. Here, we are given a set P of n points in ℝm and integers j ≥ 1, k ≥ 0, and the goal is to find j k-subspaces so that the sum of the distances of each point in P to the nearest subspace is minimized. Observe that this is a shape fitting problem where we wish to find the best fit in the L1 sense. Here we will treat the number j of subspaces we want to fit and the dimension k of each of them as constants. We consider instances of projective clustering where the point coordinates are integers of magnitude polynomial in m and n. Our main result is a randomized algorithm that for any ε > 0 runs in time O(mn polylog(mn)) and outputs a solution that with high probability is within (1 + ε) of the optimal solution. To obtain this result, we show that the fixed dimensional version of the above projective clustering problem has a small coreset. We do that by observing that in a fairly general sense, shape fitting problems that have small coresets in the L∞ setting also have small coresets in the L1 setting, and then exploiting an existing construction for the L∞ setting. This observation seems to be quite useful for other shape fitting problems as well, as we demonstrate by constructing the first “regular” coreset for the circle fitting problem in the plane."
SODA,2012,1343-1354,"Dan Feldman, Leonard J. Schulman",Data reduction for weighted and outlier-resistant clustering.,https://doi.org/10.1137/1.9781611973099.106,"Statistical data frequently includes outliers; these can distort the results of estimation procedures and optimization problems. For this reason, loss functions which deemphasize the effect of outliers are widely used by statisticians. However, there are relatively few algorithmic results about clustering with outliers. For instance, the k-median with outliers problem uses a loss function fc1, …, ck(x) which is equal to the minimum of a penalty h, and the least distance between the data point x and a center ci. The loss-minimizing choice of {c1, …, ck} is an outlier-resistant clustering of the data. This problem is also a natural special case of the k-median with penalties problem considered by [Charikar, Khuller, Mount and Narasimhan SODA'01]. The essential challenge that arises in these optimization problems is data reduction for the weighted k-median problem. We solve this problem, which was previously solved only in one dimension ([Har-Peled FSTTCS'06], [Feldman, Fiat and Sharir FOCS'06]). As a corollary, we also achieve improved data reduction for the k-line-median problem."
SODA,2012,1355-1370,"Paul Bendich, Bei Wang 0001, Sayan Mukherjee 0001",Local homology transfer and stratification learning.,https://doi.org/10.1137/1.9781611973099.107,"The objective of this paper is to show that point cloud data can under certain circumstances be clustered by strata in a plausible way. For our purposes, we consider a stratified space to be a collection of manifolds of different dimensions which are glued together in a locally trivial manner inside some Euclidean space. To adapt this abstract definition to the world of noise, we first define a multi-scale notion of stratified spaces, providing a stratification at different scales which are indexed by a radius parameter. We then use methods derived from kernel and cokernel persistent homology to cluster the data points into different strata. We prove a correctness guarantee for this clustering method under certain topological conditions. We then provide a probabilistic guarantee for the clustering for the point sample setting – we provide bounds on the minimum number of sample points required to state with high probability which points belong to the same strata. Finally, we give an explicit algorithm for the clustering."
SODA,2012,1371-1385,"Constantinos Daskalakis, Ilias Diakonikolas, Rocco A. Servedio",Learning k-modal distributions via testing.,https://doi.org/10.1137/1.9781611973099.108,"A k-modal probability distribution over the domain {1, …, n} is one whose histogram has at most k “peaks” and “valleys.” Such distributions are natural generalizations of monotone (k = 0) and unimodal (k = 1) probability distributions, which have been intensively studied in probability theory and statistics. In this paper we consider the problem of learning an unknown k-modal distribution. The learning algorithm is given access to independent samples drawn from the k-modal distribution p, and must output a hypothesis distribution p such that with high probability the total variation distance between p and  is at most ∊. We give an efficient algorithm for this problem that runs in time poly(k, log(n), 1/ε). For , the number of samples used by our algorithm is very close (within an Õ(log(1/∊)) factor) to being information-theoretically optimal. Prior to this work computationally efficient algorithms were known only for the cases k = 0, 1 [Bir87b, Bir97]. A novel feature of our approach is that our learning algorithm crucially uses a new property testing algorithm as a key subroutine. The learning algorithm uses the property tester to efficiently decompose the k-modal distribution into k (near)-monotone distributions, which are easier to learn."
